tweet,id,date,time,username,replies_count,retweets_count,likes_count
"There was a Honduran mother that was reunited with her child THIS WEEK after being separated at our border. The mother was told that she would have to pay $4,000 to see her kid.

Whoever separated these families should have to pay to reunite them. Period. pic.twitter.com/HhLrZYkyaT",1091103052961067008,2019-01-31,22:36:54,repkarenbass,48,222,617
"Over the past 8 years, I’ve had to sit through hearings investigating texts, emails and conspiracy theories. Next week, the House Judiciary Committee will hold a hearing on gun violence prevention. 

Change is coming.",1091033332547284993,2019-01-31,17:59:51,repkarenbass,13,34,253
"Using your governmental authority to purge more than 100,000 people from voter rolls during an election that you're running in is NOT called reasonable list maintenance. That's called voter suppression. pic.twitter.com/3o6O5wQGOs",1090348688260644864,2019-01-29,20:39:19,repkarenbass,146,1475,3584
"Today on International Holocaust Remembrance Day #weremember the millions who were murdered and the millions more who were displaced. 

Today we honor them when we say #neveragain.",1089593459613282304,2019-01-27,18:38:19,repkarenbass,10,9,37
.@SpeakerPelosi should give the State of the Union since she's obviously the one running the country.,1088907755996545024,2019-01-25,21:13:34,repkarenbass,1682,4024,25180
"The thing that’s the most ironic about this shutdown is that Trump says the reason for it is border security. 

We have people at the border who aren’t being paid. We have TSA agents who aren’t getting paid. 

These are the very people that are supposed to keep us safe. pic.twitter.com/fj3YsGzD8s",1088447120682684416,2019-01-24,14:43:10,repkarenbass,50,78,306
Great to see the one and only Stacey Abrams today. The movement continues! pic.twitter.com/wt2BVr2BZi,1088181501685129220,2019-01-23,21:07:42,repkarenbass,46,119,918
"Even if we give Trump all the money in the world, he won't be able to build his wall because of eminent domain. This land isn't just there for the taking.

For those suffering from this shutdown, let me apologize to you. There is no reason for any of this. pic.twitter.com/7BMUTaFsrS",1088104424730435585,2019-01-23,16:01:25,repkarenbass,29,91,265
"In December, Congress passed a bill to establish a system for evaluating inmates to determine who could be released early without threatening public safety.

Because of the government shutdown, this process has been delayed. 

Justice cannot wait. Reopen the government.",1087877071559307264,2019-01-23,00:58:00,repkarenbass,10,32,82
"Limiting the number of those able to serve makes our military weaker. 

Limiting the number of those able to serve on account of their gender identity makes our moral code weaker. https://twitter.com/CNNPolitics/status/1087723407075102721 …",1087826957423861761,2019-01-22,21:38:52,repkarenbass,13,19,82
"The federal agency that provides programs to help with housing has been shut down for 32 days now.

It’s not just those suffering from houselessness that are being affected -- it’s also those who are just one incident away from living on the streets. https://www.nytimes.com/2019/01/21/us/politics/government-shutdown-housing-services.html …",1087789310882054144,2019-01-22,19:09:16,repkarenbass,6,28,31
It was because of the work Dr. King did in the civil rights movement that led me to make a commitment to continue that legacy of fighting for social & economic justice. pic.twitter.com/3lDV9bvSYI,1087436352558264320,2019-01-21,19:46:44,repkarenbass,68,150,718
"If we solely remember Dr. King, we fail him. 

If we HONOR his Dream, he lives. 

We are still marching. We will still win. #MLKDay pic.twitter.com/gfHtpjpt9K",1087419520593981443,2019-01-21,18:39:51,repkarenbass,10,83,294
"There are 800,000 federal workers without paychecks and countless families that depend on food stamps that don’t know when they’ll be able to afford their next grocery trip as a result of the government being shut down. 

That’s the REAL crisis.",1086755510378848259,2019-01-19,22:41:19,repkarenbass,32,112,292
Trump should realize he will never satisfy the extremists. He should take the deal he originally agreed to in December so that we can finally reopen the government. https://twitter.com/AnnCoulter/status/1086734750578929664 …,1086743814767853569,2019-01-19,21:54:50,repkarenbass,17,35,101
"I'll be on ""The Issue Is:"" with @Elex_Michaelson at 10:30 PM west coast time tonight to talk about the shutdown and much more. Tune in to @FOXLA!",1086501004281966592,2019-01-19,05:50:00,repkarenbass,1,2,11
The person Trump is hoping to confirm as the new head of the Department of Justice has written one memo calling a part of the Mueller investigation “fatally misconceived” and one that was TITLED “The Case for More Incarceration.”,1086472063429181441,2019-01-19,03:55:00,repkarenbass,5,21,42
"To this day, I do not believe that ANYONE knows how many children were actually separated and that some of these kids will never see their families again. https://www.nytimes.com/2019/01/17/us/family-separation-trump-administration-migrants.html …",1086441613163986944,2019-01-19,01:54:00,repkarenbass,9,37,74
"The morning after news breaks that Trump may have obstructed justice by telling his lawyer to lie to Congress, he decides another caravan is coming. 

Predictable. 

Dangerous. 

Didn’t work. https://twitter.com/realDonaldTrump/status/1086265436138807296 …",1086394267151552513,2019-01-18,22:45:52,repkarenbass,46,111,362
"With the government shut down, there is no guarantee about when the nearly 39 million Americans that depend on food stamps will next receive another payment to help them buy groceries. This is a disgrace. https://www.politico.com/story/2019/01/15/state-food-stamp-benefits-shutdown-2491182 …",1086338759010877441,2019-01-18,19:05:18,repkarenbass,1,12,32
"Kids need textbooks. 

Families need relief from the opioid crisis. 

Millions need help with their student loans. 

Meanwhile, Trump is focused on shutting the government down and spending $5 billion on a wall. pic.twitter.com/pAIgOGMyT0",1085663641091874817,2019-01-16,22:22:37,repkarenbass,13,54,149
"The state of our union is in an unnecessary crisis that has left us unsafe. 

Unless the President agrees to open the government, a written speech is more appropriate so hundreds of secret service members will not have to work without pay preparing the Capitol for his visit. https://twitter.com/nprpolitics/status/1085559070273064961 …",1085566139760107520,2019-01-16,15:55:11,repkarenbass,17,61,217
"Yesterday, my office learned of a reported terrorist attack in Nairobi, Kenya. I stand with the people of Kenya against this senseless act of violence. https://www.usatoday.com/story/news/world/2019/01/16/14-victims-killed-kenya-hotel-complex/2590834002/ …",1085547498318561280,2019-01-16,14:41:06,repkarenbass,3,9,21
"For those affected by today’s strike, here’s a list of helpful resources that include extended hours at rec centers, expanded library programming, and free transportation. Learn more here: https://www.lamayor.org/StudentsAndFamilies?fbclid=IwAR3ATbdGmMe3AtpWqJQR1ulA-VvPlib7TnarTzEP6k0uYJ-ZVSGF8K8kHNk#list …",1084864397686771714,2019-01-14,17:26:42,repkarenbass,4,24,42
"“So I will take the mantle. I will be the one to shut it down.” - Donald Trump before he shut down the government. 

This shutdown is now the longest shutdown in US history.",1084558030744756225,2019-01-13,21:09:19,repkarenbass,15,47,149
"If Republicans really believe these racist statements have no place in our government, then their party must offer more than shallow temporary statements of condemnation. https://twitter.com/cnnbrk/status/1084222739093835776 …",1084506674340212737,2019-01-13,17:45:14,repkarenbass,41,246,781
"There has been an absence of justice for Gemmel Moore and now, Timothy Dean has paid for that mistake with his life. https://www.cbsnews.com/news/ed-buck-second-body-found-dead-at-democratic-donors-home-in-less-than-two-years/ …",1083902604445470720,2019-01-12,01:44:53,repkarenbass,14,65,161
"Legal representation for children and families is critical in child welfare courts. Thanks to a new Children’s Bureau interpretation, states and IV-E Tribes will be reimbursed 50% of the cost of legal services for a child, parent, or the agency. https://chronicleofsocialchange.org/top-stories/how-states-can-seize-new-legal-funding-federal-government/33321 …",1083563707358236672,2019-01-11,03:18:14,repkarenbass,2,13,34
"Today is the 19th day that Trump has kept the government shut down because of his wall.

Here are 19 times he said Mexico would pay for it. pic.twitter.com/lx50uYEboC",1083147301688918016,2019-01-09,23:43:35,repkarenbass,1076,8857,16069
"These aren’t partisan issues, they affect Americans everywhere. 

We just happen to be the ones who care.",1083112717974753285,2019-01-09,21:26:09,repkarenbass,9,39,155
"One by one, we’re going to pass bills to open parts of the government that have NOTHING to do with the wall. 

We’re going to pass bills to prevent families from losing their food stamps, to provide help for families who are at risk of being evicted, and to preserve our parks.",1083112638660395009,2019-01-09,21:25:50,repkarenbass,15,107,429
"Today, I’ll be voting YES on a resolution ensuring Congress is doing all we can to protect coverage for people with pre-existing conditions and to protect the ability of young people to remain on their parents’ insurance until age 26. #ProtectOurCare",1083072547871166464,2019-01-09,18:46:32,repkarenbass,3,16,66
"Last night's address continued a shameful and cruel political stunt that has left 800,000 people without paychecks. It's a scandal.",1083008507832602626,2019-01-09,14:32:04,repkarenbass,11,39,178
Here’s my response to the fearmongering that just came out of the Oval Office. https://www.pscp.tv/w/bwVV-zF6WUtiR1d2Wkp5amV8MUJkR1lPZFptZFl4WAAUhexjhoYGsAs3NnuM8aSfWiSOIlNThNtGDNCTPj8W?t=5s …,1082828843403132932,2019-01-09,02:38:08,repkarenbass,55,62,197
"8 years ago today, 24 people were shot outside of a Safeway in Tucson, Arizona. 

Today, I’m proud to support legislation to help prevent gun violence and keep our communities safe. 

It’s long past time Congress acted on this issue. Today’s the day.",1082776806783098886,2019-01-08,23:11:22,repkarenbass,7,32,200
"I get on an airplane about 100 times per year. Lately, I’ve had to stop at security to apologize to TSA officers there because their paychecks are being held hostage for a border wall that most Americans oppose.

Their families need to eat. Trump should reopen the government NOW.",1082693415916064769,2019-01-08,17:40:00,repkarenbass,12,48,197
"The lie the Trump administration has been telling about terrorists coming across the southern border is not harmless – it’s left 800,000 people without a paycheck. https://www.nbcnews.com/politics/immigration/only-six-immigrants-terrorism-database-stopped-cbp-southern-border-first-n955861 …",1082666990924230663,2019-01-08,15:55:00,repkarenbass,6,37,81
I strongly condemn the coup attempt in Gabon. The rule of law must be respected and any transition must be in line with the country’s constitution. https://www.aljazeera.com/news/2019/01/gabon-coup-attempt-foiled-190107131011483.html …,1082649090293489665,2019-01-08,14:43:52,repkarenbass,2,3,15
"If this shutdown continues, we may have millions of people who are not able to afford food. 

I think this is just absolutely unconscionable. pic.twitter.com/idymADhGy4",1082449540278566912,2019-01-08,01:30:55,repkarenbass,40,100,272
"Throughout this whole shutdown to make us “safer” with a wall, who isn’t getting paid? 

Border patrol officers and TSA officers. pic.twitter.com/v4hRTKYvZI",1081992118380515329,2019-01-06,19:13:18,repkarenbass,51,240,532
"This week, I read about a mother whose son died because he had no choice but to ration his insulin because he couldn’t afford more. 

In the richest country in the world.

This shutdown is nonsense, let’s get the government back open so that we can get to work #ForThePeople. pic.twitter.com/vWjfQoLv2H",1081686056293068800,2019-01-05,22:57:07,repkarenbass,217,785,2236
Standing with my colleagues this morning in front of the Capitol. It’s time to get to work for the people! pic.twitter.com/X2ut6Idi5J,1081355453160976390,2019-01-05,01:03:25,repkarenbass,35,108,869
"Honored to have been sworn in as 26th Chair of the Congressional Black Caucus today.

We will fight fiercely against hate.

We will not retreat and allow our past victories to be erased.

We will exercise every ounce of our power and influence to continue the fight for justice. pic.twitter.com/BIx7ZsQUK6",1080993553524973569,2019-01-04,01:05:21,repkarenbass,42,95,569
"Just voted for Nancy Pelosi to be Speaker of the House of Representatives.

#ForThePeople",1080901008438542336,2019-01-03,18:57:37,repkarenbass,25,41,519
"Tomorrow, the House of Representatives is going to pass legislation that will reopen the government if Trump signs it. 

That’s what new leadership in Congress looks like. Welcome to 2019.",1080479284530200576,2019-01-02,15:01:50,repkarenbass,76,174,1109
"At midnight, the Violence Against Women Act will have been without funding for 10 days. https://twitter.com/RepKarenBass/status/1077324678035734528 …",1079918769156194305,2019-01-01,01:54:33,repkarenbass,4,45,72
"This year we hosted resource fairs ranging from help with the #GOPTaxScam to preventing scams targeting the elderly. 

Sign up to get an email about upcoming events in your neighborhood here:  https://bass.house.gov/signon  pic.twitter.com/oVGbG2uogi",1079890978029346816,2019-01-01,00:04:07,repkarenbass,0,1,8
