tweet,id,date,time,username,replies_count,retweets_count,likes_count
"Here's this week's #FridayFollowUp! It was a big week in Congress highlighted by the passage of #HR1, the #ForThePeople Act. Watch below to hear more ⬇️⬇️⬇️ pic.twitter.com/LwaaSUfP72",1104422321215815680,2019-03-09,16:42:55,repdeanphillips,5,8,75
"It’s #InternationalWomensDay⁠, the MN House just passed an ERA bill, and one of the most remarkable women in the world, my mother DeeDee, spoke at today’s rally at the Capitol. A shout-out to all who have fought for equality for generations, and to those leading the way today. pic.twitter.com/j6hcF1w7pQ",1104171295829307395,2019-03-09,00:05:26,repdeanphillips,5,18,120
"It was my honor and privilege to help pass #HR1 in the House. Now we continue the hard work of rebuilding our democracy, protecting our elections and eliminating the corrupting influence of big money in politics. I urge the Senate to join us in this #powergrab #forthepeople. pic.twitter.com/psZfYmXr2d",1104075581992460294,2019-03-08,17:45:06,repdeanphillips,22,32,215
"We did it - we passed #HR1, the #ForThePeople Act!

But this is just the beginning of the fight for reform. Now we have to make sure Mitch McConnell and the Senate vote for this historic legislation. Get on it, @senatemajldr! https://www.politico.com/story/2019/03/08/house-passes-sweeping-election-reform-bill-1212693 …",1104056833910718465,2019-03-08,16:30:36,repdeanphillips,13,42,173
"Update: Headed to the Floor to pass #HR1 which now includes 3 of my amendments! They’re focused on strengthening the enforcement powers, bipartisanship and diversity of the FEC, our nation’s election watchdog, and closing lobbying loopholes for the executive branch.
#ForThePeople https://twitter.com/RepDeanPhillips/status/1103080275859386368 …",1104044553559068672,2019-03-08,15:41:48,repdeanphillips,8,18,115
"#HR1 is a #PowerGrab #ForThePeople. 

We’re closing lobbyist loopholes, prohibiting members of Congress and the executive branch from serving on corporate boards and strengthening ethics oversight. 

Every page is written to return power to you. 🇺🇸 pic.twitter.com/Qw8H1LQxRI",1104039290928054272,2019-03-08,15:20:53,repdeanphillips,6,17,75
"It's a great day for democracy! We're about to vote for #HR1, the #ForThePeople Act.

I took a moment to celebrate with my friend @RepAndyKimNJ on the steps of the Capitol this morning. pic.twitter.com/WTL8yneSYh",1104034477964169216,2019-03-08,15:01:46,repdeanphillips,18,25,160
Looking forward to being there - it's a great day for democracy! https://twitter.com/SpeakerPelosi/status/1104005448901058560 …,1104013363540119553,2019-03-08,13:37:52,repdeanphillips,4,8,60
"Happy to report that the #ForThePeople Act is progressing on the House Floor.

I'm heading there shortly to testify on an amendment I authored to make sure the FEC has the tools it needs to operate independently and hold administrations accountable - #HR1 keeps getting better! pic.twitter.com/1MlALvhtIb",1103751958043811841,2019-03-07,20:19:08,repdeanphillips,7,14,100
"Whatever your number 1 issue, I ask that you make campaign finance reform your number 2.

(The culture of corruption caused by the relentless pursuit of money in politics is what stands in the way of us getting to work on your number 1.)

It’s time to fix this. #ForThePeople #HR1 pic.twitter.com/iAryDYcGsO",1103747928718491659,2019-03-07,20:03:07,repdeanphillips,9,55,225
"Spread the word:
We’re rescheduled for March nine,
See you there to listen, learn and opine! 

Join me for an #HR1 Community Conversation this weekend: 
 https://www.facebook.com/events/410324279773386/?ti=ia … https://twitter.com/RepDeanPhillips/status/1098229603678801920 …",1103697448306921473,2019-03-07,16:42:32,repdeanphillips,4,3,26
"Voters should choose their politicians. Politicians shouldn’t choose their voters.

 #HR1 makes Election Day a holiday, enacts automatic voter registration, expands early voting and vote by mail, ends partisan gerrymandering and increases election security. #ForThePeople 🇺🇸🗳 pic.twitter.com/YmKk3HHL1U",1103656608998047744,2019-03-07,14:00:15,repdeanphillips,3,24,112
"We're LIVE! Join us and tweet your questions using #TownHallForThePeople

Link here ⬇️⬇️⬇️
 https://www.facebook.com/NowThisPolitics/videos/551573655351212/ …",1103446779314556929,2019-03-07,00:06:27,repdeanphillips,1,3,8
"Join us at 6 PM Central at the @NowThisPolitics Facebook page for our #TownHallForThePeople! We'll be taking your questions about #HR1, the #ForThePeople Act.

Excited to discuss how we're going to reduce the influence of special interests and restore power to you. https://twitter.com/versharma/status/1103439962723307520 …",1103443854492164096,2019-03-06,23:54:50,repdeanphillips,2,2,17
"I spoke on the House Floor today to voice my full support for #HR1, the #ForThePeople Act.

People are losing faith in the integrity and fairness of our political system. Let’s pass #HR1 and begin the principled work of restoring our democracy for the people. pic.twitter.com/1UR8eb4j0e",1103410646639620097,2019-03-06,21:42:53,repdeanphillips,11,35,198
"Thanks to everyone for your interest in tonight's #TownHallForThePeople.

It will be broadcast at 6 PM CST in a live stream on @NowThisPolitics' Facebook page:  https://www.facebook.com/NowThisPolitics/ …

I'm looking forward to answering your questions with my colleagues!",1103337689150078976,2019-03-06,16:52:58,repdeanphillips,6,5,27
"Representation begins with listening, and our local leaders are amazing, knowledgeable advocates for our community. Looking forward to doing great things for Minnesotans with this group! #MN03 https://twitter.com/MarionGreene/status/1103124644821897216 …",1103297610633408512,2019-03-06,14:13:43,repdeanphillips,3,7,29
"The 2018 midterms were the most expensive in history - we can’t allow that trend to continue. #HR1 begins the work of ending the corrupting influence of money in politics. Disclosure, oversight and overturning Citizens United are on the table, we must get this done. #ForThePeople pic.twitter.com/0xOI6n0Zmn",1103286309630763009,2019-03-06,13:28:48,repdeanphillips,2,11,62
"Looking forward to taking part in a #TownHallForThePeople tonight with @RepSarbanes and several of my fellow freshmen. Have questions about what #HR1, the #ForThePeople Act means for America?

Tweet us your questions using #TownHallForThePeople!",1103282834049908737,2019-03-06,13:15:00,repdeanphillips,185,100,318
"I'm here in the Capitol, about to head into the Rules Committee to offer some amendments to #HR1.

We'll be posting updates as we work to pass the #ForThePeople Act all week long! pic.twitter.com/DhGReWq0mh",1103080275859386368,2019-03-05,23:50:06,repdeanphillips,4,15,82
"Excited to vote for #HR1, the #ForThePeople Act this week!

It's my top priority to restore your faith in an honest and transparent government, and this bill is the first step in doing that.

I'll be keeping you updated all week as we work to get this done - stay tuned! pic.twitter.com/805YXmCx7g",1103073834637365248,2019-03-05,23:24:30,repdeanphillips,3,18,135
"You’re right, @senatemajldr, #HR1 is designed to benefit just one side; THE VOTERS. #ForThePeople https://twitter.com/HouseGOP/status/1103009968473677826 …",1103013769708560386,2019-03-05,19:25:50,repdeanphillips,4,28,160
"We will vote on #HR1 this week to end the corrupting influence of big money in politics, make it easier to vote and put government back to work #ForThePeople. I’m grateful for the energy and passion of those in #MN03 and beyond who have worked so hard for this historic change. pic.twitter.com/dl0U21juTN",1102980664834449408,2019-03-05,17:14:17,repdeanphillips,15,38,210
"#FridayFollowUp (on Monday), episode 7: It was a historic week in Congress as we passed two, common-sense gun violence prevention measures, #HR8 and #HR1112. This week we'll consider #HR1, the most important reform bill of our generation. Stay tuned... #ForThePeople pic.twitter.com/RKhR3E3CKx",1102760670230208513,2019-03-05,02:40:06,repdeanphillips,16,34,204
That’s correct. The top image is from a display in the WV Capitol and bottom image is from a gas station in Rogers.,1101865572688711681,2019-03-02,15:23:18,repdeanphillips,6,1,11
"A core promise of America is the vigilant protection of free speech and the security of those who engage in it. While I strongly object to some of Rep. @ilhan Omar’s recent comments, the disgusting display in the WV Capitol and threats on her life are antithetical to our values. pic.twitter.com/R8qE6UbpDE",1101853417180446720,2019-03-02,14:35:00,repdeanphillips,316,328,1390
