tweet,id,date,time,username,replies_count,retweets_count,likes_count
"In a late-night filing, Democrats are back to alleging that President @realDonaldTrump committed criminal bribery, and they've added a new charge - wire fraud. The goalposts continue to expand to justify the Democrats' vindictive impeachment scheme: https://www.politico.com/news/2019/12/16/judiciary-committee-impeachment-report-trump-committed-multiple-federal-crimes-086096 …",1206590509017382912,2019-12-16,15:02:49,repandybiggsaz,212,954,1852
"ICYMI: I'll be hosting a telephone town hall later this morning. If you'd like to discuss impeachment, USMCA, government spending, border security, or anything else, please call in at 11 AM AZ time.

You can call into our town hall at 877-229-8493, using the pin of 116368. #AZ05 https://twitter.com/RepAndyBiggsAZ/status/1206040751546806272 …",1206575195202473985,2019-12-16,14:01:58,repandybiggsaz,31,141,320
"I joined a letter to @GOPLeader & @RepKayGranger to express gratitude for their commitment to ensure that appropriations bills for FY20 do not contain any poison pill language that would attack pro-life, religious liberty, or family values policy.  https://biggs.house.gov/sites/biggs.house.gov/files/2019-12-09-%20FINAL%20Smith-Hartzler%20Letter%20to%20McCarthy-Granger%20Poison%20Pills.pdf …",1206422461270638593,2019-12-16,03:55:03,repandybiggsaz,21,213,723
"This past Friday, we said goodbye’ to our two D.C. interns, Gabbi and Stefan. Both interns worked extremely hard for the constituents of #AZ05, and we wish them well with their future endeavors. pic.twitter.com/cNyjvEJ1L1",1206357582220288003,2019-12-15,23:37:15,repandybiggsaz,18,135,652
"The liberal Senators who tried to smear Secretary Bernhardt’s reputation should be ashamed. The IG report has corrected the record, and I hope the Democrats put an end to their efforts to take down the @realDonaldTrump administration.  https://westerncaucus.house.gov/news/documentsingle.aspx?DocumentID=3279 … #AZ05",1206261657523179522,2019-12-15,17:16:05,repandybiggsaz,49,556,1791
"There won’t be any shortage of issues to discuss next week, which is why I’ll be hosting a telephone town hall.

If you are free at 11 AM AZ time MONDAY, please join me for a telephone town hall.

You can call into our town hall at 877-229-8493, using the pin of 116368. pic.twitter.com/kNjyBUoMdZ",1206040751546806272,2019-12-15,02:38:16,repandybiggsaz,49,181,444
"The Border Security Caucus was pleased to welcome former Acting Director of @ICEgov Tom Homan to Capitol Hill this week. We appreciated his valuable insight on securing our border and enforcing our immigration laws, which are two of my top priorities in Congress. #AZ05 pic.twitter.com/oNOzHsdJC3",1205983565567209474,2019-12-14,22:51:02,repandybiggsaz,32,228,828
"It's rich hearing my Democrat colleagues start to malign the Senate's impeachment trial process - even before it's started.

Impeachment was predetermined in the House long ago.

Democrats have no high ground to complain about the Senate's process. https://video.foxnews.com/v/6115848072001 ",1205918111976894464,2019-12-14,18:30:57,repandybiggsaz,166,1047,2832
"TUNE IN: I’m about to join @TeamCavuto to talk about the Democrats’ partisan, vindictive march to impeach @realDonaldTrump. Watch @FoxNews NOW. #AZ05",1205866124715446278,2019-12-14,15:04:22,repandybiggsaz,28,104,405
COMING UP: I’m joining @TeamCavuto this morning to preview the Democrats’ grand finish to their vindictive impeachment sham. Watch @FoxNews at 10:12 EST. #AZ05,1205845233742864386,2019-12-14,13:41:21,repandybiggsaz,34,147,490
"Democrats have manipulated the process in an obscene way to advance their obsession to impeach President @realDonaldTrump based solely on their opposition to him and his policies – not because he has done anything wrong.

Read my @FoxNews op-ed ➡️ https://www.foxnews.com/opinion/trump-impeachment-vote-house-democrats-andy-biggs …",1205679129363992576,2019-12-14,02:41:19,repandybiggsaz,248,1243,3140
"TUNE IN: I’m on #HANNITY with @seanhannity, alongside @SteveScalise, to discuss next week’s impeachment vote on the House Floor. Watch @FoxNews NOW.",1205676412818149376,2019-12-14,02:30:31,repandybiggsaz,70,125,531
"COMING UP: I’ll be joining @seanhannity to talk about the Democrats’ partisan, vindictive impeachment sham they’ve perpetuated on America. Democrats may impeach @realDonaldTrump, but Americans are disgusted by the Democrats’ actions. Watch @FoxNews at 9 EST. #AZ05",1205662042105008130,2019-12-14,01:33:25,repandybiggsaz,51,306,953
"Today’s impeachment vote in the House Judiciary Committee was anticlimactic because there wasn’t anyone in that room - or across America - who had any doubt on how the vindictive Democrats would vote.

Democrats have been plotting to impeach @realDonaldTrump for three years. pic.twitter.com/qgizxOfFBw",1205619993444044806,2019-12-13,22:46:20,repandybiggsaz,197,1772,3888
TONIGHT: I’ll be joining @seanhannity to react to today’s partisan vote on Articles of Impeachment in the House Judiciary Committee. Watch @FoxNews at 9 EST. #AZ05,1205613938194419712,2019-12-13,22:22:16,repandybiggsaz,35,211,635
"During a time of year when all Americans should be coming together in joy & peace, Democrats have willfully chosen to divide the nation in their attempt to overturn the will of 63 million voters who supported President @realDonaldTrump in the ‘16 election https://biggs.house.gov/media/press-releases/house-judiciary-democrats-take-big-step-overturn-2016-election …",1205532706379096065,2019-12-13,16:59:29,repandybiggsaz,106,512,1152
NO. pic.twitter.com/7ZCZ9FAL83,1205526505725579265,2019-12-13,16:34:51,repandybiggsaz,98,487,2117
TUNE IN: I’m about to react to today’s vindictive vote on Articles of Impeachment in the House Judiciary Committee with @broomheadshow. Listen on @KFYI. #AZ05,1205511490419249153,2019-12-13,15:35:11,repandybiggsaz,52,144,417
The Democrats have abused the rules throughout this impeachment process. Their actions have done irreparable harm to this institution. They've caused a lot of problems that they are going to have to live with for a number of years to come. https://video.foxnews.com/v/6115594676001 ,1205504165436383232,2019-12-13,15:06:04,repandybiggsaz,276,1193,3012
TUNE IN: the House Judiciary Committee is about one hour away from resuming our markup/vote on Articles of Impeachment. I’ll be joining @BillHemmer on @AmericaNewsroom at 9 EST to preview what’s in store for the next week. Watch on @FoxNews. #AZ05,1205487358549905408,2019-12-13,13:59:17,repandybiggsaz,35,152,426
COMING UP: I’m joining @BillHemmer on @AmericaNewsroom this morning to discuss last night’s stunning recess to the House Judiciary Committee’s Impeachment markup and what’s next for this predetermined outcome. Watch @FoxNews at 9 EST. #AZ05,1205478177067479040,2019-12-13,13:22:48,repandybiggsaz,32,132,412
"Last night’s stunning turn of events was yet another in a long line of dishonest, bad-faith maneuvers from the Democrats. They have proven at every step of this impeachment process that they will do & say anything to accomplish their vindictive goal. https://video.foxnews.com/v/6115478269001 ",1205470857780514816,2019-12-13,12:53:43,repandybiggsaz,174,1212,3025
"Chairman Jerry Nadler just pulled a fast one on House Judiciary Republicans. We were expecting to vote on Articles of Impeachment in Committee tonight before he recessed until tomorrow.

This is yet another of a long line of bad-faith, dishonest dealings by the Democrats. pic.twitter.com/wvPs4XE1rF",1205349451235299328,2019-12-13,04:51:18,repandybiggsaz,1244,3559,8102
TUNE IN: about to join @ShannonBream on @foxnewsnight to talk about tonight’s stunning recess of the Articles of Impeachment markup. Watch @FoxNews NOW. #AZ05 pic.twitter.com/KmuIPfYkRf,1205344507379802114,2019-12-13,04:31:39,repandybiggsaz,27,63,208
President @realDonaldTrump will be exonerated yet again. https://twitter.com/oliverdarcy/status/1205310704124870658 …,1205311417840263170,2019-12-13,02:20:10,repandybiggsaz,90,436,1274
"We've heard basically every grievance Democrats have against this President the past two days.

They’ve tried to pigeonhole their grievances into 1 of 2 things – either Obstruction of Congress or Abuse of Power.

Democrats are all over the map because they can’t deliver a crime. pic.twitter.com/4FZikSer3i",1205306622693781506,2019-12-13,02:01:07,repandybiggsaz,101,516,1200
"The Democrats have been attempting to mislead the American people about a lot of things today - as they have all throughout their partisan, vindictive impeachment of @realDonaldTrump.

And @RepDougCollins had had enough with the untruths we've heard today.... pic.twitter.com/gCnY1GVwaE",1205303480665149440,2019-12-13,01:48:37,repandybiggsaz,321,1306,2552
"“It’s clear to the American people watching that the President didn’t not do something to justify this impeachment. 

But I think we could have done a lot more to fulfill the President’s promise to drain the swamp if we had actually followed the rules.” - @RepMattGaetz pic.twitter.com/a3LKphJV8f",1205296240851849216,2019-12-13,01:19:51,repandybiggsaz,272,911,2921
"""Sorry to President Zelensky.

Sorry to President @realDonaldTrump.

Sorry to the American people.""

Well said, @RepRatcliffe. pic.twitter.com/jR5PJkkLuA",1205290804316651520,2019-12-13,00:58:15,repandybiggsaz,268,2700,6848
"“(Democrats) don’t just want to remove President @realDonaldTrump from the Oval Office.

They want to crush him.

They want to destroy him.

They want to banish him from the marketplace.” - @RepMikeJohnson pic.twitter.com/0Sr1GriQtq",1205286533449879552,2019-12-13,00:41:17,repandybiggsaz,108,437,774
"The Democrats' legislative record pales in comparison to @realDonaldTrump's three-year record as Commander in Chief.

They can't stand his record of promises made, promises kept.

And for this, they are pursuing impeachment.

Thanks for the reminder, @Jim_Jordan. pic.twitter.com/H0B5u1LSIx",1205284235331952641,2019-12-13,00:32:09,repandybiggsaz,2898,11438,35311
"Don't let any Democrat fool you: 

Democrats have been plotting impeachment since they took over the House.

Their latest attempt is simply the culmination of their coup.

They're already promising more impeachment attempts once @realDonaldTrump is exonerated by the Senate! pic.twitter.com/66NAMYMsPf",1205281463706562562,2019-12-13,00:21:08,repandybiggsaz,240,1517,3065
"Mr. Schiff has admitted that he doesn’t want to take the time to avail himself of the process that Democrats claim to be defending (by not going to court to enforce subpoenas).

That’s exactly why Democrats are the ones abusing the process, the President & the Executive Branch. pic.twitter.com/0fNhgc73Iy",1205270143309426688,2019-12-12,23:36:09,repandybiggsaz,68,701,1425
"ICYMI: ""For three years, this president has been harassed."" - @replouiegohmert pic.twitter.com/YqcZ80TAV7",1205265627654578176,2019-12-12,23:18:13,repandybiggsaz,106,601,1250
"Everyone needs to listen to @Jim_Jordan talk about who's really guilty of Obstruction of Congress.

It's not @realDonaldTrump.

It's Adam Schiff.

Mr. Schiff owes this committee, this body, and the American people some answers for what he has done behind closed doors. pic.twitter.com/jgGwoEfEOX",1205263026267533312,2019-12-12,23:07:52,repandybiggsaz,666,4512,10826
"🚨 Judiciary Democrats just defeated my amendment to highlight the fact that President @realDonaldTrump released the aid to Ukraine after President Zelensky signed two major anti-corruption measures into law. 🚨

Democrats aren't just afraid of the truth. They abhor the truth. pic.twitter.com/3uy0GE5FQ6",1205254089698922497,2019-12-12,22:32:22,repandybiggsaz,202,1684,2739
"As @RepDougCollins asks, where are the crimes that @realDonaldTrump supposedly committed?

Democrats have NO evidence to prove any crimes, so they will continue to talk about their unproven allegations.

Democrats don't have a case. But they will continue on with their sham. pic.twitter.com/VHVtxFnt2R",1205244663596236800,2019-12-12,21:54:54,repandybiggsaz,372,957,1912
Two minubuses = an omnibus https://thehill.com/policy/finance/474348-lawmakers-strike-spending-deal-to-avert-shutdown …,1205241079043375106,2019-12-12,21:40:40,repandybiggsaz,15,69,141
"The willingness of Democrats to relentlessly attack @POTUS @realDonaldTrump & his supporters has divided this country and done irreparable harm to an institution already viewed with almost universal disapprobation.

Read the rest of my @FoxNews op-ed ➡️ https://www.foxnews.com/opinion/rep-andy-biggs-democrats-continue-baseless-rush-to-impeach-trump-despite-lack-of-evidence-of-wrongdoing …",1205238581268230145,2019-12-12,21:30:44,repandybiggsaz,112,486,987
"The Democrats’ standard giving absolute process authority to the House would impel them to impeach a judge who sustained a lawful exercise of executive privilege.

Democrats have overstepped their bounds everywhere you look on their vindictive march to impeach @realDonaldTrump. pic.twitter.com/1bbIU0Hy6y",1205234515985215505,2019-12-12,21:14:35,repandybiggsaz,57,378,760
"One of our colleagues on the other side of the aisle said that the President should come in and prove his own innocence.

That is antithetical to our American judicial process, to the Constitution, to the Bill of Rights, and to what we do here in Congress. pic.twitter.com/UhhjhufyGz",1205232502232756226,2019-12-12,21:06:35,repandybiggsaz,151,694,1566
"If Democrats were honest, they would admit that the aid was released within days of Ukrainian President Zelensky signing two major anti-corruption measures into law, convincing President @realDonaldTrump that the new Ukrainian administration was serious about reform measures. pic.twitter.com/P2RgRkP6xT",1205230829712093184,2019-12-12,20:59:56,repandybiggsaz,63,607,1065
".@RepMikeJohnson LEVELS Chairman Nadler's arguments for impeachment.

Democrats are charging @realDonaldTrump with ""Obstruction of Congress"" because they were in too much of a hurry to go to court.

They're supposed to go to court to resolve disputes; not resort to impeachment. pic.twitter.com/jOdQ8bThdb",1205215182680707073,2019-12-12,19:57:46,repandybiggsaz,145,889,1620
"“If you issue an Article of Impeachment for obstructing Congress, you’re going to make this president more popular, not less popular. Congress is an embarrassment, and this president is keeping his promises.” - @RepKenBuck pic.twitter.com/VMqcOlr8X6",1205212724369723392,2019-12-12,19:47:59,repandybiggsaz,105,894,1856
It's a honor to serve with a patriot like yourself. Thank you for your leadership throughout this sham. https://twitter.com/SteveScalise/status/1205187979913945091 …,1205191520296611841,2019-12-12,18:23:44,repandybiggsaz,62,415,1194
"This President has done a remarkable job in spite of three years of constant harassment by the Democrats in this body and the media on the left of this country.

We have a great economy.

He’s trying to bring order to the border.

He’s restored the military.

And so much more! pic.twitter.com/DD2sXyxkIt",1205186272303734784,2019-12-12,18:02:53,repandybiggsaz,6090,10384,32115
"I'll save @SteveScalise some time: I'm a NO on both Articles of Impeachment.

This latest hoax that Democrats have used to pursue impeachment of President @realDonaldTrump is completely without merit. https://twitter.com/Journo_Christal/status/1205182922648702976 …",1205184496997412877,2019-12-12,17:55:49,repandybiggsaz,61,357,827
"Today's impeachment markup has confirmed our worst fears: 

Democrats have invented two Articles of Impeachment against @realDonaldTrump, but they are still holding many others over his head.

They will never be satisfied until this President is out of office. pic.twitter.com/VXJEOg7OGO",1205182913593171975,2019-12-12,17:49:32,repandybiggsaz,3479,8341,25462
".@Jim_Jordan is right:

The President - & not unelected bureaucrats - sets America's foreign policy.

When the President differs from bureaucrats on policy, POTUS gets to make the call every single time.

Democrats are turning this on its head to impeach @realDonaldTrump. pic.twitter.com/ltsRlF1a1H",1205179370941353984,2019-12-12,17:35:27,repandybiggsaz,256,1630,4054
"Forget for a second that Democrats are again calling Mr. Zelensky's integrity into question, but there is zero evidence to support this statement from Chairman Nadler.

Zero.

Just like the absolute lack of evidence for their entire impeachment case against @realDonaldTrump. https://twitter.com/mkraju/status/1205170235420168193 …",1205172776040108034,2019-12-12,17:09:15,repandybiggsaz,73,522,1033
"Democrats want EVERY inference to go against @realDonaldTrump. Why should the American public give them ANY inference of credibility?

The ONLY direct evidence in this case remains the same: Ukrainian officials have said repeatedly that there was NO pressure. pic.twitter.com/A0unKqnAP0",1205157018098647041,2019-12-12,16:06:38,repandybiggsaz,1535,6663,20580
Blast from the past. https://twitter.com/RepDougCollins/status/1205152616721911809 …,1205152729146019842,2019-12-12,15:49:35,repandybiggsaz,38,151,397
"President @realDonaldTrump wanted to ensure that the new President of Ukraine was committed to anti-corruption measures before he released the aid.

Once he was convinced, the aid was released.

He's getting impeached for being a good steward of taxpayer dollars.

Unbelievable. pic.twitter.com/jvc9hkYwQN",1205151558838734848,2019-12-12,15:44:56,repandybiggsaz,116,829,1642
“Democrats are naming crimes in debate that they don’t even have in their impeachment resolution because they can’t prove them and because there are no underlying facts.” - @RepMattGaetz pic.twitter.com/WqSC6lYz0b,1205148099334807553,2019-12-12,15:31:12,repandybiggsaz,446,1861,4648
"Democrats continue to ignore the testimony of their own witnesses, misstate facts, and conflate timelines.

The funds that were temporarily withheld from Ukraine were prospective. The withheld funds did not lead to Ukrainian deaths as some Democrats state. pic.twitter.com/GzJglY2Af2",1205142116642496512,2019-12-12,15:07:25,repandybiggsaz,52,462,950
"As @Jim_Jordan reminds us, Article I ignores the truth & should be discarded:

“The call transcript shows no quid pro quo.

President Trump & Zelensky have said no pressure.

Ukraine didn’t know about withheld aid on 7/25.

Ukraine didn’t take any action to get aid released.” pic.twitter.com/2EnxbLb7X8",1205136865411641347,2019-12-12,14:46:33,repandybiggsaz,264,825,2109
"The Democrats continue to run all over the Minority's rights throughout their partisan, vindictive impeachment sham.

We have asked for a Minority hearing per our rights under House rules.

Chairman Nadler has refused to schedule a date for this hearing.

This isn't fair. pic.twitter.com/LbSl5v3Zg1",1205133224479002624,2019-12-12,14:32:05,repandybiggsaz,225,1252,2534
"The Democrats don’t have the law or the facts on their side, so they’ve acted in bad faith to manipulate the process for impeaching @POTUS @realDonaldTrump.

The President did nothing wrong. It’s the Democrats who have abused their powers. pic.twitter.com/oRRlA1ju2G",1205123400169078784,2019-12-12,13:53:03,repandybiggsaz,90,880,1772
"The first day of the House Judiciary Committee’s markup of Articles of Impeachment is complete, and I’m about to join @IngrahamAngle live from Capitol Hill to react to what was said. Watch @FoxNews NOW. #AZ05 pic.twitter.com/7kHzRcPQd4",1204968940834828288,2019-12-12,03:39:17,repandybiggsaz,59,91,376
"""No collusion.

No obstruction.

No quid pro quo.

No treason.

No bribery.

No high crimes and misdemeanors."" - @RepGregSteube pic.twitter.com/UiXCQsLxGz",1204962497993818112,2019-12-12,03:13:41,repandybiggsaz,110,649,1450
"Hard pass.

America can't afford any more of this ""love."" https://twitter.com/lindsemcpherson/status/1204960409893117953 …",1204960731143311360,2019-12-12,03:06:40,repandybiggsaz,60,134,386
"""In three years, Democrats introduced ten resolutions related to the impeachment, and 17 members of this committee have voted to consider impeachment – and every one of those votes occurred before the July 25 phone call."" - @RepArmstrongND pic.twitter.com/b3fygWMlMT",1204960415807148032,2019-12-12,03:05:24,repandybiggsaz,35,282,554
"""Tonight, the majority takes a step down a path that achieves a goal they have long sought. But at what cost? 

This is an abuse of power by the majority, designed to achieve what they simply could not achieve at the ballot box."" - @RepBenCline pic.twitter.com/8ILVMFqfvv",1204958269657231360,2019-12-12,02:56:53,repandybiggsaz,45,268,538
"“Do we have Abuse of Power? Yes, Adam Schiff.

Do we have Obstruction of Congress? Yes, House Democrats.

This is a political hit job (against President @realDonaldTrump).” - @GReschenthaler pic.twitter.com/m56LyLSVZl",1204956040154042368,2019-12-12,02:48:01,repandybiggsaz,393,4332,14449
TONIGHT: I'll be joining @IngrahamAngle to recap the Democrats' primetime opener for their markup of Articles of Impeachment. Watch @FoxNews at 10:40 EST. #AZ05,1204953867521318913,2019-12-12,02:39:23,repandybiggsaz,11,38,141
"""If anyone is guilty of abusing power or obstructing Congress around here, it’s the Democrats, not the President. It’s time for my Democrat colleagues to look themselves in the mirror."" - @RepDLesko pic.twitter.com/AcQYqSJgol",1204952619728412673,2019-12-12,02:34:26,repandybiggsaz,154,835,1873
"""This is precisely the abuse of impeachment the American Founders feared: that the power to overrule would devolve into a weapon of partisan warfare."" - @RepMcClintock pic.twitter.com/kZmcVLByPU",1204952323186941952,2019-12-12,02:33:15,repandybiggsaz,13,160,334
"Democrats have not only drawn different inferences from the facts, they’ve created facts to satisfy the obsession of their rage against @realDonaldTrump. 

They don’t have any direct evidence to prove their predetermined case against President Trump. And that’s a crying shame. pic.twitter.com/wsXAIWjr9M",1204948365265555459,2019-12-12,02:17:31,repandybiggsaz,1156,1421,2639
"“After years of pointless and endless investigations against the President, this witch hunt is no longer simply troublesome; it has become deeply and excruciatingly tiresome.

It’s time to move on.

The American people hate this.” - @RepMattGaetz pic.twitter.com/RWLbRKWb70",1204943217277493249,2019-12-12,01:57:04,repandybiggsaz,326,1231,3195
"I’m about to speak in opposition to the Democrats’ partisan, vindictive Articles of Impeachment. Watch here:  https://www.youtube.com/watch?v=tPZfd5ro05g … #AZ05",1204943080580886528,2019-12-12,01:56:31,repandybiggsaz,25,77,169
“We are marking up Articles of Impeachment for offenses that aren’t crimes that some Members of Congress have never heard of before – much less know what it means.” - @RepRatcliffe pic.twitter.com/ht0uDQM4SE,1204936322143735808,2019-12-12,01:29:40,repandybiggsaz,120,1019,2469
"I agree with @RepKenBuck.

The American people WILL remember the Democrats resisting and looking for an excuse to impeach this president since he was elected. pic.twitter.com/zIcR9x4gzB",1204934261691863040,2019-12-12,01:21:29,repandybiggsaz,125,359,747
"""They dislike us so much they are willing to weaponize the government. 

A few years ago, it was the IRS. 

More recently it was the FBI. 

And now it’s the impeachment power of Congress, going after 63 million people and the guy we put in the White House.” - @Jim_Jordan pic.twitter.com/ZpFQKiDdG1",1204932427505963014,2019-12-12,01:14:11,repandybiggsaz,570,6757,15016
"Democrats in Congress - NOT @POTUS @realDonaldTrump - have committed the high crimes and misdemeanors of Abuse and Power and Obstruction of Congress that are laid on the table.

Thank you, @replouiegohmert, for speaking truth during this sad time in American history. pic.twitter.com/iNURYYHwhd",1204928151245246464,2019-12-12,00:57:12,repandybiggsaz,625,5530,16416
"“Tomorrow, this committee will hold a vote to impeach a president, without having heard from a single fact witness and without allowing the minority party the ability to call any witnesses or present any defense.

What a travesty of justice.” - @RepSteveChabot pic.twitter.com/DYQKcAmWqN",1204926079842041858,2019-12-12,00:48:58,repandybiggsaz,225,975,1840
"These words coming from a Member of Congress who knows a thing or two about impeachments:

“What we are debating here, in my opinion, is the weakest case in history.

And yet the Democrats have decided to go full speed ahead.” - @JimPressOffice pic.twitter.com/Ia6TlZekQ7",1204923780478492672,2019-12-12,00:39:50,repandybiggsaz,19,222,394
"""The real legacy of this impeachment hearing will not be the removal of @realDonaldTrump as President.

It’s the institutional damage to this body."" - @RepDougCollins pic.twitter.com/aN92fCsWyg",1204922606299865090,2019-12-12,00:35:10,repandybiggsaz,56,408,910
"President Zelensky & other Ukrainian officials have repeatedly said that there was NO PRESSURE from @realDonaldTrump.

Democrats don't just ignore these statements.

They call the integrity of such statements into question.

Democrats will do anything to impeach the President. pic.twitter.com/WZCkaYo9cJ",1204920783690174464,2019-12-12,00:27:55,repandybiggsaz,43,384,776
"As @RepDougCollins hammers home, Democrats have been working around the clock to impeach @realDonaldTrump for three years.

This latest case is not unexpected. 

It's exactly what Democrats have tried to do.

That's incredibly sad for America. pic.twitter.com/ONbOvt204g",1204919063065038858,2019-12-12,00:21:05,repandybiggsaz,118,470,1030
