tweet,id,date,time,username,replies_count,retweets_count,likes_count
"""This isn’t something Democrats are approaching prayerfully and mournfully and sadly. 

This is something they are gleeful about. 

They have been trying to (impeach @realDonaldTrump) for three years."" - @RepChrisStewart pic.twitter.com/3KYeD4J9pF",1207369634468511744,2019-12-18,18:38:47,repandybiggsaz,64,327,569
"""Democrats fear the true will of WE THE PEOPLE. 

They fear our faith. 

They fear our strength. 

They fear our unity. 

They fear our vote. 

AND THEY FEAR OUR PRESIDENT."" - @RepClayHiggins pic.twitter.com/bqfJLSiqD2",1207368267364474880,2019-12-18,18:33:21,repandybiggsaz,124,601,1157
"""There are two charges claimed by House Democrats, and there is ZERO cause for either."" @RepCarolMiller pic.twitter.com/yXJbNro6AG",1207366141791940608,2019-12-18,18:24:54,repandybiggsaz,19,119,242
".@RepMcClintock reminds us that the Democrats, the radical Left, and the Resistance movement vowed to remove @realDonaldTrump by any means necessary.

This is their latest effort to keep their vindictive promise. pic.twitter.com/MZCFSdbbwJ",1207365545886146566,2019-12-18,18:22:32,repandybiggsaz,32,191,313
"Democrats are clarifying that they can try to nullify an election without alleging a single high crime or misdemeanor, but rather a couple of amorphous allegations based on gossip, rumor, and innuendo.",1207364412937527296,2019-12-18,18:18:02,repandybiggsaz,39,222,443
"Democrats also arguing that President @realDonaldTrump is a danger to free elections as they relentlessly pursue overturning the 2016 election. 

Brazen hypocrisy.",1207364158888521734,2019-12-18,18:17:01,repandybiggsaz,72,494,1182
"Democrats continue to argue that @realDonaldTrump obstructed Congress. 

Yet Democrats have failed to avail themselves of the process violations they claim in court - because they said they didn't have enough time to go to court.

This is the DEMOCRATS abuse of power.",1207363934199730176,2019-12-18,18:16:08,repandybiggsaz,37,282,530
"Looking forward to hearing what you have to say, @RepRiggleman. Speak the truth. https://twitter.com/RepRiggleman/status/1207363173898162176 …",1207363373517672451,2019-12-18,18:13:54,repandybiggsaz,9,35,96
".@RepBuddyCarter argues that this impeachment is not being done to strengthen the country, but to influence public opinion against @realDonaldTrump.

He's right. This is the FOURTH impeachment attempt from Democrats. And more are expected after @POTUS is exonerated. pic.twitter.com/hSeXCPYvZW",1207363065689313281,2019-12-18,18:12:41,repandybiggsaz,51,246,427
"Chairman Nadler is not hearing the Republicans' ardent defense of President @realDonaldTrump.

I invite him to listen more attentively and hear the facts reiterated: aid given without conditionality. President Zelensky said there was no pressure. pic.twitter.com/VuQDX5pGnQ",1207362561722720258,2019-12-18,18:10:41,repandybiggsaz,53,340,687
"One of my Democrat colleagues said that @realDonaldTrump ""confessed"" to his supposed crimes and ""obstructed"" - at the same time, which would be a truly remarkable feat.

That position is what makes the Democrats' partisan, vindictive sham so incredible.",1207361079954857984,2019-12-18,18:04:47,repandybiggsaz,30,214,490
"On floor, listening to debate on the impeachment articles. Democrats must have poll tested the terms ""cheat"" & ""steal.""

But DEMOCRATS are the ones trying to cheat Americans out of their choice of @realDonaldTrump as President & steal '20 election by impeaching this President.",1207360601787424771,2019-12-18,18:02:53,repandybiggsaz,78,367,795
"This is the real motivation for Democrats pursuing impeachment.

They hate @realDonaldTrump so much -& what he stands for - they want history to forever remember him as an impeached President.

This is so flawed. So wrong. So vindictive. And so in tune w/ current Democrat Party. https://twitter.com/NateOnTheHill/status/1207359217113485312 …",1207359917503516673,2019-12-18,18:00:10,repandybiggsaz,502,1047,2012
You can't be immune from a criminal investigation because you are related to a powerful politician.,1207358871561486338,2019-12-18,17:56:01,repandybiggsaz,23,136,327
"Democrats say @realDonaldTrump asked for help in '20 election, but that is inconsistent w/ facts.

@POTUS was concerned about past events that occurred w/ the '16 election & Hunter Biden's alleged corruption.",1207358814128943104,2019-12-18,17:55:47,repandybiggsaz,25,209,442
"Democrats claim that we run the risk of being a monarchy or dictatorship. That is one of the sloppiest arguments for impeachment. It ignores the facts that all aid was given to Ukraine within time limits of the law passed by Congress, & that there was NO pressure on Zelensky.",1207358099608260610,2019-12-18,17:52:57,repandybiggsaz,56,213,506
"Our Democrat colleagues have weaponized the impeachment provision of the Constitution to nullify the votes of 63 million Americans who elected President @realDonaldTrump.

This is not about a phone call.

Or Ukraine.

Or use of executive privilege.” - @RepMikeJohnson pic.twitter.com/yvuzt80I9k",1207356017425735681,2019-12-18,17:44:40,repandybiggsaz,73,371,643
“We are here because the Majority Caucus – the Democratic Caucus – has been hijacked by the radical left. They have wanted to reverse the course of the 2016 election ever since @realDonaldTrump won that election.” - @JimPressOffice pic.twitter.com/BSzFD4ye6L,1207354772921241600,2019-12-18,17:39:44,repandybiggsaz,41,225,439
"“The people of America see through this.

The people of America understand due process.

And they understand when it is being trampled in the People’s House.” - @RepDougCollins pic.twitter.com/HNf2taEqao",1207353435634511881,2019-12-18,17:34:25,repandybiggsaz,37,241,544
"Speaker Pelosi is focusing her remarks today on the Republic & whether it will stand.

It CAN'T stand when there's not justice for all - INCLUDING the President of the United States.

We have seen Nancy Pelosi, Adam Schiff, Jerry Nadler & all of their cohorts wielding injustice.",1207349185957289984,2019-12-18,17:17:32,repandybiggsaz,101,703,1792
"Yesterday, Democrats admitted that Republicans & the President could have called any witness they wanted...as long as the witness was one of the 17 whom Democrats had already called.

Imagine a trial where you were limited only to the witnesses your accuser ALLOWED you to call.",1207347830991605760,2019-12-18,17:12:09,repandybiggsaz,63,597,1129
"House Republicans are united against this sham impeachment of President @realDonaldTrump.

Democrats have pursued a vindictive path to give them the predetermined outcome they've been seeking for 3 years.

And we believe Americans see this for the political spectacle that it is. pic.twitter.com/VIaSbbdWfg",1207344384875933696,2019-12-18,16:58:27,repandybiggsaz,67,344,722
"Impeachment of @realDonaldTrump is partisan.

Opposition to impeachment is bipartisan. https://twitter.com/benyc/status/1207340831679696901 …",1207341991224369152,2019-12-18,16:48:56,repandybiggsaz,41,174,420
"“The American people see right through this today. 

They’ve seen the rigged process. 

They’ve seen the lack of transparency and the complete absence of any supporting evidence.” - @RepWalorski pic.twitter.com/zfimaqdK3f",1207341584880148480,2019-12-18,16:47:19,repandybiggsaz,47,261,540
"""STOP SAYING THE FACTS ARE UNCONTESTED."" @RepLeeZeldin 

Lee's right. The Democrats are misleading the American people with this repeated statement. 

In fact, when the facts receive their due consideration, they tend to prove @realDonaldTrump's innocence. pic.twitter.com/lLw0EsyyZa",1207340268464345088,2019-12-18,16:42:05,repandybiggsaz,97,752,1412
"President @realDonaldTrump disbursed aid to Ukraine on time and pursuant to the law, contrary to the Democrats' erroneous assertions otherwise.

The four facts that have never changed, still remain, well, unchanged. pic.twitter.com/zyQkCPYUXL",1207338110880800769,2019-12-18,16:33:31,repandybiggsaz,24,150,264
"Democrats have demanded that the President prove his innocence and then wonder why we have suggested that they have run a Soviet-style proceeding.

They have turned fairness and due process upside-down on their vindictive march to impeach @realDonaldTrump.",1207337583317004289,2019-12-18,16:31:25,repandybiggsaz,84,450,1008
"One Democrat called the President a dictator during the debate from the last hour. This continues to demonstrate their true motivations for pursuing impeachment.

The exploited 7/25 call is only the means to the end. This is a three-year project in progress.",1207337205120806923,2019-12-18,16:29:55,repandybiggsaz,29,133,319
"Democrats are big about claiming that the rule of law must be protected while they, themselves, are ignoring the rules of the House and Constitution.

History will not kindly remember their partisan, vindictive efforts to overturn the will of 63 million Americans.",1207336469678972928,2019-12-18,16:27:00,repandybiggsaz,53,174,431
"If you watch nothing else today, take a few minutes to watch @RepDLesko on the House Floor from just a few minutes ago.

She again points out that more than half of the Democrats on the Rules Committee + 17 Democrats on the Judiciary Committee voted for impeachment before 7/25. pic.twitter.com/BjYSH11ecP",1207335981155864576,2019-12-18,16:25:03,repandybiggsaz,342,1946,3846
"The U.S. Supreme Court is reviewing whether President @realDonaldTrump must comply w/ dubious subpoenas from Congress.

Democrats want to impeach on this issue when they have not even availed themselves of the judicial process.

Count 2 is a throwaway article for mod Democrats.",1207334270907355137,2019-12-18,16:18:16,repandybiggsaz,54,270,609
"NOW: I’m joining @Varneyco to preview today’s radical, partisan, vindictive impeachment vote. Watch on @FoxBusiness. #AZ05",1207330075613503488,2019-12-18,16:01:35,repandybiggsaz,19,62,177
"Dr. @michaelcburgess makes a substantive defense of the Trump-Zelensky phone call, of which the facts and transcript have never been rebutted.

LISTEN ➡️ pic.twitter.com/4VtsSogV7Y",1207326768463523841,2019-12-18,15:48:27,repandybiggsaz,14,131,297
"Democrats have suddenly found the founders of this nation. Yet, the framers were opposed to this type of partisanship and particularly warned against impeachment of the President due to partisan or policy disputes. Democrats now embrace just such a flawed impeachment.",1207325716909559809,2019-12-18,15:44:16,repandybiggsaz,80,257,601
I really get a hoot out of Democrats acting like they are despondent to vote to impeach when it has been a Democrat talking point for the past three years.,1207325411622952960,2019-12-18,15:43:03,repandybiggsaz,108,493,1507
"“The decision to have this vote is not the result of a bipartisan process, nor a fair process. Instead, it’s going to be a deeply partisan vote, coming at the end of an unfair & rushed process, prescribed solely by Democrats to ensure a predetermined result.” - @TomColeOK04 pic.twitter.com/uoqW0u1OfD",1207325230764634112,2019-12-18,15:42:20,repandybiggsaz,12,117,247
"The House is now debating the rule for the Articles of Impeachment. Democrats have ensured that NO amendments can be considered.

Remember that the Democrats’ entire case is built on hearsay.

Remember that Democrats have been trying to impeach @realDonaldTrump for 3 years. pic.twitter.com/cemlZGUoDt",1207321803565228034,2019-12-18,15:28:43,repandybiggsaz,100,615,1085
"Democrats keep arguing that the facts behind their impeachment sham are beyond dispute. 

But the facts have been disputed. The inferences have also been disputed. 

The Democrats have not even alleged high crimes or misdemeanors.",1207319360194457600,2019-12-18,15:19:01,repandybiggsaz,76,285,696
"We are now debating the Democrats’ rule on the Articles of Impeachment. They won’t allow amendments to even be considered. 

They’re continuing their unfair, biased, partisan process all the way to the bitter end.",1207318657942130688,2019-12-18,15:16:13,repandybiggsaz,63,322,637
"This impeachment day is as predetermined and scripted as you could ever expect for the Democrats.

They've been pursuing impeachment of @realDonaldTrump for three years.

The American people won't buy their feigned, somber attitudes today. https://twitter.com/mkraju/status/1207310483264544770 …",1207314912726462467,2019-12-18,15:01:20,repandybiggsaz,65,290,630
"I’m voting to CONDEMN Adam Schiff’s blatant and repeated abuse of power + the manner in which Jerry Nadler has failed to respond to our requests for a Minority Day of Hearing.

Democrats have repeatedly run over House rules, due process, truth, and fairness.

We've had enough. pic.twitter.com/M6y1og4l8J",1207313841501229057,2019-12-18,14:57:05,repandybiggsaz,190,1862,4066
.@GOPLeader’s motion sets forth a lengthy list of the rules violations of chairmen Schiff and Nadler. Democrats have moved to prevent a vote on Leader McCarthy’s motion.,1207310704535056385,2019-12-18,14:44:37,repandybiggsaz,49,343,662
".@GOPLeader demanding that Democrats grant a minority hearing as has properly been requested by both the Intelligence and Judiciary Committees. Rules require that those hearings be held, but Democrats ignored the rules.",1207309805918064645,2019-12-18,14:41:03,repandybiggsaz,61,222,514
Republicans unify to move for adjournment of this sham impeachment proceeding. Democrats have the numbers and decided to proceed with their obsession to remove President @realDonaldTrump.,1207309168740356097,2019-12-18,14:38:31,repandybiggsaz,94,259,622
"🚨 I just moved for the House to adjourn so that we can stop wasting America's time on impeachment.

Republicans stand united against this radical, vindictive, partisan sham by the Democrats. pic.twitter.com/D7lAvN9PFD",1207302477948899329,2019-12-18,14:11:55,repandybiggsaz,572,1910,7131
Many @freedomcaucus Members already on the floor to stand with President @realDonaldTrump against the Democrat coup.,1207298970533466113,2019-12-18,13:57:59,repandybiggsaz,55,207,566
"Democrats have promised to keep investigating President @realDonaldTrump after the Senate exonerates the President. 

Crazy. 

What did Einstein say insanity is? Repeatedly doing the same thing w/ the expectation of a different result.  

That’s what we see today w/ Democrats.",1207296251798179840,2019-12-18,13:47:11,repandybiggsaz,83,532,1069
"Rep Cohen of Tennessee, a Democrat, called Van Drew a traitor to his party. But in reality, Jeff didn’t take an oath to the Democrat Party. His oath was to the Constitution. His principled stand against this malicious impeachment shows that Van Drew is honoring his oath.",1207295673831428096,2019-12-18,13:44:53,repandybiggsaz,48,466,998
"New Jersey Congressman Jeff Van Drew has consistently criticized the Democrats’ impeachment scam. Democrat leadership rumored to have threatened his staff if they continued working for him after he leaves the Democrat Party. 

That’s the Christmas spirit, Speaker Pelosi.",1207295238064218112,2019-12-18,13:43:09,repandybiggsaz,44,353,660
"In less than a hour, Democrats will officially violate Nancy Pelosi’s charge that impeachment must be bipartisan and that the evidence must be overwhelming to proceed. The only bipartisanship you will see today will be against impeachment.",1207294545840525312,2019-12-18,13:40:24,repandybiggsaz,150,752,1918
"The Democrats deny that multiple countries attempted to interfere in our election because they still can’t believe @realDonaldTrump won. And Hillary Clinton and DNC were the colluders, not Trump. https://www.usatoday.com/story/opinion/2019/12/17/russia-interfered-2016-ukraine-tried-andy-biggs-editorials-debates/2680383001/ …",1207129625899491329,2019-12-18,02:45:04,repandybiggsaz,96,922,2127
"As @RepDLesko reminds us tonight, 17 of 24 of the Judiciary Democrats, as well as a number of the House Rules Democrats, previously voted to advance Articles of Impeachment on the House Floor.

Remember - these votes occurred before the exploited July 25 call. pic.twitter.com/dAYMrCuqJ2",1207080748878041088,2019-12-17,23:30:51,repandybiggsaz,100,843,1511
"""Any member of Congress who votes in support of impeachment - against every shred of truth, fact, evidence, and legal principle - is showing how deeply they revile the voters and how truly they detest America's Constitutional order."" - @realDonaldTrump https://www.foxnews.com/politics/trump-pelosi-letter-impeachment-democrats …",1207073354831867905,2019-12-17,23:01:28,repandybiggsaz,168,1954,4046
"NO fact witness testified to a crime that @realDonaldTrump had committed.

And yet Democrats are rushing to impeach a duly elected President with no direct evidence to back up their amorphous claims. pic.twitter.com/9a2XlkKHmO",1207053057076412416,2019-12-17,21:40:49,repandybiggsaz,196,1110,2444
"Even before @realDonaldTrump was sworn into office, there was already talk about impeachment of the President-elect.

@RepRobWoodall points out one of these instances. 

This current case is not the first, and it is likely not the last. pic.twitter.com/9Rn2CWAxfF",1207043408512061440,2019-12-17,21:02:29,repandybiggsaz,62,484,892
"Democrats are entitled to their own opinions, but not their own facts.

We heard testimony that the 7/25 transcript was clear & accurate - as @RepDougCollins reminds the Rules Committee.

Democrats want that transcript to say things @realDonaldTrump never said. No quid pro quo. pic.twitter.com/X0vcSKOY7B",1207031507434557440,2019-12-17,20:15:11,repandybiggsaz,147,1021,1876
"🚨🚨🚨 Is Adam Schiff a fact witness in the Democrats' impeachment sham? 🚨🚨🚨

WATCH this exchange in today's House Rules Committee hearing ➡️ pic.twitter.com/nvL2KzUP6U",1207011833024057349,2019-12-17,18:57:00,repandybiggsaz,40,338,641
"“You were asked to vote on Articles of Impeachment against our Commander in Chief based on a report full of unsubstantiated allegations and hearsay, and you were not permitted to ask the author of the report any question?”

“That is correct.”

Why is Adam Schiff hiding? pic.twitter.com/QbzJRpCerF",1207009929967656961,2019-12-17,18:49:27,repandybiggsaz,171,2867,5527
"One of the reasons why D.C. is labeled the “Swamp” is because of how we review & pass federal appropriations.

We received 2 appropriations bills last night & will vote on them less than 24 hours later.

🚨 More than a trillion dollars of deficit spending. 🚨

I’ll be voting NO. pic.twitter.com/TCnXo9tdfd",1207006132738371584,2019-12-17,18:34:21,repandybiggsaz,126,638,1585
"Democrats ignored letters w/ legitimate questions from @RepDougCollins; and when asked about the reasoning behind ignoring the letters, mocked the Ranking Member for being a ""prolific letter writer.""

That says it all about what Democrats think about the rights of the Minority. pic.twitter.com/B3mFlz35oE",1207003897086324741,2019-12-17,18:25:28,repandybiggsaz,45,523,882
WATCH as @TomColeOK04 systematically exposes the Democrats' persistent abuse of the Minority's rights throughout this impeachment sham. pic.twitter.com/NRtuHBzFvq,1206998116983037952,2019-12-17,18:02:30,repandybiggsaz,71,477,907
"Democrats continue to turn the fundamental American concept of 'innocent until proven guilty' on its head.

To Democrats, President @realDonaldTrump is guilty, & he must PROVE his innocence to them to escape impeachment.

That is outrageous & dangerous to future of the Republic. pic.twitter.com/Vu95hc3uzR",1206990575347683329,2019-12-17,17:32:32,repandybiggsaz,386,1734,3392
"Four facts that will never change ➡️

1. Both Presidents say there was no pressure.
2. The call transcript shows no conditionality.
3. Ukrainians were not aware of any withheld aid at time of 7/25 call.
4. Ukrainians didn’t open an investigation and still got their aid. pic.twitter.com/vj8bzjU2fg",1206985801759961089,2019-12-17,17:13:34,repandybiggsaz,81,818,1733
“(The Democrats) are trying to interfere with the 2020 election by actually beginning this process and going forward.” - @RepDougCollins pic.twitter.com/HJ8d71udwl,1206983958623408130,2019-12-17,17:06:15,repandybiggsaz,35,362,692
".@RepDougCollins reminds us of Hamilton’s words on impeachment, when he wrote that the “founders warned against a vague, open-ended charge because it could be applied in a partisan fashion by a majority of the House of Representatives against an opposition president.”

So true. pic.twitter.com/FIthznNxWD",1206982625488973825,2019-12-17,17:00:57,repandybiggsaz,85,846,1798
"""If you read the report from the majority, there’s a lot of discussion about crimes, but they couldn’t find it in themselves to charge one."" - @RepDougCollins pic.twitter.com/OrguQWSGPX",1206981366111440896,2019-12-17,16:55:56,repandybiggsaz,35,335,738
"“According to the majority, however, a quid pro quo that never existed is an appropriate basis for removing the president from office.

Even though the majority has not proven its case; even though there’s no basis for impeachment, they’re still moving forward today.” pic.twitter.com/lPKCxypIas",1206980236384096256,2019-12-17,16:51:27,repandybiggsaz,34,206,432
"""(This impeachment process) contradicts Speaker Pelosi’s own words, when she said, 'Impeachment is so divisive to the country that unless there’s something so compelling and overwhelming and bipartisan, I don’t think we should go down that path because it divides the country.'"" pic.twitter.com/d0nMeeUjmf",1206978699855355904,2019-12-17,16:45:21,repandybiggsaz,100,496,1086
"""There’s no way this can – or should be – viewed as legitimate – certainly not by Republicans, whose minority rights have been trampled on every step along the way; and certainly not by the American people, observing this disastrous political show, scene by scene."" pic.twitter.com/ZrnOBrbdub",1206977836101361664,2019-12-17,16:41:55,repandybiggsaz,53,350,848
"Democrats have thrown a lot of charges at President @realDonaldTrump, including (most recently) 'criminal bribery' & 'wire fraud.'

They're going back to the drawing board because they know there's nothing in their two Articles worth pursuing.

This is a sham, & they know it. pic.twitter.com/52qV6zIuYG",1206964753840648198,2019-12-17,15:49:56,repandybiggsaz,78,917,1925
"TUNE IN: I'm about to join @IngrahamAngle, alongside @ByronYork, to talk about the latest developments with the Democrats' partisan, vindictive impeachment sham. Watch @FoxNews NOW. #AZ05",1206771370090205184,2019-12-17,03:01:30,repandybiggsaz,45,97,567
"READ my dissenting views to the House Judiciary Democrats' impeachment report. 

Democrats have sought to remove or delegitimize President @realDonaldTrump since he won the 2016 presidential election.

Americans see this process for what it is – a sham. https://biggs.house.gov/media/in-the-news/congressman-biggs-dissenting-views-house-judiciary-committees-impeachment-report …",1206765851074011136,2019-12-17,02:39:34,repandybiggsaz,75,655,1347
COMING UP: I’ll be joining @IngrahamAngle to discuss the Democrats’ flailing impeachment efforts. Their vindictive actions are embarrassing to our nation. Watch @FoxNews at 10 EST.,1206757356023009280,2019-12-17,02:05:48,repandybiggsaz,33,202,664
"Democrats promoted a false Russian collision fairytale.

One recited a false version of 7/25 transcript.

They held secret, Soviet-style hearings away from media, Americans, & most Members of Congress.

They blocked GOP-requested witnesses.

They’re now concerned w/ fairness?! https://twitter.com/KatiePavlich/status/1206652222815248385 …",1206735782213537792,2019-12-17,00:40:05,repandybiggsaz,84,860,2034
"Democrats won't ever be satisfied with their harassment of President @realDonaldTrump until he's removed from office.

That's what they think about the will of the American people. https://www.politico.com/news/2019/12/16/house-impeachment-mueller-086251 …",1206712608822353925,2019-12-16,23:08:00,repandybiggsaz,331,1281,3029
TONIGHT: I’m joining @IngrahamAngle to talk about the recently dropped impeachment report from House Judiciary Committee Democrats. Watch @FoxNews at 10 EST. #AZ05,1206691415046144001,2019-12-16,21:43:47,repandybiggsaz,17,99,331
"Polls continue to show that a majority of Americans oppose impeaching President @realDonaldTrump.

Yet Nancy Pelosi, Adam Schiff, & Jerry Nadler persist with their partisan, vindictive sham.

Democrats are overturning the result of the 2016 election. https://www.usatoday.com/story/news/politics/2019/12/15/poll-impeachment-looms-narrow-majority-opposes-convicting-trump/2657549001/ …",1206665466531454983,2019-12-16,20:00:40,repandybiggsaz,123,685,2069
"UPDATE:

We will be starting today's telephone town hall at 11:30 AZ time. #AZ05 https://twitter.com/RepAndyBiggsAZ/status/1206575195202473985 …",1206604508249436161,2019-12-16,15:58:27,repandybiggsaz,56,130,316
"Democrats are still going to be inventing impeachable offenses years from now. You don't need any proof that the offense was actually committed. Just say it, and it is so.

What a sad, sad chapter in American history.",1206590932830838785,2019-12-16,15:04:30,repandybiggsaz,48,341,893
"For anyone keeping track at home of the Democrats' shifting charges against @realDonaldTrump ➡️

• Collusion
• Obstruction of Justice
• Quid Pro Quo
• Extortion
• Bribery
• Abuse of Power
• Obstruction of Congress
• Criminal Bribery
• Wire Fraud",1206590707529584643,2019-12-16,15:03:36,repandybiggsaz,68,302,647
