tweet,id,date,time,username,replies_count,retweets_count,likes_count
"Grateful to spend lunch today with the Port Angeles Chamber of Commerce. Folks in this room are doing so many amazing things for this region - creating new businesses and jobs, keeping traditions alive, and volunteering their time to better their community. Thanks for having me! pic.twitter.com/W1WBGhd7JB",1182086585833140224,2019-10-10,00:12:58,repderekkilmer,3,1,6
"One of the things I’ve been advocating for during the appropriations process is to address food insecurity in our communities. Too many college students are suffering, so I was proud to see the student leadership at Peninsula College step-up and establish a food pantry on campus. pic.twitter.com/RAY5bBIpGX",1182064842263470082,2019-10-09,22:46:34,repderekkilmer,2,1,6
"They also won’t have to worry about competition from me, since my attempt to draw blood from Fred’s arm (practice mannequin) was just above average. pic.twitter.com/zAlL60vWba",1182041367687700481,2019-10-09,21:13:17,repderekkilmer,0,0,6
I learned today that students in Peninsula College’s Medical Assisting program score in the top 1% nationwide! That’s incredible. It’s a testament to the amazing team we’ve got up here in Clallam County. pic.twitter.com/Rc3JEBnBXJ,1182041360548990979,2019-10-09,21:13:16,repderekkilmer,2,1,11
Did you know that students in Peninsula College's welding program get hired right after completion? That’s credit to their awesome instructors - who even spent some time teaching me! pic.twitter.com/mdNGWAd5i6,1182019981485195264,2019-10-09,19:48:19,repderekkilmer,3,3,28
"Today, I’m touring Peninsula College and meeting with students, faculty, and administrators...  and the early learning center has some good lessons for us all: pic.twitter.com/3m0mh8dA4o",1181997504721752064,2019-10-09,18:19:00,repderekkilmer,2,3,8
"Thanks to the S. Kitsap Rotary for having me! I shared my approach on how to live up to the 4-way test, and how I apply it in Congress: 1. Is it the truth? 2. Is it fair to all concerned? 3. Will it build goodwill and better friendships? 4. Will it be beneficial to all concerned? pic.twitter.com/FlZVmPaqrL",1181955390348632070,2019-10-09,15:31:39,repderekkilmer,5,0,4
"Great to visit with CI Security in Bremerton today to discuss their work to protect and defend schools, hospitals, and local governments from cyber attacks. It’s been exciting to watch this company grow over the years! Thanks for doing business here - and consider me a partner. pic.twitter.com/rebOr1YYUc",1181771268913270784,2019-10-09,03:20:01,repderekkilmer,5,2,7
"It was honor to join ATNI at their annual conference to thank the many tribes in attendance for telling their stories, today & every day, here & across the country. I carry these stories with me - and they make me a stronger advocate for Indian Country because I’ve heard them. pic.twitter.com/nnrfZJi8C7",1181765874518253575,2019-10-09,02:58:35,repderekkilmer,1,0,9
That’s why I’ve continued advocating for funding for prevention and assistance for victims of sexual assault on the House Appropriations Committee. Thanks to the amazing team at Rebuilding Hope for the important work you do in our community and for your continued advocacy.,1181738290992599040,2019-10-09,01:08:58,repderekkilmer,4,1,18
Did you know that the Rebuilding Hope Sexual Assault Center for Pierce County has seen a 68% increase in calls to their helpline? Or that they saw a 50% increase in clients and over a 100% increase in service hours? pic.twitter.com/4dm7F5RfaW,1181738286349463552,2019-10-09,01:08:57,repderekkilmer,5,3,19
Great to meet w/ my friends Larry Brown & April Sims from the WA State Labor Council. I stand w/ them in supporting workers’ right to organize and negotiate better wages & working conditions.  Appreciate their partnership in working for an economy that works better for everyone! pic.twitter.com/uDqs2nAPUq,1181693144783626240,2019-10-08,22:09:35,repderekkilmer,7,1,9
More here on the #SHIELDAct here ⬇️ https://kilmer.house.gov/news/press-releases/kilmer-house-democrats-introduce-shield-act-to-combat-foreign-interference-in-american-elections …,1181647009075404805,2019-10-08,19:06:15,repderekkilmer,7,3,12
"This bill also includes the Honest Ads Act - bipartisan, bicameral legislation I lead to ensure Americans know who is paying for the online ads they are seeing and to make it harder for foreign actors to use the internet to attack our democracy. pic.twitter.com/nB6cnhFetz",1181647007447953412,2019-10-08,19:06:15,repderekkilmer,4,3,18
"Foreign interests shouldn’t be able to influence American elections, period. Today, I'm proud to introduce the #SHIELDact with my colleagues to take action to fix the loopholes in the American election system and protect our elections from foreign interference. pic.twitter.com/Rtscfet7fI",1181647002091823104,2019-10-08,19:06:13,repderekkilmer,11,8,30
Always enjoy the opportunity to catch-up with Dave Ross on @KIRORadio! Tune in this morning at 6:45am PT to hear our conversation ➡️  https://mynorthwest.com/category/kiro-radio/ … pic.twitter.com/qoXhPkneu2,1181559370271903745,2019-10-08,13:18:00,repderekkilmer,7,0,4
"It was a pleasure to sit down today w/ Rear Admiral Anthony J. Vogt, the Commander of the Thirteenth Coast Guard District. We had a great conversation on how to best support our servicemembers & keep our coastal communities safe. Thanks RADM Vogt- I look forward to working w/ you pic.twitter.com/O6ta1ZB1Rm",1181379032199421953,2019-10-08,01:21:24,repderekkilmer,1,0,14
I want to hear who you’d like me to interview next! Let me know ⬇️,1181313834541309952,2019-10-07,21:02:20,repderekkilmer,7,0,0
"These unique conversations help lead to collaborations on policies to help our constituents, like the bill I introduced to give students access to more financial aid w/ Ep 11 guest @SusanWBrooks, & a bill to make schools safer and prevent gun violence w/ Ep 19 guest @RepTedDeutch",1181313833643720711,2019-10-07,21:02:20,repderekkilmer,3,0,0
"🚨Back by popular demand...my podcast!🚨
Quick Questions about Congress with Kilmer: building understanding between lawmakers to find commonalities, forge new relationships, and work together to tackle critical issues. Episode 22 feat. @RepTomGraves. https://kilmer.house.gov/news/podcasts ",1181313832653905922,2019-10-07,21:02:20,repderekkilmer,4,1,8
Great to start the day at KUOW Public Radio! Tune in for clips of the interview starting at 12:00pm PDT today. pic.twitter.com/8dwpd8ZpgT,1181257620084203522,2019-10-07,17:18:57,repderekkilmer,6,0,6
ICYMI: last week’s newsletter - an honest take about what’s happening in our nation’s capital. https://kilmer.house.gov/news/newsletters/increasing-civility-and-collaboration …,1181008501272977408,2019-10-07,00:49:03,repderekkilmer,6,2,10
"As a proud member of the STEAM caucus, I want to shout out the value of the arts! Even for dogs... https://twistedsifter.com/videos/baby-dancing-to-a-piano-playing-dog/ …",1180914112072749058,2019-10-06,18:33:59,repderekkilmer,2,1,18
Another fantastic afternoon at the 38th Annual Oyster Fest in Shelton today! Thanks to the Shelton Rotary for everything you do to organize this incredible event - I look forward to it every year! pic.twitter.com/C5bj2ZDNZw,1180641795123941377,2019-10-06,00:31:53,repderekkilmer,2,3,20
"A historic day for a historic leader. Today Tacoma's 34th Street Bridge officially becomes the Harold Moss Bridge. Tacoma's first African American city council member, mayor, County Council member. Champion for civil rights.  Legend. Share this post- & your gratitude for Harold! pic.twitter.com/zjCi79urnr",1180556744994541568,2019-10-05,18:53:56,repderekkilmer,1,9,48
"Congratulations to all of the honorees at the Tacoma Urban League's Empowerment Dinner. It was inspiring to celebrate the amazing work happening in the City of Destiny. Great to see the Urban League leadership, Mayor Woodards, and keynote speaker Chief Tory Green! pic.twitter.com/jHsJYQ0lJA",1180526686695297025,2019-10-05,16:54:29,repderekkilmer,1,1,10
"Great to spend the afternoon with Chairman Pickernell of the Chehalis Tribe to tour the new brewery, distillery, and restaurant in Grand Mound opening for business early next year and creating 100 new jobs in the region! More about the project: pic.twitter.com/teWJ9UPB9n",1180262378673491970,2019-10-04,23:24:13,repderekkilmer,3,4,21
Totally buying this. I’ve got a brand new recipe for blue milk!,1180229576053710848,2019-10-04,21:13:53,repderekkilmer,0,0,4
"This is a win for students, a win for educational institutions, and a win for local employers who are hungry for workers.

Read more ⬇️ https://kilmer.house.gov/news/press-releases/kilmer-brooks-introduce-legislation-to-give-students-in-need-access-to-more-financial-aid …",1180135160337063938,2019-10-04,14:58:42,repderekkilmer,3,3,8
"Today, I'm proud to introduce legislation w/ Rep. @SusanWBrooks to give students in need access to more financial aid. The Pell Plus program that we’re proposing will help students complete their college degree on-time, provide more financial aid, and lower their debt burden.",1180135159569539072,2019-10-04,14:58:42,repderekkilmer,2,6,14
"Education is the door to economic opportunity, and for a lot of families, financial aid programs are the key to that door. Pell Grants are particularly important for middle class families, but even w/ that vital support, students and their families often end up saddled with debt.",1180135158848135168,2019-10-04,14:58:42,repderekkilmer,3,3,18
"One of the best investments we make is in our nation’s higher education system. I was honored to join students, administrators, and University of Puget Sound community members today for fireside chats and a student town hall to discuss what issues are on their minds. Go Loggers! pic.twitter.com/54wN3URd8a",1179967038732853250,2019-10-04,03:50:39,repderekkilmer,6,5,33
I always appreciate the opportunity to thank the good folks at the Gig Harbor Chamber of Commerce for all the work and service they do in our community. Thanks for having me at your monthly luncheon! pic.twitter.com/4QrhrT2KRd,1179937779511418880,2019-10-04,01:54:23,repderekkilmer,4,0,12
"Olga Inglebritson, the new Dean of the Tacoma Community College’s Gig Harbor campus, gives me hope! I had the great pleasure of meeting with her and Provost Marissa Schlesinger about the life-changing work they’re doing for students in our neck of the woods. Thanks for having me! pic.twitter.com/M6Y5gU2Xv1",1179887451864752128,2019-10-03,22:34:24,repderekkilmer,5,3,25
"Gig Harbor is lucky to be home to Ryan Blanck and the amazing team at the Hanger Clinic. Their incredible work to provide prosthetic solutions to patients, including veterans, is making a huge difference in the lives of so many here in our region and around the world. pic.twitter.com/NWxkXwecoJ",1179859227369725952,2019-10-03,20:42:15,repderekkilmer,2,2,12
I applaud the @seattletimes for telling these important stories and raising awareness of the crisis of Missing and Murdered Indigenous Women and Girls. I will continue to fight to ensure Congress acts to address and end this tragic epidemic. https://projects.seattletimes.com/2019/mmiw/#Latest …,1179515425694109696,2019-10-02,21:56:06,repderekkilmer,6,3,19
Proud to see the House Natural Resources Committee  unanimously advance my bipartisan bill to provide direct access to much needed resources for tribes to enhance their coastal resiliency and keep their people out of harm’s way. @NRDems https://crosscut.com/2019/10/washingtons-coastal-tribes-are-working-escape-rising-sea-levels-bill-dc-could-help …,1179451724685303813,2019-10-02,17:42:58,repderekkilmer,5,11,27
"In this week’s newsletter 📝:
🏛A solemn assessment of the House beginning a formal impeachment inquiry
✅ Committee passage of my bill to give Tribes access to coastal resiliency resources
🤝 @ModernizeCmte’s work to increase civility and collaboration

 https://kilmer.house.gov/news/newsletters/increasing-civility-and-collaboration …",1179168275189637120,2019-10-01,22:56:39,repderekkilmer,11,2,8
"Really enjoyed the opportunity to meet the team at RAIN Incubator in Tacoma and talk about the awesome work they’re doing to grow jobs, talent, and companies in the biotech sector across our region. Thanks for having me - and consider me a partner! pic.twitter.com/GkPcex0bVN",1179084894342975490,2019-10-01,17:25:19,repderekkilmer,2,5,13
Great to check-in with Dr. Zhou and the leadership team at Bates Technical College today in Tacoma! pic.twitter.com/Iq3BjNXNau,1178855224339030017,2019-10-01,02:12:42,repderekkilmer,4,3,8
