tweet,id,date,time,username,replies_count,retweets_count,likes_count
"From supporting the Cancer Moonshot initiative to funding defense health research programs for breast cancer and other cancers, I'm proud this Congress that @AppropsDems have shown our commitment to improving cancer care and finding a cure. #NationalBreastCancerAwarenessMonth pic.twitter.com/rTimGJVx8K",1190000494493745154,2019-10-31,20:20:01,repderekkilmer,5,0,14
"And as someone who came here to make life better for the folks I represent, my sincere hope is that Congress continues to move forward on those vital priorities as well. (3/3)",1189952234253148160,2019-10-31,17:08:15,repderekkilmer,8,1,48
"The months ahead should not be about re-litigating the 2016 election or trying to influence the 2020 election. Rather, they should be about protecting the integrity of our democracy and the rule of law. (2/3)",1189952233506508800,2019-10-31,17:08:15,repderekkilmer,7,1,52
"As the impeachment inquiry proceeds, it is important that it be transparent and fair. That’s what today’s vote was about. The first thing I did as our community’s representative was to swear an oath to uphold the constitution. I take that oath seriously. (1/3)",1189952232747405312,2019-10-31,17:08:15,repderekkilmer,45,9,99
COMING UP AT 9:30 AM EST: The @ModernizeCmte wil hold a hearing to examine the history of the congressional frank and how to improve communications with constituents. Tune in here: https://www.youtube.com/watch?v=TkpgOF5Uqtc …,1189885960470839296,2019-10-31,12:44:54,repderekkilmer,5,2,9
"“...since January, the members of the @ModernizeCmte, led by Reps. Derek Kilmer and Tom Graves, have been hashing out solutions to make Congress more transparent, more efficient and armed with the important information they need to make wise decisions.” https://morningconsult.com/opinions/modernizing-congress-to-meet-public-expectation/ …",1189711989968457728,2019-10-31,01:13:36,repderekkilmer,4,5,17
"The Trump Administration needs to stand down on this. These deep cuts to rural hospitals will hurt patients and hurt jobs, including at Olympic Medical Center. https://www.peninsuladailynews.com/news/judge-who-ruled-in-omcs-favor-rejects-governments-arguments/ …",1189670419055435777,2019-10-30,22:28:25,repderekkilmer,4,3,18
"Tomorrow at 9:30am ET, @ModernizeCmte will hold a hearing to examine how to improve constituent communications. Tune in to ""Congress and the Frank: Bringing Congressional Mailing Standards into the 21st Century"" here:  https://www.youtube.com/watch?v=TkpgOF5Uqtc …",1189621599827320833,2019-10-30,19:14:26,repderekkilmer,4,7,13
"DYK ~1M homes in the U.S. use wood pellets for heat in freestanding stoves, furnaces, & grills? It was great to speak w/ Stan Elliot of Pacific Coast Pellets in Shelton about how this company is turning waste from the wood products industry into a low-cost, green heating source. pic.twitter.com/yuX6Ci3Tza",1189591070918791169,2019-10-30,17:13:07,repderekkilmer,1,0,5
"When it comes to the health of our oceans, everything is not fine. *Cheers* to @TedDanson (or someone wearing a Ted Danson suit) and @Oceana for fighting for our oceans and solutions to marine debris. We’ll keep working to make our earth closer to #TheGoodPlace we deserve. pic.twitter.com/pksQ2JgXR0",1189324429668573185,2019-10-29,23:33:35,repderekkilmer,9,3,76
"To get the newsletter directly in your inbox, sign-up here 📬: https://kilmer.house.gov/contact/newsletter-subscription …",1189190026304741376,2019-10-29,14:39:31,repderekkilmer,2,1,2
"In this week's newsletter 🗞:
💊Analyzing new legislation to lower the cost of prescription drugs
🗳Passing legislation to combat foreign interference in American elections
👨‍👩‍👧‍👧Championing paid family leave on Capitol Hill
...and more! Read it here: https://kilmer.house.gov/news/newsletters/lowering-the-cost-of-prescription-drugs …",1189188501918453760,2019-10-29,14:33:27,repderekkilmer,4,0,5
"After a long morning of pumpkin chunkin’, Mason County Commissioner Sharon Trask and I sat down to discuss rural economic development, mental health and other opportunities for partnership! pic.twitter.com/uyTtQIhnS4",1188950445152227333,2019-10-28,22:47:30,repderekkilmer,4,1,20
Carved pumpkins with the girls tonight. The Kilmers are nailing Halloween. #proudfather #halloween #rebelalliance pic.twitter.com/0QKb5uWQ2B,1188642872586838016,2019-10-28,02:25:19,repderekkilmer,10,1,75
And thanks to the North Mason Chamber for inviting me to judge the competition! pic.twitter.com/RwweQsIQ3g,1188467964326092800,2019-10-27,14:50:18,repderekkilmer,3,1,11
"Have you ever spent your afternoon chucking pumpkins at Hunter Farms?! It. Is. Awesome. Yesterday marked my 10th year at the Pumpkinfest & North Mason Chamber Catapult Competition! Congrats to Rainer HS, West Sound Tech & Shelton Latter-Day Saints for some impressive catapults. pic.twitter.com/JH1yse0nWp",1188467588176760833,2019-10-27,14:48:48,repderekkilmer,4,1,31
I'll continue to fight to extend the Solar Investment Tax Credit to help encourage investments in this powerful clean energy resource.,1188206515775250432,2019-10-26,21:31:23,repderekkilmer,0,0,15
Did you know that solar energy prices have fallen by almost 90% since 2009?! I had a great conversation with the team from Vivint Solar about the important role that distributed solar technology can play in our transition to a clean energy economy. pic.twitter.com/ccSFa9Qnyl,1188206511878746112,2019-10-26,21:31:22,repderekkilmer,5,5,36
In WA (which I consider “the better Washington”) I’m proud to work with fantastic partners like State Rep. Beth Doglio to combat climate change & address the affordable housing crisis. I was grateful to catch up with her in DC to talk about the continued progress we are making! pic.twitter.com/UBp5kfXRE3,1187863967844241409,2019-10-25,22:50:14,repderekkilmer,7,4,31
Share this and tell me about a young person in your community who is making a difference!,1187814616837083138,2019-10-25,19:34:07,repderekkilmer,1,1,1
"The future is bright! Lina Flower, a Bremerton resident and current Stanford University sophomore visited with me about her passion for protecting our planet and combating climate change. Another impressive young person working to make a difference! pic.twitter.com/tBYDIwxrIX",1187813860637597702,2019-10-25,19:31:07,repderekkilmer,5,9,57
"Great to meet with Rick Hicks, the President of Teamsters Joint Council 28 (Teamsters Local No. 174) to talk about the work Congress is doing to support American workers and ensure their pensions are there for them when they retire. Count me on the home team. pic.twitter.com/NRYvlLdrxk",1187522060563681280,2019-10-25,00:11:36,repderekkilmer,2,1,6
It was great meeting with Craft3 in DC to talk about all the great investments they are making back home in Washington state to grow businesses and jobs in our region. Consider me a partner! pic.twitter.com/SDxYQ2i7UM,1187488207715405825,2019-10-24,21:57:05,repderekkilmer,1,1,7
Congratulations to @PresFawnSharp on being elected to serve as the next President of the National Congress of American Indians!! @ncai1994 https://twitter.com/indianz/status/1187440160339685377 …,1187442760208572420,2019-10-24,18:56:30,repderekkilmer,0,1,13
An incredible human being and a tireless public servant. May he #RestInPower pic.twitter.com/gn9kaNkuYz,1187432524252958720,2019-10-24,18:15:49,repderekkilmer,3,2,44
"Foreign interests shouldn’t be able to influence American elections, period. That’s not a Democratic notion. It’s not a Republican notion. It’s an American notion. I'm proud the #SHIELDAct passed the House, & I urge the Senate to take action to protect our democracy without delay pic.twitter.com/JLkjNTVrWe",1187155007919087617,2019-10-23,23:53:04,repderekkilmer,6,12,66
"TONIGHT, Team Kilmer will be holding an information session for students interested in the nation’s military service academies. 

🇺🇸 U.S. Service Academy Night
🗓️TONIGHT (10/23)
⏱️5:30-7:00pm
 📍Bremerton School District Administration Building

Details: https://kilmer.house.gov/news/press-releases/kilmer-to-host-us-service-academy-night-in-bremerton …",1187068077697130504,2019-10-23,18:07:39,repderekkilmer,3,0,3
"I'm a proud #dadvocate - and I'm proud to be from a state that's implementing paid family & medical leave early next year - but Congress should move to ensure that paid family leave applies to EVERYONE. It's important for families, for moms & dads, for children, and for employers pic.twitter.com/s13pijxy1V",1187041229638422529,2019-10-23,16:20:57,repderekkilmer,4,7,41
Proud to see the Honest Ads Act included in the #SHIELDAct  to ensure Americans know who is paying for the online ads they are seeing and to make it harder for foreign actors to use the internet to attack our democracy. More on this important legislation⬇️ pic.twitter.com/ywQwWPRerm,1186770166903988225,2019-10-22,22:23:51,repderekkilmer,6,5,18
"In the end, I come to the words of Abraham Lincoln who said, “Public sentiment is everything. With public sentiment, nothing can fail. Without it, nothing can succeed.” With young people’s engagement, we can tackle any big issue facing our country. #MobilizingMillennials pic.twitter.com/Sw3AzewBnQ",1186645981485514752,2019-10-22,14:10:23,repderekkilmer,4,5,15
"If we want to engage younger folks on fiscal issues & solutions, I would argue that we have to make them real. We have to paint a picture of what inaction will actually mean to their lives & to the things that they really care about. #MobilizingMillennials  https://www.brookings.edu/events/how-millennials-think-differently-about-climate-change-and-national-debt-lessons-for-policymakers/ … pic.twitter.com/fPpLPr3bWQ",1186636893582168069,2019-10-22,13:34:16,repderekkilmer,5,7,21
"Today at 9am, I'll be joining Brookings & the Millennial Action Project to talk about generational differences in attitudes to the challenges of climate change & national debt & deficits. #MobilizingMillennials 
Tune in here:  https://www.brookings.edu/events/how-millennials-think-differently-about-climate-change-and-national-debt-lessons-for-policymakers/ … @BrookingsEcon @MActionProject",1186613521058062342,2019-10-22,12:01:24,repderekkilmer,3,4,8
"I appreciated being able host @rep_stevewomack in our region and then to visit northwest Arkansas and learn so much more about this beautiful part of the country, the people that live there, and what that means to his approach to the job. (3/3) https://www.thenewstribune.com/news/business/article236420593.html …",1186479304013680643,2019-10-22,03:08:04,repderekkilmer,4,5,18
"When Democrats and Republicans make the effort to understand one another’s perspectives, we have a better shot at making progress on key issues facing the American people. (2/3)",1186479301832642560,2019-10-22,03:08:03,repderekkilmer,4,2,11
"There is a lot of division in our country these days. It takes work to try to find common ground. I’m a big believer that, part of the way to better understand where people are coming from is to actually see where people are coming from. (1/3)",1186479300041760770,2019-10-22,03:08:03,repderekkilmer,5,1,34
"This Wednesday, 10/23, Team Kilmer will be holding an information session for interested students of the nation’s military service academies. 

🗓️Wednesday, October 23, 2019
⏱️5:30-7:00pm
 📍Bremerton School District Administration Building

More details:
 https://kilmer.house.gov/news/press-releases/kilmer-to-host-us-service-academy-night-in-bremerton …",1186392035491827714,2019-10-21,21:21:18,repderekkilmer,1,1,5
Looking forward to it! https://twitter.com/BrookingsEcon/status/1186292054932054016 …,1186387725559238656,2019-10-21,21:04:10,repderekkilmer,1,1,9
"Foreign interests shouldn’t be able to influence American elections, period. This week, the House will debate the #SHIELDAct, a bill I'm leading to take real action to fix the loopholes and protect our elections from foreign interference. What's in it & why it matters ⬇️: pic.twitter.com/CYdN8y1S3b",1186320733045178368,2019-10-21,16:37:58,repderekkilmer,21,23,92
"Two big birthdays being celebrated at Allen AME Church in Tacoma! Pastor Anthony Steele just turned 55 and next weekend, the church will celebrate its 130th year in Tacoma. Thanks so much to Pastor Steele and the entire Allen AME family for the warm welcome this morning, & HBD!! pic.twitter.com/SMzaCXC80k",1186078380707454977,2019-10-21,00:34:56,repderekkilmer,0,1,15
Great to meet w/ the Defenders of Wildlife and discuss our shared effort to recover Puget Sound and fight for the future of our iconic salmon & orca populations. Grateful for your partnership to ensure Puget Sound stays healthy for generations to come. Keep up the great work! pic.twitter.com/BOCun1VTXX,1185707637138169856,2019-10-20,00:01:44,repderekkilmer,2,0,24
"This month, I introduced the bipartisan Pell Plus Act of 2019 with @SusanWBrooks to give student in need more access to financial aid. Hear what's it all about ⬇️ pic.twitter.com/oQYnMXqPrx",1185333486476877824,2019-10-18,23:15:00,repderekkilmer,4,9,25
10/19 is National Orca Day! Check out events across the region & join community partners & conservation districts to show our commitment to protecting this iconic species & ensure they remain an integral part of our region’s identity for future generations http://betterground.org/ord ,1185307795127754754,2019-10-18,21:32:54,repderekkilmer,4,2,5
"Given that clear need, I’m proud that @NewDemCoalition is taking a lead on forward-looking, actionable solutions to begin to address our nation’s housing crisis. (2/2) https://time.com/5704814/new-democrats-affordable-housing/ …",1185275464413335553,2019-10-18,19:24:26,repderekkilmer,8,2,14
"In every community I represent, we are grappling with housing issues. We need more homes. We need more homes for seniors. We need more homes for low-income families. We need more homes for middle-class families. We need more homes – period. (1/2)",1185275463251517443,2019-10-18,19:24:26,repderekkilmer,5,6,33
Looking forward to joining @BrookingsEcon & @MActionProject next Tuesday to discuss strategies to get younger generations of Americans engaged in long-term policy issues. Sign-up to attend in person or on the web here:  https://www.brookings.edu/events/how-millennials-think-differently-about-climate-change-and-national-debt-lessons-for-policymakers/ … #MobilizingMillennials @BrookingsInst,1185219255006044160,2019-10-18,15:41:05,repderekkilmer,3,8,6
Ken Burns is an American treasure. He visited the Library of Congress last night to honor documentary filmmakers. Investments in the humanities are investments in celebrating America and its extraordinary stories! pic.twitter.com/xVpCvqQ5hv,1185162382131302400,2019-10-18,11:55:05,repderekkilmer,1,0,19
Sunset in the other Washington pic.twitter.com/TmJha75E15,1184989309440610305,2019-10-18,00:27:22,repderekkilmer,6,2,48
"It was an honor to celebrate the #InternationalYearOfTheSalmon and speak with folks about all the work we have done, and still need to do, to ensure a healthy salmon population in the Pacific Northwest - protecting our way of life and our local economies. pic.twitter.com/MWhZ2qE1Ta",1184962773362585600,2019-10-17,22:41:55,repderekkilmer,3,1,4
"Today, folks in our region will participate in the Great Washington #ShakeOut, the annual drill to practice what to do to stay safe during an earthquake. Make sure you and your family are prepared - check-out this handy guide from the @seattletimes: https://www.seattletimes.com/seattle-news/get-ready-to-rumble-a-guide-to-earthquake-preparedness/?utm_source=marketingcloud&utm_medium=email&utm_campaign=Morning+Brief+10-17-19_10_17_2019&utm_term= …",1184859127786418176,2019-10-17,15:50:04,repderekkilmer,0,3,7
It was an honor to serve with Elijah Cummings - an incredible human being and a tireless public servant. He worked so hard for his community and to make government work better. I’m praying for his family and constituents.,1184817690889932800,2019-10-17,13:05:25,repderekkilmer,3,7,93
"Grateful to meet with the leaders of the Washington Truckers Association today. We discussed the important role trucking plays in Washington’s economy and the need to develop the trucking workforce, repair our infrastructure, and improve driver safety. I am proud to be a partner! pic.twitter.com/OlDQ6ea4Ba",1184658925687365633,2019-10-17,02:34:32,repderekkilmer,1,0,6
"Today on #WorldFoodDay, I’m grateful for the opportunity to work on the Appropriations Committee and invest in food & nutrition programs while working to achieve #ZeroHunger. I’ll continue to fight to ensure families can put healthy, nutritious meals on the table, here & abroad. pic.twitter.com/unpvytS94z",1184640098962477057,2019-10-17,01:19:43,repderekkilmer,5,2,8
"Great to visit with Chairman Pickernell, Vice President Johnson, & other partners from Chehalis Basin Strategy work group to get an update on the critical work they're doing to help reduce flood damage, restore aquatic habitat, & invest in our communities. Count me as a partner! pic.twitter.com/i5mkGj3YEV",1184589956163002368,2019-10-16,22:00:28,repderekkilmer,3,0,2
"Today, I joined over 350+ Republicans and Democrats in Congress voicing opposition to the President’s decision to withdraw American troops from Syria. His action will have far-reaching and long-lasting diplomatic and national security consequences. https://www.usatoday.com/story/news/politics/2019/10/16/trumps-syria-expected-condemned-house-vote/3992184002/ …",1184566503456292870,2019-10-16,20:27:17,repderekkilmer,9,6,49
"To get the newsletter delivered directly to your inbox, sign-up here 📬: https://kilmer.house.gov/contact/newsletter-subscription …",1184542085208330240,2019-10-16,18:50:15,repderekkilmer,1,0,0
"In this week's newsletter: 
🎓My travels across the region to hear from inspiring students & educators
📚New legislation I introduced to give students in need access to more financial aid
🇺🇸Legislation I'm leading to protect American elections
More here⬇️ https://kilmer.house.gov/news/newsletters/helping-students-succeed …",1184541796711456770,2019-10-16,18:49:06,repderekkilmer,2,0,5
Starting now! Tune in via the link below: https://twitter.com/ModernizeCmte/status/1184458009101193216 …,1184471018766770178,2019-10-16,14:07:51,repderekkilmer,2,1,2
"Today at 10am ET, the @ModernizeCmte will hold a hearing to evaluate practices and challenges surrounding the House calendar and schedule. Tune in here ⬇️: https://www.youtube.com/watch?v=PU0Ip2yPKK0 …",1184458782082060288,2019-10-16,13:19:14,repderekkilmer,1,3,1
"Earlier this year, I co-sponsored The Homeless Veteran Families Act to help homeless veterans and their families get the housing and services they need - and have earned. I’m pleased to report that the House passed this important bill tonight! https://connectingvets.radio.com/articles/homeless-veterans-kids-get-more-help-under-bill …",1184282550606483456,2019-10-16,01:38:57,repderekkilmer,4,2,12
Did you know that the next Mars rover could be named by a student from Washington's Sixth Congressional District?! @NASA is inviting students K-12 to submit essays to name NASA's next Mars rover. Details here: https://mars.nasa.gov/mars2020/participate/name-the-rover/#Naming-Contest …,1184232507149082624,2019-10-15,22:20:06,repderekkilmer,2,1,5
"Sherry Appleton has an outstanding combination of energy & moral leadership. When she retires, she will do so with an amazing legacy of battling for seniors and for those who needed a voice. Proud to consider her a friend & partner & wish her all the best. https://www.kitsapsun.com/story/news/2019/10/14/rep-sherry-appleton-announces-plans-retire/3977481002/ …",1184139438701592576,2019-10-15,16:10:17,repderekkilmer,2,2,20
It was an honor to join The Olympic College Foundation today to say thank you to all of the super heroes supporting our students and this amazing institution! pic.twitter.com/JriFEFdae9,1183919386136141824,2019-10-15,01:35:52,repderekkilmer,0,1,7
"Today on #IndigenousPeoplesDay, we honor the contributions and sacrifices of Native American communities. Let’s recommit to honoring our promises and fulfilling our nation’s trust and treaty obligations. pic.twitter.com/K7uelFq5bK",1183873840339963906,2019-10-14,22:34:53,repderekkilmer,1,5,37
Great to spend the morning with the Kitsap League of Women Voters! We had a fantastic discussion about the work I’m doing on the Select Committee on the Modernization of Congress to fix Congress and get it back to working better for the American people. Thanks for having me! pic.twitter.com/XqBuNzUui0,1183163833105420289,2019-10-12,23:33:34,repderekkilmer,1,0,6
"Ended my day yesterday with the awesome students, faculty, and staff of Tacoma Community College. Thanks to everybody for coming out and sharing what’s on your mind. We are so lucky to have a great institution like TCC here in our neck of the woods, thanks for having me! pic.twitter.com/XQLF5p7gFU",1183108017132331011,2019-10-12,19:51:47,repderekkilmer,4,3,16
"I’m proud to stand with the LGBTQ+ community on National #ComingOutDay. For those in search of guidance, check out this helpful resource: https://www.hrc.org/resources/coming-out-resource-guides …",1182852072175214594,2019-10-12,02:54:44,repderekkilmer,5,1,17
"Thanks to the leaders of Olympic College Student Government for sitting down with me today and sharing the goals you all have for the upcoming academic year. Excited to see what you accomplish! As always, count me on the home team! pic.twitter.com/wZ02UXFU8z",1182820497924513792,2019-10-12,00:49:17,repderekkilmer,3,3,13
Really enjoyed spending time w/ student leaders and administrators at UW-T. I heard firsthand about the struggles that students are facing with housing and food insecurity. We all agreed that Congress should do more about this and I commit to bringing that fight w/ me back to DC. pic.twitter.com/K7Z4PGLVl5,1182781438288125952,2019-10-11,22:14:04,repderekkilmer,4,5,22
IFPTE Local 12 - I’ve got your back! It was great to touch base with the leadership team this week and say thank you to your workers for serving the military and the nation. I appreciate all that you do! pic.twitter.com/1kf0AWVHSx,1182732618405761026,2019-10-11,19:00:04,repderekkilmer,5,1,5
"The President’s abrupt decision to withdraw American troops from northern Syria will have far-reaching and long-lasting diplomatic and national security consequences. Congress, and the American people, deserve answers. https://twitter.com/RepJasonCrow/status/1182306054685769728 …",1182655193369972736,2019-10-11,13:52:25,repderekkilmer,15,7,46
Incredible to see the progress being made at the Harrison Medical Center in Silverdale today. I can’t wait to see the center open and serving Kitsap County residents. pic.twitter.com/PUkJEOPd3o,1182487024194019329,2019-10-11,02:44:10,repderekkilmer,3,0,10
It was great to stop by the Roxy Theatre in downtown Bremerton to see some of the latest improvements and catch-up with Michael Goodnow. I appreciate the importance of this special place in the community and the work the Roxy team is doing to bring events and entertainment here! pic.twitter.com/wK0GUnkkD1,1182478248455921667,2019-10-11,02:09:18,repderekkilmer,1,0,9
"What do you get when you put together two green berets and a fire fighter...? Bremerton’s newest eatery, Axe and Arrow Gastropub! Thanks for doing business in Bremerton - and congratulations! pic.twitter.com/2CwhcjL0fP",1182456412942798848,2019-10-11,00:42:32,repderekkilmer,3,2,15
".@NitaLowey is an incredible public servant and someone I‘ve been honored to work with. She understands that budgets reflect our values. Thank you, Chair Lowey, for your leadership, partnership, and friendship. https://twitter.com/NitaLowey/status/1182329629543145474 …",1182437315010093056,2019-10-10,23:26:39,repderekkilmer,0,2,11
"On October 23, Team Kilmer will host a U.S. Service Academy night in Bremerton to give young people in our community a chance to learn more about our nation's fantastic military service academies. More info ⬇️ https://kilmer.house.gov/news/press-releases/kilmer-to-host-us-service-academy-night-in-bremerton …",1182407584655052812,2019-10-10,21:28:30,repderekkilmer,1,2,7
I had a great ending to my day in Clallam County yesterday visiting with Norma Turner and the great staff and kids of the Boys & Girls Clubs of the Olympic Peninsula. I can’t wait to see the new finished clubhouse building at the Port Angeles Unit - count me as your partner! pic.twitter.com/v6BBUTzHfX,1182355178462339072,2019-10-10,18:00:16,repderekkilmer,4,1,3
Great to catch up with the team working hard to actualize the Field Arts & Events Hall - part one of the incredible Port Angeles Waterfront Center. This project is a game changer for the Olympic Peninsula...thank you for what you do! pic.twitter.com/67a8kTaaBz,1182302307205210113,2019-10-10,14:30:10,repderekkilmer,1,1,4
"Among other things, they are encouraging folks to commit to the 5210 challenge (5 or more fruits and veggies; less than 2 hours of screen time; 1 hour or more of physical activity; and 0 sugary drinks). Thanks to Commissioner Mark Ozias for his leadership and for the invitation. pic.twitter.com/bGXVp6z39I",1182126662185619456,2019-10-10,02:52:13,repderekkilmer,1,1,8
"The boat moves best when all oars are in the water, rowing in the same direction. It was inspiring to meet with the Olympic Peninsula Healthy Community Coalition, a group of amazing organizations focused on improving health and wellness in our region. pic.twitter.com/goRz6QKEby",1182126643139289089,2019-10-10,02:52:09,repderekkilmer,4,2,17
