tweet,id,date,time,username,replies_count,retweets_count,likes_count
"Happy Friday from my friends at the Tilden Senior Center! Special thanks to Executive Director Wanda Burris for the hospitality and tour of the center. We must always prioritize the needs of our seniors, the backbone of our communities. 💪🏾💪🏾 pic.twitter.com/saZZJSKCZf",1218277684238802944,2020-01-17,21:03:29,repyvetteclarke,2,2,14
"Federal action on the #climatecrisis has been worse than absent these past few years. Instead, the #TrumpAdministration has been intentionally and willfully exacerbating the problem for the sake of short-term gains in the fossil fuel industry.

👀Read my & @Michael_Shank's oped⬇️ https://twitter.com/Newsweek/status/1218183024543662080 …",1218202871608434690,2020-01-17,16:06:12,repyvetteclarke,1,5,8
My team was able to find you and remove you from our call list. Thank you,1218179075900084224,2020-01-17,14:31:39,repyvetteclarke,0,0,0
Thank you for reaching out. Please DM me with the phone number that was called so my team can remove your from my call list.,1218005336453451776,2020-01-17,03:01:16,repyvetteclarke,1,0,0
"It’s official, @NOAA and ⁦@NASA⁩ reported this past decade was the warmest ever. As sea-levels rise and storms become more intense, it’s time for bold new action on climate. The clock is ticking. https://bklyner.com/2020-decade-bold-action-climate-opinion/ …",1217962403960434689,2020-01-17,00:10:40,repyvetteclarke,0,7,20
"Our President could learn a thing or two from @MalcolmNance, leading intelligence expert on Iran and foreign affairs. 

A belief we both share? #NoWarWithlran pic.twitter.com/PeNlI5kvHy",1217900925026799624,2020-01-16,20:06:22,repyvetteclarke,1,5,23
"Hi Allison,

Feel free to call my DC office at (202) 225-6231. Have a great day!",1217888733288157185,2020-01-16,19:17:55,repyvetteclarke,0,0,0
. @HomelandDems are committed to protecting the American people from anti-Semitism and white supremacy at all costs because domestic terrorism has no place in our communities. #NoHateNoFear pic.twitter.com/li8WFjavaI,1217887804946108416,2020-01-16,19:14:14,repyvetteclarke,3,9,23
"During my past few trips through Terminal 2 at @JFKairport, I've had the pleasure of getting to know two @TSA officers, Lena and Shanique.

These women are true professionals and I am grateful for their service to our great nation in securing our airports. #BlackWomenLead",1217854492764491778,2020-01-16,17:01:52,repyvetteclarke,0,0,12
"🚨 Happening NOW! Join me for an in depth discussion and live Q&A on the Iran conflict. 

Our community must come together to say #NoWarWithIran. #ChatWithYDC https://twitter.com/RepYvetteClarke/status/1216886009322975232 …",1217598536969281536,2020-01-16,00:04:47,repyvetteclarke,2,4,11
"I will not stand idly by while our #Jewish brothers & sisters live in fear of higher incidents of anti-Semitism, in #Brooklyn & around America. Today at @HomelandDems, I strategized w/Jewish leaders on the govt’s role in combatting domestic terrorism. #NoHateNoFear pic.twitter.com/vMs8DMlsJd",1217540723467223041,2020-01-15,20:15:03,repyvetteclarke,10,17,48
"What are your concerns about the conflict with Iran? Looking forward to answering your questions during my tele-townhall.

Call (866) 757-0651 tomorrow at 7:00 p.m. to join.
#NoWarWithIran #BrooklynStandUp https://twitter.com/repyvetteclarke/status/1216886009322975232 …",1217238428040998912,2020-01-15,00:13:51,repyvetteclarke,1,4,9
"I will not stand for the negligence of our brothers and sisters in Puerto Rico. 

@SenSchumer, @NydiaVelazquez, our colleagues and I wrote @SecretaryCarson to question why @HUDgov has illegally withheld $8.3B in aid from PR. Did Sec. Carson forget Puerto Ricans are Americans too? pic.twitter.com/GKyw87l1qy",1217222279261753345,2020-01-14,23:09:40,repyvetteclarke,1,19,41
"🚨 WEDNESDAY at 7 p.m., I’m hosting a tele-townhall with local experts on the Iran conflict and it’s impact on our community. 

We cannot afford a senseless war and we must hold this President accountable for his actions. Call (866) 757-0651 to join. #ChatWithYDC #NoWarWithIran pic.twitter.com/2flTLn7lxb",1216886009322975232,2020-01-14,00:53:27,repyvetteclarke,3,7,9
"Happy 107th #FoundersDay to my illustrious sorority, @DeltaSigmaTheta. It’s an honor to serve in Congress with my Sorors as we remember the legacy of our founders. Together, we carry out our organization’s mission through our commitment to service. #DST1913 pic.twitter.com/TYkdbYlsi7",1216769707501608961,2020-01-13,17:11:19,repyvetteclarke,8,56,302
"Yet another example of 45’s disregard for human health, the environment and basic science. As sea levels rise and extreme weather threatens our homes & critical infrastructure, ignoring climate change for new federal projects should be a criminal offense. https://www.nytimes.com/2020/01/09/climate/trump-nepa-environment.html …",1216499683763376129,2020-01-12,23:18:20,repyvetteclarke,11,40,61
Yesterday I voted in favor of the War Powers Resolution that will put the brakes on Donald Trump and the Trump Administration's abuse of authority. #NoWarWithIran pic.twitter.com/yZSmby6s5Y,1215711543867977734,2020-01-10,19:06:33,repyvetteclarke,7,9,53
"Proud to stand with my @EnergyCommerce colleagues to introduce our #CLEANfuture proposal, which takes bold steps to achieve net-zero greenhouse gas pollution by 2050, creates millions of jobs & makes America a global leader on climate. We must act now! https://twitter.com/EnergyCommerce/status/1214993023765024768 …",1215399509179670529,2020-01-09,22:26:38,repyvetteclarke,2,4,7
#NoWarWithlran pic.twitter.com/492ED1JwR1 – at United States Capitol,1215336336560984064,2020-01-09,18:15:37,repyvetteclarke,0,9,27
"This is the direction social media companies should be taking.  

Americans deserve transparency. It's why I introduced legislation last year, The DEEPFAKES Accountability Act, to require malicious #deepfakes to be labeled w/ a watermark and disclaimer. https://www.popularmechanics.com/technology/security/a30444133/facebook-bans-deepfakes-election/ …",1214998931152740352,2020-01-08,19:54:53,repyvetteclarke,2,5,9
"I’m appalled, but not surprised that HUD would undermine a crucial ruling that protects vulnerable communities from segregation. In an effort to provide fair housing for all, we must fight this Administration’s negligence of communities of color. https://thehill.com/homenews/administration/477171-hud-to-rollback-obama-era-housing-desegregation-rule …",1214914020324581376,2020-01-08,14:17:29,repyvetteclarke,18,76,129
"If Trump’s FEMA won’t address climate change, then Congress must step in. This is why I recently introduced the FEMA Climate Change Preparedness Act to ensure that FEMA is adequately prepared to assess climate change risks and protect our communities. https://www.eenews.net/stories/1062012735 …",1214637592450412553,2020-01-07,19:59:03,repyvetteclarke,0,6,14
"I’m appalled by reports of Iranian-Americans & green card holders being detained by @CBP.

2020 just began & 45 is already spewing his racist, xenophobic agenda. If you or a loved one in #NY09 have been detained or profiled by CBP, contact my Brooklyn office at (718) 287-1142.",1214012669243641856,2020-01-06,02:35:50,repyvetteclarke,8,35,77
"Our city is no place for hate.

Proud to stand shoulder to shoulder with the community that I love to denounce anti-Semitism and hate in all its forms. The time for action is now. #BrooklynStandUp #NoHateNoFear pic.twitter.com/LS9pYFqhkG",1213934420517892101,2020-01-05,21:24:54,repyvetteclarke,4,11,64
"Special thanks to Dr. Gopesh Patel & the VLS Pharmacy team for having me and for teaching me about compounding. 

I was impressed by the diverse team, the resources for budding pharmacists, the local jobs provided & the full retail pharmacy with delivery service. #BrooklynStandUp pic.twitter.com/GTlmbikN7a",1213575669457850368,2020-01-04,21:39:21,repyvetteclarke,2,3,10
"Proud to stand with my colleagues to announce our plan to increase federal funding for places of worship, cultural centers and nonprofits to increase their security. There is no place for anti-Semitism and hate in our city. We must take action now. https://www.ny1.com/nyc/all-boroughs/politics/2020/01/03/lawmakers-announce-federal-funds-to-protect-against-hate-crimes …",1213143181094719490,2020-01-03,17:00:48,repyvetteclarke,3,6,16
"Happy 216th Independence Day to the resilient people of Haiti, the world’s first free Black nation. Ayiti cheri! 🇭🇹 🇭🇹",1212575053466030085,2020-01-02,03:23:15,repyvetteclarke,2,12,64
"This year, House Democrats have fought tirelessly #ForThePeople, passing over 400 bills that lower the cost of prescription drugs, raise the minimum wage, strengthen workers’ rights, secure our elections and so much more. 
 
Our fight continues in 2020. #HappyNewYear",1212410139707355138,2020-01-01,16:27:57,repyvetteclarke,5,5,23
