tweet,id,date,time,username,replies_count,retweets_count,likes_count,tdatetime
"Honored to join friends and supporters in Roxbury to celebrate the community swearing-in of Massachusetts’ incredible new Representative. I’m proud to fight together! 

Welcome to Congress @RepPressley. pic.twitter.com/x7sTwcOb8C",1084514679500754944,2019-01-13,18:17:03,senmarkey,18,70,597,2019-01-13 18:17:03
"The #TrumpShutdown is now the longest in U.S history & Trump continues to treat thousands of workers like his hostages. Democrats are going to keep doing everything we can to re-open the government because we understand this isn’t a game, this is about real people’s livelihoods. https://twitter.com/SenMarkey/status/1084128378087763972 …",1084132431811305472,2019-01-12,16:58:08,senmarkey,26,31,107,2019-01-12 16:58:08
"The Republican paradox: they don’t believe in gov’t, but they have to run for office to shut it down. It’s an ancient animosity for gov’t & for the people it supports - workers, migrants, etc. Trump wants his wall & to win, but the Freedom Caucus just wants to get rid of gov’t.",1084128378087763972,2019-01-12,16:42:02,senmarkey,61,113,416,2019-01-12 16:42:02
"Federal workers should have been getting their paychecks today. Instead, all they are getting is more uncertainty. Today I rallied with furloughed workers to send a message to President Trump and Senate Republicans: end this shutdown. Let folks go back to work, and pay them. Now. pic.twitter.com/tcmUdN2m5r",1083821817771577344,2019-01-11,20:23:52,senmarkey,25,36,117,2019-01-11 20:23:52
The Republicans’ refusal to do their jobs and end the #TrumpShutdown means that @EPA inspectors can’t do their jobs: protecting American families from pollution. This toxic administration means toxic water and air for our communities. https://www.nytimes.com/2019/01/09/climate/epa-pollution-inspection-shutdown.html …,1083801963265966081,2019-01-11,19:04:58,senmarkey,24,65,111,2019-01-11 19:04:58
The winds of change are blowing off the coast of Massachusetts. Offshore wind can create tens of thousands of jobs along the East Coast and will be an indispensable part of our clean energy future. Great news for Boston. https://www.bostonglobe.com/business/2019/01/11/wind-turbine-company-picks-boston-for-its/xk0BuXz3cVc297f9CaCAnK/story.html …,1083784084772524032,2019-01-11,17:53:56,senmarkey,10,38,138,2019-01-11 17:53:56
"The #GreenNewDeal is an historic opportunity to fundamentally transform our economy and empower all communities. As we transition from fossil fuels to efficient, clean, renewable energy sources like solar, we must ensure that no one is left behind. https://now.tufts.edu/news-releases/study-racial-inequality-deployment-rooftop-solar-energy-us …",1083774510472540160,2019-01-11,17:15:53,senmarkey,19,42,130,2019-01-11 17:15:53
"The gov't of Burma is trying to silence the truth by jailing two @Reuters reporters. Instead, it has made them symbols of journalistic bravery.

This ruling is a blow to freedom of expression, but the fight for justice must go on. #FreeWaLoneKyawSoeOo https://www.voanews.com/a/myanmar-court-rejects-appeal-by-jailed-reuters-reporters/4738463.html …",1083761828994387968,2019-01-11,16:25:30,senmarkey,4,27,45,2019-01-11 16:25:30
"It's impossible to have a healthy planet without healthy oceans. To prevent a climate change catastrophe caused by warming oceans, we only have one choice: control our greenhouse gas emissions & quickly. There's still time before the damage is irreversible https://www.nytimes.com/2019/01/10/climate/ocean-warming-climate-change.html …",1083486939582484480,2019-01-10,22:13:11,senmarkey,14,73,153,2019-01-10 22:13:11
"The Swine Flu epidemic. 9/11. Hurricane Katrina. All declared national emergencies.

Nat'l emergency declarations aren't a tool of political convenience or grandstanding. They are meant to confront real crises & unite the country, not divide it over a manufactured vanity project.",1083442303862300673,2019-01-10,19:15:49,senmarkey,47,190,708,2019-01-10 19:15:49
"Contrary to the President’s remarks this morning, Democrats do care about crime. That’s why we’re trying to pass legislation to prevent President Trump from firing Special Counsel Mueller.",1083407008819302401,2019-01-10,16:55:34,senmarkey,41,174,540,2019-01-10 16:55:34
"The #TrumpShutdown is halting inspections at:

-food processing facilities
-water treatment plants
-chemical factories
-oil refineries

This shutdown is an impending catastrophe. If it goes on much longer, it’s just a matter of time until someone gets hurt or worse.",1083395607027429377,2019-01-10,16:10:15,senmarkey,36,139,247,2019-01-10 16:10:15
"WORK, Inc. is the largest employer of individuals with disabilities in New England under the Federal Ability One Program. It employs hundreds of individuals with significant disabilities. But because of the #TrumpShutdown, they aren’t going to work and they aren’t getting paid. pic.twitter.com/gBERomfuhJ",1083387249302081537,2019-01-10,15:37:03,senmarkey,9,70,83,2019-01-10 15:37:03
"Instead of wasting billions on President Trump’s useless wall, we should invest in the technology that helps those on the frontlines detect and intercept illegal drugs like fentanyl at ports of entry and in the mail.",1083118966065807360,2019-01-09,21:50:59,senmarkey,18,23,83,2019-01-09 21:50:59
"President Trump’s wall would do nothing to stop the flow of illegal drugs, most of which enter this country through legal ports of entry. It is shameful and disgusting that the President is trying to use the real crisis of the #OpioidEpidemic to build support for his vanity wall.",1083118961913413632,2019-01-09,21:50:58,senmarkey,37,41,197,2019-01-09 21:50:58
"Due to the #TrumpShutdown, @EPA employees are furloughed. The agency is mostly shut down. But Trump is nominating ex-coal lobbyist Andrew Wheeler to ensure that EPA never works as its mission dictates. It makes no sense to nominate Wheeler now, or ever. https://www.huffingtonpost.com/entry/epa-andrew-wheeler-trump_us_5c2e7743e4b05c88b70785f2 …",1083084984880107520,2019-01-09,19:35:57,senmarkey,15,85,190,2019-01-09 19:35:57
"The #TrumpShutdown is forcing the FDA to stop all routine inspections of American food-processing facilities. This shutdown is making Americans less safe.
 
President Trump, Leader McConnell: stop playing games with people’s lives. Re-open the government. https://www.washingtonpost.com/national/health-science/experts-warn-of-safety-and-security-risks-from-government-shutdown/2019/01/08/855472e4-1362-11e9-90a8-136fa44b80ba_story.html …",1083075622316969984,2019-01-09,18:58:45,senmarkey,20,66,99,2019-01-09 18:58:45
"We can’t just wait for the perfect political circumstances to #ActOnClimate. A regional #GreenNewDeal in New England that can be a blueprint for all of America is within reach, it’s “a matter of will, scale, and speed.” There’s no time to waste.
 https://www.bostonglobe.com/opinion/2019/01/09/why-wait-for-carbon-free-future/xY0i3UzdFu0g6PhSQI696N/story.html …",1083052656741023745,2019-01-09,17:27:30,senmarkey,13,32,81,2019-01-09 17:27:30
"No student should have to major in Hunger 101. Passing classes, graduating, and starting a career should be the top concerns of a student – not sacrificing food, housing, textbooks, or other essentials in pursuit of a better life. https://twitter.com/SenMarkey/status/1083024169657401345 …",1083026287197896709,2019-01-09,15:42:43,senmarkey,8,36,90,2019-01-09 15:42:43
Hunger has no place in our college classrooms. New @USGAO report reveals a disturbing amount of state and community college students struggling with food insecurity. We can and must do more to help schools and students. https://www.gao.gov/products/GAO-19-95 …,1083024169657401345,2019-01-09,15:34:18,senmarkey,11,40,91,2019-01-09 15:34:18
The truth is that there are more Americans today going without their paychecks because of the #TrumpShutdown than immigrants who illegally crossed the southern border in the past two years.,1082829312871550977,2019-01-09,02:40:00,senmarkey,38,188,457,2019-01-09 02:40:00
"800k federal workers are going without pay. And the longer #TrumpShutdown goes on, the more their worries mount. Mortgages, student loan payments, heating bills, food on the table. Trump may operate from crisis to crisis, but many American families are living paycheck to paycheck",1082802226437984267,2019-01-09,00:52:22,senmarkey,20,45,131,2019-01-09 00:52:22
To my @SenateGOP colleagues: let’s pass the bipartisan legislation to re-open the government. You supported it before. Support it again. Let’s put people back to work. I’m with my @SenateDems colleagues calling for an end to the #TrumpShutdown. Watch here:  https://www.facebook.com/SenatorKaine ,1082793807362576385,2019-01-09,00:18:55,senmarkey,24,52,170,2019-01-09 00:18:55
"We’ve proven in the Northeast that it is possible to grow the economy AND cut emissions by transitioning from fossil fuels to efficient, clean, renewable energy. We need to do this everywhere, and we need to do now. #GreenNewDeal https://www.nytimes.com/2019/01/08/climate/greenhouse-gas-emissions-increase.html …",1082710488935477249,2019-01-08,18:47:51,senmarkey,7,25,79,2019-01-08 18:47:51
"Instead of a publicity stunt visit to the border, President Trump should meet with the workers who are going without pay because of his tantrum. They’re thinking about how to make rent and pay bills, not a manufactured border crisis. #TrumpShutdown",1082701370988351490,2019-01-08,18:11:37,senmarkey,139,321,1140,2019-01-08 18:11:37
"Fortunately, the @NationalGridUS six-month lockout is ending and 1,250 @Steelworkers can get back to work. But lockouts should never be used as a negotiating tactic. The health and safety of workers and their families should never be used as leverage. https://www.wcvb.com/article/vote-could-end-months-long-national-grid-lockout/25773351 …",1082401592391929858,2019-01-07,22:20:24,senmarkey,6,20,56,2019-01-07 22:20:24
"Our privacy regime is so broken that many simply assume that their data has been shared or sold without their consent. It doesn’t have to be that way. A #PrivacyBillOfRights will ensure consumers, not corporations, have control over their sensitive info. https://www.washingtonpost.com/opinions/our-privacy-regime-is-broken-congress-needs-to-create-new-norms-for-a-digital-age/2019/01/04/c70b228c-0f9d-11e9-8938-5898adc28fa2_story.html …",1082374911363088387,2019-01-07,20:34:23,senmarkey,6,13,51,2019-01-07 20:34:23
Congress’ only job right now should be to re-open the government. The Senate should not consider any bills that don’t end the #TrumpShutdown.,1082356291991945217,2019-01-07,19:20:23,senmarkey,45,162,736,2019-01-07 19:20:23
"For decades, Exxon may have known about the role fossil fuels play in climate change, hid the evidence, and funded denialism. Great news that the public won’t be denied a chance for justice. Now @MassAGO can get to the truth and find out what Exxon knew. https://www.bostonglobe.com/metro/2019/01/07/supreme-court-refuses-block-healey-bid-investigate-exxonmobil/NuOpBuqIej6qzlL6X45BOM/story.html …",1082338609942986752,2019-01-07,18:10:08,senmarkey,17,86,240,2019-01-07 18:10:08
It was the negligence of @ColumbiaGasMA that led to the #MVGasFires and the 70 miles of roads and sidewalks that had to be torn up subsequently. It should be their responsibility to ensure all of this infrastructure is repaired. https://www.eagletribune.com/news/markey-warren-demand-answers-from-columbia-gas-on-road-repair/article_ad7f9462-104f-11e9-b7ab-6fb8d2ab2573.html …,1081300512719454209,2019-01-04,21:25:06,senmarkey,4,22,63,2019-01-04 21:25:06
"Without the results of this investigation, the people of the Merrimack Valley cannot hope to move forward. The residents of Lawrence, Andover, and North Andover have already had to wait too long for answers; they should not have to wait any longer.
 https://patch.com/massachusetts/northandover/s/gl7gy/shutdown-stalls-federal-gas-explosion-investigation …",1081269301468975105,2019-01-04,19:21:05,senmarkey,6,21,45,2019-01-04 19:21:05
"The #TrumpShutdown is resulting in Donald Trump's cronies getting a raise while working people get stiffed.

800,000 federal workers: not getting paid 
Pay raises for all other federal employees: frozen
White House officials: ~$10,000 raises https://www.washingtonpost.com/business/2019/01/04/while-federal-workers-go-without-pay-senior-trump-administration-officials-are-poised-get-raises …",1081246093189545990,2019-01-04,17:48:51,senmarkey,31,106,119,2019-01-04 17:48:51
"Welcome to the best delegation in Congress, @RepLoriTrahan! I look forward to working together on big things for Massachusetts. https://twitter.com/RepLoriTrahan/status/1081013243320123392 …",1081041757264060416,2019-01-04,04:16:54,senmarkey,6,12,110,2019-01-04 04:16:54
The #TrumpShutdown has shut down the federal investigation into the #MVGasFires and is shutting down justice for the residents of the Merrimack Valley impacted by the disaster. We need to fund government so the @NTSB can complete its investigation. https://www.markey.senate.gov/news/press-releases/senator-markey-trump-government-shutdown-has-shut-down-merrimack-valley-gas-disaster-federal-investigation …,1080956995828662274,2019-01-03,22:40:05,senmarkey,51,91,178,2019-01-03 22:40:05
".@SpeakerPelosi is right: climate change is an existential threat. With the new Congress seated, we can get to work on bold legislation like the #GreenNewDeal. I look forward to working w/ the Speaker & all of my colleagues who recognize the urgent need for transformative action. pic.twitter.com/L01kohKAie",1080918511361409025,2019-01-03,20:07:10,senmarkey,51,103,413,2019-01-03 20:07:10
A universal flu vaccine could save millions of lives and experts think we will see substantial progress toward one in 2019. The $140 million I secured for @NIH research this year will help us get closer to what would be an historic breakthrough. https://www.statnews.com/2018/12/31/science-medicine-2019 …,1080908022409560064,2019-01-03,19:25:29,senmarkey,1,3,39,2019-01-03 19:25:29
"Congratulations to my good friend @SenWarren on being sworn-in for a second term in the Senate today! I couldn’t ask for a more dedicated, passionate, and effective partner, and I’m excited to continue to fight side-by-side for the people of Massachusetts and for all Americans. pic.twitter.com/6Zg4BvePgr",1080889983941181445,2019-01-03,18:13:48,senmarkey,14,25,241,2019-01-03 18:13:48
My CLEARR Act would authorize more than $1 billion in federal funding to help small and disadvantaged communities replace contaminated water infrastructure. I will be reintroducing it in the new Congress. https://www.markey.senate.gov/news/press-releases/markey-senate-democrats-introduce-bill-to-help-small-and-disadvantaged-communities-improve-the-safety-of-their-drinking-water …,1080592163346542592,2019-01-02,22:30:22,senmarkey,11,26,65,2019-01-02 22:30:22
People have a right to clean water. But millions of Americans are being poisoned by their drinking water as a consequence of negligent regulation. Truly transformational climate action will aim to deliver environmental justice for all. https://www.washingtonpost.com/national/health-science/not-a-problem-you-can-run-away-from-communities-confront-the-threat-of-unregulated-chemicals-in-their-drinking-water/2019/01/01/a9be8f72-dd4b-11e8-b732-3c72cbf131f2_story.html …,1080592161907847170,2019-01-02,22:30:22,senmarkey,8,35,86,2019-01-02 22:30:22
Mercury. Chloroform. Hydrochloric acid. Trump's EPA says rules on pumping poisons into the air are unnecessary. If you’re waiting for the EPA to protect clean air don’t hold your breath. (But actually hold your breath bc the air may be filled with poison) https://www.npr.org/2018/12/28/679129613/trump-epa-says-mercury-limits-on-coal-plants-too-costly-not-necessary …,1080553278331645952,2019-01-02,19:55:51,senmarkey,19,150,245,2019-01-02 19:55:51
"Discussion of a #GreenNewDeal is breathing new energy into the movement for climate action. We need to harness this momentum heading into the new Congress. 

Read my interview with @ourdailyplanet:

 https://mailchi.mp/ourdailyplanet.com/our-daily-planet-amtraks-climate-risks-exclusive-interview-with-sen-ed-markey-our-hero-of-the-year?e=3b517a5231 …",1080194213076262916,2019-01-01,20:09:04,senmarkey,7,24,87,2019-01-01 20:09:04
Wishing everyone a very healthy and #HappyNewYear. My resolution for 2019 is to fight every day in the Senate for a #GreenNewDeal. We will #ActOnClimate.,1080163853827219456,2019-01-01,18:08:25,senmarkey,29,68,460,2019-01-01 18:08:25
"This Halloween, it's orange, black, and #GreenNewDeal. 

Proud to support @ImagineAnAnswer to Kids' Brain Cancer Foundation's Monster Mash Pumpkin Bash with this prizewinning creation. It was a treat to join some frightfully brave children and advocates. Happy Halloween! pic.twitter.com/uCpJNklP6U",1190010186842415104,2019-10-31,20:58:32,senmarkey,3,11,48,2019-10-31 20:58:32
An honor to receive this letter of support for the OCEAN Research Act from our very own Massachusetts Lobstermen’s Association! I’m looking forward to continue working together to keep our oceans healthy and our local seafood industry thriving. pic.twitter.com/b1CGfOth4m,1189648239500386304,2019-10-30,21:00:17,senmarkey,2,8,25,2019-10-30 21:00:17
"For all its talk of competition w/ China, the Trump admin is not showing up when it counts. Trump is again letting Beijing outrank the US delegation to a major Asia summit. America should be playing a more prominent role at key discussions w/ our Indo-Pacific allies & partners. https://twitter.com/Reuters/status/1189425627008524288 …",1189633019491033090,2019-10-30,19:59:48,senmarkey,2,9,21,2019-10-30 19:59:48
"In its most recent effort to vilify and stigmatize immigrants, the Trump administration wants to forcibly collect DNA from migrants, jeopardizing the civil rights and privacy of hundreds of thousands of people. I’m demanding the administration abandon this dystopian proposal. pic.twitter.com/o2hgqZOTyX",1189610716766097412,2019-10-30,18:31:11,senmarkey,11,28,73,2019-10-30 18:31:11
We can’t let the Trump administration and Republicans keep sabotaging our health care. I’m proud the @SenateDems are forcing a vote today to stop the Trump admin’s rule allowing states to promote junk insurance plans and #ProtectPreExistingConditions.,1189578623654793216,2019-10-30,16:23:39,senmarkey,7,23,84,2019-10-30 16:23:39
"For too long, America has failed to honor the victims of the Armenian Genocide by denying to acknowledge the full truth. Great news that the House just voted to recognize the Armenian Genocide. Now the Senate needs to follow suit & pass @SenatorMenendez’s accompanying resolution.",1189314425754398720,2019-10-29,22:53:50,senmarkey,6,32,134,2019-10-29 22:53:50
 https://www.bostonglobe.com/news/politics/2019/09/27/markey-wants-admit-least-refugees-year-fleeing-climate-change/gIufscMs1k6RLM3zCJPuDJ/story.html …,1189281483682390019,2019-10-29,20:42:56,senmarkey,4,9,34,2019-10-29 20:42:56
"Climate change will displace millions around the world. This is already a crisis and it will only get worse. America should be a leader in a humanitarian response. That’s why I’m fighting to pass my legislation to have the U.S. admit at least 50,000 climate refugees each year. https://twitter.com/nytclimate/status/1189223229543669761 …",1189281481769865218,2019-10-29,20:42:55,senmarkey,7,27,86,2019-10-29 20:42:55
"America should fund education, not annihilation; that is our future. My SANE Act w/ Rep. Blumenauer will cut $75 billion from our bloated nuclear weapons budget so we can invest in the people and programs that will make America safe and prosperous. https://www.markey.senate.gov/news/press-releases/senator-markey-and-rep-blumenauer-reintroduce-legislation-to-cut-75-billion-from-bloated-nuclear-weapons-budget …",1189268881908604928,2019-10-29,19:52:51,senmarkey,7,43,101,2019-10-29 19:52:51
"Hongkongers, not the Chinese Communist Party, should decide who leads them. Congress needs to pass the Hong Kong Human Rights and Democracy Act to show that America stands unequivocally w/ the brave Hongkongers like Joshua Wong who are fighting for democracy and greater autonomy. https://twitter.com/nytimes/status/1189032897778503680 …",1189250702398443520,2019-10-29,18:40:37,senmarkey,1027,4389,6382,2019-10-29 18:40:37
The percentage of young people who watch videos online every day has doubled since 2015. But we don’t know how these new habits affect kids’ minds and bodies. That’s terrifying. Congress must pass my bipartisan bill to launch a research initiative into the impact of tech on kids. https://twitter.com/CommonSense/status/1189161227005648896 …,1189233831657824257,2019-10-29,17:33:35,senmarkey,5,7,18,2019-10-29 17:33:35
"Berkshire residents have been abused by cable companies for too long. That’s why I’m fighting against increased cable prices, surprise cable fees, and loss of access to local in-state television. https://www.berkshireeagle.com/stories/our-opinion-bad-fcc-ruling-hurts-charter-customers,588626 …",1189216346653052928,2019-10-29,16:24:06,senmarkey,2,8,25,2019-10-29 16:24:06
First responders are urgently racing to fight the California wildfires and protect the millions who are threatened. We must fight climate change w/ the same urgency because fires like these will only continue to intensify without real action. #GreenNewDeal https://www.cnn.com/2019/10/29/us/california-fires-tuesday/index.html …,1189193141779197952,2019-10-29,14:51:53,senmarkey,10,20,57,2019-10-29 14:51:53
America must stop denying the truth that what happened in Armenia was a genocide. I hope the House passes this resolution to formally recognize the Armenian Genocide and the Senate quickly does the same. Congress must speak with one voice and unequivocally condemn this horror. https://twitter.com/ARAMAC_DC/status/1188952715856093184 …,1188961335431835648,2019-10-28,23:30:46,senmarkey,4,53,173,2019-10-28 23:30:46
"Sec. Carson’s comments about transgender individuals are disrespectful to the people he has a duty to serve and demoralizing to those at HUD who take that duty seriously. 

I joined @SenSherrodBrown and 31 senators demanding @SecretaryCarson retract his transphobic statements. https://twitter.com/SenSherrodBrown/status/1188907278784708611 …",1188937960143687682,2019-10-28,21:57:53,senmarkey,7,37,89,2019-10-28 21:57:53
"Senator Kay Hagan’s passing is a great loss for our country. Kay was a devoted public servant with a rare amount of courage, both throughout her political career and in her personal life. She will be missed. My thoughts are with her family. https://www.charlotteobserver.com/news/politics-government/article236736088.html …",1188910371794571264,2019-10-28,20:08:16,senmarkey,2,9,37,2019-10-28 20:08:16
"Gay & trans “panic” defenses, which allow LGBTQ victims to blamed for the violence against them, remain legal in dozens of states. Congress should honor the lives of Matthew, James, & every victim of hate crimes & pass my bill to ban LGBTQ panic defenses in all federal courts. https://twitter.com/SenMarkey/status/1188854051657654272 …",1188854204376535042,2019-10-28,16:25:04,senmarkey,5,20,71,2019-10-28 16:25:04
"On October 28, 2009, President Obama signed into law the landmark Matthew Shepard and James Byrd Jr. Hate Crimes Prevention Act. But 10 years laters, LGBTQ individuals still face discrimination in the courtroom in the form of gay & trans ""panic"" defenses. https://www.cbsnews.com/news/matthew-shepard-parents-hate-crime-progress-despite-hypocritical-justice-department …",1188854051657654272,2019-10-28,16:24:28,senmarkey,2,8,25,2019-10-28 16:24:28
"The world is a safer place without al-Baghdadi. This is a win for the U.S., the intelligence community, our foreign partners, and the courageous forces who conducted this dangerous operation. https://www.nytimes.com/2019/10/27/us/politics/isis-leader-al-baghdadi-dead.html …",1188554685818511360,2019-10-27,20:34:54,senmarkey,11,5,48,2019-10-27 20:34:54
"As our community continues to recover from the Merrimack Valley gas explosions, we appreciate the chance to hear about what went wrong and how we can keep it from happening ever again. Thank you to @NTSB, @RepLoriTrahan, Mayor Rivera and everyone who joined us in Lawrence today. pic.twitter.com/1rGUnmpVyB",1187847791088943106,2019-10-25,21:45:57,senmarkey,5,16,34,2019-10-25 21:45:57
"Today, the FCC paved the way for a powerful cable company to increase its prices without regard for the impact on consumers. I will closely monitor whether Charter uses this decision to dramatically hike prices for cable consumers in Massachusetts. https://www.theverge.com/2019/10/25/20932391/fcc-charter-att-monopoly-order-raise-cable-rates …",1187838617424666625,2019-10-25,21:09:30,senmarkey,15,33,73,2019-10-25 21:09:30
Ocean acidification is jeopardizing our oceans. Proud to partner w/ @SenDanSullivan on legislation to bolster federal resources and partnerships for understanding the threat of ocean and coastal acidification and provide communities with tools to respond. https://www.markey.senate.gov/news/press-releases/senators-markey-and-sullivan-introduce-bipartisan-legislation-to-improve-the-health-of-oceans …,1187795507554467840,2019-10-25,18:18:11,senmarkey,1,13,51,2019-10-25 18:18:11
"Mass Maritime has trained cadets for over a century on how to navigate the battering winds off the coast of Massachusetts, now cadets are being trained on how to tame that wind and work in a renewable energy economy. https://twitter.com/MassGovernor/status/1187496005475938309 …",1187728424288374784,2019-10-25,13:51:37,senmarkey,5,7,40,2019-10-25 13:51:37
