tweet,id,date,time,username,replies_count,retweets_count,likes_count,tdatetime
"Today’s hearing is an opportunity to give a voice to the voiceless, and to discuss what America can, should, and must do to defend those being persecuted.",1115623899537051648,2019-04-09,14:33:59,senmarkey,3,3,17,2019-04-09 14:33:59
"When governments deny the fundamental rights of their people, they take their countries down paths that result – all too often – in mass atrocities, humanitarian crises, and civil war.  

These tragedies transcend borders and impact the interests of the U.S. and our our allies.",1115623898559713283,2019-04-09,14:33:59,senmarkey,1,7,18,2019-04-09 14:33:59
".@SenCoryGardner and I are holding a Foreign Relations hearing on our #ARIA law and fostering U.S. leadership in promoting human rights. Witnesses will share their perspectives on the human rights abuses against Uighurs, Tibetans, and Rohingya.

WATCH: https://www.foreign.senate.gov/hearings/aria-in-action-part-1-human-rights-democracy-and-the-rule-of-law-040919 …",1115617569585684483,2019-04-09,14:08:50,senmarkey,19,17,41,2019-04-09 14:08:50
Great news that Massachusetts will finally put an end to the horrific & illegitimate practice of conversion therapy for LGBTQ minors. But conversion therapy for minors is shockingly still permissible in 34 states. We must abolish this practice nationwide. https://www.masslive.com/news/2019/04/massachusetts-bans-conversion-therapy-for-minors.html …,1115376764371345408,2019-04-08,22:11:57,senmarkey,6,82,287,2019-04-08 22:11:57
"Wilbur Ross called on the @FCC to allow government contractors to harass Americans with robocalls. The FCC is supposed to be policing robocallers, not turning a blind eye. I’ve introduced a bill w/ @SenMikeLee to ensure all callers receive your permission before robocalling you. pic.twitter.com/h3ac8xjorW",1115325004365877248,2019-04-08,18:46:17,senmarkey,9,57,120,2019-04-08 18:46:17
We owe it to the people of the Merrimack Valley and to all Americans to put in place requirements to ensure that no natural gas company is allowed to shortchange safety ever again. That is what the Leonel Rondon Pipeline Safety Act aims to do. https://www.bostonglobe.com/metro/2019/04/08/markey-trahan-introduce-pipeline-safety-bill-after-merrimack-valley-natural-gas-disaster/tYstL23gWZwDuvPmjofgjI/story.html …,1115321135959347200,2019-04-08,18:30:55,senmarkey,5,12,45,2019-04-08 18:30:55
"Our natural gas pipeline infrastructure is a ticking time bomb. Proud to be with @RepLoriTrahan, local leaders & the Rondon family to announce the Leonel Rondon Pipeline Safety Act that will strengthen pipeline safety by closing regulatory loopholes & increasing safety standards. pic.twitter.com/dtETJveqa3",1115285893177327617,2019-04-08,16:10:52,senmarkey,3,7,35,2019-04-08 16:10:52
Thank your for your partnership  on pipeline safety and commitment to getting answers about this disaster. The Merrimack Valley is well served by your leasderahip in introducing this bill. https://twitter.com/RepLoriTrahan/status/1115279699306004487 …,1115280239834406913,2019-04-08,15:48:24,senmarkey,2,8,28,2019-04-08 15:48:24
"It’s been nearly 7 months since the Merrimack Valley gas fires and explosions. Andover Fire Chief Mansfield called it Armageddon. Columbia Gas called it unfortunate. I call it preventable.

I’m in Lawrence to announce the Leonel Rondon Pipeline Safety Act.  https://www.facebook.com/EdJMarkey ",1115271587857600512,2019-04-08,15:14:01,senmarkey,9,28,102,2019-04-08 15:14:01
"Kirstjen Nielsen may not have been the architect of Donald Trump’s inhumane immigration agenda, but she was its steward and her departure is long overdue. But our fight is far from over to ensure Trump’s assault on our immigrant community comes to an end. https://www.cbsnews.com/news/kirstjen-nielsen-resigning-dhs-secretary-expected-to-offer-resignation-today-live-updates-2019-04-07/ …",1115022832298352643,2019-04-07,22:45:33,senmarkey,85,138,603,2019-04-07 22:45:33
This bipartisan resolution makes it clear that the U.S. Congress seeks an immediate improvement in the government’s behavior and the end of efforts to weaponize the rule of law against brave individuals like Senator Leila de Lima and Maria Ressa. https://www.markey.senate.gov/news/press-releases/senators-markey-rubio-durbin-blackburn-coons-introduce-bipartisan-resolution-highlighting-human-rights-concerns-in-the-philippines …,1114247825896935424,2019-04-05,19:25:58,senmarkey,12,8,25,2019-04-05 19:25:58
"The Duterte gov't is turning the law against the very voices promoting the rights of the Philippine people and trying to intimidate voices against the gov't. Today, my colleagues and I intro'd a resolution to condemn human rights abuses in the Philippines. https://www.nytimes.com/2019/03/28/business/media/maria-ressa-arrested-philippines-rappler.html …",1114247824617672705,2019-04-05,19:25:57,senmarkey,7,10,40,2019-04-05 19:25:57
"Aji Piper is one of the inspiring young people suing the federal government for violating their right to a stable climate system.

To Aji and the generation fighting for climate justice: I stand with you, and I believe you have a fundamental right to a livable planet.

@youthvgov pic.twitter.com/ebVCaSDEEn",1114216413655388166,2019-04-05,17:21:08,senmarkey,20,57,197,2019-04-05 17:21:08
".@jimsteyer has it exactly right. Just like there are rules for children’s television, we need rules for kids on the internet. My #KIDSAct will put into place strict rules to keep kids safe from manipulative marketing and design practices online. https://thehill.com/opinion/technology/437504-kids-programming-on-tv-is-regulated-what-about-their-digital-devices …",1114185345632014336,2019-04-05,15:17:41,senmarkey,10,5,26,2019-04-05 15:17:41
"Boeing put a price on safety and sold safety-critical features that could have prevented these crashes as “optional” add-ons, not standard features.
 
Boeing put profits over people and now 346 people are dead. https://www.nytimes.com/2019/04/04/world/asia/ethiopia-crash-boeing.html …",1113915649380765696,2019-04-04,21:26:01,senmarkey,16,51,88,2019-04-04 21:26:01
Parents should know what videos appear on the websites their kids view. The #KIDSAct will create transparency by establishing an annual audit of content being served to kids and creating a labeling system so parents can know if they are being exposed to harmful material. pic.twitter.com/ho5jH5TdXU,1113902193202159616,2019-04-04,20:32:32,senmarkey,8,5,28,2019-04-04 20:32:32
"The power of the #GreenNewDeal has struck a chord in this country. Americans see how a Green New Deal can transform our economy and democracy, all while addressing climate change. Senate Republicans’ sham vote wasn’t the end, it was just the beginning. https://www.bostonglobe.com/business/2019/04/03/why-markey-calls-unpassed-green-new-deal-victory/KzQEoj4WqrlwJTR2YpZBSM/story.html …",1113886087078973440,2019-04-04,19:28:32,senmarkey,22,35,78,2019-04-04 19:28:32
"If you feel bombarded by online advertisements and disturbing internet content, think how vulnerable children are. We need to ban product placement and program-length ads in kids’ videos. Kids don’t have the cognitive skills to determine that these videos are ads. #KIDSAct pic.twitter.com/0mc4bc65hQ",1113874227554324487,2019-04-04,18:41:25,senmarkey,3,10,35,2019-04-04 18:41:25
"Building on funding I first secured in '18 @NIH is starting its first clinical trial of a universal flu vaccine. This would be an historic breakthrough that would save millions of lives. I’ll keep fighting to secure funds @NIH needs to make this a reality.
 https://www.nih.gov/news-events/news-releases/nih-begins-first-human-trial-universal-influenza-vaccine-candidate …",1113858208538533888,2019-04-04,17:37:46,senmarkey,1,18,40,2019-04-04 17:37:46
Websites and apps are using features like auto-play to manipulate kids into staying on their platforms as long as possible. My #KIDSAct will ban these damaging features on platforms for kids so they don’t develop unhealthy habits. pic.twitter.com/Qa9Asn9G4K,1113837159537152001,2019-04-04,16:14:07,senmarkey,4,10,33,2019-04-04 16:14:07
"Fuel economy emissions standards are the single greatest action ever taken by any nation to fight climate change. That’s why @SenFeinstein, @SenKamalaHarris & I have introduced legislation to block Trump’s attempts to roll back strong emissions standards. https://www.washingtonpost.com/news/powerpost/paloma/the-energy-202/2019/04/02/the-energy-202-epa-s-own-adviser-finds-trump-s-rollback-of-car-rules-could-cost-jobs/5ca230f91b326b0f7f38f2d6/?utm_term=.934b722899ca …",1113818965325897728,2019-04-04,15:01:49,senmarkey,45,93,309,2019-04-04 15:01:49
"Right now, parents can’t trust that their kids are safe from harmful content when using the internet. We need to change that. I’ll soon be introducing the Kids Internet Design and Safety (KIDS) Act to enact strong rules to keep kids safe online. #KIDSAct
@TODAYshow pic.twitter.com/AbW7iMvNHF",1113807870217396225,2019-04-04,14:17:44,senmarkey,6,6,17,2019-04-04 14:17:44
"Just like there are rules for children’s television, we need rules for kids on the internet. I’ll be introducing the #KIDSAct to make sure children aren’t being manipulated by dangerous features, inappropriately advertised to, or exposed to harmful content. pic.twitter.com/nDq4fd6Ena",1113802999963500545,2019-04-04,13:58:23,senmarkey,3,11,30,2019-04-04 13:58:23
"I’m proud to join ⁦@CommonSense⁩ ⁦@vivek_murthy⁩, and kid’s champion Jim Steyer at the #TruthAboutTech conference to talk about my new #KIDSAct and protecting children online from harmful content. Thank you for your leadership! pic.twitter.com/5KBsB7VDGU",1113798036675801089,2019-04-04,13:38:39,senmarkey,0,5,19,2019-04-04 13:38:39
"This morning at 9:30 ET I’ll be with @CommonSense to announce the #KIDSAct, major new legislation I intend to introduce to make the internet a safer place for children. #TruthAboutTech #DWB19 https://twitter.com/CommonSense/status/1113788566839205888 …",1113791282898452481,2019-04-04,13:11:49,senmarkey,2,15,39,2019-04-04 13:11:49
"I know you will clear this hurdle and bring a renewed passion and dedication to your work when you’re soon back on the Senate floor. Thank you for sharing your news and being an inspiration not just for Colorado, but for the entire country. The strength of the nation is with you. https://twitter.com/SenatorBennet/status/1113632417095536641 …",1113643358331731968,2019-04-04,03:24:01,senmarkey,2,14,83,2019-04-04 03:24:01
"Thank you to Bob Coughlin and Massachusetts’s great engine of innovation and job creation ⁦@MassBio⁩. I pledge to fight for the continued federal investments in biomedical, health, and life sciences at the heart of the Commonwealth’s economy. pic.twitter.com/oQfIoSTkmw",1113614295043125248,2019-04-04,01:28:32,senmarkey,0,3,28,2019-04-04 01:28:32
"By requesting Trump’s tax returns, Congress is prepared to shine a bright light on the truth about the President’s finances and do its duty to ensure executive accountability. And I couldn’t think of a better person to lead the way than my friend Chairman @RepRichardNeal. https://twitter.com/RepRichardNeal/status/1113572001837395968 …",1113594116569554946,2019-04-04,00:08:21,senmarkey,30,47,161,2019-04-04 00:08:21
"Gay marriage. Family separation. The Muslim ban. DACA.
 
Federal district court judges make the first decisions in the country’s most important cases. And @SenateGOP just limited debate on the confirmation of district court nominees to only 2 hours. This will hurt us for decades.",1113560513424887808,2019-04-03,21:54:50,senmarkey,32,78,206,2019-04-03 21:54:50
"The onslaught of robocalls must stop. It’s great news that the Senate Commerce Committee voted unanimously to advance my bill cracking down on robocall scammers, and I hope the entire Senate will vote to pass it soon so we can put an end to this scourge. https://abcnews.go.com/Politics/move-congress-stop-annoying-robocalls-cell-phone/story?id=62137551 …",1113546497633787904,2019-04-03,20:59:08,senmarkey,7,18,74,2019-04-03 20:59:08
"The American people have a right to know who is representing them. With this rule, there won’t be enough time for a proper examination. Republicans simply want to shield extremist nominees from scrutiny because they know they wouldn’t stand up to real debate.",1113526355482877952,2019-04-03,19:39:06,senmarkey,52,221,909,2019-04-03 19:39:06
This is a sad day for democracy. Leader McConnell and @SenateGOP just shortened debate time for executive nominees from 30 hours to 2 hours. 2 hours is not nearly enough time to properly vet nominees to these important posts.,1113526354547494913,2019-04-03,19:39:05,senmarkey,737,2063,7389,2019-04-03 19:39:05
"While Donald Trump sells off ambassadorships to completely unqualified donors, Senate Republicans this week are threatening to use the “nuclear option” and change the Senate rules so these nominees face even less time for scrutiny. https://twitter.com/NBCNews/status/1113449226845995010 …",1113512483950559233,2019-04-03,18:43:58,senmarkey,8,43,82,2019-04-03 18:43:58
"For those saying the #GreenNewDeal resolution is unrealistic, we’ve done it before with the Nuclear Freeze resolution. I was there & I fought for it. We redefined our politics & achieved what some said was impossible, & we’ll do it again on climate change. https://www.newyorker.com/news/daily-comment/why-ed-markey-the-co-sponsor-of-the-green-new-deal-may-be-hopeful-for-its-chances …",1113507592934916099,2019-04-03,18:24:32,senmarkey,8,30,94,2019-04-03 18:24:32
"In March alone, consumers received an estimated 5.2 billion robocalls. Robocalls are a menace. That’s why I am so pleased that the Senate Commerce Committee took an historic step forward towards finally ending the deluge of intrusive robocalls by passing the TRACED Act. https://twitter.com/SenMarkey/status/1113445158350094336 …",1113452181489881089,2019-04-03,14:44:21,senmarkey,8,21,98,2019-04-03 14:44:21
My and @SenJohnThune’s bipartisan TRACED Act that cracks down on robocall scammers just unanimously passed the Senate Commerce Committee. We’re sending a message today to fraudulent robocallers: your days are numbered. https://thehill.com/policy/technology/437117-senate-panel-advances-bill-to-penalize-illegal-robocalls …,1113445158350094336,2019-04-03,14:16:27,senmarkey,5,16,54,2019-04-03 14:16:27
".@McDonaldsCorp is the first global restaurant to use science-based targets for their goal to reduce their emissions by 1/3 by 2025. To fight climate change, we need to make sure all corporations are acting responsibly. Thanks for briefing our Climate Change Task Force. pic.twitter.com/CqEjAD0JPy",1113183838497320966,2019-04-02,20:58:03,senmarkey,13,16,62,2019-04-02 20:58:03
"The average American woman is getting seriously shortchanged her entire life by the systemic injustice of the gender pay gap. It’s even worse for women of color. On #EqualPayDay, let’s commit to finally closing the gap and ensuring equal work means equal pay for all Americans.",1113149596082089984,2019-04-02,18:41:59,senmarkey,16,29,98,2019-04-02 18:41:59
"Too many communities, especially low income and communities of color, lack access to clean water. The #DirtyWaterRule will only make the situation worse. We must oppose this dangerous rule and #ProtectCleanWater.",1113134674824527873,2019-04-02,17:42:42,senmarkey,12,14,56,2019-04-02 17:42:42
"The news from Brunei reminds us that LGBTI persons around the world remain vulnerable. My and @RepLowenthal’s bill will reaffirm America’s commitment to stand up for anyone whose human rights are being violated, especially the LGBTI community. @HRC https://www.hrc.org/blog/against-backdrop-of-brunei-lawmakers-reintroduce-human-rights-defense-act …",1113108493362491392,2019-04-02,15:58:40,senmarkey,3,8,37,2019-04-02 15:58:40
"Illicit #fentanyl made from ingredients from China is fueling the #OpioidEpidemic, causing tens of thousands of deaths from overdoses. It’s good news that China says that it will live up to this commitment, but we need to make sure it does. https://www.nytimes.com/2019/04/01/world/asia/china-bans-fentanyl-trump.html …",1112837076079267842,2019-04-01,22:00:09,senmarkey,15,8,40,2019-04-01 22:00:09
The reckless greed of Purdue Pharma fueled the #OpioidEpidemic. But Purdue should never profit from its own wrongdoing. That’s why I led my colleagues in demanding that Purdue commit in writing to never profit from opioid overdose medication. https://www.nytimes.com/2019/04/01/health/sacklers-oxycontin-lawsuits.html …,1112783586296545280,2019-04-01,18:27:36,senmarkey,7,20,40,2019-04-01 18:27:36
"I also urge the Trump administration to speak out. Last week, I introduced legislation that will make sure the U.S. has a dedicated envoy to protect LGBTI communities for heinous policies like these.",1112769231697965056,2019-04-01,17:30:33,senmarkey,5,4,32,2019-04-01 17:30:33
Brunei’s decision to punish LGBTI communities with the death penalty is appalling. I join those voices urging the government to reverse its decision. https://www.theguardian.com/world/2019/apr/01/brunei-cruel-and-inhuman-law-on-stoning-for-gay-sex-condemned-by-un …,1112769230234161153,2019-04-01,17:30:33,senmarkey,5,18,53,2019-04-01 17:30:33
"If the Trump admin were serious about migration from Central America, it would address the root causes - poverty, violence - instead of throwing fuel on the fire by cutting this critical aid. Cutting off aid and building a wall would make this humanitarian crisis a catastrophe. https://twitter.com/washingtonpost/status/1112048823277416455 …",1112757115922333697,2019-04-01,16:42:25,senmarkey,36,40,131,2019-04-01 16:42:25
"In this era of media globalization and consolidation, cable access TV gives viewers critical information about their communities and offers an important platform for local residents.
 
Thank you to all of the incredible leaders who came together today to support community TV. pic.twitter.com/CCuSbqJ2Ob",1112746307154776068,2019-04-01,15:59:28,senmarkey,4,17,33,2019-04-01 15:59:28
A new Trump admin rule could devastate local access television channels. We need to protect community television. I’m in Boston to highlight the invaluable role these stations play in communities and blast the potential cuts to local programming. WATCH:  https://www.facebook.com/EdJMarkey ,1112737770043305986,2019-04-01,15:25:32,senmarkey,13,22,56,2019-04-01 15:25:32
"If President Trump is looking to turn the impeachment trial into a reality TV show, he chose the right team with Alan Dershowitz, Ken Starr, and Robert Ray. But this is the U.S. Senate, not the People's Court. 

The pressure is on Senate Republicans to ensure this trial is fair. pic.twitter.com/5xt0yVQAvd",1218303412523163649,2020-01-17,22:45:43,senmarkey,31,33,115,2020-01-17 22:45:43
NOW: I'm on @CNN with @wolfblitzer to talk about next week's impeachment trial in the Senate. Tune in.,1218293898713485318,2020-01-17,22:07:54,senmarkey,7,4,29,2020-01-17 22:07:54
"This is the scope of the climate crisis. We cannot stand by and give Trump the power to destroy the planet. That’s what drove this lawsuit and that’s what drives the fight for a #GreenNewDeal.
 https://www.cnn.com/2020/01/17/politics/climate-childrens-lawsuit/index.html … pic.twitter.com/D8Pjssm2dA",1218278979817410560,2020-01-17,21:08:37,senmarkey,10,20,54,2020-01-17 21:08:37
346 people were killed because of a flawed aircraft certification system and Boeing’s dangerous safety culture. We cannot accept anything less than major reforms to our aviation system. https://twitter.com/SenMarkey/status/1218198634166128640 …,1218198686771089408,2020-01-17,15:49:34,senmarkey,19,25,80,2020-01-17 15:49:34
It's both unsurprising and deeply disturbing that this industry-led report on the Boeing 737 MAX is more focused on protecting business innovation than lives. https://www.politico.com/news/2020/01/16/737-max-boeing-faa-099700 …,1218198634166128640,2020-01-17,15:49:22,senmarkey,4,24,53,2020-01-17 15:49:22
I’ll be on @CNN on @AC360 to talk about President Donald Trump’s impeachment trial in the Senate. Tune in at 8:30pm EST.,1217977470722494469,2020-01-17,01:10:32,senmarkey,3,6,38,2020-01-17 01:10:32
I was just sworn in for the Senate impeachment trial of President Donald Trump. I pledge to my constituents and to the American people to do my constitutional duty and to follow the facts where they lead. The American people deserve a fair trial. pic.twitter.com/M0K8eldqxS,1217899570249764865,2020-01-16,20:00:59,senmarkey,55,56,438,2020-01-16 20:00:59
"USMCA had a chance to correct NAFTA’s disastrous approach toward climate change. Instead, it completely ignores it. The trade deal will allow the fossil fuel industry to continue to play by its own rules at the expense of our planet’s future. That’s why I voted NO today.",1217856320864444416,2020-01-16,17:09:08,senmarkey,13,45,125,2020-01-16 17:09:08
The Senate needs to be briefed by the Administration on the GAO’s findings and the American people need answers.,1217846742248456196,2020-01-16,16:31:04,senmarkey,4,10,38,2020-01-16 16:31:04
"President Trump’s withholding aid from Ukraine wasn’t just bad judgment or unethical, it was illegal. This GAO report makes it even clearer that President Trump must be held accountable for his illegal extortion scheme. https://www.washingtonpost.com/business/economy/white-house-hold-on-ukraine-aid-violated-federal-law-congressional-watchdog-says/2020/01/16/060ea7aa-37a3-11ea-9c01-d674772db96b_story.html …",1217846741048885252,2020-01-16,16:31:04,senmarkey,9,38,94,2020-01-16 16:31:04
"‘Exit bans’ are oppressive. This legislation will make sure that Chinese authorities responsible for the mistreatment of my constituents Victor and Cynthia Liu, and for the mistreatment of other Americans, know that denial of basic rights is unacceptable. https://www.nytimes.com/reuters/2020/01/15/world/asia/15reuters-usa-china-exitbans.html …",1217833273197547520,2020-01-16,15:37:33,senmarkey,16,645,683,2020-01-16 15:37:33
"The Constitution gives Congress, not the President, the power to make war and to authorize the use of military force. We are the direct representatives of the American people. And we cannot allow Trump to start an illegal war in Iran.

#NoWarWithIran pic.twitter.com/NxOGas36MS",1217564997410263052,2020-01-15,21:51:31,senmarkey,13,35,107,2020-01-15 21:51:31
"#NoWarWithIran

I’m on the Senate floor to support Senator Kaine’s resolution to prevent President Trump from starting an unnecessary and unauthorized war with Iran. Watch LIVE:  https://facebook.com/EdJMarkey ",1217541817379557381,2020-01-15,20:19:24,senmarkey,8,13,78,2020-01-15 20:19:24
 https://www.nytimes.com/interactive/2020/01/15/climate/hottest-year-2019.html …,1217496470313754624,2020-01-15,17:19:13,senmarkey,3,13,21,2020-01-15 17:19:13
"New NASA/NOAA analysis: 2019 was second-hottest year ever, 2010s hottest decade ever.

The planet is on fire, and it’s getting worse. The trend is dramatic and clear.

What gives me hope is that the trend for climate action and the #GreenNewDeal is also dramatic and clear. pic.twitter.com/5fhpoYeYie",1217496467901992961,2020-01-15,17:19:12,senmarkey,8,28,52,2020-01-15 17:19:12
"We are seeing the dramatic effects of the climate crisis every day, with floods, hurricanes, wildfires, and rising seas all worsening as we fail to act. But USMCA fails to even mention climate change. 

The trade deal is a profound climate failure. I voted NO. pic.twitter.com/ymgYiLD4Qv",1217476457536073728,2020-01-15,15:59:41,senmarkey,19,22,119,2020-01-15 15:59:41
"The people of Puerto Rico are owed far more than our thoughts and prayers. The Trump administration must immediately release the $8.3 billion they are withholding and provide all additional resources the island requires in its time of need.
 https://www.markey.senate.gov/news/press-releases/senator-markey-joins-senate-democrats-in-support-of-puerto-ricos-request-for-a-major-disaster-declaration-to-respond-to-earthquakes_ … pic.twitter.com/YeAoZiUGak",1217169632458629120,2020-01-14,19:40:28,senmarkey,10,65,156,2020-01-14 19:40:28
“We know what stranded assets are: all the fossil fuel that has to be kept in the ground. Workers should never be stranded assets.” - @JaneFonda on justice and the #GreenNewDeal pic.twitter.com/rK7NUeCVG4,1217150549281341445,2020-01-14,18:24:39,senmarkey,13,68,179,2020-01-14 18:24:39
We can no longer negotiate trade deals using the same framework of the past. Trade deals must reflect the urgency of the climate crisis and implement the strategic vision necessary for our planet’s survival.,1217129441949880321,2020-01-14,17:00:46,senmarkey,4,7,35,2020-01-14 17:00:46
It also gives polluters new power over the policymaking process while continuing old rules that allow fossil fuel companies like Chevron and ExxonMobil to file suit in secret tribunals against climate or environmental policies.,1217129440565780485,2020-01-14,17:00:46,senmarkey,2,7,23,2020-01-14 17:00:46
"USMCA includes explicit giveaways for the fossil fuel industry, making it cheaper to export dirty tar sands oil and continues giving the gas industry carte blanche to export American gas to Mexico.",1217129439445835776,2020-01-14,17:00:46,senmarkey,2,5,10,2020-01-14 17:00:46
"Since NAFTA went into effect 26 years ago, every year of a young person’s life has been warmer than the 20th century average. We cannot afford another 26 days, let alone years, of business as usual, where fossil fuel companies get to play by their own rules.",1217129437994606595,2020-01-14,17:00:45,senmarkey,2,5,15,2020-01-14 17:00:45
