tweet,id,date,time,username,replies_count,retweets_count,likes_count,tdatetime
"We have watched,time and again, communities torn apart by gun violence. Sadly, we have also seen elected officials block meaningful change. I will continue to and fight to create change in Congress when it comes to reducing gun violence. My @mcweekly op-ed http://www.montereycountyweekly.com/opinion/forum/we-can-curb-gun-violence-and-still-honor-the-second/article_810034fc-ed20-11e8-9b37-37b826a9a0d9.html …",1066076887359852551,2018-11-23,21:11:51,repjimmypanetta,6,7,36,2018-11-23 21:11:51
Happy Thanksgiving!  I am thankful for the opportunity to serve the people of California’s 20th Congressional District.  Wishing everyone on the central coast of California a happy and healthy holiday. #CA20 pic.twitter.com/Z46Cq9fCz3,1065639543364337665,2018-11-22,16:14:00,repjimmypanetta,2,1,37,2018-11-22 16:14:00
"Due to the recent California wildfires, the University of California will extend its fall 2019 application deadline to Dec. 15 for affected students who may need additional time to complete the application process. 

 https://www.universityofcalifornia.edu/press-room/uc-extends-undergraduate-application-deadline-students-affected-recent-wildfires …",1065314400569978880,2018-11-21,18:42:00,repjimmypanetta,0,3,5,2018-11-21 18:42:00
"Gottlieb promised to provide my office w/daily updates throughout the investigation. I will continue to work w/FDA, CDC & our producers to ensure that the investigation is completed in a timely manner so our consumers are safe & our industry is secure in its production of romaine",1065259748856090624,2018-11-21,15:04:50,repjimmypanetta,1,3,2,2018-11-21 15:04:50
I urged Commissioner Gottlieb to work collaboratively and communicatively with industry partners to minimize any health risks to consumers and reduce the loss of safe and healthy crops that are not connected to this outbreak.,1065259748172410880,2018-11-21,15:04:50,repjimmypanetta,1,1,1,2018-11-21 15:04:50
"Update: On Tuesday night, I spoke with FDA Commissioner Scott Gottlieb about the bacterial contamination outbreak linked to romaine. During our conversation, I stressed the urgency for an expedited investigation to find the source and region where the outbreak occurred.",1065259747446849536,2018-11-21,15:04:50,repjimmypanetta,1,0,1,2018-11-21 15:04:50
"I will continue to gather evidence and am committed to working with all stakeholders to ensure the food we produce and consume is safe. 
@FDAfood",1065040990082347008,2018-11-21,00:35:34,repjimmypanetta,1,0,8,2018-11-21 00:35:34
"I am engaging with the FDA and romaine lettuce producers about this outbreak. As the representative of the ‘Salad Bowl of the World,’ food safety is of the utmost importance to me and my constituents as it is for the health of American consumers. https://twitter.com/washingtonpost/status/1064969797887238144 …",1065040989394534402,2018-11-21,00:35:34,repjimmypanetta,2,5,26,2018-11-21 00:35:34
"On #TransDayofRemembrance, we mourn and pay tribute to #transgender individuals who lost their lives to intolerance, hate, and violence. We honor their memories, and we recommit ourselves to combating discrimination and advancing equality for all #TDOR2018",1064997203528376320,2018-11-20,21:41:34,repjimmypanetta,1,5,20,2018-11-20 21:41:34
"Caught up with @JoeSzyd_Salinas of the Californian @salnews to talk about my priorities for the coming months, and the new House Democratic majority's plans for the 116th Congress. https://twitter.com/salnews/status/1063515231442350086 …",1063919726160723968,2018-11-17,22:20:04,repjimmypanetta,3,1,15,2018-11-17 22:20:04
"I spoke on the floor of the House of Representatives today to honor retiring Monterey County District Attorney Dean Flippo. DA Flippo leaves big shoes to fill, but he has left a long legacy of public service and safety in our community. #CA20 #Monterey pic.twitter.com/1sR0IeXAoQ",1063516494603186177,2018-11-16,19:37:46,repjimmypanetta,1,3,12,2018-11-16 19:37:46
"The time for action on #ClimateChange is now. This week, I cosponsored H.Res.1145, to recognize the results of the @IPCC_CH climate change report and to stress the need to act immediately to reduce greenhouse gas emissions. https://www.congress.gov/bill/115th-congress/house-resolution/1145/text …",1063453470328582144,2018-11-16,15:27:19,repjimmypanetta,2,1,7,2018-11-16 15:27:19
"#ClimateChange is a threat to our public health, our national security, our economic viability, and our pristine coastlines and ocean biodiversity. The findings of the @IPCC_CH report on global warming show the immediate consequences of climate change  https://www.nytimes.com/2018/10/07/climate/ipcc-climate-report-2040.html …",1063453469342875651,2018-11-16,15:27:19,repjimmypanetta,2,1,8,2018-11-16 15:27:19
"Great meeting with local young farmers visiting Washington with @YoungFarmers. We discussed the importance of passing a strong #FarmBill that invests in beginning farmers and ranchers, supports organic production, and strengthens local food systems. pic.twitter.com/EESAKzUkSI",1063227650330714113,2018-11-16,00:30:00,repjimmypanetta,0,2,13,2018-11-16 00:30:00
"The administration’s inaction on #ClimateChange is not just disconcerting, it’s deadly. Climate change is fueling CA wildfires. Instead of addressing the issue, President Trump is threatening to withhold federal funding. https://www.vox.com/energy-and-environment/2018/11/10/18082282/trump-blames-california-wildfires-forest-management-climate-change …",1063182897300062208,2018-11-15,21:32:10,repjimmypanetta,2,2,13,2018-11-15 21:32:10
I introduced the Immigrant Witness and Victim Protection Act for people like Maria. Non-citizen victims & witnesses daring to come forward to support our criminal justice system deserve safeguarding. My bill promotes safety & encourages continued participation in our communities. https://twitter.com/salnews/status/1062768462832062464 …,1062773031037218817,2018-11-14,18:23:30,repjimmypanetta,2,2,23,2018-11-14 18:23:30
"On Veterans Day, we honor the brave the men & women who served and sacrificed for our nation. I had the privilege this weekend of speaking with some veterans from our community who served our country & fought for our freedom. I will continue to honor them in my work every day. pic.twitter.com/68mYKX5G8S",1061757285863735296,2018-11-11,23:07:18,repjimmypanetta,1,1,39,2018-11-11 23:07:18
My thoughts are with our fellow Californians impacted by the wildfires. Thankful for the brave first responders and firefighters - including those from our communities - who are working tirelessly to battle the blazes.,1061393053431275521,2018-11-10,22:59:58,repjimmypanetta,1,8,50,2018-11-10 22:59:58
"Earlier this year, I introduced the Special Counsel Security Assurance Act to limit the President’s ability to interfere with Special Counsel Robert Mueller’s investigation into Russian interference in the 2016 presidential election. More here: https://panetta.house.gov/media/press-releases/congressman-panetta-introduces-legislation-protect-security-clearance-special …",1060679611024138243,2018-11-08,23:45:00,repjimmypanetta,5,3,29,2018-11-08 23:45:00
"Another tragic, mass shooting – this time in Thousand Oaks, California. Our community grieves with our neighbors. Thoughts and prayers are not enough, we must take action.",1060593083988017152,2018-11-08,18:01:10,repjimmypanetta,1,5,46,2018-11-08 18:01:10
It's Election Day.  Polls across California are open from 7:00 a.m. to 8:00 p.m.  Find your polling place here:  https://www.usa.gov/election-office ,1059829612316897280,2018-11-06,15:27:24,repjimmypanetta,3,7,28,2018-11-06 15:27:24
"Open Enrollment continues for California residents through January 15, 2019. Compare rates and learn more, here:  https://apply.coveredca.com/lw-shopandcompare/?utm_source=twitter&utm_medium=socialorganic&utm_campaign=OE_Phase_6&utm_content=T101518 …",1058007352815824897,2018-11-01,14:46:24,repjimmypanetta,0,1,2,2018-11-01 14:46:24
"Congratulations to our new Postmaster, Joseph La Spina. As the 30th Postmaster of Salinas, he hopes to bridge gaps between the @USPS Postal Service and our community. I look forward to working with him. pic.twitter.com/NDBpfYuvKd",1091046537281658882,2019-01-31,18:52:19,repjimmypanetta,0,0,1,2019-01-31 18:52:19
This administration’s unilateral imposition of tariffs under Section 232 of the Trade Expansion Act has created a great amount of unpredictability and uncertainty. Our bipartisan Bicameral Congressional Trade Authority Act puts guardrails on the administration’s broad authority. https://twitter.com/Reuters/status/1090861139003695107 …,1091036243314511872,2019-01-31,18:11:25,repjimmypanetta,3,1,17,2019-01-31 18:11:25
These bills will support proper national security decision-making by requiring the Administration report to Congress and provide a delineated strategy prior to withdrawing from our obligations. https://twitter.com/Malinowski/status/1090704109458653184 …,1091003895713857536,2019-01-31,16:02:53,repjimmypanetta,3,7,19,2019-01-31 16:02:53
Industries are experiencing unpredictability & uncertainty due to this administration’s unilateral imposition of tariffs under Section 232 of the Trade Expansion Act. Congress must ensure that these tariffs are legitimate & supportive of our nation’s security & economic interests https://twitter.com/RepGallagher/status/1090718462220091392 …,1090727558096793600,2019-01-30,21:44:49,repjimmypanetta,0,1,5,2019-01-30 21:44:49
"I sat down with the Polish Ambassador this week to talk about the importance of my legislation, the #NATOSupportAct. Last week, the House overwhelmingly passed this bill, reaffirming our strong commitment to NATO.  I urge my colleagues in the Senate to support this bill. pic.twitter.com/nRFfTBvSBf",1090690613249540096,2019-01-30,19:18:00,repjimmypanetta,1,2,16,2019-01-30 19:18:00
"Today, @HouseDemocrats reintroduced #HR7 the #PaycheckFairnessAct. I am proud to support this bill. https://twitter.com/RepJimmyPanetta/status/1090375137197731840 …",1090647366351421440,2019-01-30,16:26:10,repjimmypanetta,1,3,28,2019-01-30 16:26:10
"At today's @WaysMeansCmte hearing, I talked about the how we must continue protecting coverage for people with pre-existing conditions, and how any support for the Texas v. Azar case is inconsistent with support for health care coverage. Watch here:  https://youtu.be/acuA_UCmrd4?t=14248 … https://twitter.com/WaysMeansCmte/status/1090329427005882368 …",1090396699577729028,2019-01-29,23:50:06,repjimmypanetta,2,5,12,2019-01-29 23:50:06
"10 years ago, the Lilly Ledbetter Fair Pay Act was signed into law. Everyone should have the same opportunities to contribute to our economy, support themselves & their families, and achieve their full potential. We must work to close wage gap & ensure true pay equity. #EqualPay",1090375137197731840,2019-01-29,22:24:25,repjimmypanetta,2,1,25,2019-01-29 22:24:25
"Honored to receive a 100% from the @HumaneSociety for 2018, for my voting record and the legislation I introduced to protect animals. View the scorecard here:  http://www.hslf.org/assets/pdfs/humane-scorecard/humane_scorecard_2018_final.pdf …",1090331980032544768,2019-01-29,19:32:56,repjimmypanetta,3,1,14,2019-01-29 19:32:56
Honored to receive a 100% on @eqca's 2018 legislative scorecard. Equality California is the nation’s largest statewide #LGBTQ civil rights organization.  https://www.eqca.org/wp-content/uploads/EQCA18_FEDERALLegislativeScorecard_v5.pdf …,1090322560477290497,2019-01-29,18:55:30,repjimmypanetta,3,4,31,2019-01-29 18:55:30
Today is my first policy hearing on the @WaysMeansCmte. We will discuss health coverage for preexisting conditions. Over 130 million Americans have a pre-existing condition and protecting them goes to the core of safeguarding heath care for all Americans.  https://www.youtube.com/watch?v=acuA_UCmrd4&feature=youtu.be&app=desktop …,1090287335860826112,2019-01-29,16:35:32,repjimmypanetta,0,1,19,2019-01-29 16:35:32
"Yesterday, at @SHFBSantaCruz I met with families who rely on #CalFresh to help put food on the table. These families were some of the many impacted by the partial government shutdown. We must ensure that this never happens again. pic.twitter.com/s0hxQRLH5Q",1089564620849848323,2019-01-27,16:43:43,repjimmypanetta,3,9,19,2019-01-27 16:43:43
"On International Holocaust Remembrance Day we recommit ourselves to fight against anti-Semitism, prejudice, and racism.",1089539778129780736,2019-01-27,15:05:00,repjimmypanetta,2,4,40,2019-01-27 15:05:00
"Over the next 3 weeks, our leadership must put politics aside &have a serious discussion about the policy of border security &immigration reform so that we can keep our government open and provide security for our nation & a pathway for those who want and deserve to be part of it",1088982638273200128,2019-01-26,02:11:07,repjimmypanetta,2,3,14,2019-01-26 02:11:07
This shutdown had a negative impact on federal workers&their families &on our economic &national security. To ensure this never happens again our leadership must put politics&emotion aside and focus on the policy&evidence of reasonable border security&necessary immigration reform,1088982637732077569,2019-01-26,02:11:07,repjimmypanetta,1,2,11,2019-01-26 02:11:07
"I am pleased that the President finally took the necessary step to reopen our government so that federal employees can return to work and get paid.  This could have been avoided in December, but this administration used the shutdown as a tool for a political agenda.",1088982636918460416,2019-01-26,02:11:07,repjimmypanetta,3,8,27,2019-01-26 02:11:07
The House has voted on 11 bills to reopen the government. It's time for the Senate to get serious about ending the shutdown. That must be the number one priority.,1088838594503081984,2019-01-25,16:38:45,repjimmypanetta,1,0,8,2019-01-25 16:38:45
"This article by the @mcweekly shows the ripple effect this shutdown is having on our community. Not only are our federal workers & local Coast Guard taking the brunt, but small business owners, local tourism, and more. https://www.montereycountyweekly.com/news/local_news/the-federal-government-shutdown-leaves-locals-out-of-work-and/article_5ca094c4-1f77-11e9-a22e-6304f9e68990.html …",1088838591978049537,2019-01-25,16:38:44,repjimmypanetta,2,5,19,2019-01-25 16:38:44
"The President can open up the government with a stroke of a pen.  Instead, he has chosen to use this government shutdown as a tool to fulfill a campaign promise.",1088561714533187590,2019-01-24,22:18:31,repjimmypanetta,3,5,26,2019-01-24 22:18:31
"These types of statements demonstrate how out-of-touch this Administration can be when it comes to how this government shutdown actually hurts people. 800,000 federal employees without work or a paycheck and having a hard time paying for basic living expenses. https://twitter.com/CNBC/status/1088454677216153602 …",1088561713639755776,2019-01-24,22:18:31,repjimmypanetta,1,1,18,2019-01-24 22:18:31
"Excited to get to work on the @WaysMeansCmte, where I will be at the forefront of promoting smarter trade policies, enacting fairer tax policies, increasing access to health care and coverage, and protecting federal programs for vulnerable children and our seniors. pic.twitter.com/m402rhAF9h",1088469455728971776,2019-01-24,16:11:55,repjimmypanetta,3,9,35,2019-01-24 16:11:55
"I'll be on #AMR to talk about the importance of my bipartisan legislation, the #NATOSupportAct, which overwhelmingly passed the House yesterday.  Tune in at 9:20amPST//12:20pmEST https://twitter.com/mitchellreports/status/1088103075401719808 …",1088106305888403456,2019-01-23,16:08:54,repjimmypanetta,8,5,17,2019-01-23 16:08:54
"My legislation, the #NATOSupportAct, overwhelmingly passed the House yesterday. @Morning_Joe covered the importance of this legislation on this morning's program. pic.twitter.com/2qzK4sSjTO",1088097386478665730,2019-01-23,15:33:27,repjimmypanetta,12,7,42,2019-01-23 15:33:27
"The United States must continue to support and defend our allies around the globe. Today, the House reaffirmed its strong commitment to #NATO alliance and our responsibility to invest in this pillar of international peace, stability, and security. https://panetta.house.gov/media/press-releases/congressman-panetta-statement-house-passage-nato-support-act …",1087873819497385984,2019-01-23,00:45:04,repjimmypanetta,2,7,26,2019-01-23 00:45:04
"I am proud to announce that today, the House of Representatives passed my bipartisan legislation, H.R. 676, the #NATOSupportAct, which rejects any efforts by the President to withdraw from the #NATO alliance and prohibits the use of funds to take any such action. pic.twitter.com/fFLqTJbcyv",1087873816255234049,2019-01-23,00:45:04,repjimmypanetta,8,20,75,2019-01-23 00:45:04
"As a veteran, I value every American who is willing and able to serve in the U.S. military. This is a deeply disappointing move by #SCOTUS. We in Congress must redouble our efforts to end this discriminatory ban. #ProtectTransTroops https://www.npr.org/2019/01/22/687368145/supreme-court-revives-trumps-ban-on-transgender-military-personnel-for-now …",1087794323234672640,2019-01-22,19:29:11,repjimmypanetta,3,11,27,2019-01-22 19:29:11
"Today, we honor the legacy of Dr. Martin Luther King, Jr. 
Dr. King spoke about the importance of standing up for what is right, what is just, and what is true. We must recommit to standing up, speaking out, and marching forward for equality & against hatred, and to create change pic.twitter.com/WnYHVjsmeb",1087369379828957184,2019-01-21,15:20:37,repjimmypanetta,2,9,48,2019-01-21 15:20:37
"We must promote our shared values of freedom, equality, and empowerment by continuing to invest in the institutions, programs, and people that enhance our national security. The #NATOSupportAct will help make sure we do.",1086077087855738881,2019-01-18,01:45:30,repjimmypanetta,4,3,20,2019-01-18 01:45:30
"The #NATOSupportAct rejects any efforts by the President to withdraw from the alliance. Moreover, the measure supports NATO member efforts to spend at least 2% of their GDP on defense and promotes robust funding for the European Deterrence Initiative to counter Russian aggression",1086077087021027328,2019-01-18,01:45:30,repjimmypanetta,2,2,18,2019-01-18 01:45:30
"Today, I introduced the bipartisan #NATOSupportAct.  The legislation reiterates strong Congressional support for the North Atlantic Treaty Organization (#NATO), the longest-standing and most successful military alliance in the world.",1086077086152876033,2019-01-18,01:45:30,repjimmypanetta,1,7,31,2019-01-18 01:45:30
"I am honored to have the opportunity to continue my service on the @HouseAgDems Committee.  I will continue to work to advance priorities for Central Coast growers, shippers, farmworkers, and families, and to make sure that the #2018FarmBill is implemented as Congress intended.",1085997483531087873,2019-01-17,20:29:11,repjimmypanetta,1,9,32,2019-01-17 20:29:11
"As the representative of the Salad Bowl of the World, I am proud to co-introduce this bill, which is a critical step forward for both our farmers and farmworkers and for our efforts to finally reform our broken immigration system.  https://panetta.house.gov/media/press-releases/panetta-lofgren-feinstein-introduce-bicameral-legislation-shield-farmworkers … https://twitter.com/sleavenworth/status/1085920587724263424 …",1085953000584171520,2019-01-17,17:32:26,repjimmypanetta,3,14,43,2019-01-17 17:32:26
"If you receive #SNAP, please be advised that due to the partial government shutdown, February’s #CalFresh nutrition assistance benefits will be issued today. 

 http://www.cdss.ca.gov/Portals/13/Blue%20Pages/CalFresh%20Early%20Issuance%20Press%20Release%201-2019.pdf?ver=2019-01-14-144925-097 … https://twitter.com/CaliforniaDSS/status/1084963153278988288 …",1085630537149153281,2019-01-16,20:11:04,repjimmypanetta,0,1,5,2019-01-16 20:11:04
"The Salinas Service Center will temporarily reopen on Thursday 1/17, Friday 1/18, and Tuesday 1/22.  Farm Service Agency staff will be available to assist with existing farm loans and other limited services. https://twitter.com/SecretarySonny/status/1085568494173851648 …",1085581503495585792,2019-01-16,16:56:14,repjimmypanetta,0,0,5,2019-01-16 16:56:14
"Concerningly, just as the CDC and FDA announced the end of the E. coli outbreak associated with romaine lettuce, furloughed FDA employees are unable to properly inspect food processing facilities.  These actions are putting domestic consumers at risk. https://www.washingtonpost.com/national/health-science/us-lettuce-industry-wary-of-e-coli-wants-fda-back-on-the-job/2019/01/15/36a9b268-18d4-11e9-8813-cb9dec761e73_story.html?utm_term=.821c9897fb53 …",1085549792326008833,2019-01-16,14:50:13,repjimmypanetta,2,4,19,2019-01-16 14:50:13
"Today, I joined in supporting @WhipClyburn’s resolution to condemn Rep. Steve King’s comments.  The House must not tolerate any form of racism or such hateful, reprehensible speech.",1085319804360249344,2019-01-15,23:36:20,repjimmypanetta,1,1,28,2019-01-15 23:36:20
"I have also posted a list of resources on my website for federal employees and their families in our congressional district: #CA20  https://panetta.house.gov/services/resources-federal-employees …

Additional information on federal services during the partial government shutdown can be found here: https://panetta.house.gov/information-services-during-partial-government-shutdown …",1085297144846790662,2019-01-15,22:06:17,repjimmypanetta,0,0,3,2019-01-15 22:06:17
"If you have been impacted by the partial government shutdown, I encourage you to share your story and help put pressure on Senate Republicans to take up House-passed legislation to end the shutdown.
 http://TrumpShutdownStories.us ",1085297143953477632,2019-01-15,22:06:17,repjimmypanetta,16,6,24,2019-01-15 22:06:17
Good news - A federal court blocked the Administration from adding a #citizenshipquestion to the #2020Census.  We must continue to work to ensure that the census depicts an accurate population count. https://twitter.com/hansilowang/status/1085182716109307905 …,1085229607215865859,2019-01-15,17:37:55,repjimmypanetta,4,5,26,2019-01-15 17:37:55
"Proud to stand with my congressional colleagues of the @ProChoiceCaucus, @PPFA, and other women's health leaders this morning to talk about our priorities for the #116thCongress.  We are committed to protecting women's reproductive rights and access to healthcare. pic.twitter.com/AidFToHD7o",1085221812731109376,2019-01-15,17:06:57,repjimmypanetta,1,1,11,2019-01-15 17:06:57
I met with constituents on Saturday in Santa Cruz to talk about issues from education to housing to climate change. Throughout this partial government shutdown my door remains open. I am back to work in DC to reopen the government &continue serving the people of the Central Coast pic.twitter.com/ALMoEBKt3Y,1084956409639374848,2019-01-14,23:32:20,repjimmypanetta,2,3,25,2019-01-14 23:32:20
"Mobile Office Hours for local Veterans in Capitola tomorrow. To schedule a meeting, please call our Salinas office at 831-424-2229. https://panetta.house.gov/services/mobile-office-hours …",1084950790098292736,2019-01-14,23:10:00,repjimmypanetta,1,1,1,2019-01-14 23:10:00
"I agree, Mr. Secretary.  Our farmers, farmworkers, shippers, and consumers are all hurting because of this shut down.  That is why I voted last week to reopen your department.  The Senate and President must act. #EndTheShutdown @USDA https://twitter.com/axios/status/1084870329766473733 …",1084875526194503680,2019-01-14,18:10:56,repjimmypanetta,1,4,14,2019-01-14 18:10:56
"Today marks the longest government shutdown in U.S. history. For 39,000 federal workers in California, there is nothing partial about lost wages. For countless Americans, there’s nothing partial about halted services. #EndTheShutdown https://twitter.com/AP/status/1083953812770033664 …",1084257353317392391,2019-01-13,01:14:32,repjimmypanetta,7,5,11,2019-01-13 01:14:32
"This may be a partial government shutdown, but there’s nothing partial about the lost wages that our federal workers are encountering. The House just voted on this bill to make sure all federal employees receive back pay so they & their families will be made whole #EndTheShutdown https://twitter.com/SenFeinstein/status/1083498904270852097 …",1083804656881598466,2019-01-11,19:15:40,repjimmypanetta,3,4,19,2019-01-11 19:15:40
"I voted to reopen Pinnacles National Park & Fort Ord National Monument for families to enjoy with safe & sanitary conditions, and to reopen the EPA to protect the Central Coast’s & America’s residents from exposure to harmful pollutants. It is time for the Senate to do the same. https://twitter.com/CNNPolitics/status/1083779710767763457 …",1083802732820135937,2019-01-11,19:08:02,repjimmypanetta,8,20,77,2019-01-11 19:08:02
"Because of the partial government shutdown
-USDA is closed
-Farm Service Agencies are shuttered
-Agricultural research is suspended
-Organic certification programs are stopped
-FDA inspectors have ceased operations
The House will vote to reopen these agencies. #EndTheShutdown pic.twitter.com/8O3qjWWsGf",1083464742667276288,2019-01-10,20:44:59,repjimmypanetta,4,13,39,2019-01-10 20:44:59
"Due to the shut down furloughed FDA employees are unable to properly inspect food processing facilities, putting domestic consumers at risk. We must reopen the government immediately so the federal workers at FDA & USDA can get back to protecting consumers & supporting producers. https://twitter.com/CBSNews/status/1083353962714152961 …",1083380032041611264,2019-01-10,15:08:22,repjimmypanetta,3,11,24,2019-01-10 15:08:22
