tweet,id,date,time,username,replies_count,retweets_count,likes_count,tdatetime
"Education. A clean environment. Health care. Nutrition assistance.
These and other bipartisan priorities face huge cuts in the #TrumpBudget. We will fight back. pic.twitter.com/mk1eTpskHb",1105544738495586304,2019-03-12,19:03:00,repjimmypanetta,4,6,15,2019-03-12 19:03:00
"At today's @HouseBudgetDems hearing on the President’s 2020 Budget, I questioned OMB Acting Director Russell Vought about proposed work requirements for #SNAP and the #HarvestBox idea, both of which we rejected in last year's bipartisan #FarmBill. @CSPAN  http://www.c-span.org/video/?c4785772/rep-panetta-questions-dir-vought …",1105526479805403136,2019-03-12,17:50:27,repjimmypanetta,1,1,6,2019-03-12 17:50:27
"This idea of a #HarvestBox was floated last year, and it was widely rejected. We didn't enact it in the bipartisan Farm Bill, and it certainly won't stick now. One of the many proposals in the #TrumpBudget based on ideology, not policy or evidence. https://twitter.com/ArthurDelaneyHP/status/1105505773981966336 …",1105523798382657536,2019-03-12,17:39:47,repjimmypanetta,2,1,11,2019-03-12 17:39:47
"Staff mobile office hours tomorrow in Hollister: Congressional staff members can assist with issues concerning Social Security, Medicare, federal employee retirement, immigration services, veterans' services, passports, searching for military records & any other federal matters. pic.twitter.com/PjElMgyva7",1105479810489278464,2019-03-12,14:45:00,repjimmypanetta,2,0,2,2019-03-12 14:45:00
Proud to be a member of the largest #LGBT Equality Caucus in the history of the U.S. House of Representatives. Follow @LGBTEqCaucus for updates on our important work.,1105173562564988928,2019-03-11,18:28:05,repjimmypanetta,0,4,34,2019-03-11 18:28:05
"Staff mobile office hours Wednesday in Hollister: Congressional staff members can assist with issues concerning Social Security, Medicare, federal employee retirement, immigration services, veterans' services, passports, searching for military records & any other federal matters. pic.twitter.com/MblHR6jRuV",1105112526805745664,2019-03-11,14:25:33,repjimmypanetta,0,3,4,2019-03-11 14:25:33
On @KSCOPetRadio to talk #KITTENAct  http://www.zbsradio.com/show_detail/id/105 …,1104828623897444352,2019-03-10,19:37:25,repjimmypanetta,2,1,3,2019-03-10 19:37:25
"This #InternationalWomensDay we celebrate the contributions of women across the globe, and recommit ourselves to work together for equal pay and equal opportunity for all. pic.twitter.com/jh5kAsFjgd",1104141314222899206,2019-03-08,22:06:17,repjimmypanetta,2,3,18,2019-03-08 22:06:17
"We just passed #HR1 the #ForThePeopleAct. I spoke on the House floor this morning on the importance of this bill, that will help more Americans to exercise their right to vote. pic.twitter.com/Nkl5UicQ8T",1104065425925648384,2019-03-08,17:04:44,repjimmypanetta,6,4,39,2019-03-08 17:04:44
"Today, Congress will introduce legislation to reauthorize the Violence Against Women Act. I am a cosponsor of the bipartisan #VAWA that will provide essential resources & protections for survivors of domestic violence & sexual assault, and help advocates keep our communities safe",1103744191010623489,2019-03-07,19:48:16,repjimmypanetta,5,8,44,2019-03-07 19:48:16
"We must never forget the sacrifices made, what it took to get us here. We must keep pushing forward. Let's pass #HR4 the Voting Rights Advancement Act of 2019 & #HR1 the For the People Act to ensure that all Americans can fully participate in our political process #RestoreTheVote https://twitter.com/repjohnlewis/status/1103685536189988864 …",1103720325395742720,2019-03-07,18:13:26,repjimmypanetta,1,9,39,2019-03-07 18:13:26
"Today, @SenJeffMerkley and I are introducing the bipartisan, bicameral #KITTENAct to end the U.S. Department of Agriculture (USDA) practice of killing kittens after they’re used in agency testing. https://twitter.com/darehgregorian/status/1103654201639534593 …",1103660396626493440,2019-03-07,14:15:18,repjimmypanetta,98,172,472,2019-03-07 14:15:18
"Proud to welcome Monterey County Supervisors @MaryLAdams, Chris Lopez, & @SupervisorAlejo to my DC office. I appreciate our continued partnerships to improve our Central Coast communities-working to address issues from immigration reform to homelessness to an accurate #2020Census pic.twitter.com/JQxhWacEKf",1103077042055270402,2019-03-05,23:37:15,repjimmypanetta,4,3,19,2019-03-05 23:37:15
"Mobile office hours for veterans tomorrow: Staff members will be available in Downtown Santa Cruz on Wednesday, March 6 to assist veterans. Call 831-424-2229 to schedule an appointment. pic.twitter.com/P3X4gjIcUk",1102970023298170880,2019-03-05,16:32:00,repjimmypanetta,1,1,2,2019-03-05 16:32:00
"Mobile office hours for Veterans in Santa Cruz this week: Staff members will be available in Downtown Santa Cruz this Wednesday, March 6 to assist veterans. Call 831-424-2229 to schedule an appointment. pic.twitter.com/ZFZZ1JIYtI",1102350692319223810,2019-03-03,23:31:00,repjimmypanetta,1,2,9,2019-03-03 23:31:00
"Our community of Gilroy experienced a mass shooting on Sunday.
Our nation has repeatedly experienced the tragedy of gun violence.
We in the House have introduced&passed gun safety bills.
Now the Senate must join us&do their damn job-If not,we the people must hold them accountable",1156569225533829121,2019-07-31,14:16:06,repjimmypanetta,10,16,74,2019-07-31 14:16:06
"and my office will continue to work with all partners to provide support to those impacted by this tragedy. Tonight, we are a hurting, but we find strength and resolve in each other and our community. (2/2)",1155741336341008384,2019-07-29,07:26:21,repjimmypanetta,3,4,26,2019-07-29 07:26:21
"I join our community members in grieving & praying for the victims of the mass shooting at the Gilroy Garlic Festival. I am grateful for law enforcement's & first responder’s swift response, (1/2)",1155741334231244800,2019-07-29,07:26:21,repjimmypanetta,1,5,48,2019-07-29 07:26:21
I am aware of the shooting at the Gilroy Garlic Festival. The staging area for families and loved ones is at Gavilan College at parking lot B. Please follow @GilroyPD for more information. I will also post updates as I have them. https://twitter.com/GilroyPD/status/1155664763436724224 …,1155667360151494657,2019-07-29,02:32:24,repjimmypanetta,7,58,140,2019-07-29 02:32:24
"As members of Congress committed to an effective federal nutrition assistance program, we worked hard to pass a bipartisan #FarmBill that maintained states’ ability to opt into broad-based categorical eligibility.@USDA proposed rule would have harmful effects-it must be rescinded",1154798801955303426,2019-07-26,17:01:04,repjimmypanetta,3,16,39,2019-07-26 17:01:04
California has relied on categorical eligibility to eliminate the asset test for #CalFresh. This ensures low-income families with substantial housing and childcare costs are still able to put food on their tables.,1154798800957038593,2019-07-26,17:01:03,repjimmypanetta,6,17,46,2019-07-26 17:01:03
"The @USDA released a proposed rule to change the way states determine who qualifies for #SNAP, known as #CalFresh in CA. Today, I led my Democratic colleagues from the California Congressional Delegation in urging @SecretarySonny to rescind the proposal:  https://panetta.house.gov/media/press-releases/congressman-panetta-leads-democratic-california-delegation-urging-usda-rescind … pic.twitter.com/5uBoG9e6or",1154798798683672577,2019-07-26,17:01:03,repjimmypanetta,27,58,114,2019-07-26 17:01:03
"This morning, I joined join my Democratic and Republican colleagues & fellow veterans in hand-washing the Vietnam War Memorial. It was an honor to pay tribute to the men and women who served and paid the ultimate sacrifice. This is the least that we can do for all that they did. pic.twitter.com/bGieKWPv3R",1154791505468567552,2019-07-26,16:32:04,repjimmypanetta,13,30,158,2019-07-26 16:32:04
"Horse soring is cruel, painful and unnecessary. I am pleased that the House voted to end this harmful and dated practice with strong bipartisan support.",1154504820721475585,2019-07-25,21:32:53,repjimmypanetta,3,1,14,2019-07-25 21:32:53
"Happy #NationalInternDay to our interns in D.C., Salinas, and Santa Cruz! Thank you for your hard work and dedication to serving our neighbors on the Central Coast. pic.twitter.com/FM1SYdN746",1154496399947554816,2019-07-25,20:59:25,repjimmypanetta,2,3,10,2019-07-25 20:59:25
"Today, I introduced the #ClimateAction Rebate Act, along with Senator @ChrisCoons & @SenFeinstein, to combat climate change. This bill is a commonsense, market-based approach to reducing emissions, powering innovation, and creating jobs.   https://panetta.house.gov/media/press-releases/rep-panetta-sens-coons-and-feinstein-introduce-bill-price-carbon-pollution … pic.twitter.com/rnW3czv4WY",1154477747357413376,2019-07-25,19:45:18,repjimmypanetta,7,10,19,2019-07-25 19:45:18
"The Social Security 2100 Act, of which I am a cosponsor: -Increases benefits for all current and future Social Security recipients
-Cuts taxes for almost 12 million seniors
-Ensures the system remains solvent for the rest of the century

#Secure2100",1154461364221464576,2019-07-25,18:40:12,repjimmypanetta,0,2,10,2019-07-25 18:40:12
"For the 113,000 residents of #CA20 who receive benefits, Social Security is an essential component to any retirement plan. It allows them to retire with dignity, knowing they have contributed throughout their working years and can count on the benefits they've earned. pic.twitter.com/OLtkm5DSGo",1154461359503024131,2019-07-25,18:40:11,repjimmypanetta,1,2,8,2019-07-25 18:40:11
"During our @WaysMeansCmte hearing on Social Security today, I highlighted how the Social Security 2100 Act will provide a much-needed benefit increase while ensuring our nation’s most successful social insurance and anti-poverty program remains strong through this century. https://twitter.com/LatinxsRetire/status/1154444079549353984 …",1154461353844891649,2019-07-25,18:40:10,repjimmypanetta,1,1,9,2019-07-25 18:40:10
Older Americans should not live in fear that they could lose their hard-earned retirement savings. I am proud to have worked with the Ways and Means Committee to pass this bipartisan legislation to protect pensions. https://twitter.com/WaysMeansCmte/status/1154189858644156417 …,1154416502084423680,2019-07-25,15:41:56,repjimmypanetta,0,2,16,2019-07-25 15:41:56
"Passed: The House just passed the bipartisan #StopBadRobocalls Act. This comprehensive bill requires every call to be verified, allows the blocking of spam calls, and empowers @FCC to protect Americans from scammers. https://twitter.com/RepJimmyPanetta/status/1154063119246921728 …",1154129856197779457,2019-07-24,20:42:55,repjimmypanetta,10,2,22,2019-07-24 20:42:55
"I cosponsored bills to help prevent abusive practices by robocallers, better restrict unauthorized robocalls, and help us to again trust the number we see on our caller ID is actually the person calling. I'll be voting on one of these bills, the Stopping Bad Robocalls Act, today. https://twitter.com/MontereyHerald/status/1153784992184430594 …",1154063119246921728,2019-07-24,16:17:43,repjimmypanetta,5,2,19,2019-07-24 16:17:43
"Happening Soon: We on @HouseBudgetDems are holding a hearing on the impacts of #climatechange to coastal communities, agricultural economies, public health, and national security https://budget.house.gov/legislation/hearings/costs-climate-change-coasts-heartland-health-security …",1154024936559845377,2019-07-24,13:46:00,repjimmypanetta,1,3,6,2019-07-24 13:46:00
"The climate crisis is a threat to our public health, national security, economy, and future. Democrats are committed to putting our nation back on the path to smart economic and climate decisions and reversing the Administration’s dangerous neglect of the risks of climate change. pic.twitter.com/IuYas9wtTr",1154024433302081537,2019-07-24,13:44:00,repjimmypanetta,2,4,13,2019-07-24 13:44:00
Watch here for information regarding the changes and improvements the California Department of Forestry and Fire Protection is making to provide accurate and timely information. https://twitter.com/CAL_FIRE/status/1153801368974422026 …,1153804624425435142,2019-07-23,23:10:33,repjimmypanetta,0,2,3,2019-07-23 23:10:33
California has relied on broad-based categorical eligibility to ensure low-income families with substantial housing & childcare costs are still able to put food on their tables. Families should never have to decide between putting a roof over their heads & spending money on food.,1153759021268119552,2019-07-23,20:09:21,repjimmypanetta,2,4,22,2019-07-23 20:09:21
"Yet again, the Administration is attempting to sidestep Congress. Both Democrats and Republicans blocked this proposal in Congress last year. I am going to continue to fight to make sure SNAP provides critical nutrition assistance to those in need. https://twitter.com/NPR/status/1153712160645816323 …",1153759019766558720,2019-07-23,20:09:20,repjimmypanetta,1,9,32,2019-07-23 20:09:20
"From fighting to #ProtectTheDream and for the #EqualityAct to demanding #ClimateActionNow, the new new Democratic Majority in the House has been hard at work. #200DaysOfProgress. pic.twitter.com/nWkLykGXFm",1153423502629847042,2019-07-22,21:56:07,repjimmypanetta,7,6,9,2019-07-22 21:56:07
#Robocalls have become more than just a pain in the ear for many residents on the Central Coast; the calls are an invasion of our privacy. I cosponsored bills that take a variety of approaches to stop abusive robocall practices. https://panetta.house.gov/media/press-releases/congressman-panetta-cosponsors-legislation-combat-robocalls-and-scammers …,1153415711403982854,2019-07-22,21:25:09,repjimmypanetta,1,2,17,2019-07-22 21:25:09
"I am working to ensure health insurance benefits remain strong. This week, I voted to repeal the #CadillacTax - a tax on employer-sponsored healthcare plans that would ultimately fall on workers. I hope that the Senate takes this bill up immediately. pic.twitter.com/NyxVvw87qt",1152246090160381953,2019-07-19,15:57:30,repjimmypanetta,11,0,18,2019-07-19 15:57:30
I voted to pass the #RaiseTheWageAct to gradually raise the minimum wage to $15 by 2025. California already voted to raise the state minimum wage to $15. I am proud to have voted to raise it nationally to give millions of Americans a raise & lift 1.3 million people out of poverty https://twitter.com/nytimes/status/1151888135992860673 …,1151890890631389184,2019-07-18,16:26:04,repjimmypanetta,9,1,34,2019-07-18 16:26:04
"Happening now: At a House Agriculture Committee hearing on organics. As one of the top #organic agriculture producing districts in the country, I am working to make sure this growing industry is supported. 

 https://www.youtube.com/watch?v=KiWdM4YhkGo … https://twitter.com/HouseAgDems/status/1151487969825644544 …",1151516294442835968,2019-07-17,15:37:33,repjimmypanetta,7,4,14,2019-07-17 15:37:33
I introduced the Legal Services for Homeless Veterans Act.  This bipartisan legislation directs the Secretary of Veterans Affairs @DeptVetAffairs to provide grants to organizations that provide legal services to homeless #veterans and veterans at risk for homelessness. pic.twitter.com/vVJ8NMoJEv,1151501004539662337,2019-07-17,14:36:47,repjimmypanetta,2,5,20,2019-07-17 14:36:47
We know there are challenges with asylum seekers getting their cases heard in immigration court. That is why I introduced legislation to provide asylum seekers meaningful due process in the judicial system & provide immigration judges more discretion when considering their cases. https://twitter.com/scsentinel/status/1151279455165407233 …,1151500468469862400,2019-07-17,14:34:40,repjimmypanetta,11,5,21,2019-07-17 14:34:40
As a former prosecutor &board member for the Monterey Veterans Transition Center I encountered veterans who had certain legal issues that brought them to the brink or pushed them into homelessness.I introduced legislation to help them access legal services https://panetta.house.gov/media/press-releases/congressman-panetta-introduces-legislation-support-legal-services-homeless …,1151485526173786112,2019-07-17,13:35:17,repjimmypanetta,0,2,6,2019-07-17 13:35:17
"California already voted to raise the state minimum wage to $15 by 2023. 
This week, the House will vote on the #RaiseTheWage Act to raise it nationally by 2025. 
This will give more than 33 million Americans a raise and lift at least 1.3 million Americans out of poverty.",1151187044217081856,2019-07-16,17:49:14,repjimmypanetta,22,48,176,2019-07-16 17:49:14
We know there are challenges with asylum seekers getting their cases heard in immigration court. I introduced legislation to provide asylum seekers meaningful due process in the judicial system & immigration judges more discretion when considering cases https://panetta.house.gov/media/press-releases/congressman-panetta-introduces-legislation-provide-asylum-seekers-judicial …,1151147654044409857,2019-07-16,15:12:42,repjimmypanetta,3,2,9,2019-07-16 15:12:42
Seeking asylum is legal under both federal and international law. The Administration’s new rule requiring that asylum seekers’ claims be denied if they approach our border agents from Mexico is a violation of our asylum laws. https://www.washingtonpost.com/opinions/the-us-is-slamming-the-door-on-asylum-seekers/2019/07/15/98a2ed26-a746-11e9-86dd-d7f0e60391e9_story.html?utm_term=.45c94a038350 …,1151146292908843008,2019-07-16,15:07:18,repjimmypanetta,4,19,36,2019-07-16 15:07:18
"As reports came to light last week that ICE will target recently arrived families & children who legally sought asylum, I introduced legislation to provide asylum seekers meaningful due process and provide immigration judges more discretion.

 https://panetta.house.gov/media/press-releases/congressman-panetta-introduces-legislation-provide-asylum-seekers-judicial …",1151128712194273280,2019-07-16,13:57:26,repjimmypanetta,1,1,8,2019-07-16 13:57:26
"I cosponsored & hope my colleagues,Republican & Democrat,will join me today to vote for a resolution condemning racist tweets towards fellow Members of Congress by the President. That demagoguery is beneath not just those in leadership of America,but must be beneath all Americans https://twitter.com/AndrewDesiderio/status/1150915407412453379 …",1151117766197465091,2019-07-16,13:13:56,repjimmypanetta,15,7,45,2019-07-16 13:13:56
"The offensive comments made by the president about my colleagues are unacceptable and wrong.   As a Congress and as a people, we value our diversity and we must demand more from a president who swore an oath to protect and defend all Americans. https://twitter.com/realDonaldTrump/status/1150381394234941448 …",1150786715176579072,2019-07-15,15:18:28,repjimmypanetta,19,13,77,2019-07-15 15:18:28
"#KnowYourRights: No importa su estatus migratorio, usted tiene derechos legales. pic.twitter.com/M38QUIoyD5",1150435032009453569,2019-07-14,16:01:00,repjimmypanetta,4,10,24,2019-07-14 16:01:00
"#KnowYourRights: No importa su estatus migratorio, usted tiene derechos legales. pic.twitter.com/IOgRL3HxDk",1150162117229785088,2019-07-13,21:56:32,repjimmypanetta,5,10,29,2019-07-13 21:56:32
"Know Your Rights: No importa su estatus migratorio, usted tiene derechos legales. https://youtu.be/h6FkukpOZQs ",1150161228955885569,2019-07-13,21:53:00,repjimmypanetta,3,2,6,2019-07-13 21:53:00
"Just voted for the #FY20NDAA. I am proud to have successfully incorporated numerous provisions to the #NDAA that strengthen programs & priorities for Central Coast defense installations & entities, address military housing issues, and keep the US in #NATO https://panetta.house.gov/media/press-releases/congressman-panetta-secures-central-coast-priorities-defense-authorization-bill …",1149799487604482048,2019-07-12,21:55:34,repjimmypanetta,1,2,12,2019-07-12 21:55:34
"Today, we are advancing the #ButchLewisAct – critical legislation that would shore up multiemployer pension plans & guarantee retirees the full benefits they have earned. Americans who worked hard & saved should not have the rug pulled out from under them. #RT if you agree. pic.twitter.com/QYXO0qVAl3",1148949682921660416,2019-07-10,13:38:45,repjimmypanetta,2,11,19,2019-07-10 13:38:45
"I introduced the Keep Families Together Act. While conducting oversight of the asylum process in El Paso & San Diego last month, I saw the humanitarian crisis & overcrowding of the facilities, & voted for a bill that provides food,shelter, clothing, medical care &legal assistance",1148586857153925120,2019-07-09,13:37:01,repjimmypanetta,0,0,1,2019-07-09 13:37:01
"So proud that the U.S. Women’s Soccer Team represents what we stand for in the U.S.:  Stepping up, speaking out, and kicking butt! https://www.wsj.com/articles/rapinoes-confident-pose-captures-u-s-womens-team-11562539201?mod=mhp …",1148261751256965122,2019-07-08,16:05:09,repjimmypanetta,4,4,48,2019-07-08 16:05:09
We must continue to get past the politics of immigration based solely on emotion and continue to work on an immigration policy that also is based on the evidence. https://twitter.com/PostOpinions/status/1147882935900692481 …,1148258398930124801,2019-07-08,15:51:50,repjimmypanetta,6,5,11,2019-07-08 15:51:50
"Grant Announcement: @ucsc earned a grant totaling $687,972 from the @NSF to train two graduate students in observational and theoretical astrophysics, focusing on the new field of multi-messenger, gravitational wave astronomy.  https://www.nsf.gov/awardsearch/showAward?AWD_ID=1911206 …",1148257539966013441,2019-07-08,15:48:25,repjimmypanetta,1,1,7,2019-07-08 15:48:25
We must establish a national strategy that improves local recycling programs & fosters a robust market that benefits from our recycled materials. https://twitter.com/PostOpinions/status/1147667935013548032 …,1148253677414703104,2019-07-08,15:33:04,repjimmypanetta,3,9,26,2019-07-08 15:33:04
Follow for updates: https://twitter.com/Cal_OES/status/1147352055759032321 …,1147356330157641728,2019-07-06,04:07:20,repjimmypanetta,0,6,13,2019-07-06 04:07:20
"""Of all the things the federal government does, the census must be a nonpartisan exercise with these overriding goals in mind: figuring out how many people are in the country and where they are."" https://twitter.com/washingtonpost/status/1146984854652882944 …",1147155436107378688,2019-07-05,14:49:03,repjimmypanetta,3,3,20,2019-07-05 14:49:03
I would like to wish everyone on the central coast of California a happy and safe Independence Day. Let us remember what it takes to live in our democracy and recommit to our obligations to participate and engage in our nation of We the People. pic.twitter.com/DV32pJHwNB,1146754530240892928,2019-07-04,12:16:00,repjimmypanetta,4,2,41,2019-07-04 12:16:00
"Did you know you can purchase a flag that was flown over the United States Capitol Building? After each flag is flown, it is issued a keepsake Certificate of Authenticity by the Architect of the Capitol. To request a flag, please click here: https://panetta.house.gov/services/flags ",1146583905463496704,2019-07-04,00:58:00,repjimmypanetta,3,2,12,2019-07-04 00:58:00
Just sent out my July newsletter. Read here about the work that I am doing to serve our communities on the Central Coast #CA20 https://panetta.house.gov/media/newsletters …,1146509125066604544,2019-07-03,20:00:51,repjimmypanetta,1,0,6,2019-07-03 20:00:51
"These fees are meant to improve our national parks, keep them safe and protected for Americans to enjoy, and shouldn’t be used for political purposes. https://www.washingtonpost.com/politics/white-house-gives-tickets-to-trumps-july-fourth-extravaganza-to-gop-donors/2019/07/02/9109a566-9ce0-11e9-b27f-ed2942f73d70_story.html?fbclid=IwAR3TVy1QhYH_OJMrtZazjg7mdub97z2iqMiGo0PC2qKUvubWZDbyj2eKVok&utm_term=.d48292656f19 …",1146466795160776707,2019-07-03,17:12:38,repjimmypanetta,2,7,29,2019-07-03 17:12:38
"We must continue to provide aid to protect families and asylum seekers, address the root causes of this crisis, and keep those forced to flee here safe.",1146233924051460097,2019-07-03,01:47:18,repjimmypanetta,12,0,21,2019-07-03 01:47:18
The IG released photos of migrants crammed into overcrowded border detention facilities in TX. They are images of some of the deplorable conditions of the humanitarian crisis at the border. https://twitter.com/GadiNBC/status/1146111881565933569 …,1146233921853677569,2019-07-03,01:47:17,repjimmypanetta,3,6,14,2019-07-03 01:47:17
"We must continue to provide aid to protect families & asylum seekers, address the root causes of this crisis, and keep those forced to flee here safe.",1146219765993738241,2019-07-03,00:51:02,repjimmypanetta,1,0,7,2019-07-03 00:51:02
No #citizenshipquestion will be on the #2020Census! Excellent news for our community and our country. https://twitter.com/nytimes/status/1146162641007710210 …,1146219115696336896,2019-07-03,00:48:27,repjimmypanetta,1,2,31,2019-07-03 00:48:27
Our immigration system and its employees must reflect our everlasting values as a nation of immigrants.  This reported behavior is inconsistent with who we are and those responsible must be held accountable. https://www.nytimes.com/2019/07/01/opinion/border-immigration.html?action=click&module=Opinion&pgtype=Homepage …,1146120898384224259,2019-07-02,18:18:10,repjimmypanetta,7,2,23,2019-07-02 18:18:10
"Grant Announcement: Monterey County Office of Education received a grant totaling $8,845,123 from the @HHSGov for Head Start Projects. Head Start promotes school readiness of children under 5 from low-income families through education, health, social and other services.",1146097320045547522,2019-07-02,16:44:29,repjimmypanetta,2,6,32,2019-07-02 16:44:29
