tweet,id,date,time,username,replies_count,retweets_count,likes_count,tdatetime
My thoughts & prayers are with the families & friends of the Americans killed in Kenya this week. AFRICOM works with our partners to protect U.S. interests and keep us safe. We must continue to support their service & hold those responsible for the attacks https://www.washingtonpost.com/world/africa/al-shabab-attacks-joint-us-kenyan-base-but-assault-repulsed-with-four-militants-killed/2020/01/05/6208f5a2-2f82-11ea-9b60-817cc18cf173_story.html …,1215455215966539776,2020-01-10,02:08:00,repjimmypanetta,0,3,7,2020-01-10 02:08:00
"I just voted in support of a War Powers Resolution limiting the President’s military action against Iran. 

Congress must assert its constitutional responsibility and not allow our nation to get into another war in the Middle East. https://panetta.house.gov/media/press-releases/congressman-panetta-supports-war-powers-resolution-limiting-president-s …",1215424413765722113,2020-01-10,00:05:36,repjimmypanetta,7,4,51,2020-01-10 00:05:36
"Today, we will vote on the War Power Resolution, which I cosponsored, to limit the President's military actions regarding Iran. https://twitter.com/RepSlotkin/status/1215328133588668417 …",1215392770506002432,2020-01-09,21:59:52,repjimmypanetta,0,4,9,2020-01-09 21:59:52
"One year ago today, @HouseDemocrats introduced H.R. 8, the Bipartisan Background Checks Act. 

Today, that bill still sits on Mitch McConnell’s desk.  RT if you agree he should allow a vote on this legislation.",1214992555462582272,2020-01-08,19:29:33,repjimmypanetta,3,22,25,2020-01-08 19:29:33
My thoughts are with the people of Puerto Rico who have been devastated by the earthquakes that struck over the past several days. We must ensure that our fellow Americans receive the necessary resources for their recovery. https://twitter.com/Reuters/status/1214674541307404288 …,1214675896596156418,2020-01-07,22:31:15,repjimmypanetta,1,3,12,2020-01-07 22:31:15
"My bill, the Full Military Honors Act, was included in the #NDAA & signed into law. Now, Medal of Honor and Prisoners Of War heroes will be afforded full military honors when laid to rest at @ArlingtonNatl. I appreciated working with Pfc. Fletcher's family to make this a reality. https://twitter.com/freep/status/1214561103205687298 …",1214589087883177985,2020-01-07,16:46:19,repjimmypanetta,1,3,7,2020-01-07 16:46:19
"Together, we got a lot done for the Central Coast in 2019. Read about some of the highlights in my newsletter  https://bit.ly/2uq9767 

In 2020, I look forward to continuing to fight for you & our values, and promote & protect the people of the place that I have always called home",1214254517572849664,2020-01-06,18:36:51,repjimmypanetta,3,3,11,2020-01-06 18:36:51
"We are better off without Soleimani walking the earth and devising violent attacks in Middle East. However, this targeted killing, without Congressional authorization or a cohesive Iran strategy, will lead to an escalated conflict that could make us and our allies less safe.",1213138686025621504,2020-01-03,16:42:56,repjimmypanetta,22,11,47,2020-01-03 16:42:56
Wishing everyone on the Central Coast a happy New Year. Looking forward to continuing to fight for our Central Coast values and working together to move our country forward in 2020. pic.twitter.com/DQPOixgDP3,1212272997547028480,2020-01-01,07:23:00,repjimmypanetta,3,6,36,2020-01-01 07:23:00
"We continue to fight back! I am introducing my U-Visa bill to prevent deportation of undocumented victims & witnesses who step out of the shadows & forward to play a role in our justice system. Instead of punishing, we must promote & protect those who participate in our democracy https://twitter.com/thehill/status/1167511320519950339 …",1167925451731300360,2019-08-31,22:21:41,repjimmypanetta,5,2,22,2019-08-31 22:21:41
"Veterans: Congressional Staff will be holding office hours in Santa Cruz next Wednesday, September 4.

They will be available to assist with issues concerning veterans' services, searching for military records, and any other federal matters. https://panetta.house.gov/services/mobile-office-hours?fbclid=IwAR2k3OrHOKQKzJk8Qo8LSKmpKjtkPj3F5VVBNjp4UQawc90OS-z-KvRtEgE …",1167916722810232832,2019-08-31,21:47:00,repjimmypanetta,0,1,3,2019-08-31 21:47:00
"Veterans: Congressional Staff will be holding office hours in Santa Cruz next Wednesday, September 4.

They will be available to assist with issues concerning veterans' services, searching for military records, and any other federal matters.
 https://panetta.house.gov/services/mobile-office-hours?fbclid=IwAR2k3OrHOKQKzJk8Qo8LSKmpKjtkPj3F5VVBNjp4UQawc90OS-z-KvRtEgE …",1167549340744847361,2019-08-30,21:27:09,repjimmypanetta,2,1,5,2019-08-30 21:27:09
I cosponsored this important bill to keep our farmworkers safe. https://twitter.com/RepJudyChu/status/1167175625360203778 …,1167511733981851648,2019-08-30,18:57:43,repjimmypanetta,2,5,20,2019-08-30 18:57:43
"I recently had the opportunity to help install solar panels on homes in Chualar. I met with job trainees and volunteers, along with Central Coast homeowners, to discuss investments in clean energy technology and my work in Congress to combat #climatechange. #JimmyontheJob pic.twitter.com/ulwa74tPSf",1167101458900238336,2019-08-29,15:47:26,repjimmypanetta,6,5,44,2019-08-29 15:47:26
"Grant announcement: @NSF awarded $956,796 to @ucsc to fund two-year scholarships for students pursuing the established ""4+1"" pathway, which leads to a Bachelor of Science degree & a Master of Science degree in Scientific Computing & Applied Mathematics.",1166782532857344001,2019-08-28,18:40:08,repjimmypanetta,1,1,18,2019-08-28 18:40:08
"I join the @VetAffairsDems in calling for a stand-down to address veterans suicide. 

If you or a veteran you know is in crisis, you can call the Veterans Crisis Line at 1-800-273-8255 and press 1, or text 838-255. https://twitter.com/RepMarkTakano/status/1166410989782351872 …",1166415967699787777,2019-08-27,18:23:32,repjimmypanetta,4,3,15,2019-08-27 18:23:32
"On #WomensEqualityDay, we commemorate the 99th anniversary of the adoption of the 19th Amendment, giving women the right to vote and fully participate in our democracy. We honor the suffragists by continuing to fight for access to the ballot box and for #equalityforall.",1166048051636658176,2019-08-26,18:01:34,repjimmypanetta,3,5,23,2019-08-26 18:01:34
Any suggestion that an ethnic or religious group owes an obligation to support a certain political party or ideology is antithetical to the core values of our country. Charges of disloyalty have long been used to attack Jews. Promoting this ugly and antisemitic trope is wrong.,1164267426101506048,2019-08-21,20:06:00,repjimmypanetta,14,5,51,2019-08-21 20:06:00
The gag rule on Title X by the administration has cut millions of dollars used by regional health care clinics to provide affordable care. The Senate must act on House-passed legislation to protect critical resources that underserved communities depend on. https://www.latimes.com/opinion/story/2019-08-19/title-x-gag-rule-miserable-long-wait-clinic-health-care …,1164177966601035778,2019-08-21,14:10:31,repjimmypanetta,3,2,9,2019-08-21 14:10:31
"Mobile Office Hours Tomorrow in Watsonville:
Congressional staff will be available to assist with issues concerning Social Security, Medicare, immigration services, veterans' services, passports, searching for military records, and other federal matters.
 https://panetta.house.gov/services/mobile-office-hours …",1163847157440495616,2019-08-20,16:16:00,repjimmypanetta,2,2,3,2019-08-20 16:16:00
"On Wednesday, August 21st, I will be holding a Town Hall in Watsonville. Please see the following link for more information:  https://panetta.house.gov/town-hall-watsonville … pic.twitter.com/4XGO3RWouB",1163490385634766849,2019-08-19,16:38:19,repjimmypanetta,0,0,3,2019-08-19 16:38:19
"Mobile Office Hours This Week in Watsonville:
Congressional staff will be available to assist with issues concerning Social Security, Medicare, immigration services, veterans' services, passports, searching for military records, and other federal matters.
 https://panetta.house.gov/services/mobile-office-hours …",1163484518239498240,2019-08-19,16:15:00,repjimmypanetta,0,1,0,2019-08-19 16:15:00
"On Tuesday, August 20th, I will be holding a Town Hall in Monterey. Please see the following link for more information:  https://panetta.house.gov/town-hall-monterey … pic.twitter.com/9svQvOh2EC",1162433742708891649,2019-08-16,18:39:35,repjimmypanetta,3,4,5,2019-08-16 18:39:35
"On Tuesday, August 20th, I will be holding a Town Hall in Marina. Please see the following link for more information:  https://panetta.house.gov/town-hall-marina … pic.twitter.com/D6A9yaq9ng",1162433537393475584,2019-08-16,18:38:46,repjimmypanetta,1,1,3,2019-08-16 18:38:46
The decision to deny Members of Congress entry to Israel is shortsighted and wrong. The enduring U.S.-Israeli alliance is enhanced when Members gain a stronger understanding of the challenges and threats facing Israel. I hope the Prime Minister will reconsider.,1162062502416588811,2019-08-15,18:04:25,repjimmypanetta,13,8,43,2019-08-15 18:04:25
"84 years ago today, FDR signed the landmark Social Security Act into law. We reaffirm our lasting commitment to safeguarding the promise of #SocialSecurity for generations to come.  #SocSec84",1161704351511076864,2019-08-14,18:21:15,repjimmypanetta,9,9,39,2019-08-14 18:21:15
"Mobile Office Hours Tomorrow in King City:
Congressional staff will be available to assist with issues concerning Social Security, Medicare, immigration services, veterans' services, passports, searching for military records, and other federal matters.
 https://panetta.house.gov/services/mobile-office-hours …",1161673082165256192,2019-08-14,16:17:00,repjimmypanetta,0,0,2,2019-08-14 16:17:00
"Despite what this administration is trying to do to immigration policy in our nation, they cannot change the history of our nation and that is why we will continue to fight for the future of our nation. 
 https://en.wikipedia.org/wiki/The_New_Colossus …",1161664327025401856,2019-08-14,15:42:12,repjimmypanetta,3,1,19,2019-08-14 15:42:12
"We must prioritize preventing nuclear &radiological threats from nation states &terrorist organizations. I introduced the Nuclear Security & Nonproliferation Accounting Act so our government is more focused, agile&creative in confronting nat sec challenges https://www.defenseone.com/ideas/2019/08/our-efforts-prevent-nuclear-terror-are-shrinking-threat-not/159110/?oref=d-river …",1161385030150737921,2019-08-13,21:12:23,repjimmypanetta,0,3,9,2019-08-13 21:12:23
"Earlier this year, we were warned that #climatechange could negatively impact over 1million species. Now, the Administration has decided to ignore that warning & the effects of climate change when applying the ESA. Once again, they're putting self-interests over our environment. https://twitter.com/nytimes/status/1160931874245623809 …",1161337019236257794,2019-08-13,18:01:36,repjimmypanetta,0,7,16,2019-08-13 18:01:36
"Mobile Office Hours Tomorrow in Hollister:
Congressional staff will be available to assist with issues concerning Social Security, Medicare, immigration services, veterans' services, passports, searching for military records, and other federal matters. https://panetta.house.gov/services/mobile-office-hours …",1161310694081363974,2019-08-13,16:17:00,repjimmypanetta,0,0,4,2019-08-13 16:17:00
"Last year, Congress authorized the @CDCgov to study gun violence.  This year, the House voted to fund it for $50 million.  Frustratingly, it looks like the Senate will try to kill that funding.  Just another example of Senate inaction on commonsense gun safety reform.",1161300239741067271,2019-08-13,15:35:27,repjimmypanetta,2,1,18,2019-08-13 15:35:27
"A majority of Americans support background checks for all gun sales. The House has acted by passing #HR8, the Bipartisan Background Checks Act. It’s time for the Senate to take action and #DoSomething to #EndGunViolence.",1161299926296473600,2019-08-13,15:34:12,repjimmypanetta,1,7,48,2019-08-13 15:34:12
"The Administration's new rule forces LEGAL immigrants to choose between the health of their children & family or the pursuit of the American Dream. It goes against what we stand for, not just as a community here on the Central Coast, but also what we stand for as a country. https://twitter.com/nytimes/status/1160916853759324160 …",1160975975276044288,2019-08-12,18:06:57,repjimmypanetta,5,8,22,2019-08-12 18:06:57
"Mobile Office Hours This Week in King City:
Congressional staff will be available to assist with issues concerning Social Security, Medicare, immigration services, veterans' services, passports, searching for military records, and other federal matters.
 https://panetta.house.gov/services/mobile-office-hours …",1160948306454990850,2019-08-12,16:17:00,repjimmypanetta,0,0,0,2019-08-12 16:17:00
"Mobile Office Hours This Week in Hollister:
Congressional staff will be available to assist with issues concerning Social Security, Medicare, immigration services, veterans' services, passports, searching for military records, and other federal matters.
 https://panetta.house.gov/services/mobile-office-hours …",1160948054607843328,2019-08-12,16:16:00,repjimmypanetta,0,0,0,2019-08-12 16:16:00
"Gilroy, El Paso, Dayton & the 250 mass shootings this year demonstrate that our nation is afflicted by a gun violence crisis. It is critical that Congress, our country & our communities deliver not only words, but also action on gun safety reform. My op-ed in Sunday's @scsentinel https://twitter.com/scsentinel/status/1160521806832459776 …",1160915191191810049,2019-08-12,14:05:24,repjimmypanetta,6,4,19,2019-08-12 14:05:24
Eid Mubarak to all those celebrating on the central coast of California and around the world.,1160901469865988097,2019-08-12,13:10:53,repjimmypanetta,1,1,13,2019-08-12 13:10:53
"Mobile Office Hours Next Week in Hollister & King City:
Congressional staff will be available to assist with issues concerning Social Security, Medicare, immigration services, veterans' services, passports, searching for military records, and more.
 https://panetta.house.gov/services/mobile-office-hours …",1159861394398859266,2019-08-09,16:18:00,repjimmypanetta,0,1,2,2019-08-09 16:18:00
"Great to see @HartnellCollege meeting specific needs of our local students. Having met with students & administrators at our Hispanic Serving Institutions, I understand that in addition to tuition assistance, mentorship, leadership,& technology programs are key to student success https://twitter.com/ksbw/status/1159828479967485952 …",1159854675727912962,2019-08-09,15:51:18,repjimmypanetta,1,2,27,2019-08-09 15:51:18
"Mobile Office Hours Next Week in Hollister & King City:
Congressional staff will be available to assist with issues concerning Social Security, Medicare, immigration services, veterans' services, passports, searching for military records, and more.
 https://panetta.house.gov/services/mobile-office-hours …",1159499006415785985,2019-08-08,16:18:00,repjimmypanetta,0,0,6,2019-08-08 16:18:00
"It has been 162 days since the House passed two bipartisan #backgroundchecks bills, but Leader Mitch McConnell has not held a vote on either bill. He must call the Senate back to Washington immediately and pass these pieces of legislation to help prevent gun violence. pic.twitter.com/OuFG3qNNrA",1159491934500589568,2019-08-08,15:49:54,repjimmypanetta,3,9,39,2019-08-08 15:49:54
"161 days ago, we in the House passed #HR8 & #HR1112, two bipartisan #backgroundchecks bills to help prevent gun violence and save lives. 
I joined 213 of my colleagues to demand Leader McConnell immediately call the Senate back to DC & pass these bills: https://panetta.house.gov/media/press-releases/congressman-panetta-213-democratic-members-urge-mcconnell-hold-vote-bipartisan …",1159188993260630017,2019-08-07,19:46:07,repjimmypanetta,4,7,34,2019-08-07 19:46:07
"Veterans: My office is holding Mobile Office Hours in Santa Cruz tomorrow, August 7, 10:00am–12:00pm.  Congressional staff will be available to assist with issues concerning veterans' services, searching for military records, and any other federal matters.
 https://panetta.house.gov/services/mobile-office-hours …",1158760754583093248,2019-08-06,15:24:27,repjimmypanetta,0,0,5,2019-08-06 15:24:27
"Anne - I cosponsored the assault weapons ban. Having served our country in a war zone, I know the lethality of rapid-fire, military style weapons. Reinstating the prohibition on assault-type firearms & high-capacity mags will reduce access & hopefully curb mass casualty shootings",1158740757865533440,2019-08-06,14:04:59,repjimmypanetta,1,0,1,2019-08-06 14:04:59
"Gilroy, El Paso, Dayton this week alone. Our country is long past a turning point to do something on gun violence. The Senate must vote on background checks. The President must actively & openly be against domestic terrorism, and we must see & report it before it happens",1158139296206995459,2019-08-04,22:15:00,repjimmypanetta,20,11,63,2019-08-04 22:15:00
Resources for our community after the #GilroyShooting: https://twitter.com/RepZoeLofgren/status/1156979731163750401 …,1156986852534099968,2019-08-01,17:55:36,repjimmypanetta,0,3,7,2019-08-01 17:55:36
"Grateful for all of their work.
My office continues to monitor the #MillFire https://twitter.com/Gillis57/status/1156844301814362113 …",1156971106424803329,2019-08-01,16:53:01,repjimmypanetta,1,1,9,2019-08-01 16:53:01
My committee.  My chairman.  Our obligation to investigate. https://twitter.com/PostOpinions/status/1156684494298124288 …,1156968941870288897,2019-08-01,16:44:25,repjimmypanetta,12,6,40,2019-08-01 16:44:25
I look forward to voting on this important legislation on the House floor.,1190022996238520321,2019-10-31,21:49:26,repjimmypanetta,1,0,1,2019-10-31 21:49:26
"The #CollegeAffordabilityAct will also
🎓Lower the cost of college for students and families
🎓Boost funding to increase graduation rates for community colleges
🎓Create an Office of Accessibility at each institution to support students with disabilities",1190022995412160517,2019-10-31,21:49:26,repjimmypanetta,3,0,4,2019-10-31 21:49:26
"I applaud the @EdLaborCmte passage of the #CollegeAffordabilityAct. I am proud that the bill includes portions of my bill to improve the Public Service Loan Forgiveness program, H.R. 4391. These critical improvements will simplify and modernize the program for student borrowers.",1190022994682372096,2019-10-31,21:49:26,repjimmypanetta,3,0,6,2019-10-31 21:49:26
"As co-chair of the Agriculture Research Caucus & member of the Agriculture Biotechnology, Horticulture, & Research Subcommittee, I will continue to work to ensure producers on the Central Coast, and across the country, have access to cutting-edge agriculture research & resources",1190020409527287821,2019-10-31,21:39:09,repjimmypanetta,1,0,5,2019-10-31 21:39:09
"Disappointed that USDA has continued to barrel forward with its proposal to relocate two USDA research agencies from D.C. to Kansas City, despite the serious concerns voiced by members of Congress, the agriculture research community, producers, & the employees themselves. https://twitter.com/McClatchyDC/status/1189925234188656640 …",1190020408562597902,2019-10-31,21:39:09,repjimmypanetta,3,6,18,2019-10-31 21:39:09
"With this resolution, the House of Representatives continues to live up to its responsibilities under the constitution. I voted for it to provide a clear path forward in the public-facing phase of the ongoing impeachment inquiry. My full statement:  https://panetta.house.gov/media/press-releases/congressman-panetta-bipartisan-house-members-introduce-farm-workforce … https://twitter.com/NPR/status/1189928198101970944 …",1189935985842380800,2019-10-31,16:03:41,repjimmypanetta,16,14,47,2019-10-31 16:03:41
"The Grand Canyon is one of the most special places on Earth. I voted for the Grand Canyon Centennial Protection Act to protect one of our most iconic & treasured #PublicLands from mining.

#KeepItGrand pic.twitter.com/0TVmdVDgGU",1189684719987970049,2019-10-30,23:25:15,repjimmypanetta,0,5,27,2019-10-30 23:25:15
"I am co-introducing the Farm Workforce Modernization Act today. My colleagues and I worked in a bipartisan fashion, and with labor and agriculture stakeholders, on this sustainable solution that will modernize our immigration system and protect our community’s current farmworkers https://twitter.com/sfchronicle/status/1189525298242564096 …",1189538054215815169,2019-10-30,13:42:27,repjimmypanetta,13,33,114,2019-10-30 13:42:27
"PG&E está apagando la electricidad en más comunidades a través de California. Se espera que el corte de energía afecte a los condados de Santa Cruz y Santa Clara esta noche, empezando a las once de la noche.  https://www.pgecurrents.com/2019/10/28/pge-restores-57-of-customers-impacted-by-historic-wind-event-and-public-safety-power-shutoff-while-preparing-for-next-offshore-wind-event/?fbclid=IwAR21aBubOU909rY1Re9qLyUVS8994_w-NGgqoObEuCen6FHEba6qgCjc6sg …",1189287904595582977,2019-10-29,21:08:27,repjimmypanetta,0,0,0,2019-10-29 21:08:27
Wishing a happy #Diwali to all those who are celebrating on the Central Coast. pic.twitter.com/4FQIDWnoWV,1188529579679465476,2019-10-27,18:55:08,repjimmypanetta,3,0,1,2019-10-27 18:55:08
Smoke over the Monterey Bay Area this morning is from the massive Kincaid Fire up in Sonoma County. Updates here:  http://air.mbard.org/ ,1188528398454415361,2019-10-27,18:50:26,repjimmypanetta,1,3,6,2019-10-27 18:50:26
"PG&E reporting potential Public Safety Power Shutoff (PSPS) beginning as early as tomorrow evening. This includes our counties on the Central Coast. For immediate updates, follow @PGE4Me https://twitter.com/PGE4Me/status/1187850563330940928 …",1187919964642119680,2019-10-26,02:32:44,repjimmypanetta,2,2,1,2019-10-26 02:32:44
"Foreign adversaries attacked our elections in 2016 & are setting their sights on 2020. This week,the House passed the #SHIELDAct to safeguard our democratic process from foreign intervention & hold individuals engaged in attacking our elections accountable https://sanbenitolive.com/panetta-supports-bill-to-combat-foreign-interference-in-elections/ …",1187744219030544386,2019-10-25,14:54:23,repjimmypanetta,5,0,9,2019-10-25 14:54:23
"Animal cruelty has no place in our society. This week the House passed the bipartisan Preventing Animal Cruelty and Torture Act, common-sense policy that provides law enforcement additional authorities to combat animal cruelty and criminalize animal abuse. https://panetta.house.gov/media/press-releases/congressman-panetta-supports-house-passed-bill-make-animal-abuse-federal …",1187733802677755904,2019-10-25,14:13:00,repjimmypanetta,1,0,5,2019-10-25 14:13:00
"The process of the closed door hearings for the inquiry includes three committees with over 40 Republicans.  In fact, a quarter of the members who stormed the secured room are on the committees can be in the hearings.  It was not just a breach of security, but a political stunt. https://twitter.com/washingtonpost/status/1187354937719738368 …",1187464872067555329,2019-10-24,20:24:22,repjimmypanetta,10,4,38,2019-10-24 20:24:22
"Recent reports paint a grim picture of a growing number of young adults #vaping and the negative health consequences.  We must address this public health issue now rather than waiting years to do so, as was done with cigarettes. pic.twitter.com/ZbPKlXhYbm",1187425269734203397,2019-10-24,17:47:00,repjimmypanetta,3,1,1,2019-10-24 17:47:00
"Congressman Elijah Cummings was a tireless public servant, devoted to his community and committed to making our government work better for all. It was a great honor to have served alongside him in Congress and I will truly miss him. https://twitter.com/cspan/status/1187389288968871941 …",1187389720172605442,2019-10-24,15:25:44,repjimmypanetta,0,2,22,2019-10-24 15:25:44
"According to the @CDCgov, more than 3.5 million middle and high schoolers used vapes in 2018. This is a serious problem that’s having real consequences on kids’ health. Today, we on the @WaysMeansCmte are taking action. pic.twitter.com/2DoJFEtRAU",1187068800895717376,2019-10-23,18:10:31,repjimmypanetta,6,2,7,2019-10-23 18:10:31
Hi Kate- this is a targeted grant for reimbursement of the work on the lower road. My office is working with the County and FEMA on the upper portion of the road.,1187063219929714690,2019-10-23,17:48:20,repjimmypanetta,1,0,1,2019-10-23 17:48:20
"As I work in Congress to stop this attack, I encourage our neighbors to respond directly to the administration through the ""public comment period"". Between now and December 2, you can share your opinion here:  https://www.regulations.gov/document?D=FNS-2019-0009-0001 … https://twitter.com/RepJimmyPanetta/status/1187055358210166784 …",1187055581795889153,2019-10-23,17:17:59,repjimmypanetta,0,3,9,2019-10-23 17:17:59
Low income Californians rely on CalFresh. But the administration recently released a proposal that will limit California's authority to administer this critical program that prevents hunger in our communities.I led my California colleagues in calling on the administration to stop pic.twitter.com/OeACpHDCfm,1187055358210166784,2019-10-23,17:17:06,repjimmypanetta,0,9,21,2019-10-23 17:17:06
"Grant announcement: Over $1million FEMA grant for storm repairs to Palo Colorado Road in Monterey County. I am proud to have helped secure these funds, and will continue to fight for investments in resilient infrastructure to protect against future storms. https://panetta.house.gov/media/press-releases/congressman-panetta-announces-1-million-grant-monterey-county-storm-repairs …",1187004835683590144,2019-10-23,13:56:20,repjimmypanetta,9,0,27,2019-10-23 13:56:20
