tweet,id,date,time,username,replies_count,retweets_count,likes_count
"Happy birthday, California! Our great Golden State was admitted to the Union on this day in 1850. As a native Californian, it's an honor to bring California's fearless and dynamic spirit to Capitol Hill as we work to strengthen our state and nation. #CaliforniaAdmissionDay",1171166374481334272,2019-09-09,20:59:57,reproybalallard,1,10,19
"I was also surprised and humbled to receive an award from SCRS-IL in recognition of our work together over the years, including my success in securing a congressional appropriations earmark that it used for its computer lab. pic.twitter.com/PA1y8AJQix",1170847154476408834,2019-09-08,23:51:29,reproybalallard,0,0,2
It was a joy to be at SCRS-IL's 40th anniversary dinner in #Downey to salute its tireless support and advocacy for local residents with #disabilities! I presented the organization with a Certificate of Congressional Recognition to commemorate its 40-year history. pic.twitter.com/BGXl2Vtgkc,1170847147610333190,2019-09-08,23:51:27,reproybalallard,1,2,8
"To our high schoolers: As you turn 18, remember that adulthood offers new freedoms AND new responsibilities. All men over 18 must register for the #SelectiveService, and all U.S. citizens can #RegisterToVote. By getting civically engaged, you can help shape America’s future!",1170749701962063873,2019-09-08,17:24:15,reproybalallard,1,2,4
"In addition, my website’s student resource guide ( http://roybal-allard.house.gov/studentguide ) offers an annually updated list of #scholarships, #internships, #fellowships, and websites to help you pay for #college. Watch for the release of the guide’s new edition in the coming weeks!",1170749700917645312,2019-09-08,17:24:14,reproybalallard,2,1,2
"I’m fighting in Congress to help #CA40 kids get the great #education they need to excel in our economy – that’s why I helped lead the successful effort to restore year-round #PellGrant funding, which helps grant recipients finish their degrees faster and at a lower cost.",1170749700032598019,2019-09-08,17:24:14,reproybalallard,1,0,0
"Great turnout for the Commerce to College Fair! Local students and parents came by to explore #HigherEducation opportunities, and attend workshops on the #CollegeApplication and #FinancialAid process. Thanks to all who helped organize this important event. pic.twitter.com/CRv7nAUqQo",1170749697633456129,2019-09-08,17:24:14,reproybalallard,1,1,10
"Honored to present Cathy Riboli, daughter of the San Antonio Winery’s late patriarch Stefano Riboli, with a copy of my statement in the Congressional Record saluting Mr. Riboli’s life and career. You can read my statement here:  https://bit.ly/2m5iKDb . pic.twitter.com/muBAfELsII",1170091191062474752,2019-09-06,21:47:33,reproybalallard,1,1,7
"It is outrageous & immoral that the administration is not providing young menstruating immigrant girls enough feminine care products. That's not just unhygienic, it's blatantly cruel. Our govt must protect the humanity & dignity of EVERY detained migrant. https://msmagazine.com/2019/09/05/fighting-the-degrading-and-dangerous-treatment-of-menstruating-migrant-girls …",1170060472462336006,2019-09-06,19:45:29,reproybalallard,3,9,23
How dare the president take money away from the care and education of children of servicemembers so he can build his costly and ineffective vanity wall? Our kids' well-being must be a national priority. Trump shouldn’t be fulfilling his hateful campaign promise at their expense. https://twitter.com/CNBC/status/1169418025231147013 …,1170056793151741952,2019-09-06,19:30:52,reproybalallard,2,4,13
The @OIGatHHS confirms that POTUS’s cruel separations of migrant families have inflicted terrible trauma on kids torn from their parents. The Trump Admin should be PROTECTING kids in its custody from mental & emotional harm – not CONTRIBUTING to that harm by separating families. https://twitter.com/rollcall/status/1169716834498744322 …,1170050915518337025,2019-09-06,19:07:31,reproybalallard,3,3,1
"It was a pleasure to run into @CityOfCommerce Parks and Recreation Commissioner Laura Perez at #Commerce’s @DoubleTreeLA Hotel, where she works! pic.twitter.com/tokjDRuGeR",1169777678037200896,2019-09-06,01:01:46,reproybalallard,0,2,5
"Visited #LACounty's Emergency Operations Center for a briefing on its work, and on the emergency management programs for @CountyOfLA, @LACity, & @CityOfDowney. As DHS @AppropsDems Chair, I’m fighting to ensure our region is ready to respond to any disaster. #AppropriatorsAtWork pic.twitter.com/hVhvenCR9V",1169771935158493184,2019-09-06,00:38:57,reproybalallard,2,3,3
"Hosted a meeting in #Commerce with first responders, 40th District emergency coordinators, @Cal_OES Dir. Mark Ghilarducci, & @FEMARegion9 Admin. Robert Fenton. We had a productive discussion about ensuring our #CA40 cities are prepared for natural disasters. #AppropriatorsAtWork pic.twitter.com/bqcFz2yUva",1169735043155185665,2019-09-05,22:12:21,reproybalallard,1,1,7
"There are 24,000 #Dreamers in #CA40 alone who need permanent protection from deportation. That’s why I introduced #HR6, the #DreamAndPromise Act of 2019, and led its bipartisan passage in the House. It’s past time for the Senate to do its job and pass HR6. Let's #ProtectTheDream! pic.twitter.com/8mA6nE3VkT",1169661111924416514,2019-09-05,17:18:34,reproybalallard,1,22,23
También discutimos sobre la importancia crítica de proteger los derechos y la dignidad de TODOS los migrantes y refugiados que vienen a los EE. UU.,1169404107498708992,2019-09-05,00:17:20,reproybalallard,1,0,1
"Me reuní con el clero de @LA_Voice, @ClueJustice y líderes comunitarios en el Este de Los Ángeles para hablar sobre mi reciente visita congressional a Centroamérica. pic.twitter.com/0LItnktiq3",1169404104218677248,2019-09-05,00:17:19,reproybalallard,1,1,3
Met with @LA_Voice & @ClueJustice clergy and community leaders in East LA to talk about my recent congressional visit to Central America. We also discussed the critical importance of protecting the rights and dignity of ALL migrants and refugees who come to the U.S. pic.twitter.com/IgjNPq1Srh,1169403866611355649,2019-09-05,00:16:22,reproybalallard,0,2,3
Great meeting with @UNICEFUSA supporters and staff about their amazing work on behalf of children in the U.S. and worldwide!  It gave me joy and hope for the future to see these young women taking leadership roles in their communities. pic.twitter.com/fpXhs0fUKT,1169395934398177286,2019-09-04,23:44:51,reproybalallard,0,2,5
"Happy birthday to my beloved hometown of #LosAngeles!  Our #CityOfAngels may be 238 years old, but it stays forever young thanks to the idealism, diversity, and indomitable spirit of the millions who proudly call LA their home. @LACity",1169338864399503360,2019-09-04,19:58:05,reproybalallard,1,1,13
"Trump is taking money from military construction projects so he can build his costly, ineffective border wall. In doing so, he's threatening our national security, turning his back on military families, & bypassing Congress. We'll continue fighting this awful decision! https://twitter.com/NBCNews/status/1169261616543739905 …",1169328884787154945,2019-09-04,19:18:25,reproybalallard,2,4,11
"A pleasure to meet with #Cudahy Mayor Jose Gonzalez! We discussed the city’s economic development plan, as well as its efforts to advance educational opportunities for young people, increase home ownerships, and bring more union jobs to the city. @CityOfCudahyCA pic.twitter.com/FtjThn8jQ7",1169047887772311553,2019-09-04,00:41:50,reproybalallard,1,1,3
"Glad to speak with Stan Lyles, vice president of SEIU-United Healthcare Workers West. Appreciated hearing his insights about the ongoing labor negotiations between Kaiser Permanente workers and management. pic.twitter.com/vgXsn0ZYmD",1169043227200147456,2019-09-04,00:23:19,reproybalallard,0,2,6
"Amid a busy day of meetings in and around our 40th District, I stopped in at @CityOfCommerce's Eastern Avenue food court for a quick lunch at Fish-O-Licious. Thanks to all of our #CA40 eateries for feeding so many local workers and families each day! pic.twitter.com/fPwpDOBgND",1169027458953359360,2019-09-03,23:20:40,reproybalallard,1,1,7
"Glad to speak w/ @CHIRLA’s Angelica Salas & @CARECEN_LA’s Martha Arevalo about our shared commitment to fixing our broken immigration system, keeping families together, & ensuring every migrant is treated humanely. I'm pleased to lead these fights as DHS @AppropsDems chairwoman. pic.twitter.com/yOwDs7JHxd",1169023265853063168,2019-09-03,23:04:00,reproybalallard,3,5,15
Praying for the victims of the shocking and horrific boat fire near Santa Cruz Island. Thankful to our brave Coast Guard forces and local agencies as they lead the rescue effort. https://www.latimes.com/california/story/2019-09-02/massive-rescue-operation-after-dozens-trapped-in-boat-fire-off-santa-barbara …,1168545395426959372,2019-09-02,15:25:07,reproybalallard,0,2,14
"Happy #LaborDay to the millions of American workers who strengthen our economy each day! As Vice Chair of the Labor-HHS-Education Appropriations Subcommittee, I'm proudly fighting to secure our workers a fair wage, a safe workplace, and a dignified retirement. @AppropsDems",1168522398410387457,2019-09-02,13:53:44,reproybalallard,2,4,13
#Enough already!!  We must #EndGunViolence. https://amp.cnn.com/cnn/2019/08/31/us/odessa-texas-active-shooter/index.html …,1167952837709463553,2019-09-01,00:10:30,reproybalallard,1,2,8
