tweet,id,date,time,username,replies_count,retweets_count,likes_count
"Joined @RosaDeLauro & fellow Dems on a letter demanding USDA explain how the #TrumpShutdown affects SNAP benefits. Deeply worried his shutdown will take food from children, veterans & seniors. Dems have passed legislation to reopen govt. Will GOP join us?  https://delauro.house.gov/sites/delauro.house.gov/files/DeLauro_SNAP_Shutdown_Letter.pdf …",1082804272901902337,2019-01-09,01:00:30,reproybalallard,2,3,9
El periodo de inscripción abierta del @CoveredCA_es termina el 15 de enero del 2019. Encuentre el plan de seguro médico que le convenga a usted y su familia en  http://coveredca.com/espanol . ¿Necesita ayuda? Hay ayuda gratuita de expertos disponible en  http://coveredca.com/espanol/find-help ….,1082736362535743488,2019-01-08,20:30:39,reproybalallard,0,0,1
".@CoveredCA Open Enrollment lasts until January 15, 2019. Find a health insurance plan that works for you and your family at  http://coveredca.com . Need assistance? Free expert help is available at  http://coveredca.com/find-help .",1082736361571053580,2019-01-08,20:30:39,reproybalallard,1,0,1
"Due to the #TrumpShutdown, more than 37,000 federal workers in California are going without pay. Donald Trump is holding their food and rent money hostage to his demand for his immoral and ineffective border wall. He needs to #EndTheShutdown NOW!",1082728512535052288,2019-01-08,19:59:28,reproybalallard,4,7,12
"Congratulations to #CA40's Ricardo Lara on his swearing-in as State Insurance Commissioner today -- what a victory for our Southeast neighborhoods, and our Latino and LGBTQ communities! https://twitter.com/CDInews/status/1082418732356448256 …",1082423709682540549,2019-01-07,23:48:17,reproybalallard,0,0,9
"My heartfelt best wishes to Gavin Newsom as he becomes CA's governor today! I thank Gov. Jerry Brown for all he's done to put CA at the cutting edge of economic, social, and environmental policy, and I look forward to working with Gov. Newsom to continue those critical efforts. https://twitter.com/latimes/status/1082365179508215808 …",1082422909405155328,2019-01-07,23:45:06,reproybalallard,0,2,14
"My #Commerce district office is seeking motivated, dedicated college- and graduate-level #interns to help serve the 40th Congressional District for the winter 2019 term! Read the attached flyer for info, or visit  https://bit.ly/2GYTuIx . pic.twitter.com/WLG7ikNbBG",1082359987475804160,2019-01-07,19:35:04,reproybalallard,1,3,8
"Rather than squandering money on Trump's border wall, we should be investing in crucial national security priorities, like hiring more law enforcement agents to focus on opioid, gang, trade, and child exploitation investigations.
#TrumpShutdown https://www.upi.com/Top_News/US/2019/01/06/White-House-congressional-staffers-to-meet-again-on-border-wall/5601546783562/ …",1081930728877801472,2019-01-06,15:09:21,reproybalallard,1,3,8
"As we keep the victims of the Torrance shooting in our hearts today, I join with all those who know that enough is #Enough. It is long past time for America to make commonsense #GunSafety reforms that will reduce shootings and protect our loved ones. https://www.latimes.com/local/lanow/la-me-ln-torrance-shooting-20190105-story.html …",1081632293242974210,2019-01-05,19:23:29,reproybalallard,7,5,15
"What an amazing #FBF photo! Ileana @RosLehtinen, @NydiaVelazquez & I were the first 3 Latinas in Congress, and I'm proud of how we were able to work side-by-side & across-the-aisle. It's even more exciting to continue that partnership with 12 Latina sisters in the #116thCongress! https://twitter.com/LATINAStyleMag/status/1081222502171447296 …",1081356753453924353,2019-01-05,01:08:35,reproybalallard,2,13,53
"Forced to work without pay by the #TrumpShutdown, hundreds of TSA officers have become ill and are calling in sick. I want them to know I am working hard to reopen govt and restore their pay! This news is yet another example of how Trump's shutdown is hurting average Americans. https://twitter.com/CNN/status/1081299264695947265 …",1081328545857789954,2019-01-04,23:16:30,reproybalallard,9,10,23
"Republicans have spent years attacking voting rights, rewarding wealthy donors & special interests, and leaving working families behind. The GOP's #CultureOfCorruption must end NOW. Today, I joined my fellow @HouseDemocrats in unveiling our #ForThePeople Act to clean up our govt. pic.twitter.com/ge22LkP2ay",1081326209055817728,2019-01-04,23:07:12,reproybalallard,5,5,15
Don't let an earthquake take you by surprise! Download the new #ShakeAlertLA app to get early warning that a quake's on the way. https://twitter.com/MayorOfLA/status/1080911983782682625 …,1081306368508903426,2019-01-04,21:48:22,reproybalallard,0,1,5
"As the first Mexican-American congresswoman, elected in the first ""Year of the Woman,"" I've seen the ranks of female Democrats get bigger & more diverse over the years. Look at us now!

But we CAN'T stop here—women must have full & equal representation in govt. Our fight goes on. pic.twitter.com/nDvl8dYWyh",1081296488586792960,2019-01-04,21:09:07,reproybalallard,3,12,29
"Ultimately, the ones who suffer from this senseless #TrumpShutdown are millions of Americans – small business owners, farmers, and those helped by our federal civil servants. I hope @SenateMajLdr will do the right thing and hold a vote on this bill to fund the government.",1081034381945380870,2019-01-04,03:47:35,reproybalallard,1,3,6
"After 13 days of the #TrumpShutdown, 380,000 federal workers remain furloughed, and 420,000 are working without pay. We must end this shutdown and reopen our government.",1081034381324705794,2019-01-04,03:47:35,reproybalallard,3,2,4
"Voted tonight for H.R. 21, a bill that would fund 6 of the remaining 7 appropriations bills & re-open parts of govt closed by this #TrumpShutdown. The bill passed the House with an overwhelming Democratic majority – proof on day one that @HouseDemocrats are working #ForThePeople!",1081034380712337408,2019-01-04,03:47:35,reproybalallard,2,3,9
Helped lead tonight's passage of a resolution to fund DHS through Feb. 8. That would give us time to negotiate a DHS funding bill for the rest of FY19. We shouldn’t waste money on Trump's border wall -- we need that money for our most pressing & critical homeland security needs. pic.twitter.com/wmoMBQ6qes,1081026886195646465,2019-01-04,03:17:48,reproybalallard,21,8,33
At press conference tonight w/ @SpeakerPelosi in support of @HouseDemocrats' plan to end the #TrumpShutdown: Pass the 6 bipartisan FY19 funding bills & extend DHS funding a month. We CANNOT waste money on Trump's border wall—we need those funds for other pressing security needs. pic.twitter.com/P2p3URx2dR,1081006645927444480,2019-01-04,01:57:23,reproybalallard,10,5,19
"What a privilege to cast my vote today for the fearless and brilliant Nancy Pelosi to be Speaker of the House! Congratulations, @SpeakerPelosi – a dedicated progressive champion #ForThePeople, and a great friend. pic.twitter.com/MKz6FPphKC",1080995651452878849,2019-01-04,01:13:41,reproybalallard,3,5,29
"As @HouseDemocrats enter the majority today, I can't wait to keep fighting alongside my dear friend @RosaDeLauro to deliver #ABetterDeal #ForThePeople. https://twitter.com/rosadelauro/status/1080892551681503233 …",1080910125924114433,2019-01-03,19:33:51,reproybalallard,5,3,21
"As #CA40 congresswoman, I'll keep working to create jobs & increase paychecks; lower the cost of health care & prescription drugs; make a good higher education accessible for everyone; enact comprehensive & humane immigration reform; and clean our communities' air, land & water.",1080873627850104833,2019-01-03,17:08:49,reproybalallard,2,3,10
"An exciting and historic day for our country -- it's the start of the 116th Congress! I'm honored to be sworn in to represent California's 40th Congressional District, and to be part of a new House Democratic Majority that will work #ForThePeople. https://www.pscp.tv/w/1MnxnNndDjVxO ",1080873492663406592,2019-01-03,17:08:16,reproybalallard,5,11,46
America needs to invest more money in first responder grants to better prepare states and localities to prevent and respond to terrorism and other disasters. We can't do that if we waste that money on Trump's border wall. #TrumpShutdown https://www.apnews.com/f84043fe46ba4cdeb9705f672332908b …,1080838501766184961,2019-01-03,14:49:14,reproybalallard,3,1,8
"American businesses need us to fund more customs officers at our ports to speed up the flow of commerce & travel. Wasting money on Trump's border wall would mean no funding to hire those officers. That would force real economic costs on U.S. businesses, and we CANNOT allow that.",1080488322596814848,2019-01-02,15:37:45,reproybalallard,7,4,12
"Funding Trump's border wall would keep us from funding critical national security priorities, including protecting America against actions by nations like Russia & China. For example, we MUST procure a new heavy icebreaker so we can protect our vital Arctic security interests.",1080199380865613830,2019-01-01,20:29:36,reproybalallard,18,12,26
"Loved seeing the @DowneyRoseFloat Association's amazing ""Let's Go to the Hop"" float in this year's #RoseParade. So much hard work paid off to create this beautiful entry -- what a credit to the creativity and ingenuity of all involved! pic.twitter.com/BPpiPDg6Nu",1080171500626501633,2019-01-01,18:38:49,reproybalallard,1,0,5
"2019 is here! I hope this new year brings you new opportunities and wonderful memories. 2019 also brings a new Congress, starting this Thursday -- I'm excited to be sworn in as part of a new House Majority, and to continue my work to help all our 40th District communities.",1080103942082711554,2019-01-01,14:10:21,reproybalallard,3,4,22
"The Trump border wall rips away money for critical national security priorities -- protecting America from foreign threats, hiring more customs officers to speed up commerce at our ports, funding first responder grants to prepare our communities to respond to disasters, and more.",1079914582548905984,2019-01-01,01:37:54,reproybalallard,6,0,6
"As top Dem on DHS Appropriations, it’s great that Democrats have released a bill to end the #TrumpShutdown. This bill will fund our govt again and pay our federal workers again, while rejecting Donald Trump’s $5 billion demand for his useless border wall. https://www.cnn.com/2018/12/31/politics/house-democrats-government-shutdown/index.html …",1079914581038940160,2019-01-01,01:37:54,reproybalallard,3,1,10
