tweet,id,date,time,username,replies_count,retweets_count,likes_count
"Sunday at 7 AM, @WDASFM 105.3 will air my interview with @FrankieDarcell - we talked about news from DC like the Trump administration trying – again! – to repeal the ENTIRE Affordable Care Act & all its protections, and the #PaycheckFairnessAct the House passed this week.",1112125243571752960,2019-03-30,22:51:35,repdwightevans,1,7,7
"Before I left DC I met w/ the PA Association of Community Health Centers to discuss the importance of our community centers & why it’s critical we as a nation protect the ACA.
 
As your MoC, I’m doing everything I can to ensure no more harm will be done to each + every ☝🏾 of you. pic.twitter.com/obY2mbJwN0",1112075304963592192,2019-03-30,19:33:08,repdwightevans,2,3,16
We’ve learned that the Mueller Report is over 300 pages! I’m NOT satisfied with a 4-sentence summary from the Trump-appointed attorney general.  https://www.nytimes.com/2019/03/28/us/politics/mueller-report-length.html?smtyp=cur&smid=tw-nytimes … #ReleaseTheReport,1111707358198157313,2019-03-29,19:11:03,repdwightevans,5,10,48
"(2/2) This is a pattern with Trump.
 
He TALKS big about supporting our troops - but he’s also weakening our military readiness with his wasteful, unneeded wall & his fake emergency declaration: https://www.latimes.com/politics/la-na-pol-marine-corps-border-national-emergency-20190321-story.html …",1111383711214272512,2019-03-28,21:44:59,repdwightevans,1,5,9
"(1/2) I’m proud to display the transgender pride flag outside my office this #TransVisibilityWeek. Today I voted for a resolution standing w/the troops Trump will soon kick out of our military. He’s discriminating against qualified Americans, wasting tax $$ & making us less safe. pic.twitter.com/8hnfMUOpBu",1111383563444715521,2019-03-28,21:44:24,repdwightevans,8,30,178
I shouldn’t even have to say this...but @RepSusanWild knows what she’s talking about — unlike some in Washington. https://twitter.com/RepSusanWild/status/1111005014795997185 …,1111022389201170433,2019-03-27,21:49:14,repdwightevans,0,2,5
".@RepMovita & the people of PA deserved better than the sectarian, political prayer that opened #PaHouse session Monday. @RepDawkins’ prayer this week set a good, inclusive example.  https://www.washingtonpost.com/national/religion/democrats-muslim-lawmaker-decry-opening-prayer-as-divisive/2019/03/26/fe389460-502a-11e9-bdb7-44f948cc0605_story.html?utm_term=.37376d5ed8e5 …",1110982177800536066,2019-03-27,19:09:26,repdwightevans,0,3,10
The #GOPTaxLaw is correctly named the #GOPTaxScam because it doesn't work for hardworking constituents in Philly and doesn't work for the rest of Americans who are forced to make tough decisions on a day-to-day basis to simply survive.,1110969408745361408,2019-03-27,18:18:42,repdwightevans,0,4,6
I'm speaking now - watch live! https://twitter.com/RepDwightEvans/status/1110946483917021184 …,1110960271542177795,2019-03-27,17:42:24,repdwightevans,0,1,2
"PHL has a 26% poverty rate -- meaning 1/4 PHL'ians are struggling to put food on the kitchen table despite working 40+hrs/wk.

These hard-working families rely on the Earned Income Tax Credit & in 2017 the GOP was consistent w/ their policy goals: harming poor, innocent indivs.",1110950468245745664,2019-03-27,17:03:26,repdwightevans,0,3,14
"Today, I’m joining my @WaysMeansCmte colleagues to discuss the #GOPTaxScam.

Watch live HERE:  https://bit.ly/2UfmnWn ",1110946483917021184,2019-03-27,16:47:36,repdwightevans,0,1,2
"At this very moment, I’m gaveling in as chair of today’s @HouseSmallBiz hearing! pic.twitter.com/EVSmrevwbr – at Rayburn House Office Building",1110931192138862593,2019-03-27,15:46:50,repdwightevans,0,2,6
Click on the link below to subscribe to my e-newsletter and stay-up-to-date about the work I'm doing in Congress to move the city of Philadelphia forward>>>  https://evans.house.gov/contact/newsletter … pic.twitter.com/DqSawIWs7f,1110887894393253888,2019-03-27,12:54:47,repdwightevans,0,1,3
To my followers who have kids or know people who attend Temple University >>> https://twitter.com/ShainaFOX29/status/1110637774917566465 …,1110672610428358656,2019-03-26,22:39:20,repdwightevans,1,7,9
"When I tell people I represent parts of Philadelphia, they ask me about the @Eagles and @GrittyNHL.

But Philly is more than just sports: in fact, the @PHLschools music education program was just named among the nation's best by @NAMMFoundation 🙌🏿🙌🏿 https://patch.com/pennsylvania/philadelphia/philadelphia-among-nations-best-communities-music-education …",1110659102059958273,2019-03-26,21:45:39,repdwightevans,1,4,19
"My FIRST vote of this Congress was to protect people w/ pre-existing conditions & the health care of ALL Americans b/c I was elected to fight #ForThePeople.

In contrast, the Trump administration is openly trying – again - to repeal the #AffordableCareAct! https://www.philly.com/news/nation-world/trump-administration-court-repeal-obama-affordable-care-act-20190326.html …",1110601129639981057,2019-03-26,17:55:17,repdwightevans,0,4,6
"I welcome this $65 million investment in Philadelphia by @LDO_Helicopters & I appreciate the tour they gave me last week:
 https://northeasttimes.com/2019/03/22/ne-helicopter-manufacturer-to-create-new-pilot-training-facility/?mc_cid=d5fa321a4a&mc_eid=fb8b81b599 … pic.twitter.com/zW9RdB2Uqt",1110312491769303040,2019-03-25,22:48:21,repdwightevans,0,2,3
"After the demolition of Blumberg Apts in North Philly, residents of Sharswood Tower have a new place to call 🏠 -- b/c of funding from the fed gov't, which I strongly supported, much-needed renovations in affordable housing #ForThePeople are a GO! https://whyy.org/articles/sharswood-residents-return-home-after-28-million-tower-upgrade/?%3Futm_source=dlvr&utm_medium=twitterauto&utm_campaign=social-inbound …",1110311255305342976,2019-03-25,22:43:26,repdwightevans,0,3,5
"Puerto Ricans ARE Americans, @Potus – denying these U.S. citizens and taxpayers their fair share of federal funding is shameful & un-American! https://www.washingtonpost.com/business/economy/puerto-rico-faces-food-stamps-crisis-as-trump-privately-vents-about-federal-aid-to-hurricane-maria-battered-island/2019/03/25/ade500fe-4cb3-11e9-b79a-961983b7e0cd_story.html?utm_term=.b282bbc6f292 …",1110310301877104642,2019-03-25,22:39:39,repdwightevans,0,17,16
"Like most of you, I STRONGLY support a release of the FULL Mueller report because we have a right to know the entire scope of special counsel Robert Mueller’s probe.
 https://www.penncapital-star.com/government-politics/the-mueller-report-is-done-nearly-every-member-of-congress-from-pa-believes-it-should-be-public/ … 2/2 #ReleaseTheReport #ReleaseTheFullMuellerReport",1110310184738529280,2019-03-25,22:39:11,repdwightevans,1,3,18
Trump Attorney General William Barr has only released a narrow four-page summary of the 22-month-long Mueller investigation. 1/2,1110310067453284352,2019-03-25,22:38:43,repdwightevans,3,3,13
The attorney general reports to the president – he should direct him to #ReleaseTheReport – the American people have a right to know! #ReleaseTheFullMuellerReport https://twitter.com/JenniferJJacobs/status/1110217324047581184 …,1110256394320728066,2019-03-25,19:05:26,repdwightevans,0,7,15
 https://www.thedailybeast.com/its-time-to-kill-the-electoral-college-one-of-americas-original-sins …,1109885429766082563,2019-03-24,18:31:21,repdwightevans,0,4,9
Pelosi rejects any classified briefings on Mueller report https://thehill.com/homenews/house/435450-pelosi-rejects-any-classified-briefings-on-mueller-report …,1109588504709865474,2019-03-23,22:51:29,repdwightevans,1,6,15
"Trump asked African Americans ""What the hell do you have to lose?"" It's clear we have a LOT to lose! https://twitter.com/TheBlackCaucus/status/1109481177025597442 …",1109497104534249472,2019-03-23,16:48:17,repdwightevans,0,4,13
I and an overwhelming majority of the House of Representatives recently voted 420-0 that the #MuellerReport should be made public. I stand by that vote. The American people have a right to know.,1109208270223347712,2019-03-22,21:40:34,repdwightevans,20,167,545
"I enjoyed doing an interview with @ErinColemanTV of @NBCPhiladelphia for @ Issue, about how I’m working for you in Congress, including my bill to finance badly needed repairs to our schools. The show airs this Sunday at 11:30 AM on NBC-10 – tune in! pic.twitter.com/3IENyoN2EI",1109207168673333251,2019-03-22,21:36:11,repdwightevans,0,6,13
 https://www.washingtonpost.com/opinions/2019/03/20/how-ta-nehisi-coates-turned-reparations-punchline-into-policy-objective/ …,1109050336948424705,2019-03-22,11:13:00,repdwightevans,1,0,3
It’s a prime example of the amazing organizations we have in our city! #PhillyProud,1108785962421809152,2019-03-21,17:42:28,repdwightevans,0,1,3
During our meeting she touched upon many topics regarding homelessness and what resonated with me was the fact that this organization does more than just feed struggling residents - they also help people get back on their feet and provide them with resources to succeed.,1108785961675034624,2019-03-21,17:42:28,repdwightevans,1,1,3
"#TBT to just last week when I had a meeting with Elizabeth Hefner, the director of advancement for @Phillyhomeless, to discuss homelessness and policy initiatives to combat the growing problem of homelessness in the city of Philadelphia. pic.twitter.com/r4oerijPEE",1108785271733174272,2019-03-21,17:39:43,repdwightevans,1,1,7
"Today, @TempleUniv will go FACEBOOK LIVE as I talk to the next gen of black leaders and hear from them, first hand, about their everyday issues & concerns in our new political landscape + what I’m doing in Congress to move the city of Philadelphia forward. https://evans.house.gov/about/events/connecting-current-and-future-leaders-philadelphia …",1108755707925614592,2019-03-21,15:42:15,repdwightevans,0,2,8
Congrats Jerry and Val👏🏾👏🏾 https://twitter.com/RepValDemings/status/1108055250559221763 …,1108526209036627970,2019-03-21,00:30:18,repdwightevans,0,1,6
"One of my priorities for the 3rd District & Philly = JOBS. On Tuesday, I participated in 2 events that were all about good-paying jobs – a tour of Leonardo Helicopters in Northeast Philly, and a news conference about bringing jobs back to the @PhillyShipyard. pic.twitter.com/OuqJCHKfWO",1108383605984759814,2019-03-20,15:03:39,repdwightevans,1,14,37
"Proud to join my colleagues @RepMGS & @RepDean, @PhillyMayor, and members of the Philadelphia Metal Trades Council as we rally together to bring jobs back to the Philly Shipyard. Watch live:  https://www.facebook.com/RepDwightEvans/posts/801491966900048?__xts__%5B0%5D=68.ARB6tGVB1bKB5u5bSfC6BLE9Vd1BeUkpe71uyVUGY5hSuzQns3VnOp0OCVt0Qs6zjqfhvuRn6x-t7Lh_tP9k3_WNNZIGDzDfqV85OEHhXKvYGPYzp7eZJeH4X5qLdgU84Pn0yBkBjA8ZBzLoz8NbS2eu_xwRcadYasC3tzK0PRO_FiZmeid7SVslI69MgwWWHocrSgiFD3oGqgWJE2FMu1AUeS9utUFBxOJ2JkmjRchW2tG2SIHE_9RHFi4w9VpUhpQI1WN92rJY_qUY2ZKKwZY23NlMDsqCvXHoP82avjyCwWRQr7sjl6dHDgrz0V-Ls1TTHEGt0Bggvmb1CeZkb4mg36ZiarJ3hdiGNd6fJEtYYShrhbLHrv2Vrg7F5GUfZkqq9FtnXDE4d80DdYqUMGnRIQk90cmkkBCuwJE4vGf5adAZ53wnQxD5NN5zCl6L5SMe6R3ubq3zta9vzvghOG29JT42CX-oQ-wKqwCiU5_jexrEReKhIWfhzIP5Tiya&__tn__=-R …",1108078347668590592,2019-03-19,18:50:39,repdwightevans,1,1,5
"Trump asked African Americans in 2016, “What the hell do you have to lose?” It’s clearer than ever that under him, we ALL have a lot to lose. https://twitter.com/RepHoulahan/status/1108011886656794630 …",1108029061379620868,2019-03-19,15:34:49,repdwightevans,1,6,13
Raise the wage! https://twitter.com/GovernorTomWolf/status/1107657914473304064 …,1107721959801016320,2019-03-18,19:14:30,repdwightevans,1,4,13
House Judiciary Committee plans hearing on white nationalism https://thehill.com/homenews/house/434555-house-judiciary-committee-plans-hearing-on-white-nationalism …,1107720387335462912,2019-03-18,19:08:15,repdwightevans,2,4,14
"Live now: I’m speaking at the @GreatCitySchls annual legislative conference in Washington to raise the consciousness about our nation’s crumbling school #infrastructure.
Follow along live at  http://www.facebook.com/RepDwightEvans ",1107693176289181697,2019-03-18,17:20:07,repdwightevans,0,8,12
"Both school-repair bills are in @WaysMeansCmte, on which I serve. https://evans.house.gov/media-center/press-releases/evans-let-s-use-same-tax-credit-trump-used-hotel-repair-our-schools …",1107645742544572416,2019-03-18,14:11:38,repdwightevans,0,3,3
Looking forward to speaking around noon today at @GreatCitySchls conference in DC about bills I & @EdLaborCmte Chmn. @BobbyScott have introduced to finance badly needed repairs to schools across the country & create 1.9 million jobs: https://evans.house.gov/media-center/press-releases/evans-let-s-use-same-tax-credit-trump-used-hotel-repair-our-schools …,1107645598260490245,2019-03-18,14:11:04,repdwightevans,1,7,6
"BTW: I have no shame in saying my mom was 1 of those parents who used a diff home address to ensure I would go to a great PHL school.
 
The truth is, low-income parents, continue to do this b/c the deck is stacked against them -- that's why I'm fighting for educational equity. https://twitter.com/RepDwightEvans/status/1107393383318913024 …",1107634481509421056,2019-03-18,13:26:53,repdwightevans,3,13,71
"Interesting how some ppl are reacting to the story about celebs wielding their power & influence to game the system on behalf of their children, but are angered by the black parents who are using a different address to ensure their kids are going to a decent public school 🤔",1107393383318913024,2019-03-17,21:28:51,repdwightevans,3,7,34
"While the rich & famous are paying an “easy” $500,000 to get their children into prestigious schools, many PHL’ians are struggling to stay afloat as they ensure their kids are receiving the best possible care.

In Congress, I’m doing everything I can to level the playing field.",1107322323714097152,2019-03-17,16:46:29,repdwightevans,5,6,33
"Like I’ve said in my written testimony, “Our youngest and brightest learners should have high-quality school facilities so they can achieve their dreams. Instead, too many of them are trying to learn in subpar facilities – even though we expect exceptional results.”",1107061276952403969,2019-03-16,23:29:11,repdwightevans,0,3,15
Watching this news story was just one of the reasons why I decided to provide written testimony to @EdLaborCmte this week about my education-related priorities and why we must include fixing our school facilities in the #infrastructure conversation.,1107061272485482496,2019-03-16,23:29:10,repdwightevans,1,3,11
"While I’m working #ForThePeople in D.C., I make sure to read & watch local Philly news to stay on top of the issues affecting my constituents, and one of them is crumbling schools that harm our kids' health and their ability to succeed in the future: pic.twitter.com/3eREQ43pHi",1107061265099341825,2019-03-16,23:29:08,repdwightevans,6,13,37
"ICYMI: If you're a PA-03 resident and you're having difficulty contacting or working with a federal agency, my #Philadelphia office is here to help! 
 
Visit the link below and fill out our *NEW* online form so a caseworker can best solve your issue: https://evans.house.gov/services/help-with-a-federal-agency …",1107010509042257923,2019-03-16,20:07:27,repdwightevans,1,3,10
"Now, in 2019, I'm working hard in Congress representing the Third Congressional District of Philadelphia.

Moral of the story: Don't pay attention to the naysayers & keep pushing toward your goals!",1106989487526240256,2019-03-16,18:43:55,repdwightevans,4,9,161
"I'm a PROUD graduate of the Community College of Philadelphia (@CCPedu), as it shaped me into the man I am today and provided me the tools necessary to succeed at @LaSalleUniv -- where I earned my BA.
 
Soon after college, I ran for @PaLegis (@ 25 yrs old) & WON!",1106989486007824385,2019-03-16,18:43:54,repdwightevans,3,18,161
"If you attend community college and often feel as if you're not smart enough b/c you don't go to an elite college & university, I'm here to tell you that there's NOTHING wrong w/ attending a community college! https://twitter.com/yashar/status/1106250867831791616 …",1106989482392342530,2019-03-16,18:43:54,repdwightevans,34,114,941
"Charlottesville ,Virginia Charlotte South Carolina Pittsburgh Pennsylvania and now New Zealand, what do you think now ? https://thehill.com/policy/national-security/434308-trump-says-he-sees-no-rise-in-white-nationalism-after-new-zealand …",1106918566937456642,2019-03-16,14:02:06,repdwightevans,3,5,12
"“Puerto Ricans are Americans.” Well said, @WhipClyburn. https://twitter.com/AppropsDems/status/1106567700829081601 …",1106585935167275009,2019-03-15,16:00:20,repdwightevans,0,4,13
"Thanks @phillygaynews for covering the reintroduction of the #EqualityAct - I’m proud to support this important legislation!
 http://www.epgn.com/news/national/14376-local-lgbt-allies-among-cosponsors-reintroducing-equality-act-in-congress … pic.twitter.com/ex9ytyLI1T",1106585280390287360,2019-03-15,15:57:44,repdwightevans,1,4,6
"Americans of good will grieve with our Muslim sisters & brothers, as we did after hate-fueled attacks in Pittsburgh & Charleston. We stand with you.",1106559190330470400,2019-03-15,14:14:04,repdwightevans,0,18,50
Sen.Roxanne Jones was people’s Sen✊🏿 https://twitter.com/PALegBlkCaucus/status/1106223178110652417 …,1106327804365410305,2019-03-14,22:54:37,repdwightevans,0,3,10
🙏🏾 https://twitter.com/RepBonnie/status/1106284434158993408 …,1106294514958958592,2019-03-14,20:42:20,repdwightevans,1,0,8
Today I gave testimony to the @EdLaborCmte: Let’s use same tax credit Trump used for hotel to repair our schools:  https://evans.house.gov/media-center/press-releases/evans-let-s-use-same-tax-credit-trump-used-hotel-repair-our-schools …,1106271350619021312,2019-03-14,19:10:18,repdwightevans,0,2,7
.@SenToomey & I disagree on many issues but I commend him & @SenBobCasey for joining majority of both the House & Senate in rejecting unconstitutional overreach of @POTUS fake “emergency” declaration.,1106233521134284805,2019-03-14,16:39:58,repdwightevans,2,10,39
Raise the Wage👍🏽 https://twitter.com/GovernorsOffice/status/1105853898034688000 …,1106211388228292610,2019-03-14,15:12:02,repdwightevans,0,1,5
I’m pleased with this vote. The American people have a right to know. https://twitter.com/NBCNews/status/1106203056461488130 …,1106208931859361793,2019-03-14,15:02:16,repdwightevans,1,6,38
I'm questioning Treasury Secretary Mnuchin now in @WaysMeansCmte - watch LIVE at  https://www.youtube.com/watch?v=KFGBcXIQE2M …,1106201050959302656,2019-03-14,14:30:57,repdwightevans,1,0,2
Today @HouseDemocrats are reintroducing the Equality Act that would give #LGBTQ citizens full equality under our laws. I’m proud to be on the right side of history. 2/2,1105950835505270788,2019-03-13,21:56:41,repdwightevans,1,8,23
"Trump is pushing forward with banning qualified, trained people from our military simply because they’re transgender. 1/2",1105950741771022336,2019-03-13,21:56:19,repdwightevans,4,5,19
I'll be @onwurd at 5 PM today with @ellisonreport to talk about the new Trump budget. Listen live at  http://www.mainstreamnetwork.com/listen/player.asp?station=wurd-am … https://twitter.com/RepDwightEvans/status/1105142775325093891 …,1105931874059411458,2019-03-13,20:41:20,repdwightevans,0,3,2
The polls are open until 8 PM! https://twitter.com/RepMcClinton/status/1105458725446447105 …,1105555472176869376,2019-03-12,19:45:39,repdwightevans,0,0,2
"In last week’s @WaysMeansCmte hearing on our nation’s crumbling #infrastructure & the need for action, I questioned @AFLCIO Pres. Trumka + @USChamber Pres. Donohue about what’s happening to our crumbling school bldgs & why it should be included in the infrastructure discussion: pic.twitter.com/qurb4uyXNV",1105492394324172803,2019-03-12,15:35:00,repdwightevans,14,37,108
"In Congress, I'm fighting for our youngest & brightest learners having the highest-quality school facilities they need to achieve their dreams b/c no child should go to 🏫 breathing in toxins then be questioned why they're struggling to follow along. https://www.washingtonpost.com/education/2019/03/05/too-many-americas-public-schools-are-crumbling-literally-heres-one-plan-fix-them/?utm_term=.1735817443d9 …",1105242817088184322,2019-03-11,23:03:16,repdwightevans,1,10,15
"I’m a NO on this plan. “Trump for the first time calls for cutting $845 billion from #Medicare, the popular health care program for the elderly that in the past he had largely said he would protect.” https://www.washingtonpost.com/business/economy/trump-proposes-47-trillion-budget-with-domestic-cuts-86-billion-in-wall-funding/2019/03/11/de11cfa4-43fe-11e9-90f0-0ccfeec87a61_story.html?utm_term=.8514538c3661 …",1105142775325093891,2019-03-11,16:25:44,repdwightevans,7,10,29
You can count on me & the new @HouseDemocrats majority to fight this! https://www.washingtonpost.com/business/economy/trump-budget-to-propose-slashing-domestic-spending-boosting-defense/2019/03/08/1758b6e0-41c2-11e9-a0d3-1210e58a94cf_story.html?utm_term=.482b94eead35 …,1104488731950616577,2019-03-09,21:06:48,repdwightevans,3,6,18
I’ll be @onwurd with Bishop @ddroyster at 6:20 PM talking about the historic government reform & voting rights bill the @HouseDemocrats passed today. Listen live at  http://www.mainstreamnetwork.com/listen/player.asp?station=wurd-am … pic.twitter.com/Lsl130GUJa,1104140941684805637,2019-03-08,22:04:49,repdwightevans,0,4,1
The Women of PA!!! Congrats international women’s day https://twitter.com/RepIzzy/status/1104022709275549702 …,1104103041324777472,2019-03-08,19:34:12,repdwightevans,0,6,23
"Today I voted for a major government reform package, #HR1, that includes provisions to restore and protect voting rights and to make it easier to vote:  https://evans.house.gov/media-center/press-releases/evans-votes-major-reform-package-includes-voting-rights-protections … #ForThePeople pic.twitter.com/xy7El4IaYr",1104091854612647937,2019-03-08,18:49:45,repdwightevans,4,17,34
"As 1 of the richest countries in the 🌎, we should be ashamed of ourselves – we’re failing our kids & teachers by placing them in school bldgs that are causing them to get sick – I call upon my Republican colleagues to join my Dem friends & me >>Sign on Rep. @BobbyScott's HR 865! pic.twitter.com/7pFvi6xx5i",1103741819303718913,2019-03-07,19:38:50,repdwightevans,1,14,23
* HR 865,1103740217557745664,2019-03-07,19:32:29,repdwightevans,0,0,1
I'm asking questions NOW in @WaysMeansCmte subcommittee hearing on prescription drug prices - watch LIVE:  https://www.youtube.com/watch?v=aA3cDgRp37s …,1103692525984976902,2019-03-07,16:22:58,repdwightevans,1,1,4
"Tmrw, @HouseDemocrats will vote on #HR1, the #ForThePeople Act.
 
This act would: 
 
💰Take “HUUUGE” money out of politics
🧹 Clean up corruption
🗳️Ensure fair elections
 
This bill is revolutionary b/c it's created #ForThePeople -- Not 👏🏿Special  👏🏿Interests👏🏿",1103649328592289792,2019-03-07,13:31:19,repdwightevans,563,1340,5054
"The avg age of a school bldg in Philly is 70 YEARS OLD…and that’s just the AVERAGE AGE!

No child should learn in an environment where there are crumbling pieces of paint falling on them as they’re being taught about monumental figures during #WomensHistoryMonth-- it's shameful!",1103427986534121473,2019-03-06,22:51:47,repdwightevans,1,7,23
"🚨🚨🚨

LOOK. AT. THESE. PHOTOS.

In PHL, children are walking school halls where there's severe chipped paint on the walls -- from many reports, it's prob toxic lead paint, putting 1000s of kids at risk & this problem is nationwide.

GOP: Join us and sign on to HR 856 & HR 158!! pic.twitter.com/o9Uk7ibSSk",1103403565639450624,2019-03-06,21:14:44,repdwightevans,9,31,49
"While I'm happy that it's being addressed on a local & state level, what's happening in Philly isn't an anomaly.

🗣️There are crumbling school buildings, crater-sized potholes, old bridges, & inadequate water systems ALL across our country - we cannot wait - it needs fixing NOW!",1103382755730165761,2019-03-06,19:52:03,repdwightevans,2,3,11
"In ‘18, @PhillyInquirer 's @barbaralaker, @wendyruderman, & @dylancpurcell reported about the environmental hazards in PHL schools and the impact it has on our city's teachers + kids.

Later that yr, @GovernorTomWolf & @PhillyMayor announced $15.6M in joint funding to fix 57 🏫s.",1103382755025604610,2019-03-06,19:52:03,repdwightevans,1,2,6
"🇺🇸 needs more than $4.5 TRILLION by 2025 to fix our ailing infrastructure, yet Republicans spent last Congress giving $$ to the rich instead of working w/me & @HouseDemocrats.

Today, that ALL CHANGES, as @WaysMeansCmte are hearing 1st hand why we MUST invest in infrastructure!",1103368666912038913,2019-03-06,18:56:04,repdwightevans,1,7,13
I'm speaking & asking questions NOW in the @WaysMeansCmte hearing about #infrastructure - I'm emphasizing fixing up our crumbling schools as a vital part of that - you can watch LIVE at https://www.youtube.com/c/waysandmeanscommitteehearings …,1103361016107360261,2019-03-06,18:25:40,repdwightevans,2,2,7
"(2/2) Which is why I’ve reintroduced my bill, HR 158, to allow the rehab tax credit to be used for schools & I support @EdLaborCmte Chairman @BobbyScott’s Rebuild America’s Schools Act, HR 865 -- two bills that are in @WaysMeansCmte’s jurisdiction, the committee I serve on 👍🏾",1103320083131183104,2019-03-06,15:43:01,repdwightevans,0,3,3
