tweet,id,date,time,username,replies_count,retweets_count,likes_count
"Convening a meeting with the goal of moving past the rhetoric and then proceeding to attack not just a policy proposal but the MILLIONS OF PEOPLE who live on Florida's coasts = the peak of hypocrisy.  This is how we get to ""shared adversity as long as we get no adversity"" https://twitter.com/mannahhorse/status/1126158987479658496 …",1126171444810080257,2019-05-08,17:06:10,repbrianmast,1,2,2
"National Small Business Week is about more than just celebrating small businesses on social media - it’s more about recognizing & financially supporting the spots that truly make our community feel like home. Tag your favorite spot to hang out, grab a bite to eat or go shopping! pic.twitter.com/N6h3MopbFL",1126124596640378880,2019-05-08,14:00:00,repbrianmast,2,2,2
.@SFWMD is holding workshop today @ 10am on Lake O water quality/nutrient pollution & will also hold another workshop on enviro impacts to estuaries/Everglades/FL Bay.  Both open to public. This is what transparency & leadership for FL's waters looks like! Thx to @GovRonDeSantis!,1126112835434700801,2019-05-08,13:13:16,repbrianmast,5,14,17
This #NationalTeacherDay (and every day) we should say thank you to all of #FL18’s teachers who dedicate their lives to educating our children. Their commitment to preparing our children for the future makes our community - and country - stronger than ever! pic.twitter.com/2BZ3q1up8C,1125837707484078081,2019-05-07,19:00:01,repbrianmast,1,2,5
"The new South Florida Water Management District has hit the ground running, working hard to protect the public health and human safety of our communities. Join the new board tomorrow at 10am for a workshop on water quality at the SFWMD headquarters! https://twitter.com/SFWMD/status/1125751239621455873 …",1125800905281085440,2019-05-07,16:33:46,repbrianmast,0,3,15
Change is coming to the South Florida Water Management District and it’s bringing hope and optimism back to our communities. Check out the newest episode of #TheTorturedCoast: pic.twitter.com/PS4eTSTJ5i,1125460216126951424,2019-05-06,18:00:00,repbrianmast,7,12,37
ICYMI ➡️ Last week we continued the fight to clean up our waterways and introduced important legislation to hold convicted military rapists accountable. https://mast.house.gov/blog?ID=7223F193-12EC-415E-99D3-3CF932CC9635 …,1125399820821245952,2019-05-06,14:00:00,repbrianmast,1,11,7
"Don’t miss out! → The South Florida Water Management District is hosting a public workshop on the issues impacting our water quality on Wednesday, May 8th! Here are more details on how to participate. ⬇️ pic.twitter.com/vtazWeHquF",1125120477461041152,2019-05-05,19:30:00,repbrianmast,1,10,7
"ICYMI → There’s a lot of misinformation going around about the science on Lake Okeechobee. Check out this week’s #LakeOFactCheck and make sure you sign up to receive these important updates!
 https://mast.house.gov/factcheck ",1125052534073253888,2019-05-05,15:00:01,repbrianmast,2,12,8
Harmony’s Law had a great first week with Harmony on Capitol Hill working to hold military rapists accountable and ensure they stay behind bars. We must work together and get this bill passed! pic.twitter.com/YziSGUKFIZ,1124795842555142144,2019-05-04,22:00:01,repbrianmast,0,15,17
"I joined @RepAndyBiggsAZ podcast this week to discuss some of the most important issues facing veterans, including improving access to quality mental and physical health care. Listen now: https://soundcloud.com/user-171694389-215186623/looking-after-our-veterans-with-rep-brian-mast …",1124742991191715840,2019-05-04,18:30:00,repbrianmast,0,19,11
This week we continued the fight to clean our waterways and protect the health of our communities. I also teamed up with Harmony Allen of Port St. Lucie to hold military rapists accountable with our new bill. Check it out in this week’s Week in Review: https://youtu.be/QWXYaHXR99o ,1124690148220915712,2019-05-04,15:00:01,repbrianmast,2,7,15
Great to join you @RepAndyBiggsAZ.  Thanks for having me! https://twitter.com/RepAndyBiggsAZ/status/1124435715327123456 …,1124440979379978241,2019-05-03,22:29:55,repbrianmast,1,3,5
Did you know? → Potentially hundreds of convicted military rapists may be released from prison because of a misconstrued legal technicality. This is unacceptable! Our bill - Harmony’s Law - will help stop this from happening! pic.twitter.com/3fmdr0yXQg,1124437225368764416,2019-05-03,22:15:00,repbrianmast,3,12,15
"The old SFWMD consistently chose special interests over science, refusing to #LowerLakeO prior to the wet season. Here's a #LakeOFactCheck: scientific experts from @AudubonFL agree that lower levels before wet season will benefit the ecology of Lake O & help prevent discharges⤵️ pic.twitter.com/NNL78yioyU",1124399477198954496,2019-05-03,19:45:00,repbrianmast,3,8,12
"ICYMI → My bill - The Hepatitis Exposure Prevention Act - would increase access to the hepatitis A vaccination and help combat this growing statewide outbreak. Read more⤵️
 https://www.floridadaily.com/brian-mast-wants-hhs-to-provide-free-hepatitis-a-vaccinations-in-high-risk-areas/ …",1124363222243577863,2019-05-03,17:20:56,repbrianmast,0,3,3
We simply must work together if we want to have any hope of cleaning up our waterways & stopping the harmful discharges from #LakeO. Yesterday I met with @evergfoundation to talk about the next steps in our fight to fully fund the Comprehensive Everglades Restoration Plan (CERP). pic.twitter.com/u4t2hNrNEf,1124086162371387392,2019-05-02,23:00:00,repbrianmast,0,8,30
"“Starting last year, convicted sexual offenders in the military can appeal their convictions & be set free if they committed the offense before 2006 but were not charged within five years.” Our bill, Harmony’s Law, will put an end to this huge injustice! https://www.tcpalm.com/story/news/local/st-lucie-county/2019/04/26/port-st-lucie-woman-raped-fighting-bill-prevent-military-rapists-being-freed-technicality/3587574002/ …",1124059738960990208,2019-05-02,21:15:00,repbrianmast,8,4,22
"We must ensure that the lessons of the Holocaust are never forgotten, and especially with the ongoing resurgence of anti-Semitism, fight against this hatred and bigotry wherever we see it! #NeverForget #YomHaShoah",1124047422349631491,2019-05-02,20:26:03,repbrianmast,3,3,10
"Sadly, the number of sexual assaults in the military increased substantially last year. We must do better. I introduced Harmony’s Law to make sure military rapists are held accountable, but we also must do more to prevent sexual assault in the first place. https://abcnews.go.com/Politics/military-sexual-assault-numbers-increase-young-female-service/story?id=62762858 …",1124031459772260361,2019-05-02,19:22:38,repbrianmast,1,4,24
Military members who commit rape MUST be held accountable. This week Harmony Allen is sharing her story with Members of Congress so we can pass Harmony’s Law and prevent the potential release of hundreds of rapists from prison without repercussion. Learn more about the bill here: pic.twitter.com/4HDmM3czWj,1123670926472695808,2019-05-01,19:30:00,repbrianmast,7,3,20
"I joined @RepAndyBiggsAZ podcast to talk about the most important issues facing veterans, including improving access to quality mental and physical health care. Stay tuned for the podcast! pic.twitter.com/qLkW7AKXGB",1123625628518027265,2019-05-01,16:30:00,repbrianmast,2,3,9
The United States’ relationship w/ Israel is critically important to both countries & global security. A long list of our allies already benefit from full participation in Global Entry & there’s no doubt that Israel should be added to the list. Read more: https://www.jpost.com/Israel-News/Congresspeople-urge-Homeland-Security-Add-Israel-to-Global-Entry-program-587856 …,1123598250991345665,2019-05-01,14:41:13,repbrianmast,2,14,15
