tweet,id,date,time,username,replies_count,retweets_count,likes_count
"Congratulations to Somerset College Preparatory Academy’s Class of 2019. Whether you are off to college, starting your own business or joining the Armed Forces - never stop chasing your dreams! pic.twitter.com/YB0E0Z2mK1",1134542563006910464,2019-05-31,19:30:00,repbrianmast,0,5,8
"As a result of efforts to #LowerLakeO, we have hundreds of billions of gallons of space on Lake O for water to prevent discharges, vegetation is regrowing, and there's no threat to the water source. There's reason for cautious optimism this year. #Clean19 https://www.tcpalm.com/story/news/local/indian-river-lagoon/health/2019/05/29/lake-o-drops-below-11-feet-no-start-rainy-season-sight/1268763001/?fbclid=IwAR2lBTxb-p-WaBN_o70D3OR8Svehx6vK2Sngr4h5VGzbMEYwLaEN2YKzKOU …",1134501038919016448,2019-05-31,16:45:00,repbrianmast,1,4,7
"Potentially eliminating 17,000 military healthcare professionals could put the health & safety of servicemembers at risk. We need more info about why this is being proposed & what steps are being taken to ensure continued support for our servicemembers.
 https://www.floridadaily.com/brian-mast-tulsi-gabbard-urge-pentagon-to-stop-cutting-military-medical-personnel/ …",1134127329972645888,2019-05-30,16:00:01,repbrianmast,9,16,20
The Army Corps of Engineers is continuing their webinar series on Lake Okeechobee this week with your next opportunity to participate coming tomorrow. Check out the full schedule here: https://www.saj.usace.army.mil/Media/News-Releases/Article/1846267/corps-offers-series-of-webinars-o/fbclid/IwAR26bESiiJutCk3PUOSgGqgDdhPL6gtEvHRNisHOegWz29uod7nA1GsmJAE/ …,1133821561721446400,2019-05-29,19:45:00,repbrianmast,0,3,2
"The House passed my bipartisan Local Water Protection Act last month to promote public health and defend our environment by stopping pollution at the source. Now, our bill has been taken up in the Senate by @marcorubio! Check it out:
 https://www.floridadaily.com/marco-rubio-amy-klobuchar-take-up-local-water-protection-act-in-the-senate/ …",1133772488159244295,2019-05-29,16:30:00,repbrianmast,9,10,26
"Did you know? → The marine manufacturing industry in the #FL18 supports more than 3,000 jobs and more than 400 local businesses. My bill - The Maritime Industries Relief Act - will help support these jobs and our local economy. Read more:
 https://www.floridadaily.com/brian-mast-wants-to-repeal-duty-payments-on-used-boats-up-for-sale/ …",1133730965036126208,2019-05-29,13:45:00,repbrianmast,6,6,10
Did you see this? → We introduced the bipartisan Improving Veterans Access to Congressional Services Act last week to help serve veterans on the spot at VA facilities. Check it out: pic.twitter.com/b6ARaxatp9,1133462950860083200,2019-05-28,20:00:00,repbrianmast,3,18,22
"The Iranian regime is growing more radical by the day, and their intent is to completely destroy the U.S. and Israel. We must be united against this hatred, not capitulate to their demands by trying to appease terrorists whose goal is death & destruction. https://www.reuters.com/article/us-iran-khamenei-idUSKCN1SS2R4?utm_campaign=trueAnthem%3A+Trending+Content&utm_content=5ce5c7bb72c13d0001ebc898&utm_medium=trueAnthem&utm_source=facebook …",1133372357664550912,2019-05-28,14:00:01,repbrianmast,11,33,38
ICYMI → Last week we made some really great progress to expand veterans’ access to quality mental and physical health care. Learn about the bills we passed here.⤵️ https://mast.house.gov/blog?ID=BC923012-1637-4614-BD8B-A85EA402E88A …,1133115661255946242,2019-05-27,21:00:00,repbrianmast,3,5,17
"Putting on the uniform is something few Americans get to experience. But for those who do, it is a life-altering experience no matter what. For some, though, the sacrifice is the ultimate one. Thanks to the VFW for stopping by & for all you do to support our veteran community. pic.twitter.com/QTfKzT5BRs",1133085461084295169,2019-05-27,19:00:00,repbrianmast,4,8,27
"Boating is more than just a hobby in our communities - it’s a way of life. Earlier this weekend I joined up with the Coast Guard, NOAA, the YMCA for a PSA on boat and water safety. pic.twitter.com/RRBvxDiiBy",1132738175372353537,2019-05-26,20:00:00,repbrianmast,3,5,21
"Thank you to everyone who came out to Flagler Park yesterday to celebrate the servicemembers of #FL18. To all those heading off to bootcamp: work hard, don’t give up and make us proud! pic.twitter.com/ov236kEV2M",1132685325430665216,2019-05-26,16:30:00,repbrianmast,2,5,14
"Fighting the BDS movement is  necessary because the goal of the “movement” is to destroy Israel, completely destabilizing the Middle East. I recently filed a discharge petition to bring this issue to the floor for a vote, but House Dems refuse to sign on. https://www.jpost.com/American-Politics/Seven-House-Republicans-promotes-vote-on-anti-BDS-bill-589851 …",1132647577613217792,2019-05-26,14:00:00,repbrianmast,9,30,50
"Finally, thanks to all of our hard work and with the President on board, we convinced the House Appropriations Committee to increase Everglades Restoration funding to $200 million for next year. This is a big win for Everglades restoration and a big win for our community! pic.twitter.com/OOcsun6K2q",1132398435045220353,2019-05-25,21:30:00,repbrianmast,4,7,38
I will not standby and do nothing while potentially hundreds of convicted military rapists could be set free because of a fake legal technicality. My bill will fight for justice to make sure these convicted rapists stay behind bars. http://www.rollcall.com/news/congress/with-sexual-assaults-in-the-military-on-the-rise-bill-would-authorize-congress-to-intervene …,1132360685571194885,2019-05-25,19:00:00,repbrianmast,5,20,30
"I am always looking for ways to better serve veterans in our community. Our bipartisan bill - The Improving Veterans Access To Congressional Services Act - will empower other Members of Congress to hold office hours in their local VA facility. Learn more:
 http://www.sunshinestatenews.com/story/florida-congressmen-want-congressional-offices-inside-va-facilities-help-veterans …",1132322937623797760,2019-05-25,16:30:00,repbrianmast,3,19,16
"This week we received a historic commitment to fund Everglades restoration, fought to expand veterans’ access to quality care and worked to make it easier for Americans to save for their retirement. Check out this week’s Week In Review for more! https://mast.house.gov/blog?ID=0E215CE8-5B61-462B-BCE9-16D45156A663 …",1132285190439657477,2019-05-25,14:00:00,repbrianmast,1,3,7
Thank you to the Martin County Commissioners for coming in to discuss the progress of water infrastructure projects in our community. These projects are critical to our fight for clean water! pic.twitter.com/J66jXLW5to,1132013400614006786,2019-05-24,20:00:01,repbrianmast,0,3,14
"@RepDarrenSoto and I have been working together to ensure veterans have access to the best care our country has to offer, including support from their representatives in Congress. Together, we will keep fighting to make a high level of service a reality for our veterans. pic.twitter.com/dJ7TeH77Xd",1131964323360673792,2019-05-24,16:45:00,repbrianmast,0,0,1
Active-duty servicemembers and their families can visit museums across the country for free this summer - including more than 80 here in Florida! Learn more about the @NEAArts and @BlueStarFamily's #BlueStarMuseums program here → http://arts.gov/bluestarmuseums ,1131937902181720066,2019-05-24,15:00:00,repbrianmast,0,6,11
"One of the important bills we passed this week was called the SECURE Act to make it easier to save more for retirement and it also has benefits for students, veterans and small businesses.  Here’s what you should know ⤵️ pic.twitter.com/hcRq02R34J",1131915251203444736,2019-05-24,13:30:00,repbrianmast,3,4,11
I opened the first-ever Congressional office in the West Palm Beach VA to better serve veterans in our community. This week I introduced the Improving Veterans Access to Congressional Services Act to empower other Members of Congress to do the same. pic.twitter.com/NiP5TanBo2,1131684983460884480,2019-05-23,22:15:00,repbrianmast,2,14,24
I met with the Army Corps of Engineers this week to discuss the need to expedite CERP projects w/ increased federal funding. These projects are critical to restoring the natural flow to #SendTheWaterSouth! I also pressed the need for operational changes to protect public health. pic.twitter.com/VGIcEbaqnk,1131651012102508544,2019-05-23,20:00:01,repbrianmast,2,8,29
"I am always looking for new ways to expand access to quality physical and mental health care for those who served. This week, we passed 9 bills to help us do just that. Check it out: pic.twitter.com/rRrfiJSK5j",1131624585168805888,2019-05-23,18:15:00,repbrianmast,6,15,25
"Congratulations to @AWOadvocacy on 75 years of representing the tugboat and barge industry, supporting our economy and helping navigate America’s waterways! pic.twitter.com/5h8fQSBBlT",1131292395817988096,2019-05-22,20:15:00,repbrianmast,3,6,14
I’ve been urging the CDC to get more involved in this health crisis for a long time. Glad to see them step up w/ the “first-ever study of Lake Okeechobee fishing guides to help understand the long-term health effects of the lake’s cyanobacteria blooms.” https://www.tcpalm.com/story/news/local/environment/2019/05/20/florida-toxic-algae-cdc-study-lake-o-fishing-guides-who-inhaled-toxic-algae/3742397002/ …,1131273524356816896,2019-05-22,19:00:00,repbrianmast,4,5,17
#LakeOFactCheck: Here’s why lower lake levels on Lake Okeechobee right now give us a much better chance this year to avoid harmful discharges... pic.twitter.com/f3rcmmIuZq,1131243325065969665,2019-05-22,17:00:00,repbrianmast,1,6,20
This is big…we’ve been fighting hard for this and will not stop! https://www.tcpalm.com/story/news/local/indian-river-lagoon/health/2019/05/21/everglades-projects-get-2-million-house-appropriations-committee/3746211002/ …,1131211237176631298,2019-05-22,14:52:30,repbrianmast,3,12,38
"At my urging (& with bipartisan FL support), the House Appropriations Committee just amended & passed a bill with $200 mil for Everglades Restoration. This historic commitment is 3x last year's $. It is what we need to reverse this man-made, environmental & public health disaster",1130949953600274433,2019-05-21,21:34:15,repbrianmast,5,13,76
"Thank you @RepMarcyKaptur for working with me to include $200 million for Everglades Restoration in your managers amendment. This funding is critical to restore the Everglades, stop harmful discharges and (as you know all too well) combat harmful algal blooms!  #SendTheWaterSouth",1130937179176341510,2019-05-21,20:43:29,repbrianmast,0,4,16
The Army Corps of Engineers launched a new webinar series this week about the work being done to change the way Lake Okeechobee is managed! Check out the full schedule here: https://www.saj.usace.army.mil/Media/News-Releases/Article/1846267/corps-offers-series-of-webinars-o/fbclid/IwAR26bESiiJutCk3PUOSgGqgDdhPL6gtEvHRNisHOegWz29uod7nA1GsmJAE/ …,1130888179018555393,2019-05-21,17:28:47,repbrianmast,0,6,13
Opening the first-ever Congressional office inside a VA hospital has allowed us to help veterans on the spot. Yesterday I introduced the Improving Veterans Access to Congressional Services Act to help other Members of Congress do the same. Read more: https://wjno.iheart.com/featured/florida-news/content/2019-05-20-us-rep-mast-bill-is-all-about-connecting-veterans-with-congress/ …,1130839411774636032,2019-05-21,14:15:00,repbrianmast,2,9,18
"At our urging, @POTUS increased his budget request for Everglades restoration to $200 million. Now it’s up to the Appropriations Committee to fulfill this request & help us restore the Everglades. They meet tomorrow, so we’re making one last pitch for clean water. Read it here: pic.twitter.com/V0Vls0Kfv4",1130571396986363908,2019-05-20,20:30:00,repbrianmast,17,156,495
Did you see this? → Harmony Allen’s convicted rapist was set free after serving only a fraction of his sentence because of a “legal” technicality. My bill - Harmony’s Law - will fix this massive miscarriage of justice. Read more here: https://www.cnn.com/2019/05/14/politics/harmony-allen-military-sexual-assault/index.html …,1130537421697892352,2019-05-20,18:15:00,repbrianmast,4,8,17
ICYMI - Last week we worked on three important pieces of legislation to expand veterans access to healthcare and supporting our local maritime economy. Click here to learn more: https://mast.house.gov/blog?ID=AFD28908-B65B-46E6-A00B-7F7DC3027836 …,1130458148769157120,2019-05-20,13:00:00,repbrianmast,7,6,13
"ICYMI - Algal blooms are already starting to appear on Lake Okeechobee as we approach the summer months. Zero discharges gives us the best chance to prevent algal blooms and avoid another lost summer. Check out the latest #LakeOFactCheck here ⤵️
 https://mast.house.gov/factcheck ",1130231658886467584,2019-05-19,22:00:00,repbrianmast,2,7,9
I met with @Capt4CleanWater this week to discuss the ways we can continue working together to clean up our waterways and finally get the people of our community back out on the water where they love to be! pic.twitter.com/pZYu01Tnh3,1130209008332234758,2019-05-19,20:30:00,repbrianmast,4,4,15
"After conversations with Governor DeSantis and the White House, we have secured a commitment that illegal immigrants will not be sent to Florida. https://www.cbsnews.com/news/kevin-mcaleenan-acting-dhs-chief-tells-face-the-nation-the-trump-administration-wont-send-migrants-to-florida/?ftag=CNM-00-10aab6a&linkId=67592587 …",1130156983116541952,2019-05-19,17:03:16,repbrianmast,13,16,35
"Honored to be a part of @GulfstreamAero's groundbreaking ceremony. The new facility will bring more jobs to our community, improve aviation safety and enhance operations at PBI. pic.twitter.com/h9dh5E1sML",1130118410992521221,2019-05-19,14:30:00,repbrianmast,1,5,7
How many more people must get severely sick and injured before the government takes this health crisis seriously?  We must act now to address the very real public health and human safety crisis sweeping over our communities. https://www.orlandosentinel.com/opinion/guest-commentary/os-op-flesh-eating-bacteria-survive-bob-morris-20190517-3dboqefws5hlxcvhwxiikgesry-story.html?fbclid=IwAR39PAEX3X3N2iMpcsxBQlgApakt4UYu_urB7jqQopui388mh81yvWkeExE …,1129884370523701248,2019-05-18,23:00:00,repbrianmast,2,9,11
"Especially on this #ArmedForcesDay, I want to say thank you to everyone serving with the Army, Navy, Marines, Air Force and Coast Guard for their dedication to keeping our nation safe. We are grateful for you today and everyday! pic.twitter.com/KUAu9Z9Ii4",1129850394165751808,2019-05-18,20:45:00,repbrianmast,0,9,21
"As we turn the corner toward summer, reports of algal blooms on Lake Okeechobee and in the Caloosahatchee River are already coming in. But what about the St. Lucie? Here’s a #LakeOFactCheck: pic.twitter.com/dTqmzBOhud",1129812645446422528,2019-05-18,18:15:00,repbrianmast,1,7,13
This week we got some great water news! President Trump officially sent a revised budget request to Congress asking for $200 million for Everglades restoration. Check out this week’s Week in Review to learn more about what that means for our community: https://youtu.be/88ISNSTOwuM ,1129763577399844864,2019-05-18,15:00:01,repbrianmast,3,7,20
"We also owe more than just prayers and gratitude. We need a strong national plan to combat gangs like MS-13, prevent them from trafficking drugs, weapons and gang members across the border and prevent them from spreading violence and fear in our communities!",1129384558619709440,2019-05-17,13:53:56,repbrianmast,9,7,25
To this officer and their family: you are in our prayers. We owe a serious debt of gratitude to you and every single person who puts on the uniform to defend our community. https://www.usnews.com/news/best-states/florida/articles/2019-05-17/sheriff-gang-member-killed-deputy-wounded-in-shooting …,1129384367246270465,2019-05-17,13:53:10,repbrianmast,1,7,19
"I am limited in what I can say right now because the briefing was classified, but there is no doubt that in the 2016 election numerous Florida counties were under attack from Russia.  The lack of transparency and accountability is not acceptable! pic.twitter.com/hA0AR1ycoA",1129381890866253825,2019-05-17,13:43:20,repbrianmast,13,4,13
"Joined @CBSNewsRadio @EyeOnVeterans to discuss the important progress we are making on Harmony’s Law. Together, we can ensure convicted military rapists are held accountable for their crimes! Listen now: https://youtu.be/ZONnEsAG63E ",1129144496640237568,2019-05-16,22:00:01,repbrianmast,3,3,3
"We’ve had great talks this week with the @FlaFarmBureau & growers from across the state. The issues facing FL are complex, and it takes a team effort to tackle them. We may not agree on everything, but keeping an open mind is critical to finding areas where we can work together. pic.twitter.com/7FMoHJRxlX",1129110519464570886,2019-05-16,19:45:00,repbrianmast,3,5,9
The American people deserve to know if their elected Reps. have the courage to stand up against anti-Semitism & the BDS movement. I was proud to lead the charge & file a discharge petition to try to make sure our bipartisan bill gets a vote in the House. https://thehill.com/homenews/house/443867-gop-launches-anti-bds-discharge-petition …,1129076546306621441,2019-05-16,17:30:00,repbrianmast,9,13,28
"It was an honor to attend the annual officers memorial ceremony in West Palm Beach last week. This week, as we celebrate #NationalPoliceWeek, I want to say THANK YOU to the brave men & women who keep our communities safe every day. Your service is appreciated more than you know. pic.twitter.com/xV6ycWOlYR",1129037723858341890,2019-05-16,14:55:44,repbrianmast,0,7,19
"For 40+ years, thousands of veterans have suffered from being exposed to Agent Orange all while being denied the benefits they earned during the Vietnam War. Last night, the House passed the Blue Water Navy Vietnam Veterans Act to fix this injustice. https://www.militarytimes.com/news/pentagon-congress/2019/05/14/plan-for-blue-water-vietnam-veterans-benefits-on-the-move-again/ …",1128774559778234368,2019-05-15,21:30:01,repbrianmast,3,10,23
"Did you know the marine manufacturing industry in #FL18 supports more than 3,000 jobs and more than 400 local businesses? That’s why this week I re-introduced the Maritime Industries Relief Act to support this critical industry.  Read the bill ⤵️
 https://mast.house.gov/maritime ",1128736808278351874,2019-05-15,19:00:00,repbrianmast,3,3,10
Potentially hundreds of convicted military rapists could be released from prison because of a judicially-created legal loophole.  We must pass Harmony’s Law to prevent this from happening. Watch now: pic.twitter.com/OFxTtqEpwQ,1128646210267410432,2019-05-15,13:00:00,repbrianmast,2,6,11
"At our urging, @POTUS has agreed to amend his budget request to increase funding for critical infrastructure projects needed to restore the Everglades & stop harmful discharges/algal blooms. Together, we can finally get this done and #SendTheWaterSouth! https://www.tcpalm.com/story/news/local/indian-river-lagoon/health/2019/05/14/trump-ill-fight-200-million-everglades-projects-budget/3664118002/ …",1128419717461487616,2019-05-14,22:00:00,repbrianmast,7,6,33
"One year ago, the U.S. embassy in Jerusalem opened. Now, we find ourselves in a twisted battle against anti-Semitic comments penetrating the halls of Congress. Today - and every day - we must celebrate our special relationship with our Israeli allies and protect it at every turn. pic.twitter.com/DtKvGQJvcj",1128404621507141635,2019-05-14,21:00:01,repbrianmast,34,28,98
We must prevent this from happening by passing Harmony's Law.  Learn more about the bill here -->  http://mast.house.gov/harmony  https://twitter.com/CNNPolitics/status/1128370207389560832 …,1128399151060930563,2019-05-14,20:38:16,repbrianmast,5,8,16
Thank you to @CNN for covering this massive injustice.  We must pass Harmony's Law to prevent this from happening. https://twitter.com/CNNnewsroom/status/1128382692196851712 …,1128384825046466560,2019-05-14,19:41:21,repbrianmast,0,4,12
Here is the official transmission to Congress from the White House increasing the request for Everglades restoration funding to a total of $200 million. I spoke with the President about this when he was in Florida - this is a big step in our fight to restore FL water! pic.twitter.com/6xFaw2FgOz,1128351305620172802,2019-05-14,17:28:09,repbrianmast,3,16,31
Proud to recognize four exceptional students from Murray Middle School today for their work in Junior Youth in Government. Keep up the great work as we fight together to protect our waterways! pic.twitter.com/m3afuVWatc,1128049780913995776,2019-05-13,21:30:00,repbrianmast,1,3,9
"Over the weekend, Congresswoman Rashida Tlaib tried to rewrite history to make her “Palestinian ancestors” the heroes of the Holocaust and said that the Holocaust gave her a “calming feeling.” When will Speaker Pelosi stop enabling anti-Semitism? https://www.washingtonexaminer.com/news/rashida-tlaib-says-thinking-of-the-holocaust-provides-her-a-calming-feeling-shockingly-claims-palestinians-created-safe-haven-for-jews …",1128023355339132928,2019-05-13,19:45:00,repbrianmast,36,17,39
I don’t think it’s too much to ask the VA to do better than harming and killing puppies in painful experiments. I’m glad to see the Appropriations Committee vote to defund this abusive practice. Now it’s time to make this law for good! https://ijr.com/mast-applauds-house-committee-move-defund-va-dog-experiments/ …,1127987685476507648,2019-05-13,17:23:15,repbrianmast,15,58,102
ICYMI → Last week we kicked off Military Appreciation Month and celebrated some great economic news. Check it out ⤵️ https://mast.house.gov/blog?ID=586C13A7-3AA0-4094-9908-DFD88335FB1F …,1127649643150696449,2019-05-12,19:00:00,repbrianmast,1,3,4
"On Mother’s Day - and every other day - I’m reminded why the kids and I are so lucky to have Brianna on this journey with us. To all of the mothers in #FL18, happy Mother’s Day! pic.twitter.com/6UuEUiSsVN",1127574148748722178,2019-05-12,14:00:01,repbrianmast,2,2,21
@TulsiGabbard is right - burn pits are the Agent Orange of our generation. That’s why we teamed up to introduce the Burn Pits Accountability Act. Together we can ensure veterans exposed to burn pits have access to the best care our country has to offer. https://www.washingtonexaminer.com/opinion/op-eds/rep-tulsi-gabbard-burn-pits-the-agent-orange-of-our-generation …,1127287257570906112,2019-05-11,19:00:00,repbrianmast,0,9,15
"This week we kicked off Military Appreciation Month, celebrated small business week and got some great economic news. Check out this week’s Week In Review Video for all that and more: https://youtu.be/S9m-txxHMrw ",1127226863892353024,2019-05-11,15:00:01,repbrianmast,2,4,6
I couldn’t agree more → “The future of Florida — our future — is at stake.” https://www.naplesnews.com/story/opinion/editorials/2019/05/09/turning-toxic-tide-our-5-part-playbook-saving-floridas-water/3587238002/ …,1126973940474101760,2019-05-10,22:15:00,repbrianmast,5,19,18
"The life of a military spouse is not easy. On this #MilitarySpouseAppreciationDay, we say thank you to the husbands and wives who take care of everything in their servicemember’s absence - and for doing it with never ending love. You are truly appreciated and loved. pic.twitter.com/PMcXIWLRmF",1126936192367366144,2019-05-10,19:45:00,repbrianmast,1,6,25
"Thank you to the Army War College Class of 2019 for a great discussion on strengthening our foreign policy, protecting our national defense and serving our nation! pic.twitter.com/NElbK7l36y",1126902219440312322,2019-05-10,17:30:00,repbrianmast,1,2,7
"There are a ton of obstacles for members of our military returning home from overseas, and it’s far too common for our veterans to struggle to find a career and support their families. We must work together to do more to end veteran homelessness. pic.twitter.com/FG7U95oqel",1126592679696130048,2019-05-09,21:00:00,repbrianmast,2,5,13
The men and women who served during WWII are the greatest generation our nation has ever seen. Countless servicemembers risked their lives - and many paid the ultimate sacrifice - to defend the values we dear. It was an honor to recognize 6 of our nation’s bravest men this week. pic.twitter.com/s0KbLcpv8H,1126543605730910209,2019-05-09,17:45:00,repbrianmast,4,7,41
Did you see this? → The unemployment rate has fallen to a 50 year low! Read more here ⤵️ https://www.cnn.com/2019/05/03/economy/april-jobs-report/index.html …,1126494534274375686,2019-05-09,14:30:00,repbrianmast,8,20,20
"Did you see the newest #TorturedCoast episode? Change is coming to the South Florida Water Management District, and it’s bringing new optimism for clean water! Check it out ⤵️ https://mast.house.gov/blog?ID=C9ACCD5C-76CB-480F-AD11-201B044EC99E …",1126222741739171840,2019-05-08,20:30:00,repbrianmast,3,2,3
"One of my favorite parts of my job is getting the chance to recognize & celebrate my brothers and sisters in arms - past, present and future! I hope you’ll join me for a day of fun in honor of the military servicemembers & their families who live in #FL18. 

Here are the details: pic.twitter.com/1IkvfsyNpj",1126173668046987266,2019-05-08,17:15:00,repbrianmast,1,2,10
