tweet,id,date,time,username,replies_count,retweets_count,likes_count,tdatetime
".@HouseJudiciary will continue investigating, litigating and legislating regarding these matters — but we will not allow this latest abuse of power to distract from Congress’ efforts to get to the bottom of the President’s interference in the 2020 election.",1184925554623045632,2019-10-17,20:14:01,housejudiciary,33,178,678,2019-10-17 20:14:01
".@realDonaldTrump is exploiting his office and making official U.S. government decisions for his personal financial gain. 

The #EmolumentsClauses of the Constitution exist to prevent exactly this kind of corruption.",1184922925062918145,2019-10-17,20:03:34,housejudiciary,31,104,286,2019-10-17 20:03:34
The Administration’s announcement that President @realDonaldTrump’s Doral Miami resort will be the site of the next G7 summit is among the most brazen examples yet of the President’s corruption.,1184920845036244992,2019-10-17,19:55:18,housejudiciary,75,340,1221,2019-10-17 19:55:18
JUST IN: @RepJerryNadler Statement on @realDonaldTrump Hosting G7 at His Doral Resort in Miami https://medium.com/housejudiciary/trump-hosting-g7-at-his-doral-resort-in-miami-16d21ef26005?postPublishedType=initial …,1184919127951118337,2019-10-17,19:48:29,housejudiciary,66,111,239,2019-10-17 19:48:29
WATCH IT LIVE: @HouseJudiciary Oversight Hearing on the Federal Bureau of Prisons and Implementation of the #FirstStepAct https://www.youtube.com/watch?v=CqvVPF6QGPA …,1184890222921879553,2019-10-17,17:53:37,housejudiciary,1,4,17,2019-10-17 17:53:37
There is nothing more sacred in our democracy than the right to vote. Congress has the power and the duty to act and restore protections against racial discrimination in voting. It's time to #RestoreTheVote.,1184864535024472066,2019-10-17,16:11:33,housejudiciary,17,171,568,2019-10-17 16:11:33
We have a responsibility to honor our history and #RestoreTheVOTE. We cannot be silent in the face of discrimination.,1184839876107214864,2019-10-17,14:33:34,housejudiciary,3,62,233,2019-10-17 14:33:34
WATCH IT LIVE: @HouseJudiciary Holds Hearing on Strengthening the Voting Rights Act. Voters across the country are facing issues at the ballot box. Members of Congress should be helping by working to #RestoreTheVote ASAP. https://twitter.com/i/broadcasts/1OdKrLbnprqJX …,1184831169856188417,2019-10-17,13:58:58,housejudiciary,12,164,281,2019-10-17 13:58:58
WATCH IT LIVE: @HouseJudiciary Holds Markup on Preventing Online Sales of E-Cigarettes to Children Act https://www.youtube.com/watch?v=axxKlAtzI0c …,1184470230367645697,2019-10-16,14:04:43,housejudiciary,3,5,16,2019-10-16 14:04:43
HAPPENING NOW: @HouseJudiciary Chairman @RepJerryNadler Holds Hearing on Oversight of the U.S. Copyright Office. https://www.youtube.com/watch?v=C0Hp9JI8dOI …,1143889680787759105,2019-06-26,14:32:06,housejudiciary,3,11,29,2019-06-26 14:32:06
"Pursuant to subpoenas issued by @HouseJudiciary and House Permanent Select Committee on Intelligence, Special Counsel Robert S. Mueller III has agreed to testify before both Committees on July 17 in open session.",1143697378798690306,2019-06-26,01:47:58,housejudiciary,76,104,349,2019-06-26 01:47:58
JUST IN: @RepJerryNadler and @RepAdamSchiff Announce Special Counsel Mueller to Testify Pursuant to Subpoena. https://medium.com/@HouseJudDems/chairmen-nadler-and-schiff-announce-special-counsel-mueller-to-testify-pursuant-to-subpoena-c4f7e75faed5?postPublishedType=initial …,1143696379140874240,2019-06-26,01:44:00,housejudiciary,38,242,706,2019-06-26 01:44:00
".@RepJerryNadler: ""The Constitution is clear: the President must obtain Congress’s consent before receiving foreign benefits. Yet again, the courts have ruled in our favor as we seek to uphold the Constitution and prove that no one is above the law.""",1143623403427024897,2019-06-25,20:54:01,housejudiciary,142,1110,3004,2019-06-25 20:54:01
"BREAKING: Judge Rejects Delay & Orders Discovery In Blumenthal V. Trump, Lawsuit Brought By @SenBlumenthal, @RepJerryNadler & 213 Members Of Congress https://medium.com/@HouseJudDems/in-a-victory-for-the-constitution-judge-rejects-delay-orders-discovery-in-blumenthal-v-d278d78cc1eb?postPublishedType=initial …",1143615138475520000,2019-06-25,20:21:11,housejudiciary,356,4500,11261,2019-06-25 20:21:11
"Since the #ShelbyVHolder decision, we have seen the emergence of voter suppression measures, like burdensome proof of citizenship laws and significant scale-backs to early voting periods.  These kinds of voting practices have a disproportionate negative impact on minority voters.",1143604608801148928,2019-06-25,19:39:20,housejudiciary,2,11,23,2019-06-25 19:39:20
"The #VotingRightsAct is one of the most effective civil rights statutes that has ever been enacted into law.  Six years ago today, SCOTUS issued its disastrous decision in Shelby County v. Holder and thereby effectively gutted one of the Act’s central enforcement provisions.",1143601050764632065,2019-06-25,19:25:12,housejudiciary,2,16,24,2019-06-25 19:25:12
WATCH IT LIVE: @HouseJudiciary Holds Hearing on Continuing Challenges to the #VotingRightsAct Since Shelby County v. Holder with @staceyabrams. https://www.youtube.com/watch?v=JQl7T06sUpQ …,1143580075234926594,2019-06-25,18:01:51,housejudiciary,3,33,37,2019-06-25 18:01:51
"HAPPENING TODAY: @HouseJudiciary Holds Hearing on Oversight of Bankruptcy Law and Legislative Proposals with @SenatorDurbin, @RepBenCline, @NydiaVelazquez, and @repdelgado. https://www.youtube.com/watch?v=CGKUn5o5kmc …",1143522808628207616,2019-06-25,14:14:17,housejudiciary,2,22,32,2019-06-25 14:14:17
HAPPENING NOW: @HouseJudiciary Holds Hearing on The Federal Judiciary in the 21st Century. https://www.youtube.com/watch?v=BBiWeN-uSqM …,1142059426838458370,2019-06-21,13:19:20,housejudiciary,3,12,22,2019-06-21 13:19:20
"Hope Hicks was unapologetic about the Trump Campaign’s use of hacked materials released by Wikileaks, defending the campaign as using “publicly available information"" & acknowledged the Trump Campaign felt “relief” at the release of hacked information damaging to Hillary Clinton.",1141833910881587200,2019-06-20,22:23:13,housejudiciary,87,300,379,2019-06-20 22:23:13
"Key takeaways from the Hope Hicks interview:

Lawyers for the @realDonaldTrump Administration blocked Ms. Hicks from answering questions 155 times.

Ms. Hicks confirmed that the Trump Campaign welcomed the Russian attack on the 2016 presidential election.",1141832736757469184,2019-06-20,22:18:33,housejudiciary,97,586,900,2019-06-20 22:18:33
BREAKING: @HouseJudiciary Releases Transcript of Hope Hicks Interview. The full transcript is available here. https://medium.com/@HouseJudDems/house-judiciary-committee-releases-transcript-of-hope-hicks-interview-32901bc50464?postPublishedType=initial …,1141830202626138112,2019-06-20,22:08:29,housejudiciary,139,595,680,2019-06-20 22:08:29
"Trump's willingness to again welcome prohibited foreign assistance is indeed shocking. With the 2020 election looming, we must act immediately to respond to the ongoing foreign threats we face, as well as the President’s apparent willingness to accept them.",1141742678373281793,2019-06-20,16:20:41,housejudiciary,129,288,578,2019-06-20 16:20:41
"The President has said he is open to receiving information from a foreign adversary.  In fact, by stating publicly that he would accept help from a foreign government, he may well have encouraged more foreign influence operations against our democracy.",1141735484869226496,2019-06-20,15:52:06,housejudiciary,454,830,2193,2019-06-20 15:52:06
There should be broad consensus that if a political candidate accepts help from a foreign nation—and even welcomes this attack on our democracy—that candidate has fundamentally betrayed the very institutions that he must swear an oath to protect.,1141723881625083905,2019-06-20,15:06:00,housejudiciary,279,905,2469,2019-06-20 15:06:00
Mueller investigated a break-in. The target—a political campaign—was similar to that in Watergate. But the burglar was a hostile foreign nation. The crime was carried out through a hacking operation that stole hundreds of thousands of documents rather than the contents of a safe.,1141720367947534336,2019-06-20,14:52:02,housejudiciary,98,611,1058,2019-06-20 14:52:02
It's Juneteenth: Let's talk about reparations for slavery @CNN https://cnn.it/2MYXzQ2 ,1141485479751245825,2019-06-19,23:18:40,housejudiciary,4,12,36,2019-06-19 23:18:40
"Thank you, @johnlegend for your support of #HR40! American Slavery is our country’s original sin, and reparations is a holistic inquiry to address the gaping wound in the soul of America. pic.twitter.com/PNaS7Zc34g",1141376695372582913,2019-06-19,16:06:24,housejudiciary,290,441,1163,2019-06-19 16:06:24
"#Reparations and HR 40 is ultimately about respect and reconciliation—and the hope that one day, all Americans can walk together toward a more just future. pic.twitter.com/hUo04JG2yd",1141364594004418560,2019-06-19,15:18:19,housejudiciary,23,34,61,2019-06-19 15:18:19
"American Slavery is our country’s original sin and its existence at the birth of our nation is a permanent scar on our country’s founding documents, and on the venerated authors of those documents, and it is a legacy that continued well into the last century. pic.twitter.com/JzQ7SaaJ6G",1141361720612524032,2019-06-19,15:06:54,housejudiciary,10,28,75,2019-06-19 15:06:54
"We marked the 400th anniversary of the first enslaved Africans arriving at the colony of Jamestown, Virginia.  #HR40 gives us the opportunity to reflect on the shameful legacy of slavery and Jim Crow in this country, and to examine how we can best move forward as a nation.",1141359700044374016,2019-06-19,14:58:52,housejudiciary,10,40,71,2019-06-19 14:58:52
HAPPENING TODAY: @HouseJudiciary Committee Holds Historic Hearing on a Path Towards Restorative Justice and #HR40 with @CoryBooker and @mrdannyglover. https://www.youtube.com/watch?v=lfEe1MRxSgI …,1141340813772886017,2019-06-19,13:43:49,housejudiciary,24,44,58,2019-06-19 13:43:49
"H.R. 35 is named in honor of Emmett Till, a 14-year-old African American youth from Chicago who was lynched while visiting an uncle in Mississippi in 1955 in particularly gruesome fashion for allegedly whistling at a white woman.  #EmmettTill https://twitter.com/RepKarenBass/status/1138860439067140096 …",1138930192699863043,2019-06-12,22:04:52,housejudiciary,17,98,191,2019-06-12 22:04:52
"Should there be a privilege or other objection regarding any question, we will attempt to resolve any disagreement while reserving our right to take any & all measures in response to unfounded privilege assertions.  We plan to make the transcript promptly available to the public.",1138921314729828358,2019-06-12,21:29:36,housejudiciary,56,95,312,2019-06-12 21:29:36
"It is important to hear from Hope Hicks, who was a key witness for the Special Counsel.  Ms. Hicks understands that the Committee will be free to pose questions as it sees fit, including about her time on the Trump Campaign and her time in the @WhiteHouse.",1138919767677575169,2019-06-12,21:23:27,housejudiciary,223,266,843,2019-06-12 21:23:27
BREAKING: Chairman @RepJerryNadler Announces Hope Hicks to Appear for June 19 Interview. Former White House Communications Director is the first material witness from the Mueller investigation to appear before the @HouseJudiciary Committee. https://medium.com/@HouseJudDems/chairman-nadler-announces-hope-hicks-to-appear-for-june-19-interview-8b5fba899caf?postPublishedType=initial …,1138918764337086464,2019-06-12,21:19:28,housejudiciary,50,112,275,2019-06-12 21:19:28
"The ‘Emmett Till Antilynching Act,’ is long-overdue legislation that would explicitly designate lynching as a hate crime under federal law. #EmmettTill https://twitter.com/JacksonLeeTX18/status/1138819970463346688 …",1138881148682219521,2019-06-12,18:49:59,housejudiciary,5,50,120,2019-06-12 18:49:59
"We have asked 911 responders and survivors to come to Congress every five years to beg for help. It's time for us to give them peace of mind, once and for all, and pass long-term reauthorization to ensure the VCF will be there for them as long as they need it. #Renew911VCF",1138823666932867072,2019-06-12,15:01:35,housejudiciary,3,85,200,2019-06-12 15:01:35
.@RepJerryNadler: “I refuse to accept that the lives of some responders and survivors are worth more than others. Every sick responder and survivor should be treated with the same dignity and compassion. Congress must act to make that happen.” #Renew911VCF,1138821229417238530,2019-06-12,14:51:54,housejudiciary,7,88,311,2019-06-12 14:51:54
WATCH LIVE: @HouseJudiciary Markup on the “Never Forget the Heroes: Permanent Authorization of the September 11th Victim Compensation Fund Act” #Renew911VCF https://www.youtube.com/watch?v=UcNQLtMxhXg …,1138811668035788800,2019-06-12,14:13:54,housejudiciary,2,16,33,2019-06-12 14:13:54
"WATCH LIVE: Top House Chairs Hold Press Conference after Passage of Civil Enforcement Resolution.
 https://m.facebook.com/HouseJudDems/ ",1138547936768471041,2019-06-11,20:45:55,housejudiciary,3,17,41,2019-06-11 20:45:55
".@realDonaldTrump has vowed to fight all subpoenas. And true to his word, he has blocked key witnesses from testifying before the @HouseJudiciary, including his former @WhiteHouse Counsel, Don McGahn, whose account of the President’s actions was featured in the #MuellerReport.",1138533079025364992,2019-06-11,19:46:53,housejudiciary,134,291,514,2019-06-11 19:46:53
"When a congressional committee issues a subpoena, compliance is not optional.  We expect witnesses to testify when summoned.  We expect the Administration to comply with subpoenas and to provide us with the materials we require to do our jobs.",1138529036647448578,2019-06-11,19:30:49,housejudiciary,555,1616,4555,2019-06-11 19:30:49
HAPPENING AT 4:15 pm EST – Top House Chairs to Hold Press Conference after Passage of Civil Enforcement Resolution. https://medium.com/@HouseJudDems/top-house-chairs-to-hold-press-conference-after-passage-of-civil-enforcement-resolution-43c00bd48a39?postPublishedType=initial …,1138525478053195776,2019-06-11,19:16:41,housejudiciary,6,62,110,2019-06-11 19:16:41
"WATCH IT LIVE: @HouseJudiciary Hearing on Online Platforms and Market Power, Part 1: The Free and Diverse Press. https://www.youtube.com/watch?v=L2u3XidvNEc …",1138502742392131586,2019-06-11,17:46:20,housejudiciary,0,13,23,2019-06-11 17:46:20
".@RepJerryNadler: ""It is my hope, and my sincere wish, that Congress will act swiftly to stop these devastating cuts, to extend this program, and to provide as much peace of mind as we possibly can to those who continue to suffer from the 9/11 attacks. We will #NeverForget.""",1138469499810832391,2019-06-11,15:34:15,housejudiciary,63,337,951,2019-06-11 15:34:15
We must join forces to ensure that the heroes of 9/11 are not abandoned when they need us most. We must protect the heroes and survivors of 9/11. We must pass the “Never Forget the Heroes Act of 2019.” And we will. #renew911vcf pic.twitter.com/yXMzqW8foh,1138465059611598854,2019-06-11,15:16:36,housejudiciary,4,29,68,2019-06-11 15:16:36
"Nearly 11,000 September 11, 2001, responders and survivors have been diagnosed with cancer to date, a number which will only go up. #Renew911VCF",1138463306023350272,2019-06-11,15:09:38,housejudiciary,3,38,58,2019-06-11 15:09:38
"When many of us think of 9/11, we think of planes flying into the Twin Towers or the Towers collapsing.  But there were other pictures that day that captured the gravity of the loss, the scale of the destruction, and the massive amounts of toxins that were released into the air. pic.twitter.com/Qfnv9neNph",1138455151272976386,2019-06-11,14:37:14,housejudiciary,4,46,83,2019-06-11 14:37:14
"On September 11, 2001, Osama bin Laden orchestrated the deadliest terrorist attack in American history, killing almost 3,000 people in a single day and wounding thousands. The attacks created an environmental nightmare when the Twin Towers collapsed in lower Manhattan.",1138453591524630528,2019-06-11,14:31:02,housejudiciary,7,13,36,2019-06-11 14:31:02
HAPPENING TODAY: @HouseJudiciary Chairman @RepJerryNadler Holds Hearing on Renewing the 911 Victims Compensation Fund with @RepMaloney and Jon Stewart. #Renew911VCF https://www.youtube.com/watch?v=NLKWRsDPUlk …,1138444626346598400,2019-06-11,13:55:24,housejudiciary,21,82,208,2019-06-11 13:55:24
This chart highlights quotes from the Mueller Report stating it does not exonerate @realDonaldTrump. #MuellerReportExplained pic.twitter.com/UVYihcJkDB,1138207123714785289,2019-06-10,22:11:39,housejudiciary,26,251,318,2019-06-10 22:11:39
This chart highlights the substantial evidence quotes from the Mueller Report. #MuellerReportExplained pic.twitter.com/M4NZFNc0ig,1138205281383518214,2019-06-10,22:04:20,housejudiciary,13,157,181,2019-06-10 22:04:20
"Row 1 identifies the individuals @realDonaldTrump told to deny facts.

Row 2 identifies the individuals Trump used to fire the Special Counsel or limit the investigation.

Row 3 identifies the witnesses Trump attempted to influence or intimidate.

#MuellerReportExplained pic.twitter.com/0pn12lvclM",1138203276262985728,2019-06-10,21:56:22,housejudiciary,85,973,1057,2019-06-10 21:56:22
"This chart highlights the various people who @realDonaldTrump ordered to in some way interfere with the Special Counsel’s investigation, who refused his orders.  #MuellerReportExplained pic.twitter.com/ZftJxCgE3x",1138200586313248768,2019-06-10,21:45:41,housejudiciary,19,173,197,2019-06-10 21:45:41
"This chart identifies the four individuals—all of whom now pled guilty to federal charges relating to their involvement in the @realDonaldTrump campaign—who Trump attempted to intimidate, influence, or prevent from cooperating. #MuellerReportExplained pic.twitter.com/uaSafwVLaK",1138190748954824704,2019-06-10,21:06:35,housejudiciary,72,1201,2057,2019-06-10 21:06:35
"This chart shows the timeline of @realDonaldTrump efforts to limit the Special Counsel investigation, especially after he knew his own conduct was under investigation. #MuellerReportExplained pic.twitter.com/jPrZuP7JYc",1138183465797660673,2019-06-10,20:37:39,housejudiciary,44,266,318,2019-06-10 20:37:39
This chart shows the timeline of @realDonaldTrump efforts to pressure McGahn to lie or create a false record. #MuellerReportExplained pic.twitter.com/j5nh4wEvL7,1138178635976904708,2019-06-10,20:18:27,housejudiciary,41,694,805,2019-06-10 20:18:27
We were attacked.  We were attacked by a foreign adversary.  President @realDonaldTrump’s campaign took full advantage of the attack when it came.  The descriptions of obstruction of justice in Volume II go to the heart of our legal system.,1138161515822047232,2019-06-10,19:10:26,housejudiciary,221,1950,4635,2019-06-10 19:10:26
"We have an obligation to investigate the deeply troubling evidence outlined by the #MuellerReport—not merely the portions that implicate Russian nationals, but the entire report, including the volume that lays out some of the President’s troubling behavior.",1138154870450589696,2019-06-10,18:44:01,housejudiciary,24,138,312,2019-06-10 18:44:01
"We have a responsibility to follow the facts where they lead, to make recommendations to the whole House as circumstances warrant, and to craft legislation that makes certain no President, Democrat or Republican, can ever act in this way again.",1138152189988429825,2019-06-10,18:33:22,housejudiciary,104,604,1565,2019-06-10 18:33:22
"In the #MuellerReport, the Special Counsel describes ten separate incidents in which the President @realDonaldTrump attempted to change the scope or direction of the investigation, or to end it altogether.",1138148395628015617,2019-06-10,18:18:17,housejudiciary,10,65,138,2019-06-10 18:18:17
"We now know that the Russian government timed their operation to interfere with our election, to harm the candidacy of Secretary Clinton, and to benefit the Trump campaign. 

There can be no question that Congress must investigate this direct attack on our democratic process.",1138147001214918656,2019-06-10,18:12:45,housejudiciary,194,1575,3278,2019-06-10 18:12:45
HAPPENING TODAY: @HouseJudiciary Chairman @RepJerryNadler Holds Hearing on Lessons from the #MuellerReport: Presidential Obstruction and Other Crimes https://www.youtube.com/watch?v=5BrbtP0nP0Y …,1138140641727254528,2019-06-10,17:47:29,housejudiciary,75,366,723,2019-06-10 17:47:29
JUST IN: @HouseJudiciary Chairman @RepJerryNadler Reaches Agreement with @DOJgov for #MuellerReport Evidence of Possible Presidential Obstruction https://medium.com/@HouseJudDems/nadler-reaches-agreement-with-doj-for-mueller-report-evidence-of-possible-presidential-obstruction-788fd1772460?postPublishedType=initial …,1138132239487836160,2019-06-10,17:14:06,housejudiciary,23,107,196,2019-06-10 17:14:06
WATCH the latest hearing from the @HouseJudiciary Committee on the #MuellerReport and read the witness testimonies here: https://judiciary.house.gov/legislation/hearings/lessons-mueller-report-presidential-obstruction-and-other-crimes …,1138131915964375045,2019-06-10,17:12:48,housejudiciary,195,205,296,2019-06-10 17:12:48
Many Republicans said congressional subpoenas were mandatory. Now they suggest they’re optional. https://www.washingtonpost.com/politics/2019/06/07/many-republicans-said-congressional-subpoenas-were-mandatory-now-they-suggest-theyre-optional/?utm_term=.63f508bae3b2 …,1137105184944009218,2019-06-07,21:12:57,housejudiciary,110,307,444,2019-06-07 21:12:57
"BREAKING: @HouseJudiciary Chairman @RepJerryNadler Rejects @DOJgov Demand that House Cancel Contempt Vote Before Resuming Negotiations. The Chairman Urges DOJ to Respond to Earlier Offers, Resume Negotiations without Conditions. https://medium.com/@HouseJudDems/chairman-nadler-rejects-doj-demand-that-house-cancel-contempt-vote-before-resuming-negotiations-bbbd264f3db6 …",1136052847731195911,2019-06-04,23:31:20,housejudiciary,826,2781,8415,2019-06-04 23:31:20
"We must act to ensure that every woman, regardless of state, income, race, or any other factor, retains her constitutional right to access abortion. Women must have the freedom to make decisions about their lives without anyone questioning their intellect, morals, or honesty. pic.twitter.com/3OkREyH3ee",1135949598936248320,2019-06-04,16:41:03,housejudiciary,8,71,195,2019-06-04 16:41:03
Enough is enough.  Congress must now stand up with women and men around the country to say we will not turn back the clock on women’s constitutional rights and women’s autonomy.  #StopTheBans,1135947443059732480,2019-06-04,16:32:29,housejudiciary,21,86,239,2019-06-04 16:32:29
"We will not go backward.  If women cannot make decisions about their reproductive health, they cannot make decisions about starting a career, going to school, opening a business, and planning their lives. #StopTheBans pic.twitter.com/B4N4g94w89",1135945859223490561,2019-06-04,16:26:12,housejudiciary,4,19,47,2019-06-04 16:26:12
"This country has reached a crisis point for women’s constitutional right to control their own bodies and reproductive choices.  States have passed unconstitutional bill after unconstitutional bill imposing new, extreme restrictions on abortion. #StopTheBans",1135938205054844928,2019-06-04,15:55:47,housejudiciary,13,93,222,2019-06-04 15:55:47
HAPPENING TODAY: @HouseJudiciary Holds Hearing on the Threats to Reproductive Rights in America. #StopTheBans https://www.youtube.com/watch?v=skW42K26b90 …,1135908284702035968,2019-06-04,13:56:53,housejudiciary,5,23,63,2019-06-04 13:56:53
".@RepJerryNadler: “Given the growing tide of concentration and consolidation across our economy, it is vital that we investigate the current state of competition in digital markets and the health of the antitrust laws.”",1135667650368024577,2019-06-03,22:00:42,housejudiciary,19,38,100,2019-06-03 22:00:42
NEW: @HouseJudiciary and @JudiciaryGOP Launch Bipartisan Investigation into Competition in Digital Markets. Committee will investigate rise and use of market power online and assess the adequacy of existing antitrust laws and current enforcement levels. https://medium.com/housejudiciary/house-judiciary-committee-launches-bipartisan-investigation-into-competition-in-digital-markets-4b04bfd96dd3 …,1135666059481112577,2019-06-03,21:54:22,housejudiciary,3,26,46,2019-06-03 21:54:22
"No one is above the law. While the @WhiteHouse continues to cover up and stonewall, and to prevent the American people from knowing the truth, we will continue to move forward with our investigation. #MuellerReport",1135631311882870791,2019-06-03,19:36:18,housejudiciary,139,347,921,2019-06-03 19:36:18
"Russia attacked our elections to help @realDonaldTrump win, Trump and his campaign welcomed this help and the President then tried to obstruct the investigation into the attack. Mueller confirmed these revelations and has now left Congress to pick up where he left off.",1135629655443218434,2019-06-03,19:29:43,housejudiciary,320,1030,2668,2019-06-03 19:29:43
JUST IN: @HouseJudiciary to Hold Series of Hearings on #MuellerReport – June 10th Hearing Will Feature Former Nixon @WhiteHouse Counsel John Dean. https://medium.com/@HouseJudDems/house-judiciary-committee-to-hold-series-of-hearings-on-mueller-report-a6121775b07b …,1135628775977345024,2019-06-03,19:26:13,housejudiciary,107,457,874,2019-06-03 19:26:13
"READ: RM @RepJerryNadler floor statement in support of the First Step Act. #cjreform #CriminalJusticeReform
 https://bit.ly/2UXLZVb ",1075799335789584386,2018-12-20,17:05:23,housejudiciary,0,1,4,2018-12-20 17:05:23
