tweet,id,date,time,username,replies_count,retweets_count,likes_count,tdatetime
"Why is impeachment in the Constitution? The Framers feared a president might corrupt our elections by dragging foreign powers into our politics, in order to promote the personal political ambitions of the President above the rule of law. pic.twitter.com/VOwBz7ASkB",1204170184996671488,2019-12-09,22:45:19,housejudiciary,21,306,631,2019-12-09 22:45:19
Rep. Lieu shows how President Trump’s actions undermined the rule of law. No one is above the law. Not even the President. pic.twitter.com/k5nWODX2Ob,1204168741891792898,2019-12-09,22:39:35,housejudiciary,277,1195,3859,2019-12-09 22:39:35
FACT: Withholding military assistance to Ukraine did not serve legitimate U.S. national security interests. pic.twitter.com/lWORKiHZ5U,1204166158351523845,2019-12-09,22:29:19,housejudiciary,16,166,386,2019-12-09 22:29:19
Rep. Jeffries: “The President abused his power. The President must be help accountable. No one is above the law.” pic.twitter.com/oKHhtA4Vh7,1204162692946309120,2019-12-09,22:15:32,housejudiciary,10,53,204,2019-12-09 22:15:32
"Watch: Rep. Richmond puts up the timeline. Just as President Trump called Zelensky, his White House started leveraging $400 million in military aid. pic.twitter.com/QAqdXcKkuY",1204161144602210304,2019-12-09,22:09:23,housejudiciary,28,148,325,2019-12-09 22:09:23
Rep. Deutch walks step by step through President Trump’s use of a White House visit to extract a personal favor from Ukraine. pic.twitter.com/MF64mfFppw,1204159692441821185,2019-12-09,22:03:37,housejudiciary,13,137,321,2019-12-09 22:03:37
"As Rep. Swalwell notes, nobody asks “what did Trump know and when did he know it?” 

He knew everything, he directed everything, he was at the center of everything. pic.twitter.com/2c8SGrpdg7",1204158395844042759,2019-12-09,21:58:28,housejudiciary,932,5569,16129,2019-12-09 21:58:28
"Rep. Bass picks up on the President using the powers of his office – in this case, a meeting at the White House – to pressure a foreign country to investigate his political rival. pic.twitter.com/cZjpDTXDa0",1204156430057721856,2019-12-09,21:50:39,housejudiciary,9,85,174,2019-12-09 21:50:39
"Rep. Jackson-Lee: Are you aware of any witness who testified that investigating the Bidens was an objective of official US policy?
 
Goldman: No it was not before and it was after the call... Every single witness said there’s no factual basis for either of the investigations. pic.twitter.com/FpdjWrSAB2",1204153675058425858,2019-12-09,21:39:42,housejudiciary,17,105,230,2019-12-09 21:39:42
Rep. Johnson walks through the long trail of evidence that the President and his personal lawyer Rudy Giuliani left behind. It’s undisputed and overwhelming. pic.twitter.com/axRd7mkDR9,1204150896638267392,2019-12-09,21:28:40,housejudiciary,10,285,710,2019-12-09 21:28:40
"Rep. Cohen draws the distinction between the national interests and the President’s personal interests.
 
Q: Is there any evidence that the National Security Council wanted an investigation into the Bidens, Burisma, or alleged Ukrainian election interference in 2016?
 
A: No. pic.twitter.com/cYSEWGKokC",1204148204746551296,2019-12-09,21:17:58,housejudiciary,31,409,725,2019-12-09 21:17:58
The facts are uncontested: the President’s pressure campaign to secure politically-motivated investigations to help his 2020 reelection is a serious abuse of power. President Trump is a continuing threat to our elections and the sanctity of our democracy.,1204125157075410945,2019-12-09,19:46:23,housejudiciary,14,52,118,2019-12-09 19:46:23
"The President, his defenders in Congress, and right-wing media will continue to prop up these conspiracy theories to deflect from the President’s misconduct, but we will not be distracted by their baseless allegations.",1204125156035219456,2019-12-09,19:46:23,housejudiciary,1,28,79,2019-12-09 19:46:23
The report affirms that DOJ and FBI had an authorized purpose to conduct temporary surveillance as part of the investigation.,1204125155011842048,2019-12-09,19:46:23,housejudiciary,1,16,29,2019-12-09 19:46:23
"While the IG identified some problems with the FISA applications by lower level individuals, the IG ‘did not find documentary or testimonial evidence of intentional misconduct.’",1204125153862533121,2019-12-09,19:46:22,housejudiciary,1,14,27,2019-12-09 19:46:22
"The truth matters. Russia, not Ukraine, attacked us in 2016. The IG’s report shows that the investigation Special Counsel Mueller took over was not politically motivated and that officials acted appropriately in opening the investigation.",1204125152910434304,2019-12-09,19:46:22,housejudiciary,3,19,35,2019-12-09 19:46:22
"The individuals who pled guilty or who were convicted of criminal acts include President Trump’s national security advisor, his campaign manager, his deputy campaign manager, his foreign policy advisor, his longtime political advisor, and his personal lawyer.",1204125151916367872,2019-12-09,19:46:22,housejudiciary,1,18,31,2019-12-09 19:46:22
"The Special Counsel’s investigation has led to the indictment of 34 people and 3 businesses, 7 guilty pleas, and 5 prison sentences.",1204125150981038081,2019-12-09,19:46:22,housejudiciary,2,19,34,2019-12-09 19:46:22
The evidence uncovered by the Special Counsel’s investigation shows that the Trump campaign was aware of Russia’s interference in the 2016 election and expected it to benefit Donald Trump.,1204125149924089857,2019-12-09,19:46:21,housejudiciary,1,23,36,2019-12-09 19:46:21
"Those discredited conspiracy theories were attempts to deflect from the President’s serious and ongoing misconduct, first urging Russia and now extorting Ukraine into interfering with our elections to benefit himself personally and politically.",1204125148560973824,2019-12-09,19:46:21,housejudiciary,1,20,35,2019-12-09 19:46:21
The report issued today by the Inspector General debunks the conspiracy theories about the Mueller report and the Russia investigation that President Trump and Republicans in Congress have pushed for years.,1204125147160035328,2019-12-09,19:46:21,housejudiciary,1,26,42,2019-12-09 19:46:21
JUST IN: Nadler and Maloney Issue Statement on Department of Justice Inspector General Report https://medium.com/housejudiciary/nadler-and-maloney-issue-statement-on-department-of-justice-inspector-general-report-9aea37f59ffd …,1204125146077896704,2019-12-09,19:46:21,housejudiciary,8,114,175,2019-12-09 19:46:21
When someone is offering an excuse that is not true. It is not consistent with the evidence. It does not make sense. It cannot be squared with what the facts show. These excuses – do NOT make sense. pic.twitter.com/1q6Ha1vZX5,1204112755109908480,2019-12-09,18:57:06,housejudiciary,47,422,884,2019-12-09 18:57:06
"Barry Berke asks the Republican presenter what the following phrases in the July 25th transcript mean:
 
“Biden’s son”
 
“Biden”
 
“Whatever you can do”
 
“If you can look into it” pic.twitter.com/4YNAiPVegM",1204106759100604416,2019-12-09,18:33:17,housejudiciary,19,215,473,2019-12-09 18:33:17
"Goldman on the July 25th call: “During this call with the Ukrainian leader, President Trump did not discuss matters of importance to the United States… instead he veered quickly into the personal ‘favor’…two investigations that would help President Trump’s re-election efforts.” pic.twitter.com/eq19mB5IPD",1204083912546369541,2019-12-09,17:02:30,housejudiciary,12,155,308,2019-12-09 17:02:30
Barry Berke: “My son. Our children – our grandchildren. They will study this moment in history. … History. Future generations. Will be the judge.” #DefendOurDemocracy pic.twitter.com/5b3spiyPjD,1204081689359736832,2019-12-09,16:53:40,housejudiciary,34,357,1274,2019-12-09 16:53:40
"That President Trump again invited foreign interference in our elections after he was caught shows the risk of what will happen if Congress does not act.

Trump believes he can put his personal, political interests over the nation's interest. He believes he is above the law. pic.twitter.com/k1t7GVIoA4",1204079199595696128,2019-12-09,16:43:46,housejudiciary,24,353,675,2019-12-09 16:43:46
"""Pres. Trump himself has obstructed the investigation. He has directed his most senior aides ... not to come testify, to defy subpoenas. He has told every one of his agencies ... not to produce records to us."" - Barry Berke
 
No one is above the law. pic.twitter.com/myzZkU2pRd",1204075313661128704,2019-12-09,16:28:20,housejudiciary,56,1078,2288,2019-12-09 16:28:20
When someone is offering an excuse that is not true. It is not consistent with the evidence. It does not make sense. It cannot be squared with what the facts show. These excuses – do NOT make sense. pic.twitter.com/bjfl1cnQjC,1204074062584127489,2019-12-09,16:23:21,housejudiciary,5,98,213,2019-12-09 16:23:21
"Barry Berke: “President Trump’s actions are impeachable offenses. They threaten our rule of law. They threaten our institutions. And as James Madison warned us, they threaten our republic.” pic.twitter.com/0cQ5VDN9bD",1204071107470471169,2019-12-09,16:11:37,housejudiciary,21,285,589,2019-12-09 16:11:37
"Berke: ""To quote Amb. Taylor, the US had supported Ukraine & approved military aid for Ukraine because it affects our national interests 'very directly.' So when Pres. Trump withheld that aid for his own personal reason, as he did, he was hurting our country's national interest."" pic.twitter.com/Igqt6wp12O",1204066698707558401,2019-12-09,15:54:06,housejudiciary,20,245,534,2019-12-09 15:54:06
"Barry Berke: ""It is not a requirement that the President be a good person… But the very document that created the awesome presidency and its powers that we have, made it clear it is a requirement that that the President be a person who does not abuse his power."" pic.twitter.com/MHDAd4HfIs",1204059411284725760,2019-12-09,15:25:08,housejudiciary,43,720,1732,2019-12-09 15:25:08
"Any one of these violations of the public trust would compel the members of this Committee to take action. When combined in a single course of conduct, they state the strongest possible case for impeachment and removal from office. President Trump put himself before country. pic.twitter.com/UI3N4LArQw",1204056405344489472,2019-12-09,15:13:11,housejudiciary,752,1248,2984,2019-12-09 15:13:11
The Founders were most concerned about the A-B-Cs of potential abuses to make sure a president could not abuse his power by putting his interests over the country. pic.twitter.com/OvqlLw2rXo,1204054272939307009,2019-12-09,15:04:43,housejudiciary,54,203,352,2019-12-09 15:04:43
"The Founders determined that if the President commits a grave offense against the interest of this nation – an offense known as a high crime and misdemeanor, then the House of Representatives should impeach that president.",1204049883000426496,2019-12-09,14:47:16,housejudiciary,15,107,296,2019-12-09 14:47:16
"The Founding Fathers had experienced the abuses of King George of England who they had just won their independence from. 

They wanted to ensure the Constitution provided a way to remove a president who was placing his own interest above the people he was elected to represent.",1204049276235587591,2019-12-09,14:44:52,housejudiciary,6,79,198,2019-12-09 14:44:52
The Founders were very concerned about making sure the powerful presidency they were creating in the constitution did not fall into the hands of someone who would try to take advantage of that position for his or her personal gain at the expense of our country.,1204048497764421632,2019-12-09,14:41:46,housejudiciary,20,225,497,2019-12-09 14:41:46
"The integrity of our next election is at stake. 

Nothing could be more urgent. 

#DefendOurDemocracy pic.twitter.com/vp0cRkKAOS",1204048266117230592,2019-12-09,14:40:51,housejudiciary,431,332,969,2019-12-09 14:40:51
"The evidence shows that Donald J. Trump, the President of the United States, has put himself before his country.",1204046152372572161,2019-12-09,14:32:27,housejudiciary,12,130,409,2019-12-09 14:32:27
in apparent attempt to gin up the same so-called “favors” that brought us here today and forced Congress to consider the impeachment of a sitting President.,1204045657092300800,2019-12-09,14:30:29,housejudiciary,4,46,145,2019-12-09 14:30:29
"If you do not believe that he will do it again, let me remind you that the President’s personal lawyer, Rudy Giuliani, spent last week back in Ukraine, meeting with government officials ...",1204045656001777664,2019-12-09,14:30:29,housejudiciary,14,358,765,2019-12-09 14:30:29
The integrity of our next election is at stake. Nothing could be more urgent. The President welcomed foreign interference in our elections in 2016.  He demanded it in 2020.  Then he got caught.  #DefendOurDemocracy,1204045254485270529,2019-12-09,14:28:53,housejudiciary,18,89,217,2019-12-09 14:28:53
"When combined in a single course of conduct, they state the strongest possible case for impeachment and removal from office.",1204044418757603328,2019-12-09,14:25:34,housejudiciary,3,24,67,2019-12-09 14:25:34
"The debates around the Framing make clear that the most serious such offenses include abuse of power, betrayal of the nation through foreign entanglements, and corruption of public office. Any one of these violations of the public trust would compel this Committee to take action.",1204044417805496324,2019-12-09,14:25:33,housejudiciary,3,42,105,2019-12-09 14:25:33
"They also knew that they could not anticipate every threat a President might someday pose, so they adopted the phrase “treason, bribery, and other high crimes and misdemeanors” to capture the full spectrum of possible Presidential misconduct.",1204043766828589056,2019-12-09,14:22:58,housejudiciary,3,92,251,2019-12-09 14:22:58
"They warned us against the dangers of would-be monarchs, fake populists, and charismatic demagogues.  They knew that the most dangerous threat to our country might come from within in the form of a corrupt executive who put his private interests above the interests of the nation.",1204043184470396928,2019-12-09,14:20:39,housejudiciary,29,437,1092,2019-12-09 14:20:39
The Framers of the Constitution were careful students of history and clear in their vision for our new nation.  They knew that threats to democracy can take many forms and that we must protect against them.,1204042486185963521,2019-12-09,14:17:53,housejudiciary,11,101,220,2019-12-09 14:17:53
"No matter his party or his politics, if the President places his own interests above those of the country, he betrays his oath of office. If he puts himself before the country, he violates a President’s most basic responsibility.  He breaks his oath to the American people.",1204041960266317824,2019-12-09,14:15:48,housejudiciary,38,333,918,2019-12-09 14:15:48
WATCH IT LIVE: @HouseJudiciary Committee Holds Hearing on The Impeachment Inquiry into President Donald J. Trump. #DefendOurDemocracy https://twitter.com/i/broadcasts/1MYxNPdQpXRGw …,1204037312553914369,2019-12-09,13:57:19,housejudiciary,202,265,418,2019-12-09 13:57:19
JUST IN: @HouseJudiciary Chairman @RepJerryNadler Sends Letter to White House Regarding Impeachment Inquiry https://medium.com/housejudiciary/chairman-nadler-sends-letter-to-white-house-regarding-impeachment-inquiry-980bb62c821?postPublishedType=initial …,1203896771723829248,2019-12-09,04:38:52,housejudiciary,12,459,786,2019-12-09 04:38:52
"TOMORROW: 9 am EST – The @HouseJudiciary Committee Holds Hearing on The Impeachment Inquiry into President Donald J. Trump. #DefendOurDemocracy 

Watch it live here: https://www.youtube.com/watch?v=ZtuIqgqXZCE …",1203841835963158529,2019-12-09,01:00:34,housejudiciary,39,347,600,2019-12-09 01:00:34
"President Trump’s actions were exactly what America’s founders were concerned about. 

No one is above the law. 

Not even the President. 

#DefendOurDemocracy pic.twitter.com/PX4mTpNd3S",1203690815832375296,2019-12-08,15:00:28,housejudiciary,1833,4356,10265,2019-12-08 15:00:28
"NEW: @HouseJudiciary Hearing to Receive Counsel Presentations of Evidence in the Impeachment Inquiry of President Donald Trump
 https://judiciary.house.gov/news/press-releases/monday-house-judiciary-hearing-receive-counsel-presentations-evidence … pic.twitter.com/fU6hxvHjMD",1203401475407450118,2019-12-07,19:50:44,housejudiciary,19,74,166,2019-12-07 19:50:44
"The consideration of articles of impeachment is always a sad and solemn undertaking. In the end, it is the House—speaking for the Nation as a whole—that must decide whether the President’s conduct rises to the level of “high Crimes and Misdemeanors” warranting impeachment.",1203372513822232576,2019-12-07,17:55:39,housejudiciary,16,68,177,2019-12-07 17:55:39
"Impeachment is the House’s last and most extraordinary resort when faced with a President who threatens our constitutional system. It is a terrible power, but only ‘because it was forged to counter a terrible power: the despot who deems himself to be above the law.’",1203372362051334144,2019-12-07,17:55:03,housejudiciary,30,223,531,2019-12-07 17:55:03
"As Madison recognized, ‘In framing a government which is to be administered by men over men, the great difficulty lies in this: You must first enable the government to control the governed; and in the next place oblige it control itself.’",1203371893732073472,2019-12-07,17:53:11,housejudiciary,0,34,80,2019-12-07 17:53:11
The American people choose their leaders; a President who wields power to destroy opponents or manipulate elections is a President who rejects democracy itself.,1203371839692693506,2019-12-07,17:52:58,housejudiciary,5,71,151,2019-12-07 17:52:58
"Any one of these violations of the public trust is impeachable. When combined in a scheme to advance the President’s personal interests while ignoring or injuring the Constitution, they state the strongest possible case for impeachment and removal from office.",1203370744018849798,2019-12-07,17:48:37,housejudiciary,14,132,285,2019-12-07 17:48:37
"Where the President engages in serious abuse of power, betrays the national interest through foreign entanglements, or corrupts his office or elections, he has undoubtedly committed ‘high Crimes and Misdemeanors’ as understood by the Framers.",1203369541914517504,2019-12-07,17:43:50,housejudiciary,21,129,338,2019-12-07 17:43:50
"The Framers principally aimed the impeachment power at a few core evils, each grounded in a unifying fear that a President might abandon his duty to faithfully execute the laws.",1203368246143078400,2019-12-07,17:38:42,housejudiciary,8,43,120,2019-12-07 17:38:42
Impeachment is the Constitution’s final answer to a President who mistakes himself for a monarch.,1203367430816489472,2019-12-07,17:35:27,housejudiciary,31,555,1752,2019-12-07 17:35:27
"The Constitution details only one remedy for this misconduct: impeachment. The safety and security of our nation, our democracy, and future generations hang in the balance if we do not address this misconduct. In America, no one is above the law, not even the President.",1203366930364715008,2019-12-07,17:33:28,housejudiciary,17,151,370,2019-12-07 17:33:28
"The Framers worst nightmare is what we are facing in this very moment. 

President Trump abused his power, betrayed our national security, and corrupted our elections, all for personal gain.",1203365726112952323,2019-12-07,17:28:41,housejudiciary,23,251,651,2019-12-07 17:28:41
BREAKING: @HouseJudiciary Committee Releases Staff Report on Constitutional Grounds for Impeachment https://medium.com/housejudiciary/house-judiciary-committee-releases-staff-report-on-constitutional-grounds-for-impeachment-feca54ccc7c …,1203365356477276160,2019-12-07,17:27:13,housejudiciary,106,1668,2844,2019-12-07 17:27:13
The President’s failure will not prevent us from carrying out our solemn constitutional duty.,1203106417772810241,2019-12-07,00:18:17,housejudiciary,33,173,651,2019-12-07 00:18:17
"If the President has no good response to the allegations, then he would not want to appear before the Committee.  

Having declined this opportunity, he cannot claim that the process is unfair.",1203104732623097857,2019-12-07,00:11:35,housejudiciary,81,811,3149,2019-12-07 00:11:35
"We are disappointed that the President has once again failed to provide those answers here.  

We gave President Trump a fair opportunity to question witnesses and present his own to address the overwhelming evidence before us.",1203102674436145153,2019-12-07,00:03:24,housejudiciary,20,221,676,2019-12-07 00:03:24
"The American people deserve answers from President Trump.  

The House invited, and then subpoenaed, his top advisors.  

The President ordered them not to show and continues to block key evidence from Congress.",1203101533862273025,2019-12-06,23:58:52,housejudiciary,38,260,710,2019-12-06 23:58:52
BREAKING: @HouseJudiciary Chairman @RepJerryNadler Statement on White House Refusal to Participate in House Impeachment Inquiry https://medium.com/housejudiciary/chairman-nadler-statement-on-white-house-refusal-to-participate-in-house-impeachment-inquiry-bb20f85e7420 …,1203100188111495168,2019-12-06,23:53:32,housejudiciary,16,82,158,2019-12-06 23:53:32
NEW: @HouseJudiciary to Hold Hearing to Receive Counsel Presentations of Evidence in the Impeachment Inquiry of President Donald Trump - MONDAY December 9 - 9 am EST https://medium.com/housejudiciary/monday-notice-judiciary-committee-to-hold-hearing-to-receive-counsel-presentations-of-evidence-in-9328f47de634 …,1202626433966841857,2019-12-05,16:31:00,housejudiciary,16,215,398,2019-12-05 16:31:00
.@RepDMP brings out the videos of President Trump and Mick Mulvaney’s confessions: pic.twitter.com/RThwuYKnXp,1202377467882811392,2019-12-05,00:01:42,housejudiciary,17,208,485,2019-12-05 00:01:42
No one is above the law. Not even the President. pic.twitter.com/ppoye25OvK,1202367858556198913,2019-12-04,23:23:31,housejudiciary,36,712,1869,2019-12-04 23:23:31
"From the founding of our country to today, one truth remains clear:  the impeachment power is reserved for conduct that endangers democracy and imperils our Constitution.",1202365807042453506,2019-12-04,23:15:21,housejudiciary,18,122,330,2019-12-04 23:15:21
"Just one week after the transcript of the July 25 call was released, this is what the President said when a reporter asked him what he wanted from President Zelensky: pic.twitter.com/QwpSLOk7Wz",1202365493295882240,2019-12-04,23:14:07,housejudiciary,49,411,602,2019-12-04 23:14:07
The President’s actions and behaviors do matter. The President’s obstruction of justice matters.  The President’s apparent abuse of power matters.  A fundamental principle of our democratic system is that no one is above the law—not even the President.,1202358255491731459,2019-12-04,22:45:21,housejudiciary,16,147,347,2019-12-04 22:45:21
The President’s obstruction of Congress has been occurring since March when we initially began investigating the President’s misconduct in relation to the Special Counsel’s investigation. There is pattern of behavior we are seeing exhibited by the President. pic.twitter.com/vzrslTgm1R,1202357370426470403,2019-12-04,22:41:50,housejudiciary,47,422,717,2019-12-04 22:41:50
"The President welcomed election interference by Russia. He publicly said he would do it again. And then he did it again when he demanded election interference by Ukraine. And throughout, there is evidence the President has tried to cover it up.",1202355941951324160,2019-12-04,22:36:09,housejudiciary,23,255,575,2019-12-04 22:36:09
No one is above the law. Not even the President. pic.twitter.com/BmZkptnSCE,1202354467980693504,2019-12-04,22:30:18,housejudiciary,10,42,110,2019-12-04 22:30:18
"If we let the President be above the law – If we let him abuse and disregard Congress, the one constitutional check placed against the President, the one constitutional check preventing a President from becoming a king, then we lose who we are as a country.",1202353672384106498,2019-12-04,22:27:08,housejudiciary,20,195,499,2019-12-04 22:27:08
"The President said that he’s above the law – that Article II allows him to do quote “whatever he wants.”  That can’t be true.  As Judge Jackson said, “no one is above the law.” pic.twitter.com/pXGQGbETAh",1202353392036798464,2019-12-04,22:26:01,housejudiciary,10,155,350,2019-12-04 22:26:01
"The President’s direction, more than a dozen members of the administration have defied congressional subpoenas.  The following slide lists those who have refused to comply at the President’s direction: pic.twitter.com/I1AseFnkSN",1202351809546932224,2019-12-04,22:19:44,housejudiciary,109,975,1065,2019-12-04 22:19:44
The President has suggested that he is above the law.  The President has said that he cannot be prosecuted for criminal conduct.  The President has said that he need not comply with Congressional requests and subpoenas. No one is above the law. Not even the President.,1202351111287562240,2019-12-04,22:16:58,housejudiciary,76,533,1425,2019-12-04 22:16:58
"If we don’t stand up now to a corrupt president, we risk sending a message to all future presidents that they can put their own personal, political interests ahead of the American people and our national security.",1202350606914138112,2019-12-04,22:14:57,housejudiciary,41,246,829,2019-12-04 22:14:57
"Tom Paine said that in the monarchies, the King is Law, but in the Democracies the Law is King.  

We have no Kings here and none of us is above the law.",1202348847571361793,2019-12-04,22:07:58,housejudiciary,45,238,688,2019-12-04 22:07:58
