tweet,id,date,time,username,replies_count,retweets_count,likes_count
It’s why I voted last week to send $4.6 billion in emergency humanitarian assistance to ensure better care and more timely processing for migrants — especially families and children — detained at our Southern Border. https://www.carper.senate.gov/public/index.cfm/2019/6/carper-supports-bipartisan-bill-to-provide-much-needed-humanitarian-aid-for-migrant-families-children …,1147146839046721537,2019-07-05,14:14:54,senatorcarper,10,8,13
"Every major religion has a form of the Golden Rule — to treat others the way we want to be treated. Mistreatment of migrants and the poor conditions in which they are living is not in keeping with our values as a nation, let alone our moral obligation to care for our fellow man. https://twitter.com/rollcall/status/1146901568165490689 …",1147146091412033537,2019-07-05,14:11:55,senatorcarper,15,18,54
"Independence Day also reminds me of the work we have ahead of us to make our nation a more perfect union. We can, and always should, strive to do better. But today, we celebrate the great progress we have made and our brave service members who dedicated their lives to get us here",1146861778565046272,2019-07-04,19:22:10,senatorcarper,2,6,16
"But on this Independence Day, between all of the festivities, we should also take a moment and recognize the brave men and women of our armed forces who have fought for the freedoms we enjoy today. #4thofJuly",1146861616811642880,2019-07-04,19:21:31,senatorcarper,2,5,14
"The celebration of our nation’s birthday is one of my favorite holidays because we get to celebrate it with friends, family and our fellow Americans. Today, I was glad to be with so many fellow Delawareans at the Smyrna-Clayton, Bethany Beach and Hockessin parades. #4thofJuly",1146861444123758592,2019-07-04,19:20:50,senatorcarper,5,5,24
"Back in 1776, our Founding Fathers argued about many things. But there was one thing they agreed on – they didn't want an all-powerful king. It’s important to not lose sight of that as we celebrate the birth of a system created of the people, by the people and for the people.",1146482441827377153,2019-07-03,18:14:49,senatorcarper,5,17,30
"Celebrating our nation’s birthday is not about one person or party. It’s about honoring the values we all hold dear as Americans and the brave men and women who have, for generations, risked their lives to protect the freedoms we enjoy today. https://twitter.com/CNNPolitics/status/1146479290122473472 …",1146481880730087424,2019-07-03,18:12:35,senatorcarper,6,12,29
I’m on @wdel with Mark Fowser this morning. Tune in! pic.twitter.com/PuEgjbkECy – at WSTW 93.7 / WDEL 101.7 & 1150,1146409470949515264,2019-07-03,13:24:51,senatorcarper,3,5,6
"I’ve said from the start that @realDonaldTrump’s pursuit to add a #CitizenshipQuestion to the #2020Census was troubling, legally questionable and threatened its accuracy. Taking the idea off the table is the right thing to do, but it shouldn’t have been pursued in the first place https://twitter.com/nytimes/status/1146162641007710210 …",1146182928591917056,2019-07-02,22:24:39,senatorcarper,9,5,28
"Yesterday, I joined Delawareans who stepped up in a big way to help lift up our neighbors. Together, we cut the ribbon to officially open Dover Interfaith Mission's new housing facility that will provide a second chance to some of our most vulnerable community members. pic.twitter.com/Mql03zRASc",1146135843553382401,2019-07-02,19:17:33,senatorcarper,0,6,23
Great to see Governor @JohnCarneyDE taking another step to help Delaware lead on climate change. Eliminating HFCs – supported by Republicans and Democrats alike – would cut down on a potent greenhouse gas and help American companies export innovation https://news.delaware.gov/2019/06/30/delaware-to-eliminate-hfcs-to-confront-climate-change/ …,1146055348895268866,2019-07-02,13:57:42,senatorcarper,2,9,17
"Today at @westsidehealth, I joined Delaware doctors, health care leaders, and brave patients with pre-existing conditions to tell the Trump Administration that enough is enough. We won't stand for continued attacks on the life-saving care on which millions depend. #ProtectOurCare pic.twitter.com/uwFpgrume1",1145781985568333825,2019-07-01,19:51:27,senatorcarper,6,11,21
"If Republicans get their way in this lawsuit, the entire Affordable Care Act would be invalidated. That includes critical protections for nearly 400,000 Delawareans, and 133 million Americans, living with pre-existing conditions. pic.twitter.com/s8Trna2Jqd",1145781974923186178,2019-07-01,19:51:25,senatorcarper,2,20,21
"Make no mistake: the Trump Administration is working overtime to take away millions of Americans' health care coverage. Next week, oral arguments  will begin in a lawsuit brought by 18 Republican Attorneys General and Governors to completely eliminate the #ACA.",1145781959974633472,2019-07-01,19:51:21,senatorcarper,32,144,166
