tweet,id,date,time,username,replies_count,retweets_count,likes_count
"We MUST continue this impeachment inquiry and shine a light on what is happening for all to see. It is our Constitutional responsibility, and I pray for our nation.",1180183811147157504,2019-10-04,18:12:01,janschakowsky,11,15,64
"... and the President’s personal attorney, Rudy Giuliani, knew what was happening here.",1180183809381294080,2019-10-04,18:12:01,janschakowsky,2,6,30
"These texts reveal that at minimum, the President, Vice President, Secretary of State, National Security Advisor, Acting White House Chief of Staff, Acting Ambassador to Ukraine, Ambassador to the EU, Special Representative for Ukraine Negotiations...",1180183807988776961,2019-10-04,18:12:01,janschakowsky,2,3,11
"Basic fact we all must remember no matter our political affiliation: It is illegal, unprecedented, unethical and immoral to ask a foreign nation to involve itself in the American democratic process.",1180183806717972480,2019-10-04,18:12:00,janschakowsky,2,2,17
"Also, the same Administration that ran on Hillary Clinton’s private emails has been caught red handed using an encrypted text message service – WhatsApp – to conceal their communications outside of official government channels as is required by standing policy.",1180183805199552513,2019-10-04,18:12:00,janschakowsky,1,4,17
"Special Representative for Ukraine Negotiations, Ambassador Kurt Volker, recently resigned from the State Department and turned over these messages. He knows where this is going and is trying to get out of the way.",1180183803974881280,2019-10-04,18:12:00,janschakowsky,1,2,13
"Question: Why was Trump political appointee, Ambassador to the EU Gordon Sondland, involved in this at all? Ukraine is not a member of the European Union.",1180183802334851072,2019-10-04,18:11:59,janschakowsky,2,3,15
"Distinguished career diplomat, Ambassador Bill Taylor, wrote at the time, “As I said on the phone, I think it’s crazy to withhold security assistance for help with a political campaign.”",1180183800300605440,2019-10-04,18:11:59,janschakowsky,1,5,16
The threat to Ukraine from Russia is real – Russia has invaded its territory and poses an existential threat to its existence.,1180183798673281028,2019-10-04,18:11:59,janschakowsky,1,4,19
THREAD - To My Constituents: Take a moment to read the communications between State Department employees verifying they knew Trump was trying to withhold essential security aid to Ukraine in exchange for help with his reelection. https://www.washingtonpost.com/context/read-the-documents-house-democrats-letter-on-state-department-texts/2b855855-423b-48e7-b2cf-b67c3440e283/ …,1180183795405873152,2019-10-04,18:11:58,janschakowsky,8,33,69
ALERT: the Kavanaugh Court has taken up a case that would unconstitutionally restrict access to abortion care. Are you ready for the fight? #MyRightMyDecision https://www.politico.com/news/2019/10/04/supreme-court-review-louisiana-abortion-restrictions-000275 …,1180162037504253952,2019-10-04,16:45:30,janschakowsky,5,30,61
"My heart goes out to his wife Marsha, and I wish them all peace and joy in his memory.",1179858961689911301,2019-10-03,20:41:11,janschakowsky,0,2,8
"Sending my condolences and love to the Emanuel family on the loss of Dr. Benjamin Emanuel. He was a much beloved pediatrician and the father of four remarkable children, including my long-time friend Rahm.",1179858959936540672,2019-10-03,20:41:11,janschakowsky,1,5,21
"At today’s @EnergyCommerce hearing, I asked our expert panel of witnesses about how we can use trauma-informed and culturally competent care to address racial disparities in the chronic disease of #gunviolence. pic.twitter.com/JEkClXDSmo",1179839370599321603,2019-10-03,19:23:20,janschakowsky,1,6,18
"This is a crisis! It demands a sense of urgency.....We have good laws in Chicago and in Illinois, but 60% of the guns that come into our state come from other states. You can go to a gun show in Indiana and load up your trunk with weapons. That is why we need a federal solution. pic.twitter.com/AZAac7IlFF",1179835866396663811,2019-10-03,19:09:25,janschakowsky,9,23,69
"Great discussion today at this important field hearing on gun violence and the public health impacts, here on Chicago’s south side. pic.twitter.com/qCtHgAEfnQ – at Kennedy-King College",1179789259995267073,2019-10-03,16:04:13,janschakowsky,3,11,26
"If you want to follow along with the hearing, it is being live streamed on YouTube. Please join us for this important hearing examining the public health impacts of gun violence. https://twitter.com/EnergyCommerce/status/1179764289629913088 …",1179768305122496517,2019-10-03,14:40:57,janschakowsky,4,15,30
Tune into @MSNBC - I’ll be joining @AriMelber at the top of the hour (5pm CST) pic.twitter.com/r18H0639nZ – at NBC Studios,1179516325548482565,2019-10-02,21:59:41,janschakowsky,1,6,16
"Great to spend this afternoon at the IL Alliance for Retired Americans Senior Power Lunch. I talked about @HouseDemocrats plans to negotiate lower drug prices for seniors & retirees and introduced my friend @RepUnderwood as the 2019 Jerry Prete Award Winner. Congrats, Lauren! pic.twitter.com/Jd5IlVEIdu – at SEIU HCII",1179486369086873600,2019-10-02,20:00:38,janschakowsky,0,2,14
Today we broke ground on a historic $1B infrastructure and mass transit upgrade for the Red & Purple lines that serve so many in my district! pic.twitter.com/W21ISV17aW,1179477451413639174,2019-10-02,19:25:12,janschakowsky,1,2,33
"Exhibit A in showing how Senate inaction has real world consequences on Americans’ everyday lives. 

It’s still #YourMoveMitch. https://www.washingtonpost.com/technology/2019/10/01/appeals-court-upholds-trump-administrations-cancelling-net-neutrality-rules/ …",1179138471543357440,2019-10-01,20:58:13,janschakowsky,1,4,16
"In April, @HouseDemocrats voted to restore the free and open internet Americans want; unfortunately, because of Senate Republicans’ do-nothing strategy, an appeals court has rubber stamped the Trump Administration’s attack on a free and open internet.",1179138470838710273,2019-10-01,20:58:13,janschakowsky,3,13,33
Looking forward to participating in this critical hearing in our Chicagoland on Thursday. This nation’s gun violence epidemic is a chronic disease. We must address the issue through a public health lens and protect the human right to live in a safe and healthy community. https://twitter.com/EnergyCommerce/status/1178682429466464261 …,1179038958740594694,2019-10-01,14:22:47,janschakowsky,6,7,15
"In 2015, @RepBarbaraLee & I co-authored the #EACHWoman Act to lift bans on abortion coverage & stop political interference in personal health care decisions. After 43 years of the Hyde Amendment, we must stand for our rights and our dignity and pass this bill. #BeBoldEndHyde",1179035252133629953,2019-10-01,14:08:04,janschakowsky,6,22,114
