tweet,id,date,time,username,replies_count,retweets_count,likes_count
Glad to see Wizard Rock returned to its place in @PrescottNF after a most impressive disappearance. https://www.azcentral.com/story/travel/arizona/2019/11/01/arizona-stolen-boulder-returned-prescott-national-forest-wizard-rock/4125722002/ …,1191901263098793989,2019-11-06,02:13:00,senmcsallyaz,44,10,67
"So many veterans come back from war with invisible wounds. Today, I introduced legislation to expand access to veteran treatment courts that are successfully helping our veterans get the care they need and get them back on track. 
  http://bit.ly/2JU54UB ",1191872070910504960,2019-11-06,00:17:00,senmcsallyaz,42,26,162
"It’s my job to be a voice for Arizona. Tomorrow, I'm hosting a telephone town hall at 6:00PM AZ to hear about issues impacting your family and take your questions. I hope you’ll join the conversation by calling 855-531-1067. pic.twitter.com/vzwW0u2n3M",1191856169993814016,2019-11-05,23:13:49,senmcsallyaz,122,38,157
Absolutely horrific news out of Sonora. These cowardly acts killing innocent families are despicable and barbaric. The Mexican government must step up to stop this senseless violence and hold killers accountable. My heart and prayers are with the victims’ families.,1191727146462597123,2019-11-05,14:41:07,senmcsallyaz,66,69,337
".@UArizona offers incredible opportunities for servicemembers, veterans and military families to study. https://uanews.arizona.edu/story/uarizona-jumps-top-20-best-vets-ranking?fbclid=IwAR2HP1n5pcIK9T_acCI6sj6J_idqRckiQw48lrfPnlaNp-rXSi5tKe6Pvj4 …",1191531138700992513,2019-11-05,01:42:15,senmcsallyaz,19,8,53
"Arizona researchers are making important advances in the fight against Alzheimer’s disease. Last week, I held a Senate hearing in Scottsdale to get the perspective of Arizona researchers and caregivers. https://kjzz.org/content/1282816/mcsally-holds-hearing-impact-alzheimers-arizonans …",1191505628512034816,2019-11-05,00:00:53,senmcsallyaz,34,19,101
Excessively long loan processing times are keeping Native American families from becoming homeowners. I introduced legislation to streamline the process.,1191086141945942016,2019-11-03,20:14:00,senmcsallyaz,57,35,138
"Yesterday, Chandler's VFW Post 7401 was renamed for a true patriot, John S. McCain. There is no one more deserving of this honor, and I was honored to take part in this Arizona tribute to a life so well lived. pic.twitter.com/kjZzsRsA9U",1191032157218787330,2019-11-03,16:39:29,senmcsallyaz,78,19,130
It’s time our trade agreements took into account growing digital trade. Great op-ed by Michael Beckerman of @InternetAssn in Grand Canyon Times on why Arizona needs the USMCA. http://bit.ly/2qXrLAm ,1190772575791501313,2019-11-02,23:28:00,senmcsallyaz,47,14,47
"Trade in tomatoes from Mexico supports around 33,000 American jobs and contributes millions of dollars to the economy of Arizona. I will continue to fight on behalf of Arizonans for duty-free trade in tomatoes. https://chamberbusinessnews.com/2019/10/31/arizona-congressional-delegation-advocates-duty-free-importation-of-mexican-tomatoes/ …",1190738853650264065,2019-11-02,21:14:00,senmcsallyaz,80,24,119
Congratulations to Tucson wrestler Audrey Jimenez who is representing Team USA at the Pan-American Games this month! She is breaking the mold and inspiring women around the world with her courage and determination. https://tucson.com/sports/local/she-s-special-meet-the--pound-middle-school-wrestler/article_ce8c9958-67a4-5a27-9e2b-0ea4dbac4a9d.html …,1190408099976355842,2019-11-01,23:19:42,senmcsallyaz,55,17,69
"Our economy continues to grow, adding 128,000 jobs in October. https://www.marketwatch.com/story/us-adds-128000-new-jobs-in-october-in-stronger-than-expected-employment-report-2019-11-01 …",1190388942606143488,2019-11-01,22:03:34,senmcsallyaz,159,109,571
Took today’s @SenateAging hearing on the road! Grateful to have @SenatorCollins join me in Scottsdale to learn more about the impact of Alzheimer’s on Arizona families. pic.twitter.com/3zi6b4iIeL,1190337231996772352,2019-11-01,18:38:06,senmcsallyaz,63,12,56
