tweet,id,date,time,username,replies_count,retweets_count,likes_count
"First game of the season tonight, Devils! #ForksUp #SunDevilTough #GoDevils pic.twitter.com/KeY05sxiVq",1167167069319815169,2019-08-29,20:08:08,repgregstanton,1,1,7
"I'm proud of @MayorGallego and the broad, bipartisan coalition of business and labor leaders, neighborhood groups, nonprofits, and volunteers who helped defend Phoenix's future. The nation is indeed taking note, and we will continue to lead on transportation and infrastructure.",1167109898666033152,2019-08-29,16:20:58,repgregstanton,2,0,12
"On Tuesday, Phoenix voters spoke once again, loud and clear: Keep investing in public transit. Since light rail opened 10 years ago, it’s exceeded our expectations and brought $11 billion ininvestment along the line—it's been a resounding success, and it's here to stay. pic.twitter.com/816U3W6VGh",1167109896661274624,2019-08-29,16:20:57,repgregstanton,3,1,29
"Trade with Mexico is essential for Arizona’s economy and it supports tens of thousands of good jobs. Thank you, Governor @dougducey for a positive, bipartisan tele-town hall tonight about the #USMCA and strengthening our trade relationship with Mexico. pic.twitter.com/L0OguJoNjb",1166906060139094018,2019-08-29,02:50:59,repgregstanton,0,11,36
"On this day, 1963: 250,000 demonstrators marched with the goal to shine a light on the racism and poverty that persisted 100 years after emancipation. Martin Luther King, Jr. delivered his 'I Have a Dream' speech at the March on Washington, and his words are still powerful today. pic.twitter.com/CmWJhGK3N7",1166804209863462912,2019-08-28,20:06:16,repgregstanton,0,2,11
"We celebrate #WomensEqualityDay to commemorate the adoption of the 19th Amendment to the Constitution, granting women the right to vote. Here's to the women who fought for years for this right—and the women who continue to empower others and fight for greater voter access today. pic.twitter.com/oMLyuMeQVr",1166046174434025477,2019-08-26,17:54:06,repgregstanton,4,0,8
Thank you to the @seedspot team for convening such an impressive group of entrepreneurs for Congressional #StartupDay2019. Arizona is a great place to start and grow a business—and we need entrepreneurs at the table to find ways to continue building an innovative economy. #yesphx pic.twitter.com/pGa0NAubDl,1165030777563693057,2019-08-23,22:39:17,repgregstanton,1,2,16
"Today marks #BlackWomensEqualPay Day, or the date in this year when Black women finally earn what white, non-Hispanic men made last year. #PaycheckFairness is the first step towards economic security for Black women and families.",1164702577197506560,2019-08-23,00:55:08,repgregstanton,0,1,4
"We now have an opportunity to move this policy further in the right direction, by extending in-state tuition to Dreamers. Arizona students who have lived and been educated in our state for nearly their whole lives should have equal access to Arizona universities.",1164653925808705539,2019-08-22,21:41:48,repgregstanton,1,2,17
"This is the right thing to do for our students, our universities, and our economy. https://twitter.com/rachelleingang/status/1164599500087808000 …",1164649802920951808,2019-08-22,21:25:25,repgregstanton,1,15,63
"Two-thirds of all reported Valley Fever cases are from Arizona—@RepDavid and I hosted a roundtable yesterday to discuss how to change that. Thank you to the medical experts, health care providers and Arizonans with first-hand experience dealing with Valley Fever who joined us. pic.twitter.com/toERmKyw63",1164613725061599233,2019-08-22,19:02:04,repgregstanton,0,10,14
"Yesterday I toured the Phoenix Electrical JATC, where over 400 apprentices are on their way to becoming electrical contractors. My office is proud to support training programs that provide workers with the technical skills needed to enter the workforce. pic.twitter.com/mUUmAdkzPT",1163993953986908160,2019-08-21,01:59:19,repgregstanton,1,6,25
"We capped off our experience talking to representatives from many industries committed to maintaining a strong relationship with Mexico, our state's largest trading partner. Our trade partnerships with our southern neighbor support agriculture, infrastructure, aviation and more. pic.twitter.com/xSRY55AemN",1162507577932111872,2019-08-16,23:32:59,repgregstanton,0,0,8
We stopped by @LutesCasino--a Yuma staple--to try their famous potato tacos and the Especial. We chatted with owner Bob Lutes and caught up with @yumacountyaz Supervisor Lynne Pancrazi. pic.twitter.com/TBOg1S1oxV,1162507529181642754,2019-08-16,23:32:47,repgregstanton,2,0,4
"We visited the temporary migrant holding facility. Border Patrol agents showed us supplies on site for families. I spoke with a mother and child from Central America, and she was frank with me about her experiences coming to the U.S. and her fear of being returned to Mexico. pic.twitter.com/23DzwE9Wwk",1162507504967925760,2019-08-16,23:32:42,repgregstanton,1,0,2
"We first toured the Port of San Luis II, where U.S. Customs officials inspect and process commercial imports. It's a critical facility that supports our cross-border trade and business. pic.twitter.com/NHnz4PLf3T",1162507437926158338,2019-08-16,23:32:26,repgregstanton,1,0,3
"Yesterday I was in Yuma with State House Minority Leader @CharleneforAZ to tour the San Luis border facilities and meet with local leaders in agriculture, trade, infrastructure, transportation and economic development. pic.twitter.com/mgSPEyOgo9",1162507414266138625,2019-08-16,23:32:20,repgregstanton,2,2,14
"7 years ago, #DACA began helping young people brought here as children come out of the shadows and work lawfully. Today, hundreds of thousands are at risk of losing their legal status. If you have questions about DACA or renewing your status, we can help. http://Stanton.house.gov/contact ",1162140146394787840,2019-08-15,23:12:57,repgregstanton,0,2,7
Today is #NavajoCodeTalkerDay. Navajo Code Talker Fleming Begaye Sr. passed away earlier this year at age 97. He was one of more than 400 Code Talkers who developed a secret military code during WWII. We owe a huge debt of gratitude for their service. https://www.azcentral.com/story/news/local/arizona/2019/05/12/navajo-code-talker-fleming-begaye-sr-dies-97-world-war-ii/1183723001/ …,1161791960719482880,2019-08-15,00:09:23,repgregstanton,1,26,84
"Since day one, we've been working hard to deliver results to Arizonans. Take a look at some of our team's highlights since the start of the 116th Congress. #AZ09 pic.twitter.com/hdqwYJCmhx",1161328666950811648,2019-08-13,17:28:25,repgregstanton,27,3,23
"To my friends celebrating the festival of sacrifice, Eid al-Adha, I wish you many blessings and #EidMubarak.",1160669299826032640,2019-08-11,21:48:19,repgregstanton,9,5,25
"Before signing the #VotingRightsAct on this day in 1965, President Johnson said, ""Today is a triumph for freedom as huge as any victory that has ever been won on any battlefield.” 54 years later, we have more work to do to ensure every American can exercise their right to vote. pic.twitter.com/g2bdG6HaTc",1158874005656526848,2019-08-06,22:54:28,repgregstanton,2,5,20
Thanks for a great meeting and for being advocates for a fiduciary standard across the industry. I look forward to working with you more in the future! https://twitter.com/fpaofphoenix/status/1158425895670972416 …,1158482199898939394,2019-08-05,20:57:34,repgregstanton,0,0,5
"Light rail isn't just for getting to work or school, it can also take you to some of the best restaurants in the Valley. Investment in great public transit spurs great economic development, and that includes great destinations for foodies. https://www.phoenixnewtimes.com/restaurants/dining-guide-best-restaurants-stop-by-stop-the-valley-metro-light-rail-11332081 …",1157315416454250497,2019-08-02,15:41:11,repgregstanton,0,0,15
Separating children from their parents at the border on the basis of the parent’s HIV status is cruel and senseless. We’re committed to getting an explanation from the administration. https://twitter.com/RepRaskin/status/1155965685505282054 …,1157050430897184768,2019-08-01,22:08:14,repgregstanton,1,29,81
"We’re working to improve access to great public transportation options across Arizona, in communities big and small. This is a bipartisan bill that would increase support for transit systems in Flagstaff and Casa Grande and help them reach even further. https://stanton.house.gov/media/press-releases/stanton-introduces-bipartisan-bill-support-small-transit-systems …",1156988417005281280,2019-08-01,18:01:49,repgregstanton,2,0,8
