tweet,id,date,time,username,replies_count,retweets_count,likes_count,tdatetime
Couldn’t ask for a better neighbor! Thanks @RepRaskin and your team for all of your help as we get our office up and running. https://twitter.com/RepRaskin/status/1095087403914706944 …,1095094340605624320,2019-02-11,22:56:51,repdavidtrone,1,1,4,2019-02-11 22:56:51
"To be clear, AIPAC is a bipartisan organization that supports the US-Israel relationship, and Israel is a progressive, democratic beacon of light in the Middle East. Comparing AIPAC to the NRA shows a serious lack of listening and learning.",1095069330784600065,2019-02-11,21:17:28,repdavidtrone,21,3,21,2019-02-11 21:17:28
"The U.S. and Israel have a strong bond because of our shared democratic interests and values, and the use of prejudicial tropes is both deeply hurtful and ill-informed. I agree with @SpeakerPelosi that Rep. Omar should apologize. https://twitter.com/SpeakerPelosi/status/1095026564503343104 …",1095052236575698944,2019-02-11,20:09:32,repdavidtrone,4,4,9,2019-02-11 20:09:32
It makes me sick to my stomach that active-shooter trainings are now a fact of life for our kids. https://bethesdamagazine.com/bethesda-beat/active-shooter-training-to-reach-all-schools-by-june/ …,1095025140247773184,2019-02-11,18:21:52,repdavidtrone,0,7,8,2019-02-11 18:21:52
Wise words we’d do well to heed. June and I send our deepest condolences to @RepDebDingell https://wapo.st/2Sw2YQj ,1094335942268211200,2019-02-09,20:43:15,repdavidtrone,2,2,11,2019-02-09 20:43:15
"Beautiful Saturday in Hagerstown holding my first “Office Hours.” We met with more than 50 people. I learned a lot, and we’re already getting to work helping folks. pic.twitter.com/aKYOrHY6wz",1094326140251049985,2019-02-09,20:04:18,repdavidtrone,6,3,26,2019-02-09 20:04:18
"Yesterday I met the new Ambassador of India to the United States, Harsh Vardhan Shringla. Ambassador Shringla is a brilliant diplomat and was previously the Indian High Commissioner to Bangladesh. It was excellent meeting him and I am glad to now call him a friend! pic.twitter.com/P454uxbwIp",1093924811724804096,2019-02-08,17:29:33,repdavidtrone,1,9,40,2019-02-08 17:29:33
Olympic gold medal hockey player @skrooops28 started playing hockey at age 4 in Rockville. I’m wishing her good luck in the U.S. Women’s National Team’s upcoming series against Canada! pic.twitter.com/akiLQ400Bv,1093199921002528773,2019-02-06,17:29:06,repdavidtrone,2,2,12,2019-02-06 17:29:06
My daughter was named at the Tree of Life Synagogue in Pittsburgh. I knew many families there. We must stand up against anti-Semitism and stand with the Jewish people #SOTU,1092985890526449670,2019-02-06,03:18:37,repdavidtrone,4,25,124,2019-02-06 03:18:37
"Modern border security means increased funding for technology, surveillance, border patrol officers, and immigration judges. Not a fifth century wall. #SOTU",1092977847545839622,2019-02-06,02:46:40,repdavidtrone,10,27,119,2019-02-06 02:46:40
We can and must work together to address our broken criminal justice system that disproportionally affects minorities and people of color. The bipartisan First Step Act was a great start - and we must do more. #SOTU19,1092974455956082689,2019-02-06,02:33:11,repdavidtrone,2,4,10,2019-02-06 02:33:11
We must do both. Legislate on issues of common ground and investigate issues of corruption. #SOTU19,1092972907398119424,2019-02-06,02:27:02,repdavidtrone,1,10,22,2019-02-06 02:27:02
"The Trump Administration’s tax cut helped the wealthy - and they don’t need the help. To put it simply, the Trump administration has failed the middle class. #SOTU19 https://www.cbpp.org/research/federal-tax/new-tax-law-is-fundamentally-flawed-and-will-require-basic-restructuring …",1092971408529997825,2019-02-06,02:21:04,repdavidtrone,1,6,9,2019-02-06 02:21:04
"Tom Wibberley, another Maryland 6th District resident, is at the #SOTU19 tonight. Tom lost his son Craig at the age of 19 while he was serving our country abroad. We honor Craig and his father Tom tonight for their sacrifice for our country.",1092969557952774147,2019-02-06,02:13:43,repdavidtrone,1,1,8,2019-02-06 02:13:43
"We have to take this strength that we have here in Hagerstown and spread it across Maryland and across the United States.

Mr. President - please help lead us tonight and speak about this catastrophe to give it the attention it deserves.",1092867747875352577,2019-02-05,19:29:10,repdavidtrone,1,3,8,2019-02-05 19:29:10
"Literally thousands of Brookes all over America are being claimed by this epidemic. My nephew Ian was one of them. He died at the age of 24 from a fentanyl overdose.

This is not a tragedy of just Hagerstown or Maryland, it’s the most important tragedy that America faces. pic.twitter.com/5xG86MsHlA",1092867619504513024,2019-02-05,19:28:39,repdavidtrone,1,3,6,2019-02-05 19:28:39
I’m honored to have Kevin Simmers as my guest to the #SOTU19 tonight. Kevin lost his daughter Brooke to an overdose at the age of 19. He took action after that tragedy and today officially opened Brooke’s House - a safe living facility for women seeking treatment from addiction. pic.twitter.com/ti1MUWFgSu,1092867155052425216,2019-02-05,19:26:48,repdavidtrone,2,12,31,2019-02-05 19:26:48
We must support the press and the work they do to report the truth. Their work is more important now than ever before. https://twitter.com/washingtonpost/status/1092255028566523904 …,1092450137010552832,2019-02-04,15:49:44,repdavidtrone,2,9,28,2019-02-04 15:49:44
Phil who? The real weather predicting groundhog is right here in the 6th district. #MD06 https://www.times-news.com/news/photos-western-maryland-murray-sees-shadow/article_fb37276c-26f0-11e9-ba7a-63717cc308dc.html …,1091743105852862466,2019-02-02,17:00:14,repdavidtrone,4,1,7,2019-02-02 17:00:14
"I am proud to recognize Frederick Dentist Dr. Harvey Levy who, as a part of National Children’s Dental Health Month, provided free dental care to 50 under-served children today. pic.twitter.com/CkVqXMV2Op",1091466868794318848,2019-02-01,22:42:34,repdavidtrone,1,8,22,2019-02-01 22:42:34
Thank you @RepMGriffith for your comments at the @EnergyCommerce Member Day hearing on the need to fight the opioid epidemic. We can't let up until we #EndtheAddictionCrisis. Proud to partner with you on this effort. https://nrvnews.com/continuing-to-fight-the-opioid-crisis/ …,1156627761777303554,2019-07-31,18:08:42,repdavidtrone,0,0,4,2019-07-31 18:08:42
Education is fundamental to ending the opioid epidemic. Can't wait to see results from this great program at @hagerstowncc. #EndTheAddictionCrisis https://www.heraldmailmedia.com/news/local/hagerstown-community-college-starts-two-substance-abuse-counseling-programs/article_8879298d-29a8-5db1-b0ea-4ab3eb62f2e8.html …,1156587008711700482,2019-07-31,15:26:45,repdavidtrone,0,3,6,2019-07-31 15:26:45
"Good news out of Washington County, but we can't let up until we #EndtheAddictionCrisis https://www.localdvm.com/news/overdoses-reported-in-washington-county-have-declined/ …",1156563804546895872,2019-07-31,13:54:33,repdavidtrone,3,2,3,2019-07-31 13:54:33
"54 years ago, LBJ signed #Medicare and #Medicaid into law. To this day, these programs provide quality health coverage to millions of Americans.

In Congress, I will continue fighting to protect these programs that support our most vulnerable populations.",1156266195840045056,2019-07-30,18:11:58,repdavidtrone,2,1,8,2019-07-30 18:11:58
"I am sending my deepest condolences to the people of Gilroy. Among the victims was a six year-old boy.

This is outrageous and it cannot continue. Children and families deserve to feel safe in their communities, free of the constant threat of gun violence. https://www.cbsnews.com/live-news/garlic-festival-mass-shooting-gilroy-california-victims-suspect-santino-william-legan-live-updates/ …",1155971021997924353,2019-07-29,22:39:03,repdavidtrone,3,0,3,2019-07-29 22:39:03
"The President’s false claims & personal attacks are a naked attempt to aggravate racial tensions. Trump hopes this will improve his weak political standing. It’s up to us to prove him wrong, to show that we’re better than this. 

@RepCummings will keep fighting and so will we! https://twitter.com/realDonaldTrump/status/1155073965880172544 …",1155127756935585793,2019-07-27,14:48:13,repdavidtrone,17,18,61,2019-07-27 14:48:13
@RepDonBacon @RepBarbaraLee @RepSusieLee,1154837583970668545,2019-07-26,19:35:10,repdavidtrone,1,1,3,2019-07-26 19:35:10
"I’ve seen the impact an education has on incarcerated students first-hand -- it changes lives and improves our communities.

I'm proud to introduce a bipartisan bill that would remove the ban on Pell Grants for incarcerated students.
 https://edit-trone.house.gov/media/press-releases/reps-david-trone-don-bacon-barbara-lee-susie-lee-introduce-bipartisan-bill …",1154837582984990720,2019-07-26,19:35:10,repdavidtrone,1,4,6,2019-07-26 19:35:10
"This week I testified in front of @EnergyCommerce to urge additional and consistent funding to fight the opioid epidemic.

I lost my nephew Ian to a fentanyl overdose at the age of 26. I will do everything in my power to make sure we don’t lose more lives to this epidemic. pic.twitter.com/mEYlFYV3JO",1154827789742350339,2019-07-26,18:56:15,repdavidtrone,0,4,10,2019-07-26 18:56:15
"Our team couldn’t ask for better interns in our office. 

Their intellect, positive attitudes, and enthusiasm keep our office running (or jumping...)

Thanks for sharing your summer with us and being part of the team!
 #NationalInternDay pic.twitter.com/CHFwjUrkk9",1154555591802494976,2019-07-26,00:54:38,repdavidtrone,3,1,29,2019-07-26 00:54:38
"Older Americans should not live in fear that their hard-earned retirement savings will collapse. But sadly, that is what’s happening. Today, I voted for the #ButchLewisAct to fix this problem before it's too late.",1154202265777057793,2019-07-25,01:30:38,repdavidtrone,2,3,16,2019-07-25 01:30:38
An estimated 100.5 MILLION robocalls were made in Maryland last month. This is absurd. It’s time to end the onslaught of robocalls. That’s why I voted for the bipartisan #StopBadRobocalls Act on the House floor today. pic.twitter.com/SeytdCbmSC,1154166808523546624,2019-07-24,23:09:45,repdavidtrone,5,3,14,2019-07-24 23:09:45
"The President should be setting the model of conduct for our nation, and it’s our duty to ensure that no one - certainly not the President - is above the law.",1154160787495313408,2019-07-24,22:45:49,repdavidtrone,17,5,20,2019-07-24 22:45:49
"We must be relentless in continuing to investigate, legislate, and litigate both Russia’s interference in our 2016 elections and the President’s attempts to obstruct justice. We must also aggressively combat future attempts to interfere in our democracy.",1154160786299924480,2019-07-24,22:45:49,repdavidtrone,3,2,18,2019-07-24 22:45:49
"Special Counsel Mueller’s testimony today illuminated the facts: Mueller’s investigation found 10 instances of obstruction by the President, and the investigation’s report does not exonerate the President.",1154160784253100032,2019-07-24,22:45:48,repdavidtrone,10,5,30,2019-07-24 22:45:48
"I am particularly grateful to the members of our Freshmen Working Group on Addiction who have shown they are willing to work tirelessly to end the addiction epidemic in our country. 

@RepJohnJoyce, @RepLoriTrahan, @RepBenMcAdams, and @RepAngieCraig",1154067627448426503,2019-07-24,16:35:38,repdavidtrone,1,2,14,2019-07-24 16:35:38
"In this month's Freshmen Working Group on Addiction meeting, Dr. Travis Rieder & Dr. James Baker spoke about their personal experiences with opioid dependence & addiction.

We must work with our medical community to understand how to best prevent & combat substance use disorder. pic.twitter.com/tiCnuZEfje",1154067623409328128,2019-07-24,16:35:37,repdavidtrone,3,2,9,2019-07-24 16:35:37
The #EFFORTAct is an important step in our work as members of the Freshmen Working Group on Addiction to confront the opioid epidemic. @RepWexton’s bill would help expand interdisciplinary research on opioid addiction so we can best treat those suffering from this illness. pic.twitter.com/tNe1bSmvok,1154021571520008192,2019-07-24,13:32:37,repdavidtrone,0,2,8,2019-07-24 13:32:37
These emails make me sick to my stomach. These companies must be held accountable. https://www.washingtonpost.com/investigations/internal-drug-company-emails-show-indifference-to-opioid-epidemic-ship-ship-ship/2019/07/19/003d58f6-a993-11e9-a3a6-ab670962db05_story.html?utm_term=.120dfc60614a …,1154019519997906944,2019-07-24,13:24:28,repdavidtrone,0,1,4,2019-07-24 13:24:28
"Today I was proud to support H. Res. 246 which opposes BDS, reaffirms our commitment to Israel as an ally, and emphasizes the importance of a two-state solution. I’m glad to see Congress unite around our bipartisan support for Israel and our close, continued partnership.",1153827270252998656,2019-07-24,00:40:32,repdavidtrone,6,5,41,2019-07-24 00:40:32
"This policy by the Trump Administration is cruel and affects those that are most vulnerable. Instead of giving tax breaks to the wealthy, we should be supporting the hardworking men and women in America who are trying to make ends meet. https://www.cnn.com/2019/07/23/politics/trump-snap-food-stamps/index.html …",1153724647122329601,2019-07-23,17:52:45,repdavidtrone,1,3,6,2019-07-23 17:52:45
This is a reminder to be careful on the roads. As more storms pass through remember to stay safe and plan accordingly. https://www.wusa9.com/article/news/i-270-closed-both-directions-after-severe-storm-takes-out-trees-power-lines/65-1207386d-3bb8-4997-a030-677d63e4763c …,1153398831612145664,2019-07-22,20:18:05,repdavidtrone,0,1,4,2019-07-22 20:18:05
"I’m proud to stand with my colleagues today and #RaisetheWage to lift 1.3 million Americans out of poverty - 600,000 of which are children. 

$15 minimum wage is a win for business and a win for American families. I’m proud to support this legislation today. It’s about time. pic.twitter.com/8uKTUtRpFJ",1151863860074352640,2019-07-18,14:38:39,repdavidtrone,11,16,37,2019-07-18 14:38:39
"I had the chance to meet with some smart students today who are at @usnistgov participating in their Summer Undergraduate Research Fellowship. 

These programs are a great way to educate and invest in our future. pic.twitter.com/r3rwsbyqO5",1151634508036415488,2019-07-17,23:27:17,repdavidtrone,0,0,9,2019-07-17 23:27:17
We should be following Maryland’s lead!,1151560931467583488,2019-07-17,18:34:55,repdavidtrone,0,0,0,2019-07-17 18:34:55
.@RepKarenBass is spot on. https://thehill.com/hilltv/rising/453292-democratic-lawmaker-says-mass-incarceration-in-us-is-an-embarrassment …,1151479989180628998,2019-07-17,13:13:17,repdavidtrone,0,5,9,2019-07-17 13:13:17
"On #Apollo50th we remember the incredible work from an estimated 400,000 men and women who allowed humans to step foot on the moon.

Today, we must continue to invest in research that pushes what was previously thought impossible & that may result in something truly exceptional.",1151260721789001728,2019-07-16,22:42:00,repdavidtrone,4,3,11,2019-07-16 22:42:00
"Before I ran for Congress, I ran a business with over 7,000 employees in 25 states. 

We paid our employees well because it’s a win for the team member and a win for the business. 

We must #RaiseTheWage to lift Americans out of poverty and boost our economy. pic.twitter.com/OmgmtaoAJK",1151157236632301573,2019-07-16,15:50:47,repdavidtrone,11,41,130,2019-07-16 15:50:47
"It's not every day you get to meet a world champion, but today I was lucky enough to meet @roselavelle and the rest of the @WashSpirit.

If you live in Germantown, head out to the Maryland SoccerPlex to support these world-class athletes year-round. pic.twitter.com/boYLosdIPQ",1150918319790272512,2019-07-16,00:01:25,repdavidtrone,3,4,68,2019-07-16 00:01:25
"The comments made by the President this weekend were racist and just plain wrong.

Our diversity is our strength, and we should be united behind one another to make our country stronger. This type of language is unacceptable.",1150800322211827713,2019-07-15,16:12:32,repdavidtrone,8,2,46,2019-07-15 16:12:32
"It was an honor to have the fantastic leader @RepGraceMeng in the 6th District yesterday to speak with our advisory committees. 

Diversity is our strength, and unity is our power. When we take steps to listen and understand the experience of others, we grow better as a nation. pic.twitter.com/temSYx32XA",1150462143210426370,2019-07-14,17:48:44,repdavidtrone,1,2,10,2019-07-14 17:48:44
"This is a great first step, and we will continue to fight for Luke and the surrounding community to get the benefits and investment they deserve.",1150441935632515072,2019-07-14,16:28:26,repdavidtrone,1,0,4,2019-07-14 16:28:26
"The Luke Mill workers will be supported in their new job search and receive income support and reemployment services where necessary. 

I was proud to work with @SenatorCardin and @ChrisVanHollen to urge the @USDOL to accept this application for the hard-working people of Luke.",1150441934634323981,2019-07-14,16:28:26,repdavidtrone,2,1,5,2019-07-14 16:28:26
"BIG NEWS: Maryland’s application for Trade Adjustment Assistance for the 675 workers who lost their jobs at Luke Mill has been accepted!

This means that Luke Mill workers will receive training to gain skills and credentials for new job opportunities.
 https://trone.house.gov/media/press-releases/trone-cardin-and-van-hollen-announce-approval-maryland-s-trade-adjustment …",1150441933476651008,2019-07-14,16:28:25,repdavidtrone,2,6,12,2019-07-14 16:28:25
Our immigrant communities are living in fear as result of policies that threaten their families. The best way to be prepared against these threats is to KNOW YOUR RIGHTS. pic.twitter.com/jEjy2oFlWb,1150202608004534279,2019-07-14,00:37:26,repdavidtrone,4,12,25,2019-07-14 00:37:26
See below for the original letter: @RepVanTaylor @RepGwenMoore @RepEspaillat @JacksonLeeTX18 @RepYvetteClarke @RepSchakowsky @RepGraceMeng @RepRaskin @RepDonaldPayne @RepRoybalAllard @EleanorNorton @RepDonBeyer @RepAnthonyBrown @RepRoKhanna pic.twitter.com/EQy328nxw9,1149800519646531584,2019-07-12,21:59:40,repdavidtrone,2,1,4,2019-07-12 21:59:40
"BREAKING: @USOPM reverses course on requiring indication of pretrial diversion program on federal employee applications.

Proud to work alongside @RepJeffries to ensure those in pretrial diversion programs get a fair shot at a job in the federal gov't. Next step: ban the box. pic.twitter.com/cEcdXJRXNR",1149799017401987072,2019-07-12,21:53:42,repdavidtrone,6,13,18,2019-07-12 21:53:42
"9/11 first responders defined what it means to be heroes. Their sacrifice, courage, and bravery will never be forgotten. Today when the House passed #HR1327, we extended the 9/11 Victim Compensation Fund by 70 years to support any care these heroes need.",1149766497604161542,2019-07-12,19:44:29,repdavidtrone,0,2,6,2019-07-12 19:44:29
"This morning I was at the Gaithersburg-Germantown Chamber of Commerce Public Safety Awards discussing the importance of valuing our first responders.

This afternoon, I was proud to vote for the 9/11 Victim Compensation Fund. #Renew911VCF",1149766497029545984,2019-07-12,19:44:29,repdavidtrone,3,1,6,2019-07-12 19:44:29
"For Maryland, climate change isn’t a future threat — its a real problem now. We can’t wait to #ActOnClimate https://www.marylandmatters.org/2019/07/11/report-coastal-flooding-in-md-will-get-worse-even-on-sunny-days/ …",1149709657784705024,2019-07-12,15:58:37,repdavidtrone,1,4,7,2019-07-12 15:58:37
"On Sunday, ICE plans to arrest thousands across the US. Make sure you know your rights. https://oag.ca.gov/immigrant/rights …",1149356427447853056,2019-07-11,16:35:00,repdavidtrone,4,5,11,2019-07-11 16:35:00
"A $15 minimum wage would mean: 

📈consumer spending 
📈worker productivity 
📉poverty rates 
📉suicide rates
📉recidivism

Raising the minimum wage is a win-win, benefitting both employees AND the economy. https://www.washingtonpost.com/business/2019/07/08/its-not-just-paychecks-surprising-society-wide-benefits-raising-minimum-wage/?utm_term=.44396f5da99f …",1149003538334441473,2019-07-10,17:12:45,repdavidtrone,1,2,7,2019-07-10 17:12:45
The conditions at the southern border are absolutely unacceptable. The administration must act immediately to rectify the treatment of children and migrants. https://www.washingtonpost.com/immigration/2019/07/08/un-human-rights-chief-deeply-shocked-by-migrant-detention-center-conditions-texas/?utm_term=.a3d68ec91458 …,1149001087585849349,2019-07-10,17:03:01,repdavidtrone,5,1,4,2019-07-10 17:03:01
"It’s invaluable to hear from people like Odessa David who is on the front lines of school nutrition advocacy. Thanks for sharing your expertise, Odessa! https://twitter.com/jacqdecarlo/status/1148761567028305920 …",1148986249207865345,2019-07-10,16:04:03,repdavidtrone,0,0,3,2019-07-10 16:04:03
"Older Americans should not live in fear that their hard-earned retirement incomes are at risk of collapse. But sadly, that’s what’s happening. Today, House Democrats are taking steps to fix this problem before it’s too late. #ButchLewisAct",1148967702809272320,2019-07-10,14:50:21,repdavidtrone,2,2,9,2019-07-10 14:50:21
Thanks for having us! We are lucky to have such fantastic leaders and educators in Frederick. https://twitter.com/beyondAscore/status/1148734884791427075 …,1148762625616035841,2019-07-10,01:15:27,repdavidtrone,0,1,9,2019-07-10 01:15:27
"I’m in Germantown for our Summer Meals Tour! 

Many children don’t take advantage of free summer meals. We need to spread the word about these great programs so kids can eat well ALL year. 

Text “FOOD” to 877-877 to find a summer meals location near you @nokidhungry pic.twitter.com/PLYeKtB6FP",1148684212305879040,2019-07-09,20:03:52,repdavidtrone,4,17,41,2019-07-09 20:03:52
"The next stop on our Summer Meals Tour was in Frederick, where only 1 in 6 students receive a free meal during the summer. Thanks to @BryanVoltaggio for serving meals today and for being a strong advocate for child nutrition. #SummerMeals pic.twitter.com/aNOSJWqTcu",1148669807170138118,2019-07-09,19:06:37,repdavidtrone,0,4,22,2019-07-09 19:06:37
"Today is our Summer Meals Tour! We started in Hagerstown at Children in Need where we met with state and local leaders to figure out how we can get more students healthy meals during the summer. #SummerMeals 

Text “FOOD” to 877-877 to find free summer meals near you. pic.twitter.com/8uPNQjNbfN",1148661974110277638,2019-07-09,18:35:30,repdavidtrone,1,3,12,2019-07-09 18:35:30
"Congrats, Nate! https://twitter.com/NateTinbite/status/1148399443017908224 …",1148617792008216576,2019-07-09,15:39:56,repdavidtrone,1,2,18,2019-07-09 15:39:56
"Congratulations @USWNT for a historic & repeat win this year! Special shout-out to @MalPugh & @roselavelle from our very own @WashSpirit for an exceptional performance.

I look forward to welcoming you to the US Capitol & to rooting for you at games year-round #OneNationOneTeam https://twitter.com/SpeakerPelosi/status/1148038918669033477 …",1148255290611122176,2019-07-08,15:39:29,repdavidtrone,0,3,6,2019-07-08 15:39:29
"Today we celebrate 55 years since the signing of the #CivilRightsAct. As we celebrate the steps we have made, we must also recognize that there is still work to do in reforming our unjust criminal justice system and restoring the Voting Rights Act. The fight is not over.",1146170831216828422,2019-07-02,21:36:35,repdavidtrone,2,5,13,2019-07-02 21:36:35
This is abhorrent and disgusting. There is a moral crisis at the border. https://www.propublica.org/article/secret-border-patrol-facebook-group-agents-joke-about-migrant-deaths-post-sexist-memes …,1146151395097272321,2019-07-02,20:19:21,repdavidtrone,6,5,12,2019-07-02 20:19:21
"Border Patrol just made the largest fentanyl bust in U.S history. 

A wall didn't keep these drugs out. It was the work and expertise of CBP officers. We must continue to invest in smart border security to stop these deadly drugs from entering the U.S. https://www.nbcnews.com/news/us-news/feds-make-largest-fentanyl-bust-u-s-history-n965486 …",1091078660679974914,2019-01-31,20:59:58,repdavidtrone,13,18,55,2019-01-31 20:59:58
"Huge win for federal workers today. My first amendment passed on the House floor, giving a 2.6% pay increase for Secret Service along with all other federal employees.

After 35 days of an unnecessary shutdown, federal workers deserve better. I stand with you. pic.twitter.com/oW08e5LbJu",1090686057119666178,2019-01-30,18:59:54,repdavidtrone,11,93,475,2019-01-30 18:59:54
Poverty is unjust. We need to take action to reverse this trend. https://bethesdamagazine.com/bethesda-beat/news/report-16000-women-in-montgomery-county-poverty-montgomery-county/ …,1090650321871872000,2019-01-30,16:37:54,repdavidtrone,3,2,11,2019-01-30 16:37:54
"Now more than ever we need to unite against foreign threats and fight for American values abroad. That's why I'm excited to get to work on my two subcommittees in @HouseForeign:

- Middle East, North Africa, & International Terrorism
- Europe, Eurasia, Energy, and the Environment",1090419643641147392,2019-01-30,01:21:16,repdavidtrone,4,7,19,2019-01-30 01:21:16
"I'm excited to announce that in the @EdLaborCmte I will serve on the Subcommittees on:

🍎Higher Education and Workforce Investment
🍎Civil Rights and Human Services

It's time to think long-term and invest in success of all students and workers.",1090340708450488320,2019-01-29,20:07:37,repdavidtrone,2,9,20,2019-01-29 20:07:37
