tweet,id,date,time,username,replies_count,retweets_count,likes_count,tdatetime
"Today I wrote about how Congress is addressing the opioid epidemic.

With life expectancy declining three straight years for the first time in 100 years because of the opioid epidemic, Congress can't wait any longer to take action. https://thehill.com/blogs/congress-blog/healthcare/450098-congress-needs-to-continue-fighting-the-opioid-epidemic …",1143900890526625793,2019-06-26,15:16:39,repdavidtrone,5,8,15,2019-06-26 15:16:39
"Today marks one year since the #SCOTUS decision to uphold Trump's #MuslimBan.

I'm proud to support two bills to defund & repeal the ban. Check out the new report from @NILC:  https://www.nilc.org/wp-content/uploads/2019/06/Impacts-of-the-Muslim-Ban-2019.pdf …",1143891600592003074,2019-06-26,14:39:44,repdavidtrone,1,1,4,2019-06-26 14:39:44
"Thank you to @RepSusanWild, @RepJohnJoyce, @RepShalala, and @RepBrianFitz for co-sponsoring the Higher Education Mental Health Act of 2019. 

Together we can make sure our students have the mental health care they need to be successful.",1143648473012756480,2019-06-25,22:33:38,repdavidtrone,4,0,8,2019-06-25 22:33:38
"Today I was proud to introduce the bipartisan Higher Education Mental Health Act of 2019. 

#Mentalhealth is a growing concern for students across the country, and we need to make sure our students have top notch mental health care. 

Thanks to @SenBobCasey for your partnership. pic.twitter.com/8KKatseIgi",1143648463663640577,2019-06-25,22:33:36,repdavidtrone,5,0,12,2019-06-25 22:33:36
"Six years ago, the Supreme Court struck down a crucial portion of the #VotingRightsAct. Since then we've seen voter purges, reduced early voting periods, and nearly 1,000 polling places shuttered. We must ensure EVERY American is guaranteed equal access to vote. pic.twitter.com/qWulO2C7Wd",1143561968843984896,2019-06-25,16:49:54,repdavidtrone,3,23,21,2019-06-25 16:49:54
I was honored to receive the @uscoastguard seal to display in my office today. The men and women of the United States Coast Guard represent the best and brightest we have to offer as a country. I thank all of them for their service and sacrifice for our country. pic.twitter.com/YrScidzwe9,1143259937658871808,2019-06-24,20:49:44,repdavidtrone,2,1,6,2019-06-24 20:49:44
"It was great running into my dear friend, former Montgomery County Executive Ike Leggett, while at @UatShadyGrove today. pic.twitter.com/y6eZ3YuBBt",1143198885348872192,2019-06-24,16:47:08,repdavidtrone,1,0,3,2019-06-24 16:47:08
"Behavioral Health and Addiction Treatment is critical to battling the opioid crisis. Team Trone was proud to attend the Grand Opening of the @WesternMDHealth Behavioral Health Emergency Department yesterday, where patients will be able to get the specified care they need. https://twitter.com/CumberlandTN/status/1142430807346352128 …",1142557503953297409,2019-06-22,22:18:31,repdavidtrone,2,1,4,2019-06-22 22:18:31
"ICE raids are starting Sunday to target families, including some in Baltimore. Immigrants have rights. Make sure you know yours: https://twitter.com/ACLU/status/1140991461938401280 …",1142487748772859906,2019-06-22,17:41:20,repdavidtrone,1,8,20,2019-06-22 17:41:20
"It’s time that @SenateMjrLdr listen to the American people and give them the progress that they deserve. This means transitioning to clean, renewable energy, investing in environmental cleanup, and joining the international fight against climate change. #ForThePeople",1142159579821817857,2019-06-21,19:57:18,repdavidtrone,7,4,16,2019-06-21 19:57:18
"Expanding broadband service to rural communities will be critical for strengthening the economy. I support @AppropsDems Agriculture bill, providing $680 million for broadband expansion.",1142130508220026880,2019-06-21,18:01:47,repdavidtrone,1,0,6,2019-06-21 18:01:47
"Thank you to our working group members who came out today. By working together we can save lives and #EndTheAddictionCrisis
@RepArmstrongND @RepKimSchrier @RepLoriTrahan @RepJahanaHayes @RepDean @RepJohnJoyce @RepJasonCrow @RepTimBurchett @RepVanTaylor",1142054660724973568,2019-06-21,13:00:24,repdavidtrone,2,0,5,2019-06-21 13:00:24
"Rhode Island saw a 61% decline in post-incarceration opioid deaths when they used Medication Assisted Treatment (MAT) in prisons. 

In the Freshmen Working Group on Addiction, we’re hearing from two Brown professors about how we can replicate these unbelievable numbers. pic.twitter.com/hwbW7tDBFS",1142054656039956480,2019-06-21,13:00:23,repdavidtrone,3,4,10,2019-06-21 13:00:23
"Funding rural development programs will help EVERYONE participate in our economy. I’m proud to support @AppropsDems Agriculture bill, providing $3.9 billion in rural development and infrastructure.",1141877393243533312,2019-06-21,01:16:00,repdavidtrone,0,2,9,2019-06-21 01:16:00
"Our servicemen and women put their lives on the line to defend our freedom. Now, it’s time that we take care of them. I’m proud to support the Defense @AppropsDems bill, which includes a 3.1% pay raise for those who serve in the military. #ForThePeople",1141857231610232832,2019-06-20,23:55:53,repdavidtrone,3,3,7,2019-06-20 23:55:53
"The Paris Climate Agreement is fundamental to the future of our environment, and we cannot abandon this responsibility. @AppropsDems FY 2020 State and Foreign Ops bill will ensure that NO funds can be used to withdraw from the Paris Climate Agreement. #ForThePeople",1141823034937892864,2019-06-20,21:40:00,repdavidtrone,2,5,13,2019-06-20 21:40:00
.@RepSherrill and @RepRiggleman have been amazing partners and leaders in the fight to end the addiction epidemic. This $1.5 billion historic federal investment shows that Congress is serious about tackling the opioid crisis across the country. #EndTheAddictionCrisis https://twitter.com/RepSherrill/status/1141806669313335302 …,1141809232657952768,2019-06-20,20:45:09,repdavidtrone,0,3,10,2019-06-20 20:45:09
"For the first time ever, $50 million will be allotted to the NIH and the CDC to study gun deaths in America. @HouseDemocrats are ready to end the gun violence epidemic once and for all. #ForThePeople",1141802906322182144,2019-06-20,20:20:01,repdavidtrone,1,5,17,2019-06-20 20:20:01
Thank you @RepRiggleman for being such a strong partner in the bipartisan Freshmen Working Group on Addiction and for working with me to put an end to the terrible opioid crisis in our country. Together we will make a difference in people's lives.,1141770957943709699,2019-06-20,18:13:04,repdavidtrone,1,1,6,2019-06-20 18:13:04
I was proud to work with @RepRiggleman on two amendments that would put additional funding toward expanding rural broadband deployment and combating the opioid crisis in rural communities. pic.twitter.com/QmlFiww3ao,1141770859260067840,2019-06-20,18:12:40,repdavidtrone,2,1,11,2019-06-20 18:12:40
"I grew up on a farm that went bankrupt. It was because of a good education that I was given a shot in life.

Dual enrollment is a great program that means higher graduation rates and college attendance, but we must make sure it's available to ALL students equally. @EdLaborCmte pic.twitter.com/0AHWceDqwA",1141764536585920517,2019-06-20,17:47:33,repdavidtrone,1,5,14,2019-06-20 17:47:33
"I’m proud to support Labor & HHS @AppropsDems bill, which includes:
✅$2.4 billion for Alzheimer’s research
✅$3.2 billion for HIV/AIDs research
✅$195 million for Cancer Moonshot research initiative
@HouseDemocrats are working #ForThePeople to promote a safe and healthy society.",1141427947330527232,2019-06-19,19:30:04,repdavidtrone,2,1,7,2019-06-19 19:30:04
The Trump Administration's threat to furlough OPM employees is baseless and wrong. Innocent federal workers do not deserve to be punished because the Administration isn't getting it's way. https://thehill.com/homenews/administration/449337-trump-officials-threaten-to-furlough-150-workers-at-federal-personnel …,1141426116672065540,2019-06-19,19:22:47,repdavidtrone,1,1,2,2019-06-19 19:22:47
To this day the Trump Administration has refused to deliver a report on the murder of Jamal #Khashoggi. The UN report's findings make it clear: no one is above the law and we need answers now. https://www.nytimes.com/2019/06/19/world/middleeast/jamal-khashoggi-Mohammed-bin-Salman.html …,1141407835709943809,2019-06-19,18:10:09,repdavidtrone,7,3,7,2019-06-19 18:10:09
"Unbelievable. We need the full force of the federal government to work towards ending the climate crisis. This action takes us backward, and our children will pay the price. https://twitter.com/SpeakerPelosi/status/1141374704370012161 …",1141398409615745026,2019-06-19,17:32:41,repdavidtrone,8,0,8,2019-06-19 17:32:41
We have an unjust criminal justice system that transformed the idea of slavery into segregation & then mass incarceration. It perpetuates a vicious cycle that negatively affects people of color. Congress must act to pass REAL criminal justice reform. We have a lot of work to do.,1141381189149831168,2019-06-19,16:24:15,repdavidtrone,3,1,7,2019-06-19 16:24:15
"On #Juneteenth we celebrate the liberation of enslaved people across the U.S. While we acknowledge this historic victory, we must recognize the injustices of the past and how far we still have to go to right these wrongs.",1141381188516536321,2019-06-19,16:24:15,repdavidtrone,1,2,9,2019-06-19 16:24:15
When Vincent Chin was brutally murdered 37 years ago his death became a rallying point for the #AAPI community. Now more than ever we must continue to come together against xenophobia and hate. https://www.nbcnews.com/news/asian-america/who-vincent-chin-history-relevance-1982-killing-n771291 …,1141333559765954562,2019-06-19,13:15:00,repdavidtrone,0,2,5,2019-06-19 13:15:00
"Disgusting and immoral. The administration's destructive family separation policy is simply inexcusable, and families are being torn apart. We cannot sit idle as these horrors take place. https://twitter.com/maggieNYT/status/1140605424183521280 …",1141054985142263809,2019-06-18,18:48:02,repdavidtrone,8,5,17,2019-06-18 18:48:02
"On this day in 1983 Sally Ride became an inspiration to many young women and men for being the first American woman to fly into space. Now, her fearlessness and determination continue to model what is possible for all those involved in STEM. https://www.nasa.gov/multimedia/imagegallery/image_feature_2533.html …",1141032662041268224,2019-06-18,17:19:20,repdavidtrone,0,3,6,2019-06-18 17:19:20
"This is now the longest period in U.S. history without an increase to the federal minimum wage. I am proud to support the #RaisetheWage Act, which will give nearly 40 million Americans and over 64,000 people in Maryland's 6th District a raise. pic.twitter.com/Bk1B1dBECS",1140698960513949696,2019-06-17,19:13:20,repdavidtrone,7,2,11,2019-06-17 19:13:20
Team Trone was happy to attend the Third Annual Rockville Pride this weekend. I’m grateful to represent such an open and accepting city and I look forward to continuing the fight in Congress for equal rights for all! #PrideMonth pic.twitter.com/cUFzx6sGuB,1140647108996939776,2019-06-17,15:47:17,repdavidtrone,1,0,4,2019-06-17 15:47:17
Four years ago we lost nine lives to a horrendous act of gun violence. The Senate must follow the lead of the House and take action against gun violence now. https://twitter.com/WhipClyburn/status/1140606767249985537 …,1140646176724783105,2019-06-17,15:43:35,repdavidtrone,2,12,36,2019-06-17 15:43:35
Proud to have voted in favor of these proposals to improve health care for American families. It’s time for the @SenateGOP to finally listen to the people – not the donor class – and pass these measures to improve health care for all Americans! #HealthCareWeekend pic.twitter.com/2cFD18L94q,1139914207644831744,2019-06-15,15:15:00,repdavidtrone,3,5,8,2019-06-15 15:15:00
The path to stability in #Sudan passes through a civilian-led government - not the military. The people have spoken and deserve a democracy. TMC should listen to protesters and give the people of Sudan the government they've worked for years to achieve. Proud to #StandWithSudan,1139548146416181248,2019-06-14,15:00:24,repdavidtrone,2,9,17,2019-06-14 15:00:24
.@JohnsHopkins is doing some truly incredible research that will make our future a better place. Thanks for having me! https://twitter.com/JohnsHopkins/status/1139233773013180417 …,1139252433413128192,2019-06-13,19:25:21,repdavidtrone,3,2,6,2019-06-13 19:25:21
Diverse communities enrich our society and make America stronger. Immigrants have contributed to the extraordinary character of our nation and often made great sacrifices to be here. We must continue to push for immigration reform. #CelebrateImmigrants #ImmigrantHeritageMonth,1139230955821051904,2019-06-13,18:00:00,repdavidtrone,1,6,10,2019-06-13 18:00:00
"Yesterday we saw a truly historic win by the U.S. Women’s Soccer Team. Shout out to the world class athletes Rose Lavelle and Mallory Pugh, who play right here in Germantown for the Washington Spirit. We are rooting for you! #USWNT https://www.nbcsports.com/washington/soccer/washington-spirits-rose-lavelle-and-mallory-pugh-ballers-score-three-goals-uswnt-world-cup …",1138971340063592449,2019-06-13,00:48:23,repdavidtrone,2,1,5,2019-06-13 00:48:23
"Behind the scenes w/ @mattlpost and Alexa Chronister. Even when talking about serious issues, it’s important to take time to laugh. pic.twitter.com/GIVeMTq6Bl",1138928091722596353,2019-06-12,21:56:31,repdavidtrone,1,2,6,2019-06-12 21:56:31
The @CDC has not conducted research on gun violence in more than 20 years. We need to change that. Research on gun violence can help us solve the epidemic and save lives. #WeNeedToKnow @AMarch4OurLives @bradybuzz pic.twitter.com/yFypglhAtc,1138927739656949762,2019-06-12,21:55:08,repdavidtrone,7,42,165,2019-06-12 21:55:08
"This is real leadership, @NIHDirector. 

I'm happy to pledge that I will no longer participate in any ""manels."" Diversity makes us stronger and we all must play our part in supporting inclusive practices that benefit us all. https://www.washingtonpost.com/health/nih-director-will-no-longer-speak-on-all-male-science-panels/2019/06/12/fe3b6386-8d2c-11e9-adf3-f70f78c156e8_story.html?utm_term=.6d2956237be9 …",1138925593532215297,2019-06-12,21:46:36,repdavidtrone,1,4,28,2019-06-12 21:46:36
"The disturbing historical undertones are laid out pretty plainly here. This year we're on track to separate the highest number of immigrant children away from their families, and now the Trump Administration will hold them at a literal internment camp. http://time.com/5605120/trump-migrant-children-fort-sill/?xid=tcoshare#d43c48d8-c745-4336-89a0-1b6801acf06c?utm_source=twitter.com&utm_medium=social&utm_campaign=social-share-article …",1138841925287600131,2019-06-12,16:14:08,repdavidtrone,11,4,5,2019-06-12 16:14:08
This week was the first time EVER the pride flag was raised at the Montgomery County Executive Office Building. I'm proud to have leaders in our county that advocate for equality and inclusion and continue to fight for the rights of the LGBTQ community. #PrideMonth pic.twitter.com/kGJ22fnGvc,1138831598118457344,2019-06-12,15:33:06,repdavidtrone,1,2,8,2019-06-12 15:33:06
"Today we remember the 49 victims of the Pulse Nightclub shooting in Orlando, FL that were murdered 3 years ago.

Hate and bigotry have no place in our communities. We must continue to support LGBTQ Americans and work to ensure equality for all. #WeAreOrlando pic.twitter.com/mOSOopMV53",1138810541072424960,2019-06-12,14:09:25,repdavidtrone,0,4,7,2019-06-12 14:09:25
Thank you Councilmember @willjawando for bringing attention to this outrageous event. Racial profiling is a daily reality for people of color and it is a vestige of Jim Crow. It's incomprehensible and epitomizes the disfunction in our criminal justice system. We must fix this. https://twitter.com/willjawando/status/1138057378799214592 …,1138564485537554434,2019-06-11,21:51:41,repdavidtrone,1,0,7,2019-06-11 21:51:41
What a great interview with my good friend @LilyQiMaryland. Her journey from China to the U.S. and subsequent election to the Maryland House of Delegates last year is a testament to her exceptional work ethic and the American Dream. Maryland is lucky to have her. https://twitter.com/LilyQiMaryland/status/1138068384510283776 …,1138483604672172039,2019-06-11,16:30:18,repdavidtrone,1,2,6,2019-06-11 16:30:18
"That's why this year the House passed H.R. 7, the #PaycheckFairnessAct which strengthens the #EqualPay Act. We must continue to work until equal pay for equal work becomes a reality.",1138188597817991174,2019-06-10,20:58:02,repdavidtrone,0,3,3,2019-06-10 20:58:02
Today in 1963 the Equal Pay Act was signed into law. But now women still only make 80 cents for every dollar earned by a man - and the gap is even worse for women of color.,1138188597067243520,2019-06-10,20:58:02,repdavidtrone,3,1,5,2019-06-10 20:58:02
"Farmers in Western Maryland deserve our attention and partnership at the local, state, and federal levels.

Thank you to Sec. Bartenfelder and @MdAgDept for joining us today to talk about the needs and priorities of farmers in Western Maryland! https://twitter.com/MdAgDept/status/1136999709086834688 …",1137004611531939840,2019-06-07,14:33:18,repdavidtrone,1,2,8,2019-06-07 14:33:18
Today marks the 75th anniversary of the invasion of Normandy by Allied forces. We will forever be indebted to the brave individuals who fought to protect democracy at home and abroad. Learn more about their story at  https://www.loc.gov/vets/  #DDay75 pic.twitter.com/fZvOGFSpjh,1136626631299272704,2019-06-06,13:31:21,repdavidtrone,5,4,5,2019-06-06 13:31:21
Today I'm proudly wearing #RedforFeds to show my support for VA workers in Maryland and across the country and their right to collectively bargain. @AFGENational pic.twitter.com/VONfcBpQd6,1136380949141381120,2019-06-05,21:15:05,repdavidtrone,2,3,11,2019-06-05 21:15:05
"Affordable housing is the foundation for families and individuals across America and a vital part of our infrastructure. 

Today I'm learning about how to increase housing affordability with the House @NewDemCoalition Housing Task Force. pic.twitter.com/LkyJQ6ch3I",1136347711517732865,2019-06-05,19:03:01,repdavidtrone,3,1,8,2019-06-05 19:03:01
"When women have reproductive freedom, their families and their communities are better off. We need #MenForChoice to stand up in support now more than ever. #StopTheBans",1136320019481190401,2019-06-05,17:12:59,repdavidtrone,29,160,736,2019-06-05 17:12:59
"From the mountain ranges in Western Maryland to banks of the Potomac River, Maryland's 6th district is home to countless natural wonders. On #WorldEnvironmentDay, we are reminded that we must continue to protect and conserve our natural resources.",1136313091866726400,2019-06-05,16:45:27,repdavidtrone,1,1,2,2019-06-05 16:45:27
"I stand with my 61 other freshmen colleagues to call on @senatemajldr to bring #HR1, the #ForThePeople Act, to the Senate floor. 

I came to Washington to represent real people, not PACs or lobbyists. #HR1 returns the power to the people. pic.twitter.com/MObDfnJHzd",1136312003860021249,2019-06-05,16:41:08,repdavidtrone,8,9,28,2019-06-05 16:41:08
"I’m happy to stand behind Dreamers and support #HR6, the Dream and Promise Act. We must give these Dreamers a path to citizenship — it’s simply the right thing to do. 

#ProtectTheDream pic.twitter.com/Mqf48nyiqs",1136025549476966403,2019-06-04,21:42:51,repdavidtrone,10,13,49,2019-06-04 21:42:51
I was honored to hear @SpeakerPelosi testify in today’s hearing marking 30 years since the Tiananmen Square uprising and massacre. The Speaker has been a leader in fighting for human rights & democratic expression in China and reminded us that repression is still a reality today.,1136021773965766657,2019-06-04,21:27:51,repdavidtrone,1,0,6,2019-06-04 21:27:51
"Today I’m hosting Michael as a part of #FosterYouthShadowDay. I got to hear about his experiences, and we even snagged a picture in the Chairman’s chair! 

Thank you @RepKarenBass for hosting this shadow day for #FosterYouthVoices. Every child deserves a loving home. pic.twitter.com/KQ30kBnGhg",1135973872841437184,2019-06-04,18:17:31,repdavidtrone,0,1,10,2019-06-04 18:17:31
Wishing Marylanders and those gathering around the world to celebrate the end of Ramadan a happy #EidMubarak!,1135712143716868096,2019-06-04,00:57:30,repdavidtrone,0,4,8,2019-06-04 00:57:30
".@JanGardnerExec is doing a great job with her leadership in Frederick, where I joined her today for a tour of the future detox center.

Opioids are killing our family and neighbors every day. We need more facilities like this detox center to help those suffering from addiction. https://twitter.com/JanGardnerExec/status/1135591169612664833 …",1135691736834084869,2019-06-03,23:36:24,repdavidtrone,0,2,6,2019-06-03 23:36:24
"Another 12 lives lost in #VirginiaBeach.  While we mourn with the families and friends of those no longer with us, we must also demand action to put an end to gun violence in this country. Everyone should be on board to stop these awful tragedies.",1134888317898698753,2019-06-01,18:23:54,repdavidtrone,2,4,15,2019-06-01 18:23:54
The Older Americans Act makes important strides to protect our aging citizens and includes my bills to combat social isolation among seniors & extend benefits to those with younger-onset Alzheimer's. I am proud to support this bill. It is good for our communities and our economy. pic.twitter.com/mdjby6Q46p,1190011343174287375,2019-10-31,21:03:08,repdavidtrone,4,0,13,2019-10-31 21:03:08
"This morning my colleagues & I in @EdLaborCmte passed the College Affordability Act out of committee, which includes my Higher Education Mental Health Act & 4 more of my bills. This monumental legislation is good for our students & teachers. https://trone.house.gov/media/press-releases/trone-bills-pass-committee-head-floor …",1190005725210255360,2019-10-31,20:40:48,repdavidtrone,0,0,4,2019-10-31 20:40:48
"Our children are our future, and we've got to do everything we can to reverse these trends. https://www.baltimoresun.com/education/bs-md-naep-score-release-20191030-vyfuhrsfq5egviee35g42e2fxq-story.html …",1190002091143643136,2019-10-31,20:26:22,repdavidtrone,2,1,3,2019-10-31 20:26:22
"Happy Halloween! Wishing everyone lots of good, spooky fun.",1189994462405107715,2019-10-31,19:56:03,repdavidtrone,0,1,4,2019-10-31 19:56:03
"My thanks to Markus Leitner, Swiss Ambassador to Iran, who joined me for an informative and helpful discussion on Iran and regional dynamics in the Middle East. It’s important to have the latest info for our @houseforeign work. pic.twitter.com/VrtIbXXt1k",1189976716032258052,2019-10-31,18:45:32,repdavidtrone,0,0,8,2019-10-31 18:45:32
Thrilled to announce the creation of the Middle Eastern & North African Congressional Staff Association! My legislative assistant Cortney was instrumental in the formation of this bipartisan group which will foster professional & leadership development. pic.twitter.com/1Oe5Eg7VOS,1189959298597736448,2019-10-31,17:36:19,repdavidtrone,0,3,14,2019-10-31 17:36:19
"Today I voted to let the American people hear for themselves the extent of the President's abuse of power. He has betrayed his oath of office & must be held accountable for his actions. @HouseDemocrats will continue to defend the Constitution from all enemies, foreign & domestic.",1189937236042752001,2019-10-31,16:08:39,repdavidtrone,11,10,38,2019-10-31 16:08:39
This is unacceptable. https://www.nytimes.com/2019/10/31/world/asia/kashmir-school-children.html?smid=nytcore-ios-share …,1189929052687228928,2019-10-31,15:36:08,repdavidtrone,2,1,4,2019-10-31 15:36:08
#TeamTrone attended the ribbon cutting of New Heights Industrial Park in Hagerstown. The Bluestone Group is working to uphold the history of the former Fairchild Building by partnering with @HGRAviationMus & looking for partners to invest in the future of New Heights. #MD06 pic.twitter.com/YEgZhRkder,1189917719241601024,2019-10-31,14:51:06,repdavidtrone,0,0,0,2019-10-31 14:51:06
"Happy Halloween! Ready for a scary story? Climate change is causing sea levels to rise, natural disasters to worsen, & food insecurity to grow. Still, @senatemajldr has let #HR9 go to die in his legislative graveyard. Time for Mitch to stop the tricks & deliver some treats. pic.twitter.com/OTB5xD7HtG",1189895493008183296,2019-10-31,13:22:47,repdavidtrone,4,3,13,2019-10-31 13:22:47
Let’s go Nats! #FINISHTHEFIGHT,1189692357731606528,2019-10-30,23:55:36,repdavidtrone,1,0,14,2019-10-30 23:55:36
At this morning's Freshmen Working Group on Addiction briefing we discussed harm reduction and its role in fighting the opioid epidemic. Thank you to @RepShalala and @RepMGS for your help organizing this event and for your continued commitment to ending the addiction crisis. pic.twitter.com/bSLg4BvD8G,1189653215761055748,2019-10-30,21:20:03,repdavidtrone,0,0,4,2019-10-30 21:20:03
Americans deserve lower prescription drug prices. Soaring prices are driving up health insurance premiums and creating unaffordable costs for taxpayers. I'm proud to support #LowerDrugCosts. pic.twitter.com/HSLS8WoLc4,1189619652256772099,2019-10-30,19:06:41,repdavidtrone,1,0,3,2019-10-30 19:06:41
".@TomColeOK04 and I sat down yesterday to talk about the importance of NIH funding. Without funding, we are putting ourselves at a disadvantage in the fight against Alzheimer's, opioids, and rare diseases. pic.twitter.com/FvfgknKZ4e",1189577343465148418,2019-10-30,16:18:34,repdavidtrone,2,1,8,2019-10-30 16:18:34
"Excited to work with @RosaDelauro on increasing funding for NIH. More money for NIH research grants means more lives saved. She has been an absolute champion for medical research, and I look forward to our partnership. pic.twitter.com/Wp2vQcv9Le",1189577124908326912,2019-10-30,16:17:42,repdavidtrone,1,1,6,2019-10-30 16:17:42
