tweet,id,date,time,username,replies_count,retweets_count,likes_count
What a fun week it's been! I'm so excited to have my daughter Margaret & her class from @TrinityWildcats in D.C.! Yesterday they toured the White House & today I met w/ them for a tour of the Capitol. I hope you've enjoyed the trip. It's been a special honor to spend time w/ you! pic.twitter.com/YwftkWoB2m,1091010056450203655,2019-01-31,16:27:22,repmartharoby,4,1,21
"Happy 98th birthday to Alabama's largest farm organization, @AlfaFarmers! Thank you for your tireless work for farmers in all 67 Alabama counties. Here's to 98 more!",1090977148666548227,2019-01-31,14:16:36,repmartharoby,2,2,22
.@mgmwerx is officially open! Yesterday they hosted their grand opening in downtown Montgomery to show off their new innovation center. I’m confident this collaboration w/ @usairforce & @HQAirUniversity will produce some amazing results. More via @yhn: https://yellowhammernews.com/mgmwerx-officially-launches-operations-in-montgomery/ …,1090666010141696007,2019-01-30,17:40:15,repmartharoby,1,2,7
Thanks for taking the time to sit down with me - I enjoyed our discussion! https://twitter.com/almedassoc/status/1090627726581616643 …,1090628081713319938,2019-01-30,15:09:32,repmartharoby,0,1,6
This afternoon I met w/ the AL Chapter of the American Academy of Pediatrics & the Medical Association of the State of Alabama. I appreciated this opportunity to learn more about the developments & needs of our medical community. Thanks for meeting w/ me & sharing your knowledge! pic.twitter.com/FD5j0maeMV,1090363189718585344,2019-01-29,21:36:57,repmartharoby,2,2,10
I'm grateful for these opportunities to continue to advocate for the conservative priorities important to the people I represent in AL-02. My full statement: https://roby.house.gov/newsroom/press-releases/roby-announces-committee-assignments-116th-congress …,1090322209405579264,2019-01-29,18:54:06,repmartharoby,1,0,4
"I'm excited to announce I will continue to serve on Approps & Judiciary Cmtes during the 116th. On Approps, I'll serve on the Subcmtes on State & Foreign Ops, MilCon-VA, & CJS. On Judiciary, I'll serve as Ranking Member on Subcmte on Courts, Intellectual Property, & the Internet.",1090321911782014976,2019-01-29,18:52:55,repmartharoby,3,6,35
"33 yrs ago we witnessed the Challenger explode 73 sec after launch. Today we remember the 7 lives lost & pay tribute to their bravery. As Pres. Reagan said, “The crew... honored us by the manner in which they lived their lives. We will never forget them.” https://bit.ly/LhQ81C ",1089933112119881728,2019-01-28,17:07:58,repmartharoby,1,4,23
AL-02 college students: My summer '19 internship application is available online now! This competitive experience is designed for those interested in learning about our nation's legislative process & the operations of a congressional office. Apply by 4/12:  https://roby.house.gov/student-resources/internships … pic.twitter.com/O4AAeYOw4o,1088842981568851968,2019-01-25,16:56:11,repmartharoby,1,2,12
"If you were impacted by this devastating event, please know that my office stands ready to assist you however we can. My staff & I want to be a resource for you during this difficult time, & our prayers are with you. #WetumpkaStrong",1088492413268692993,2019-01-24,17:43:09,repmartharoby,1,2,5
"I am grateful that the volunteer response was immediate & that the rebuilding process is already underway, but the road to recovery will be long & challenging for quite a few people who suffered tremendous loss.",1088492157248421889,2019-01-24,17:42:08,repmartharoby,1,1,3
"ICYMI: Yesterday, I spoke on the House floor to honor the people I represent in the City of Wetumpka who this past Saturday experienced devastating loss when a tornado struck their hometown. Watch my remarks via @wsfa12news --> https://www.wsfa.com/2019/01/23/wetumpka-honored-us-house-floor-after-tornado/ …",1088491896475930629,2019-01-24,17:41:05,repmartharoby,2,2,4
Spread the news: It’s National Peanut Butter Day! Did you know that almost half of the peanuts grown in the U.S. are grown within 100 miles of Dothan? You can find more interesting facts about peanuts via the Alabama Peanut Producers Association:  https://www.alpeanuts.com/peanuts-did-you-know/ … pic.twitter.com/P1CVwEWEXA,1088449281449693184,2019-01-24,14:51:45,repmartharoby,1,0,3
"My office stands ready to assist in whatever ways we're able. My staff & I work for you. We want to be a resource for you during this challenging time. In the meantime, my family & I will continue to pray for those hurt by this devastating event. We'll get through this together.",1088100756568395777,2019-01-23,15:46:50,repmartharoby,1,2,5
"I just spoke on the House floor to honor the people in Elmore County who this past Saturday experienced devastating loss when a tornado struck Wetumpka. I spent time on the ground w/ those impacted & saw firsthand the damage to churches, the police station, businesses, & homes. pic.twitter.com/udtYmEYt0G",1088100346927435776,2019-01-23,15:45:13,repmartharoby,2,4,11
"As recovery efforts begin in Wetumpka in the wake of the tornado, the Elmore County Commission has asked that all non-emergency calls related to storm damage & recovery be directed to 211 until further notice. If you have an emergency, please call 911. https://www.al.com/news/montgomery/2019/01/elmore-county-sets-up-hotline-for-storm-damage-calls.html …",1087746928136413186,2019-01-22,16:20:51,repmartharoby,0,7,13
"Today, we honor the life and legacy of Dr. Martin Luther King, Jr. He led a remarkable life of service, and we can all benefit tremendously from reflecting on his powerful example. #MLKDay",1087382897902915585,2019-01-21,16:14:20,repmartharoby,2,3,18
"Volunteers looking to help w/ the clean-up efforts in Wetumpka should contact the Elmore County EMA office at (334) 567-6451 beginning at 8:00 am CT today, Sunday January 20.  https://elmoreco.wordpress.com/2019/01/19/volunteer-coordination-information/ …",1086973145893011457,2019-01-20,13:06:07,repmartharoby,0,13,17
"My thoughts are with all those impacted by the tornado in Elmore County today, and my office stands ready to assist in whatever ways we are able. As we await further details about the full scale of damages, I will be praying for all those who have been injured. https://twitter.com/JoshWeather/status/1086740249550749699 …",1086746316334686208,2019-01-19,22:04:47,repmartharoby,1,11,28
"Thanks for having me on today, @jeff_poor! Great discussion about our pro-life efforts in Congress among other timely issues. Looking forward to next time. https://twitter.com/jeff_poor/status/1086339802423873543 …",1086360969067089921,2019-01-18,20:33:33,repmartharoby,4,1,12
The world’s largest pro-life event is taking place in DC today! Right now Americans from across the country are gathering to speak out for the unborn at the @March_for_Life. I'm grateful for their commitment & I stand w/ them in the fight. Watch live here:  http://goo.gl/b8NYo5  pic.twitter.com/qcK3KaAF2y,1086283725661458432,2019-01-18,15:26:37,repmartharoby,6,10,23
"I am proud of our pro-life victories so far during President Trump's term, & I will continue to work alongside his Administration & my colleagues in Congress to advance protections for the unborn. It's our responsibility to defend the defenseless.",1085999699658788866,2019-01-17,20:37:59,repmartharoby,6,4,16
"This wk, I joined 168 of my House colleagues in sending Pres. Trump a letter asking that he commit to reject any legislation that would weaken existing pro-life policy. I'm eager to see POTUS continue his pro-life efforts by making this promise to Congress & the American people. pic.twitter.com/MtMcQwPAnV",1085999484738457602,2019-01-17,20:37:08,repmartharoby,7,2,25
Great news for Montgomery! The newly-formed Montgomery Smart Community Alliance is creating a Smart City Living Lab in downtown to increase connectivity and work towards making Montgomery a more high-tech city. Read more about the plans here: https://www.wsfa.com/2019/01/17/city-montgomery-announces-new-smart-city-living-lab/ …,1085923610424995840,2019-01-17,15:35:38,repmartharoby,1,0,7
Calling all AL-02 small businesses and start-ups: You can pitch your ideas to the @usairforce! #AirForceInnovates https://twitter.com/usairforce/status/1083861111617867776 …,1085641290656727040,2019-01-16,20:53:48,repmartharoby,0,0,1
"As women, we have unique perspective to bring to the table, & it's our job to use our experiences to positively impact the dialogue surrounding the important issues facing our country. Many thx to Sec. Wilson for joining us & to @SenJoniErnst for hosting. Let's do it again soon!",1085617235547353091,2019-01-16,19:18:13,repmartharoby,2,1,5
"This morning, women in Congress from both sides of the aisle enjoyed breakfast with USAF Secretary Wilson & discussed ways we can find common ground on defense, foreign affairs, veterans affairs, & intelligence issues. pic.twitter.com/KJ1oPRP0vP",1085616857334378496,2019-01-16,19:16:43,repmartharoby,2,1,11
"45 yrs ago, SCOTUS offered its Roe v. Wade decision that legalized abortion on demand. Since then, more than 60 million babies have had their lives ended by abortion. To say this is a tragedy is an understatement. I won’t stop fighting until our laws protect life at every stage.",1085567395018825729,2019-01-16,16:00:10,repmartharoby,2,14,29
"This morning, I spoke on the House floor to commemorate the 2019 @March_for_Life which will take place in Washington, D.C., this Friday, January 18. Our pro-life momentum is strong, especially during this time each year, but our work is far from being complete. pic.twitter.com/c3LTx8eQYh",1085566754355662849,2019-01-16,15:57:37,repmartharoby,12,67,251
"In her remarks, she outlined the importance of fighting against abortion and explained a few of the many reasons #WhyWeMarch. 

Watch her speech starting at the 1:06:38 mark here: 
 https://www.c-span.org/video/?439812-1/lawmakers-address-march-life-rally …",1085245160492056577,2019-01-15,18:39:43,repmartharoby,3,3,14
"Last year, Montgomery native Agnes Armstrong was selected as the guest college student speaker for the 2018 @March_for_Life Rally. Agnes served this past summer as one of my interns, and I was impressed by her dedication to defending the lives of the unborn.",1085245159808348160,2019-01-15,18:39:43,repmartharoby,1,11,45
Read my weekly column via the @MGMAdvertiser here: https://www.montgomeryadvertiser.com/story/opinion/2019/01/11/martha-roby-congress-and-administration-fighting-human-trafficking/2551822002/ …,1084895814932148225,2019-01-14,19:31:33,repmartharoby,1,4,7
".@POTUS has designated Jan. as Nat'l Slavery & Human Trafficking Prevention Month. In my column, I discuss 4 bills he signed to strengthen internat'l standards, authorize $ to fight trafficking, provide resources for victims, & est. better agency collaboration to bring justice.",1084895691439255558,2019-01-14,19:31:03,repmartharoby,7,8,27
ICYMI: I spoke on the House floor to highlight the severity of the situation at our border. My constituents have told me time & time again that we need enhanced border security & I couldn't agree more. The time to act is now. Watch my speech via @yhn here: https://yellowhammernews.com/roby-on-border-security-we-are-in-the-midst-of-a-real-crisis-and-we-must-act-now/ …,1083841806146723841,2019-01-11,21:43:18,repmartharoby,15,8,23
You can find the full list of @March_for_Life events here: https://marchforlife.org/mfl-2019/rally-march-info/ …,1083789235050688516,2019-01-11,18:14:24,repmartharoby,1,13,21
"The @March_for_Life is a week from today! People from across the country travel to D.C. to participate in this remarkable event each year. If you’re an AL-02 resident making the trip, let my office know – we'd love to see you & hear why you march. #whywemarch #uniquefromdayone",1083789234329317382,2019-01-11,18:14:23,repmartharoby,4,16,45
"It’s Human Trafficking Awareness Day in Alabama. Across the state, the Alabama Human Trafficking Task Force will spend the day educating people about this terrible crisis, its impact on Alabama, and how we can put a stop to it. More here: https://yellowhammernews.com/alabama-human-trafficking-awareness-day-to-be-held-friday/ …",1083751471731097600,2019-01-11,15:44:20,repmartharoby,1,12,12
"For the past decade, the people I represent in SE Alabama have consistently expressed to me their frustrations w/ our country’s illegal immigration problem. We must use every tool available to finally enhance our border security, & we must do it now. We can't wait another decade.",1083502710580748288,2019-01-10,23:15:51,repmartharoby,13,7,18
"I just spoke on the House floor to underscore the severity of the situation at the southern border. Here in Congress, my colleagues on both sides of the aisle are talking about this issue as if it’s something new – but this is NOT a new issue. pic.twitter.com/MtPvAkRrGT",1083502534780698624,2019-01-10,23:15:09,repmartharoby,22,17,44
You can read more about the scholarship and its recipients via @yhn: https://yellowhammernews.com/red-tail-scholarship-foundation-honors-legacy-of-tuskegee-airmen/ …,1083452010052177921,2019-01-10,19:54:23,repmartharoby,0,4,8
Have you heard about the Red Tail Scholarship Foundation? This non-profit provides scholarships to African American students interested in a career in aviation. AL has an incredible history w/ the Red Tails & I’m glad that this will continue to promote their remarkable legacy.,1083452009183883267,2019-01-10,19:54:23,repmartharoby,2,5,13
The 2019 Wiregrass Renaissance Faire will be open this weekend and next weekend from 10 a.m. to 5 p.m. Don’t miss out on this great event! More information here:  https://www.dothanfirst.com/news/don-t-miss-the-wiregrass-renaissance-faire/1693570021 …,1083394556689825792,2019-01-10,16:06:05,repmartharoby,0,0,0
"Human trafficking is happening all around us, on a daily basis, in plain sight. It is our responsibility to stop these heinous crimes & take action when we see them happening. If you have any information, call 334-242-1142 or file a report online here:  https://app.alea.gov/SAR ",1083073118430744576,2019-01-09,18:48:48,repmartharoby,0,1,3
"In recent weeks, POTUS has signed several bills that demonstrate our commitment to eradicating human trafficking. TODAY, he'll sign the Trafficking Victims Protection Reauthorization Act, which tightens criteria for whether countries are meeting standards for ending trafficking.",1083072550563971072,2019-01-09,18:46:33,repmartharoby,2,5,19
It’s Law Enforcement Appreciation Day! I am grateful for all who serve and keep our communities safe. Thank an officer today! #LEAD2019 pic.twitter.com/PPhoG4FUOJ,1083016057575694336,2019-01-09,15:02:04,repmartharoby,1,9,19
"The deadline to submit an entry to this year's Congressional Art Competition through my office is coming up on Monday, January 28. Please share this information w/ AL-02 high school students who might be interested in participating. Rules & specifics here: https://roby.house.gov/student-resources/art-competition …",1082672321075310593,2019-01-08,16:16:11,repmartharoby,3,3,1
"2018 was a fantastic year in many ways for our district, state, & country. From great economic news here in AL-02 to a strong new farm bill & proper defense funding, there was a lot to celebrate last year & much work to continue as we welcome 2019. More in my column via @yhn --> https://twitter.com/yhn/status/1081890193836265472 …",1082332010012700672,2019-01-07,17:43:54,repmartharoby,4,3,19
"ICYMI: Yesterday, the 116th Congress was sworn-in. I will continue to fight for the priorities of my constituents and the issues that impact Alabama, and I am honored to represent Alabama’s Second District for another term in the House of Representatives. https://www.andalusiastarnews.com/2019/01/04/roby-sworn-in-for-5th-term-thursday/ …",1081283969314902016,2019-01-04,20:19:22,repmartharoby,3,1,17
"GREAT economic news: Our economy added 312,000 jobs in December - almost double what was expected, according to the recently released #JobsReport. I hope we see this momentum continue through 2019! http://www.aldailynews.com/us-employers-added-a-stellar-312000-jobs-in-december/ …",1081194320911314944,2019-01-04,14:23:08,repmartharoby,7,7,30
"Today, alongside my family, I was sworn-in to a 5th term serving AL-02 in the U.S. House of Representatives. I'm humbled & grateful to have this opportunity. W/ every vote I cast, my guiding principle is that Alabama always comes first. My statement here:  https://roby.house.gov/newsroom/press-releases/roby-sworn-fifth-term-116th-congress-begins … pic.twitter.com/ZHwkEcRJ5o",1080957648642732032,2019-01-03,22:42:41,repmartharoby,3,3,46
The Chattahoochee River is continuing to rise at an alarming speed. I encourage residents of Columbia and Gordon to stay up-to-date with conditions and heed any warnings. Be safe! https://www.dothaneagle.com/news/local/caution-urged-for-residents-as-chattahoochee-continues-to-rise/article_d522f644-0d11-11e9-a5e2-13389d857be2.html …,1080927110028541953,2019-01-03,20:41:20,repmartharoby,5,1,3
The 116th Congress will be sworn-in today! You can watch the ceremony live beginning at 11:00 a.m. Central Time:  https://www.c-span.org/congress/ ,1080850252154982400,2019-01-03,15:35:55,repmartharoby,1,1,5
"2018 brought some great economic news to AL-02! Shaw Industries invested $250 million in its Andalusia plant. I’m looking forward to seeing this company continue to grow, & I am eager to hear more positive news like this in 2019. AL is open for business! https://m.andalusiastarnews.com/2019/01/01/looking-back-shaws-250m-investment-will-have-long-term-impact-on-community/?fbclid=IwAR0J4bVkeAaQdRLGXefWZNqt7NYmegVrV1VDqlbfw5ZzitATrSxmVNwIBnE …",1080524850928730112,2019-01-02,18:02:54,repmartharoby,3,4,13
Happy New Year! I pray 2019 brings health and happiness to all the wonderful people I'm grateful to represent here in Alabama's Second District. pic.twitter.com/AnzII6t7JA,1080122809429516288,2019-01-01,15:25:20,repmartharoby,4,2,38
