tweet,id,date,time,username,replies_count,retweets_count,likes_count
Thanks to the Rochester Post-Bulletin for reporting on our town hall. I enjoyed the back and forth discussion and the opportunity to address many issues.-JH https://twitter.com/PB_News/status/1145167725964288000 …,1145439382213713923,2019-06-30,21:10:04,rephagedorn,8,3,3
"I support our nation’s foreign policy goals of standing with U.S. allies, projecting American values and building relationships of lasting peace.-JH",1145318582865268741,2019-06-30,13:10:03,rephagedorn,6,1,4
"The historic visit between @realDonaldTrump, Chairman Kim Jong Un and President Moon Jae-in at the Korean DMZ was a bold stroke of diplomacy that offers both risk and hope. https://www.politico.com/story/2019/06/30/trump-north-korea-kim-jong-un-1390737 …",1145318581959319552,2019-06-30,13:10:03,rephagedorn,9,3,5
Check back soon for town hall video -JH,1145010987067727872,2019-06-29,16:47:47,rephagedorn,1,1,4
"Special thanks to Kathleen Harrington, President of the Rochester Chamber of Commerce, for serving as the town hall moderator. -JH #rochmn pic.twitter.com/aTin2yQJmg",1145010892502904832,2019-06-29,16:47:24,rephagedorn,1,3,2
"Thanks to everyone who joined us for the Olmsted Co Town Hall at Rochester Community and Technical College last night. These opportunities are important as I hear directly from you about how federal policies affect family, business, school, health care, taxes and more. -JH pic.twitter.com/dkJ1jQGUtI",1145003090208284673,2019-06-29,16:16:24,rephagedorn,2,2,2
".@flyrst is an important transportation hub that serves our whole region. It was my pleasure to discuss expansion opportunities and federal @USDOT programs with local officials.
-JH #mn01 pic.twitter.com/mmGf01kE7g",1144746027544711168,2019-06-28,23:14:55,rephagedorn,0,2,4
"It was great to visit @KwikTrip in Eyota. We started at a convenience store, which is a constant hub of activity, followed by an informative tour of their ethanol and biodiesel blending facility. -JH #mn01 pic.twitter.com/t2N6XTyVvo",1144694409776312323,2019-06-28,19:49:49,rephagedorn,1,2,7
Suggested parking for tonight’s Olmsted Co Town Hall at @RochesterCTC is Heintz West Lot (parking also available in Heintz East Lot). https://hagedorn.house.gov/townhall ,1144622806698778629,2019-06-28,15:05:17,rephagedorn,2,2,2
"Happy Minnesota Turkey Week! This week is an opportunity to recognize all the hard work that our Minnesota turkey growers do for our state. Minnesota is number one in turkey production! -JH
#Minnesotaturkeyweek
 https://minnesotaturkey.com/ ",1144567474672848896,2019-06-28,11:25:25,rephagedorn,1,2,5
Thank you to @ABC_MNandND and @MN4H students for coming by my office this week! -JH #MN01 pic.twitter.com/CSumZN8sJG,1144411363894353926,2019-06-28,01:05:05,rephagedorn,0,3,7
"Our Olmsted County Town Hall is at @RochesterCTC - Heintz Center Campus, Heintz Commons (inside of Door H15), 1926 Collegeview Road SE, Rochester. Find more details and a link to a campus map:  https://hagedorn.house.gov/townhall  #RochMN #MN01",1144363552091856898,2019-06-27,21:55:06,rephagedorn,2,2,1
Statement on addressing the humanitarian crisis on our southern border pic.twitter.com/IBCi3AgL60,1144361685144264705,2019-06-27,21:47:41,rephagedorn,3,3,4
"Our Olmsted County Town Hall is tomorrow, starting at 6:30 p.m. Doors open at 5:30 p.m.  https://hagedorn.house.gov/townhall ",1144239014859464704,2019-06-27,13:40:14,rephagedorn,3,2,2
Welcome news! I’ve been a long-time advocate of efforts to promote price transparency and competition to improve health care and drive down costs. I offer my support to the Trump administration as it enacts this new policy. -JH https://abcnews.go.com/Politics/president-trump-signs-executive-order-tackling-health-care/story?id=63909394 …,1143972632418816000,2019-06-26,20:01:44,rephagedorn,3,6,5
"It was an honor to welcome Jeff Neve of @MayoClinic Ambulance Service to Washington! Jeff, an Emergency Medical Technician, was recognized as a #StarsofLife by @amerambassoc. -JH pic.twitter.com/6QXcS2Jf81",1143942696337334272,2019-06-26,18:02:46,rephagedorn,1,3,8
"Attend the Olmsted County Town Hall Event this Friday from 6:30 p.m. - 8 p.m.
Details:  https://hagedorn.house.gov/townhall  #MN01 pic.twitter.com/5DbCbEyCt0",1143687041487724544,2019-06-26,01:06:54,rephagedorn,1,3,1
"Interns gain a valuable perspective on the legislative process. The deadline to apply for fall internships is one week from today, July 1. https://hagedorn.house.gov/services/internships …",1143304073560625154,2019-06-24,23:45:07,rephagedorn,0,3,3
"Today, Tyler Quitmeyer of Austin, saw his artwork on display on Capitol Hill! “All American” won our district's Congressional Art Competition. Congrats, Tyler! pic.twitter.com/WexCy47n0z",1143256776898469888,2019-06-24,20:37:10,rephagedorn,1,2,12
"To the men and women of law enforcement: We Have Your Backs! Tragically, two police officers were murdered in just the past few days. Let’s always show our respect and admiration for those who protect and serve our communities. -JH https://fox4kc.com/2019/06/23/missouri-officer-shot-killed-while-investigating-bad-check-complaint-near-st-louis/ …",1143196238252261383,2019-06-24,16:36:37,rephagedorn,0,2,6
Thanks to Georgia for interning with us! Best wishes as you return to school in Minnesota. pic.twitter.com/HKXDAmMG5Z,1142240561367310336,2019-06-22,01:19:06,rephagedorn,0,2,8
Our compassionate goal is empowering people to go from welfare and government dependency to work and self-sufficiency. -JH https://youtu.be/RCTaXus3iUk ,1141862818154782721,2019-06-21,00:18:05,rephagedorn,3,5,3
"If you have any concerns about transportation in southern Minnesota, or any other topic, don’t hesitate to contact us. Send an email or find contact information at  http://hagedorn.house.gov . -JH #MN01",1141754462576480257,2019-06-20,17:07:31,rephagedorn,1,3,3
Transportation priorities should be an area where we can find overwhelming bipartisan consensus. I appreciated the opportunity to discuss Highways 14 and 169 yesterday with MN transportation officials. - JH https://twitter.com/KEYCNews12/status/1141507674863001602 …,1141744253565100034,2019-06-20,16:26:57,rephagedorn,0,2,5
"Thanks, Minnesota Transportation Alliance, for the opportunity to connect with you this morning. Quality roads affect all of us in #MN01 -JH @MNTransportAll pic.twitter.com/V7WdnwEGcm",1141505253919068160,2019-06-20,00:37:15,rephagedorn,0,2,2
"Attention Dairy Producers: Sign-ups for the '19 Dairy Margin Coverage program began this week. Also, dairy producers are invited to a workshop in July in Mankato and Rochester, hosted by the Farm Service Agency and University of Minnesota Extension https://content.govdelivery.com/accounts/USFSA/bulletins/24acc59 …",1141342561166090240,2019-06-19,13:50:46,rephagedorn,2,4,4
"In #rochmn, I visited @AbilityBC, which exists to serve people with disabilities and special needs by providing rehabilitation and employment services. -JH pic.twitter.com/H8JSIaZGtV",1140993696445456385,2019-06-18,14:44:30,rephagedorn,1,2,2
"Yesterday in Rochester, I visited the Zumbro Valley Health Center, which provides care relating to mental health and substance use disorders #rochmn -JH pic.twitter.com/4f1P0bhFse",1140989736884080641,2019-06-18,14:28:46,rephagedorn,1,2,2
"While visiting community resources and non-profits throughout #MN01, I see a constant theme of southern Minnesotans tirelessly serving their neighbors. -JH #service #dedication",1140989524971020288,2019-06-18,14:27:55,rephagedorn,2,3,6
Happy Father’s Day! I’m grateful to remember my dad’s service to Minnesota and our nation every day as I now serve in the same office he had. -JH #FathersDay https://www.rollcall.com/news/hoh/jim-hagedorn-follows-in-his-father-office-footsteps …,1140258272869527553,2019-06-16,14:02:11,rephagedorn,0,2,2
"Thank you, Rochester Police, for sharing the positives of the Police Assisted Recovery program and discussing how we can combat drugs through the High Intensity Drug Trafficking Area designation -JH #rochmn https://kttc.com/news/minnesota-news/2019/06/14/rep-hagedorn-visits-rpd-talks-drug-enforcement/ …",1139996802411839490,2019-06-15,20:43:12,rephagedorn,0,3,9
"Happy Flag Day! Did you know you can order flags that have been flown over the U.S. Capitol? Learn more about this public service offered by Congressional offices:  https://hagedorn.house.gov/services/flags  
-JH pic.twitter.com/tuL9pVEUg6",1139524185485692930,2019-06-14,13:25:11,rephagedorn,0,4,4
This week I met with the Taiwanese national delegation attending the #SelectUSASummit conference hosted by @SecretaryRoss -JH @SelectUSA pic.twitter.com/bhP7hGZkpr,1139342960733110272,2019-06-14,01:25:04,rephagedorn,1,2,7
"If any communities have trouble navigating the assistance programs, I invite them to contact my Mankato office at 507-323-6090. #MN01
-JH",1139208253613719552,2019-06-13,16:29:47,rephagedorn,0,2,2
"It was a rough spring between flooding, winter storms and high winds. I hope this disaster designation will help MN communities get the federal support they need. -JH https://kstp.com/news/trump-approves-minnesota-disaster-declaration/5387551/ …",1139208252850364416,2019-06-13,16:29:47,rephagedorn,2,5,8
Happy birthday!,1138540491560103936,2019-06-11,20:16:20,rephagedorn,0,0,1
Today in @HouseAgGOP we heard from Ambassador Doud and Undersecretary Ted McKinney. We need to pass #USMCA to support jobs dependent on trade with our North American neighbors! – JH pic.twitter.com/3BBwzTeTb3,1138540339076186112,2019-06-11,20:15:44,rephagedorn,2,5,7
Loved having students from @RclsRochesterMN visit the Capitol today! -JH #RochMN pic.twitter.com/ytwJC1RtlM,1138176793607884801,2019-06-10,20:11:08,rephagedorn,1,2,8
"We must now pass USMCA to expand markets for Minnesota’s farmers, manufacturers and more.-JH",1137522054167703552,2019-06-09,00:49:26,rephagedorn,1,2,5
Border security is national security.  I’m pleased the administration successfully negotiated with Mexico the need to enforce border security and dismantle human trafficking and drug smuggling activities. https://www.investors.com/news/economy/trump-mexico-tariff-dropped-migrant-deal-reached/ …,1137522052578054145,2019-06-09,00:49:26,rephagedorn,4,3,5
25 years ago the Luverne Vets Home opened. We are grateful for everyone who serves our vets at this location and we extend our steadfast gratitude to its residents for defending our nation. -JH pic.twitter.com/wtU3HgZP5w,1137369098093060096,2019-06-08,14:41:38,rephagedorn,0,3,6
"As a member of @HouseAgGOP, I am listening to farmers’ concerns and working hard to help sustain agriculture and our way of life. One way we can help expand our markets is to pass #USMCA. We urge Speaker Nancy Pelosi give it an up-or-down vote. #MN01 needs the USMCA. -JH",1137163782768222209,2019-06-08,01:05:47,rephagedorn,1,4,17
Today I joined MN @SenatorWeber and MN Rep. Joe Schomacker in Luverne for an agriculture roundtable discussion with local residents. -JH pic.twitter.com/bjuSUNF6Mc,1137163219901005824,2019-06-08,01:03:33,rephagedorn,0,2,5
"Answer to yesterday's #ThrowbackThursday. I'm #9.
-JH pic.twitter.com/KPpBuRtQWS",1136979918787698691,2019-06-07,12:55:11,rephagedorn,0,2,1
"For #ThrowbackThursday, here’s a photo spotted during my town hall at St. Paul's in Truman. I played basketball, though there’s a reason I never went on to play basketball professionally. Which number do you think I am? Answer tomorrow. #tbt
-JH pic.twitter.com/JSnOzweQ8d",1136753414233309185,2019-06-06,21:55:08,rephagedorn,3,1,2
WATCH: Promoting Vocational Training at Ways & Means Committee https://youtu.be/-HdZQnwuA6M ,1136702773460897792,2019-06-06,18:33:54,rephagedorn,0,3,4
"President Reagan on #DDay 40th Anniversary: “All of you loved liberty. All of you were willing to fight tyranny, and you knew the people of your countries were behind you.” https://youtu.be/1Leb7ynduCU ",1136665364023169025,2019-06-06,16:05:15,rephagedorn,1,3,4
"“I want to share all the glory, all the honor, everything with those boys that never come back.” -Veteran Dennis Boldt
#DDayAnniversary #DDay75thAnniversary #DDay75 https://www.keyc.com/2019/05/30/mankato-veteran-reflects-d-day/ …",1136621960446795776,2019-06-06,13:12:47,rephagedorn,0,3,5
Thank you @CPofMN for sharing the issues that are affecting nursing homes and assisted living facilities in Minnesota. https://www.keyc.com/2019/06/05/long-term-care-workers-meet-hagedorn-washington/ …,1136340950974959617,2019-06-05,18:36:09,rephagedorn,1,3,6
Thanks @ALUMACRAFTBOATS @therealnmma http://www.nmma.org/press/article/22708 …,1135998184440963073,2019-06-04,19:54:07,rephagedorn,1,4,5
"WATCH: Martin County Town Hall Event
 https://youtu.be/km1XBquPthM  #MN01",1135655977284448260,2019-06-03,21:14:19,rephagedorn,2,3,3
"Thanks to everyone who joined us for the Town Hall in Martin County this morning! Great conversations on the issues affecting families, farms, businesses and our local communities. #MN01 pic.twitter.com/7t9FhLK3Wz",1134895913326059520,2019-06-01,18:54:05,rephagedorn,7,8,29
