tweet,id,date,time,username,replies_count,retweets_count,likes_count
"Last year, U.S. carbon emissions increased & we endured record-breaking drought & wildfire across the West. More than ever, we need strong leadership at @EPA to combat climate change & protect public health. @EPAAWheeler is not that leader. Full statement: https://www.bennet.senate.gov/public/index.cfm/press-releases?id=1DB6B1EC-2A6A-4491-8BE8-2D0AD8201B77 …",1101214155825205249,2019-02-28,20:14:48,senatorbennet,42,85,342
"I can think of nothing more at war with who we are as Americans than letting kids grow up in poverty. A new report shows how we can cut child poverty in half & how a child allowance, like my #AmericanFamilyAct, can be a big part of the solution. https://www.nap.edu/child-poverty/?utm_source=rep123&utm_medium=email&utm_campaign=childpov&utm_content=embargo …",1101178331364511744,2019-02-28,17:52:27,senatorbennet,45,68,262
"Heading into the Senate Ag Hearing to question @SecretarySonny on implementing the #FarmBill. From legalizing #hemp to funding drought resilience, we have our work cut out for us. We must ensure the Trump administration stands ready to help Colorado implement the bill.",1101150768764207104,2019-02-28,16:02:56,senatorbennet,12,18,139
Agree that the health of our communities is dependent on vibrant local news. We must seek out innovative ways to support & invest in local journalism and ensure the next generation understands the critical role it plays in our democracy.,1100917014107955202,2019-02-28,00:34:04,senatorbennet,32,46,388
"10 years ago today, the Rocky Mountain News published its final edition. I can’t imagine my time at Denver Public Schools without having both the Rocky & Denver Post to hold each other to the highest standards & push for facts. https://www.theatlantic.com/ideas/archive/2019/02/who-is-going-to-save-local-news/583696/ …",1100916020586385408,2019-02-28,00:30:07,senatorbennet,27,67,469
"We all have a responsibility to do everything we can to protect our environment now and for generations to come. Thank you, @LCVoters. #LCVScorecard https://twitter.com/LCVoters/status/1100866599685419008 …",1100874420690829312,2019-02-27,21:44:49,senatorbennet,13,27,189
"In Colorado, after two of the worst mass shootings in our nation’s history, our legislators rose to the occasion & strengthened gun background checks. 

Today the House joined Colorado, passing a clean bill to #UpdateBackgroundChecks nationwide. 

The Senate must do the same.",1100862433269350400,2019-02-27,20:57:11,senatorbennet,72,315,2260
#LWCF has directly benefited communities in our state like Durango. We are now one step away from providing Coloradans the certainty they need to pursue conservation projects that will boost the outdoor economy. pic.twitter.com/I6TIWSn8uU,1100584933020585985,2019-02-27,02:34:30,senatorbennet,11,9,52
House passage of #LandsPackage2019 moves it to the President's desk. Permanent reauthorization of LWCF will expand & ensure access to public lands for future generations. pic.twitter.com/af6T8lCFrl,1100562308164657154,2019-02-27,01:04:36,senatorbennet,9,8,137
"For years, I worked w/Senator John McCain, who valued service above all else, on the 21st Century Conservation Service Corps. Our bill, headed to @POTUS' desk in #LandsPackage2019, expands opportunities for youth & veterans to pursue national service & outdoor careers. #21CSC https://twitter.com/TheCorpsNetwork/status/1098679930941001728 …",1100548231392579584,2019-02-27,00:08:40,senatorbennet,14,26,261
Now the Senate must pass this disapproval resolution to bring the President’s #FakeTrumpEmergency to an end. This sends a clear message to @realDonaldTrump that he cannot undermine democratic norms to fulfill his campaign promise. https://twitter.com/thehill/status/1100540861765611520 …,1100547040264810496,2019-02-27,00:03:56,senatorbennet,116,186,1316
"#LandsPackage2019—which includes many bills I’ve long-championed—will ensure access to #publiclands for future generations. 

After years of working alongside Coloradans to save #LWCF, permanent reauthorization is headed to @POTUS' desk. Now our work for full funding continues.",1100545831231471616,2019-02-26,23:59:07,senatorbennet,13,24,274
Yet another example of the Trump Administration undermining women’s health care and the right to choose. https://twitter.com/NPR/status/1099026538710908930 …,1099303301001211904,2019-02-23,13:41:45,senatorbennet,212,475,1532
".@realdonaldtrump, nice attempt to move the goal posts back to the 1950s by putting climate deniers on a panel to discredit a fact that your own government has reinforced time and time again: 

Climate change is a threat to national security. https://twitter.com/nytimes/status/1098292478673866752 …",1098311269680140289,2019-02-20,19:59:46,senatorbennet,75,267,956
"This is incredibly moving. Thank you, @repjanetbuckner for sharing your story. https://twitter.com/nowthisnews/status/954542263903838208 …",1098259581627699200,2019-02-20,16:34:23,senatorbennet,38,161,595
Colorado won’t stand for this attack on our Constitution and rule of law. Grateful to @GovofCO and @COAttnyGeneral for joining the lawsuit to block President Trump’s #fakenationalemergency. https://nyti.ms/2GOE7AW ,1097952060815958016,2019-02-19,20:12:24,senatorbennet,191,195,1158
"Whatever your politics, every American should worry about a President inventing a fake emergency to bypass Congress. This is a dangerous precedent and blatant attack on our democracy and rule of law. #FakeTrumpEmergency",1096485273771393026,2019-02-15,19:03:55,senatorbennet,431,2038,7496
"At a time when @POTUS attacks judges, flouts ethical norms, and disparages the Mueller investigation, Mr. Barr’s broad view of executive power and narrow view of obstruction of justice are deeply troubling. That's why I voted against his nomination for Attorney General.",1096172876879851520,2019-02-14,22:22:34,senatorbennet,151,250,1824
"Climate change is a national emergency. 

So is child poverty. 

You know what's not, @realDonaldTrump? Your ridiculous campaign promise.",1096139597195689990,2019-02-14,20:10:19,senatorbennet,406,1747,8632
"We owe it to the kids in Parkland, and kids across the country, to fight for a country free from gun violence. 

The time to act is now.",1096090475193421831,2019-02-14,16:55:08,senatorbennet,66,87,614
"In the year #sinceParkland, nearly 1,200 children have been killed by guns. 

Yet, tragedy after tragedy, Congress has done nothing.",1096090153913860100,2019-02-14,16:53:51,senatorbennet,28,74,343
"Alyssa Alhadeff
Scott Beigel
Martin Duque Anguiano
Nicholas Dworet
Aaron Feis
Jaime Guttenberg
Chris Hixon
Luke Hoyer
Cara Loughran
Gina Montalto
Joaquin Oliver
Alaina Petty
Meadow Pollack
Helena Ramsay
Alex Schachter
Carmen Schentrup
Peter Wang",1096089849424154624,2019-02-14,16:52:39,senatorbennet,3,40,179
"We remember the 17 students and staff from Marjory Stoneman Douglas High School in Parkland, Florida who were taken from us one year ago today. 

We must honor their lives with action. #msdstrong",1096089164041408512,2019-02-14,16:49:55,senatorbennet,25,105,709
".@StephenAtHome speaking the truth.

""Celebrating"" a bill to keep the gov open means accepting such a pathetically low standard for our leaders. We need to raise our game & do real work for our country—on immigration, climate, income inequality & more. https://youtu.be/-klwBbrCmGw ",1096070091136008195,2019-02-14,15:34:08,senatorbennet,16,52,269
The President should not walk away from China negotiations w/ a superficial deal. Any deal w/ China must include real commitments to address tech transfer & IP threats that harm our workers & undermine our economic & national security. More on our letter: https://www.reuters.com/article/us-usa-trade-china-democrats/senate-democrats-press-trump-for-china-ip-tech-transfer-commitments-idUSKCN1Q22S1?il=0 …,1095880513007599616,2019-02-14,03:00:49,senatorbennet,24,40,146
"It’s unacceptable that the United States does not guarantee #paidleave for our workers. We must pass the #FAMILYAct to guarantee paid leave, support working families and small businesses, and – in turn – strengthen our economy.",1095843568294547456,2019-02-14,00:34:01,senatorbennet,54,128,928
"In the Yampa River Valley, #LWCF helped improve access for anglers to world-class trout waters. My trip there last year—with sportsmen, veterans & @COParksWildlife—was telling of the enormous role LWCF plays in their lives. pic.twitter.com/dT8lqaVmxF",1095710839666036738,2019-02-13,15:46:36,senatorbennet,17,14,87
"In the #LandsPackage2019, we made a commitment to future generations to permanently protect their access to public lands across the country. In the last decade, Coloradans have shown me the importance of #LWCF projects in places like Ophir Valley & Yampa River. Take a look ⬇️ pic.twitter.com/8hJbUnZP9Z",1095708093990739970,2019-02-13,15:35:41,senatorbennet,8,23,151
"After working for a decade to #SaveLWCF, tonight the Senate passed permanent reauthorization as part of the #LandsPackage2019. Thank you to everyone who spoke up about this critical program to expand access to the outdoors in Colorado & across the country. pic.twitter.com/lWRWgE5iIM",1095485296353951746,2019-02-13,00:50:22,senatorbennet,18,54,386
Today is a victory for Colorado and a commitment to future generations. #SaveLWCF pic.twitter.com/Q5HxdhxHfp,1095455583283617793,2019-02-12,22:52:18,senatorbennet,17,20,182
"🚨 Senate passes #LWCF permanent reauthorization!
 
To everyone who fought to #SaveLWCF, thank you. This is your historic win. After a decade of leading the charge, we’ll make sure this bill makes it across the finish line.",1095451067175845893,2019-02-12,22:34:21,senatorbennet,6,41,239
"These attacks don’t happen in a vacuum. When you slander journalists as enemies of the people, you give cover to those who seek to commit violence against them. 

Our nation was founded on the view that journalists should work in freedom, not fear. https://twitter.com/washingtonpost/status/1095345503498326016 …",1095440412775497728,2019-02-12,21:52:01,senatorbennet,206,586,2208
"To those gathered outside the Capitol today, thanks for raising your voices. We’ll keep fighting to #SaveTPS. pic.twitter.com/0KQ9WguWUA",1095381875726659585,2019-02-12,17:59:25,senatorbennet,45,137,1075
"The #LWCF bill passed a procedural step last night, putting us closer to permanently reauthorizing the program. Having worked on this issue since I joined the Senate in 2009, I’m thrilled that we are nearing the finish line.",1095379850213380098,2019-02-12,17:51:22,senatorbennet,10,16,101
"To secure US leadership in #AI, this order must be followed by a long-term strategy that maintains & enhances US competitiveness in technologies of the future and is clear-eyed about the challenges ahead, including implications for our privacy, security, & economic prosperity. https://twitter.com/thehill/status/1095073510706331648 …",1095108417620987905,2019-02-11,23:52:47,senatorbennet,22,34,140
It’s time for Justin Fairfax to step down.,1094367976810266629,2019-02-09,22:50:32,senatorbennet,76,39,491
"John Dingell will be remembered for his esteemed service, landmark legislation, & incomparable wit. His leadership at a time when Congress was less partisan & more responsive to the people will not be forgotten.
 
Our thoughts are with @RepDebDingell and John’s family & friends.",1094245989718937600,2019-02-09,14:45:48,senatorbennet,14,53,434
"Looking forward to working as ranking member of @SenateAgDems subcommittee on Conservation, Forestry & Natural Resources & @SenateFinance subcommittee on Energy, Natural Resources & Infrastructure to fight for CO’s rural communities & advance bipartisan clean energy solutions.",1093919940984426497,2019-02-08,17:10:12,senatorbennet,11,29,256
Thank you @RepDianaDeGette for leading the first House oversight hearing on the Trump administration’s inhumane and cruel family separation policy. The White House must be held accountable. https://twitter.com/RepDianaDeGette/status/1093585652136980482 …,1093690237069463552,2019-02-08,01:57:26,senatorbennet,89,202,941
"More evidence that @realDonaldTrump should prioritize #climatechange, not ignore it like he did in the #SOTU. Today @NASA and @NOAA found that 2018 was the fourth hottest year on record. https://twitter.com/NOAA/status/1093182290937683968 …",1093268797279084545,2019-02-06,22:02:47,senatorbennet,62,88,311
"Every Coloradan, whether they live in a city or the mountains, should have access to affordable, high-quality health care. That's why my #MedicareX plan would roll out first in rural communities. Today I met with @coruralhealth to hear their input on expanding access. pic.twitter.com/9KJXNEa74W",1093263132217278473,2019-02-06,21:40:17,senatorbennet,33,40,279
"The state I represent is a third republican, a third democratic, and a third independent. Colorado knows what hard, bipartisan work really looks like. We’ll be looking in the days, months, and years ahead to see if any of it can be produced in Washington.",1093006155113222145,2019-02-06,04:39:09,senatorbennet,41,67,678
"We heard nothing in tonight’s speech that addressed how the President will help raise incomes for middle-class Americans, make quality higher education more affordable, or address the urgent problem of climate change.",1093006045545418752,2019-02-06,04:38:42,senatorbennet,38,83,704
It will take more than a speech to paper over President Trump’s consistent view that the only obligation he has is to his political base.,1093005967678210048,2019-02-06,04:38:24,senatorbennet,58,164,1249
What lines did we miss?,1092950547760640003,2019-02-06,00:58:11,senatorbennet,33,12,123
"He thinks Democrats have “turned into an angry mob, bent on destroying anything or anyone in their path.”",1092948049834446848,2019-02-06,00:48:15,senatorbennet,36,19,192
He has said Democrats are “too dangerous to govern” and have “gone wacko.”,1092946954781421569,2019-02-06,00:43:54,senatorbennet,25,18,169
He has called Democrats “totally unhinged” and the “party of crime.”,1092946385257877504,2019-02-06,00:41:38,senatorbennet,23,20,171
It will be interesting to hear what @realDonaldTrump comes up with tonight to talk about his commitment to bipartisanship. He should probably not repeat these earlier lines:,1092945990376738816,2019-02-06,00:40:04,senatorbennet,40,59,485
"The real state of our union includes families concerned about #climatechange, #healthcare, #education & more. Here's a roundup of what @POTUS should address tonight:

⚡️ “What Coloradans Want to Hear in the State of the Union” https://twitter.com/i/moments/1092881741138874370 …",1092930303579119617,2019-02-05,23:37:44,senatorbennet,14,14,64
"JoBeth J. says, ""I want to hear a clear and precise plan to reunite children separated from their parents at the border.""",1092926247234162689,2019-02-05,23:21:37,senatorbennet,13,17,167
"Angela H. wants to know how the Trump administration will #ActOnClimate, asking “What initiatives will we take to reduce greenhouse emissions and commit to renewable, clean energy?”",1092925498597036037,2019-02-05,23:18:39,senatorbennet,5,8,65
"Carrie H. says “My family is made up of a small business owner, firefighter & college student. We work hard & want our tax $ spent to improve our CO communities, schools & environment. I’m tired of hearing lies & stupid rhymes to spend my money on a useless wall.”",1092923843382071296,2019-02-05,23:12:04,senatorbennet,7,8,79
"Emy K. raised issues we don’t talk about enough: #broadband & #mentalhealth.
“I'd like to see work on rural broadband access… Funding for mental health, leaving our #PublicLands public & no more government shutdowns are important to me.”",1092922237689180160,2019-02-05,23:05:41,senatorbennet,6,6,66
"We asked, and you answered. Here’s a roundup of some of the responses we received on Twitter, Facebook, Instagram & via email. This is what Coloradans believe are the top priorities for tonight’s #SOTU. https://twitter.com/SenatorBennet/status/1092766415717842945 …",1092921886986682368,2019-02-05,23:04:18,senatorbennet,15,20,106
"Leading a bipartisan group with @SenBillCassidy to draft legislation that eliminates surprise medical bills. In our latest effort, we’re seeking answers from the providers and insurers on their billing practices. https://www.modernhealthcare.com/article/20190205/NEWS/190209974/senators-seek-industry-data-on-surprise-medical-bills …",1092891843174563840,2019-02-05,21:04:55,senatorbennet,11,17,91
"Happy Lunar New Year to all those celebrating today! Hoping the #YearOfThePig brings you happiness, good health, and prosperity.",1092874052530814976,2019-02-05,19:54:13,senatorbennet,9,10,173
"Grateful to have @OspreyPacks, a leading outdoor manufacturer based in Cortez, support the #COREAct. 

“Many of our customers & own team members regularly visit these outdoor treasures…This supports a thriving modern-day recreation & tourist economy.” https://durangoherald.com/articles/261812 ",1092796137529114625,2019-02-05,14:44:37,senatorbennet,2,19,90
"Rolling back fuel economy standards is bad policy. Instead we should reduce pollution & make our auto industry more competitive.

Ahead of today's @EPAAWheeler vote, @GovofCO & I called on him to finalize a rule that makes cars more efficient & affordable. https://www.bennet.senate.gov/public/index.cfm/2019/2/bennet-polis-send-letter-opposing-the-proposed-freeze-of-fuel-efficiency-standards …",1092777453074956290,2019-02-05,13:30:22,senatorbennet,22,69,371
"Tonight, @POTUS will deliver the #SOTU, and we need to make sure he addresses the real priorities of Coloradans. That’s why I want to hear from you. 

Share the issues that are important to you with hashtag #VoicesOfCO & I'll RT them throughout the day. pic.twitter.com/qOKhu8TYR3",1092766415717842945,2019-02-05,12:46:30,senatorbennet,256,71,355
"“You must never be fearful about what you are doing when it is right.”- Rosa Parks

Celebrating the mother of the civil rights movement on what would have been her 106th birthday. #BlackHistoryMonth pic.twitter.com/US8hbWDfWM",1092539080087347202,2019-02-04,21:43:09,senatorbennet,16,131,652
"During #BlackHistoryMonth, we remember leaders like Frederick Douglass, Zora Neale Hurston, and Dr. Martin Luther King—striving to follow their example to make our country more equal and just. pic.twitter.com/hHsQnzgKwX",1092181394892169217,2019-02-03,22:01:50,senatorbennet,19,31,184
"The #COREAct was not written in Washington D.C. It was written night after night in rooms & county commission buildings across Colorado, as neighbors sat together to iron out their differences & do something special for the next generation of Coloradans. https://coloradosun.com/2019/02/01/sen-bennet-collaboration-that-led-to-core-act-could-model-a-cure-for-partisan-disease-ailing-politics/ …",1091816368180211712,2019-02-02,21:51:21,senatorbennet,12,43,213
"The photo is racist and despicable. Governor Northam should step down and allow his Lieutenant Governor, Justin Fairfax, to become the next Governor of Virginia.",1091756280266424320,2019-02-02,17:52:35,senatorbennet,120,309,2317
Amazing way to close out the @OutdoorRetailer show with an @OIA endorsement for our #COREAct. The name of the bill—Colorado Outdoor Recreation & Economy Act—says it all. We don’t have to choose between protecting public lands & boosting our economy. One leads to the next. https://twitter.com/OutdoorAdvocate/status/1091683859052122113 …,1091699614061862912,2019-02-02,14:07:25,senatorbennet,7,22,172
Honored to use your photos & grateful for your support of the #COREAct. It’s time to protect these treasured lands. https://twitter.com/_JonMullen/status/1091494809469050882 …,1091495676914032642,2019-02-02,00:37:03,senatorbennet,12,17,215
"These outdoor enthusiasts told me why they support protecting public lands. RT and tell us why you do too. 
#COREAct pic.twitter.com/jFUlCEEEc6",1091417968796409856,2019-02-01,19:28:15,senatorbennet,43,147,588
"Behind the scenes this morning with @patagonia & @thenorthface athletes at the @OutdoorRetailer Show in Denver. Grateful to these skiers, runners & climbers for supporting the #COREAct to protect our public lands & boost the outdoor economy. pic.twitter.com/xDx9m4Y1Jz",1091410509012692992,2019-02-01,18:58:37,senatorbennet,7,18,150
"The LWCF is an essential conservation tool that helps protect CO’s treasured landscapes for future generations. @SenatorBurr & I are calling for immediate, permanent reauthorization of LWCF to support our public lands and grow our outdoor economy: https://www.bennet.senate.gov/public/index.cfm/press-releases?id=8F98B4CD-8ABE-465D-ADC3-DA8AF1B52408 …",1091372548108025858,2019-02-01,16:27:46,senatorbennet,12,36,180
