tweet,id,date,time,username,replies_count,retweets_count,likes_count,tdatetime
"Joined @JessiTurnure today on @CapitolViewAR to discuss the government shutdown, Brexit, and Syria. Delighted to have my friend and UK MP @Rehman_Chishti and hear his assessment of Syria and the status of Brexit. #AR02 pic.twitter.com/IfCIgjQEmw",1079878681101770752,2018-12-31,23:15:15,repfrenchhill,1,1,5,2018-12-31 23:15:15
Hope you will read @SteveScalise new book on his recovery “Back in the Game” #inspiration https://twitter.com/CQnow/status/1079029274126966790 …,1079810036245897216,2018-12-31,18:42:29,repfrenchhill,1,0,3,2018-12-31 18:42:29
"Proud to host my friend, UK MP @Rehman_Chishti, back to #AR02 and celebrate the special relationship between our two nations. Great to greet the cadets and their families. pic.twitter.com/oO23Egm8RH",1079182692615360512,2018-12-30,01:09:38,repfrenchhill,2,2,7,2018-12-30 01:09:38
"Wonderful to visit with our extraordinary cadets and their families. Happy New Year to each of the cadets, especially our seniors as their contemplate their commissioning and their service to our nation. #AR02 pic.twitter.com/sRAdkeDFWH",1079181966665285632,2018-12-30,01:06:45,repfrenchhill,4,2,19,2018-12-30 01:06:45
"From our family to yours, Martha, Liza and Payne and I want to wish you a very Merry Christmas! For many of us, Christmas is a celebration of the birth of our Lord Jesus Christ, who was sent to Earth to redeem us. We honor God’s gift to us by giving to others. pic.twitter.com/WucKq7DySc",1077578891940847616,2018-12-25,14:56:42,repfrenchhill,11,5,42,2018-12-25 14:56:42
"Pleased that my bill to enhance one of Arkansas’s most unspoiled landscapes, Flatside Wilderness, has been sent to the president’s desk. Arkansans and visitors should enjoy more of Flatside Wilderness and all of its natural and wild qualities. #AR02 http://bit.ly/2RcPfNE ",1077200470026924032,2018-12-24,13:53:00,repfrenchhill,3,7,29,2018-12-24 13:53:00
I cannot in good conscience accept pay while federal employees are not receiving theirs. pic.twitter.com/lOnPhflbLd,1076491521505996800,2018-12-22,14:55:53,repfrenchhill,61,62,322,2018-12-22 14:55:53
"Today, I went on @FoxBusiness to discuss the partial shutdown with @connellmcshane. The safety of Arkansans and Americans supersedes party lines, and we must secure our borders. pic.twitter.com/bF9xiq9R0W",1076261416519323649,2018-12-21,23:41:32,repfrenchhill,27,13,29,2018-12-21 23:41:32
"The Taliban has been increasing its gains in Afghanistan, and I believe that withdrawing U.S. troops now will allow the Taliban to gather strength and expand even further. My full statement here ➡️ http://bit.ly/2QPF6XS ",1076232173596917760,2018-12-21,21:45:20,repfrenchhill,4,7,12,2018-12-21 21:45:20
"I am disappointed to see Secretary Mattis go. He has served our country with distinction, and America is safer and stronger because of his leadership. His voice in our national security councils was wise, steady, and respected. http://bit.ly/2PUEbQc ",1076203032029863936,2018-12-21,19:49:32,repfrenchhill,6,4,21,2018-12-21 19:49:32
"Tune into @foxbusiness now as I talk about border security funding, partial government shutdown, and more.",1076191126195970048,2018-12-21,19:02:13,repfrenchhill,3,0,3,2018-12-21 19:02:13
 pic.twitter.com/OzlcN4GaMI,1075953630400921602,2018-12-21,03:18:30,repfrenchhill,21,7,37,2018-12-21 03:18:30
"I was proud to support this year's comprehensive farm bill that brings much needed security and support to hardworking Arkansas farm families, and I am pleased that the president signed it into law today. #AR02 #FarmBill",1075899572562608130,2018-12-20,23:43:42,repfrenchhill,3,1,13,2018-12-20 23:43:42
I object to the president's decision to withdraw from Syria. We must ensure the lasting defeat of ISIS; this move may allow Iran to consolidate gains. I am especially concerned over the tragic consequences this will have for civilians living in Syria. #SyriaWithdrawal pic.twitter.com/vIjnZ49tjV,1075775449710551040,2018-12-20,15:30:28,repfrenchhill,28,16,43,2018-12-20 15:30:28
"I encourage the president to remember the mistakes of the Obama administration when it withdrew for a “stable Iraq.” We cannot allow the atrocities being committed against the Syrian people by the dictator Assad, Russia, and Iran to continue with impunity.",1075585531545829377,2018-12-20,02:55:48,repfrenchhill,13,7,20,2018-12-20 02:55:48
I enjoyed visiting @WCFirst to talk about the programs and necessary services they provide to women who are in domestic violence situations. Thank you for your hard work providing families with a safe haven. pic.twitter.com/Awis4vA1Uw,1074798917072642049,2018-12-17,22:50:05,repfrenchhill,2,0,5,2018-12-17 22:50:05
"In America, we are blessed to freely worship and live out our respective faith, but that’s not the case for many around the globe, and it’s especially not the case for Coptic Christians in Egypt. https://washex.am/2rIpuGm ",1074684751997480960,2018-12-17,15:16:26,repfrenchhill,2,3,16,2018-12-17 15:16:26
"It was good to see Arkansas’s Attorney General and my good friend, @LeslieRutledge, and her husband, Boyce. Martha and I enjoyed showing you around our historic U.S. Capitol building today. pic.twitter.com/OeDdT1z5bC",1073644940469698560,2018-12-14,18:24:35,repfrenchhill,3,0,16,2018-12-14 18:24:35
"I had a good start to my day today, talking with my friend, Kevin Miller, on @newsradio1029. We discussed the farm bill that we passed yesterday, funding the government, border security, and more. pic.twitter.com/679FYIFHNa",1073325136395321344,2018-12-13,21:13:48,repfrenchhill,4,1,7,2018-12-13 21:13:48
"Agriculture is Arkansas’s number one economic industry, and I am proud to support the passage of this year’s comprehensive farm bill that brings much needed security and support to hardworking Arkansas farm families. #AR02 http://bit.ly/2GbB3Ac ",1072981062752579585,2018-12-12,22:26:35,repfrenchhill,5,2,11,2018-12-12 22:26:35
"I had the privilege of honoring the life & legacy of my friend and former boss, Pres. George H.W. Bush, on the House floor. He was an excellent sportsman, a man of warm and goofy humor, and a man who, in every instance, put himself in the position of serving others.#Remembering41 pic.twitter.com/5pOqpN0FvB",1072538109269696513,2018-12-11,17:06:26,repfrenchhill,2,9,25,2018-12-11 17:06:26
The American people want adequate #bordersecurity. House Republicans have proposed concrete #security initiatives and voted on them. @NancyPelosi is more worried about her Speaker election than homeland security. #SchumerShutdown #TheSequel,1072510279261585410,2018-12-11,15:15:51,repfrenchhill,40,35,65,2018-12-11 15:15:51
"Since #TaxCutsandJobsAct, we have seen pro-growth policies working for Arkansas and American families. Workers have more money in their pockets with earnings accelerating at their fastest rate since 2009. #BetteroffNow #AR02",1072257995151683585,2018-12-10,22:33:22,repfrenchhill,34,0,22,2018-12-10 22:33:22
"Thank you to @AFPArkansas for hosting the First Step Act Town Hall. I was grateful for the chance to discuss the impacts of the #FirstStepAct w/ Sheriff-Elect Eric Higgins from Pulaski County, Paul Chapman from @RestoreHopeAr, and Ruby Welch from @cut_50. #criminaljusticereform pic.twitter.com/pJ08BUEk9v",1072197852401688578,2018-12-10,18:34:23,repfrenchhill,3,7,19,2018-12-10 18:34:23
"Martha and I have joined the rest of the nation in mourning over the loss of a faithful servant, President George H.W. Bush. We have spent time reflecting on his character and devotion to our country and his loved ones. Here are this week's highlights:  http://bit.ly/2QpHJPQ ",1072146957332819969,2018-12-10,15:12:08,repfrenchhill,2,0,10,2018-12-10 15:12:08
"There were over 155,000 jobs added in November, and unemployment is at its lowest since December 1969. Arkansans are #BetteroffNow #AR02 #JobsReport https://www.marketwatch.com/story/us-gains-155000-jobs-in-november-and-unemployment-rate-stays-at-37-2018-12-07 …",1071065071097389056,2018-12-07,15:33:07,repfrenchhill,9,4,9,2018-12-07 15:33:07
"Today, “a day that will live in infamy,” as President Franklin Roosevelt famously called the attack on #PearlHarbor. We are grateful for those that sacrificed to rid the world of one of the evilest alliances ever created. 🇺🇸 pic.twitter.com/Ehiobc6RB2",1071057134505345024,2018-12-07,15:01:34,repfrenchhill,3,4,9,2018-12-07 15:01:34
I spoke w/ @HARRISFAULKNER on @FoxNews about Pres. George H.W. Bush’s final funeral procession. @TAMU is a fitting resting place for our faithful president. The engine of the train in Air Force One colors carrying 41 today was painted at @UnionPacific in North LR. pic.twitter.com/BYCX7muXrA,1070816839964475393,2018-12-06,23:06:44,repfrenchhill,8,30,217,2018-12-06 23:06:44
"Tune in today at 12:15 PM CT/1:15 PM ET as I speak with @HARRISFAULKNER on @FoxNews about my personal memories of my mentor, friend, and former boss, President George H.W. Bush.",1070728916908806144,2018-12-06,17:17:21,repfrenchhill,3,4,14,2018-12-06 17:17:21
"Honored to speak at tonight’s @indefchristians Fifth Annual Solidarity Dinner. I stand with persecuted #CopticChristians in Egypt, and lend them my support in Congress through my bipartisan resolution expressing concern over their plight. pic.twitter.com/AFOZijqusa",1070522183821287424,2018-12-06,03:35:52,repfrenchhill,6,3,18,2018-12-06 03:35:52
I’m devastated to hear the news about the bus crash in Benton this morning that injured several dozen children and adults and took the life of a child. My thoughts and prayers are with the families and children impacted by this tragedy. http://bit.ly/2zFO1Ad ,1069651340991832065,2018-12-03,17:55:27,repfrenchhill,1,3,9,2018-12-03 17:55:27
"I was grateful to be a part of the 28th year of lighting the menorah at @MY100BANK in Little Rock with Rabbi Yosef Kramer, Rabbi Pinchus Ciment, @AsaHutchinson, and @ARFirstLady. Happy #Hanukkah to all Arkansans and Americans who celebrate the Festival of Lights. pic.twitter.com/OgWpsBPQOE",1069407155525160961,2018-12-03,01:45:09,repfrenchhill,2,7,29,2018-12-03 01:45:09
"Thank you @Christi_Paul and @VictorBlackwell on @CNN for talking with me this morning as we honor the remarkable life and legacy of my loyal friend and mentor, President George H.W. Bush. pic.twitter.com/thp092lbNj",1069250486929375232,2018-12-02,15:22:36,repfrenchhill,1,2,9,2018-12-02 15:22:36
"Tonight, I shared personal stories of my dear friend and mentor, George H.W. Bush. I enjoyed talking with @AnaCabrera on @CNN about the life and legacy of a man who possessed a volunteer spirit and that of service above self. pic.twitter.com/7kvjy4k0Mh",1069033184476712960,2018-12-02,00:59:07,repfrenchhill,1,11,51,2018-12-02 00:59:07
"Tune in as I speak to @AnaCabrera tonight at 5 PM CT/6 PM ET on @CNN about the passing of my dear friend and mentor, President George H.W. Bush.",1068995825458704384,2018-12-01,22:30:40,repfrenchhill,3,5,16,2018-12-01 22:30:40
"It’s with heavy hearts that Martha and I mourn the passing of a loyal friend, mentor, and faithful servant, President George H.W. Bush. We lift up the Bush family during this time of grieving. Read my full statement here: http://bit.ly/2RoQLJa ",1068862770127482881,2018-12-01,13:41:57,repfrenchhill,1,12,42,2018-12-01 13:41:57
"This morning on @BloombergTV, I spoke with @tomkeene about what Arkansans are focused on, including the economy, tariffs, and trade. We are focused on getting results in Washington. #Daybreak #AR02 pic.twitter.com/RVTshe1gp5",1068581308027334656,2018-11-30,19:03:31,repfrenchhill,7,1,10,2018-11-30 19:03:31
Tune in this morning at 6:30 AM on @BloombergTV as I talk with @tomkeene.,1068461436811296771,2018-11-30,11:07:12,repfrenchhill,2,1,1,2018-11-30 11:07:12
"Today, I held an informative roundtable on how the ETF market is impacting Main Street as part of my duties on the @FinancialCmte. Pleased to have participants from across the country discuss the growing ETF market, including Ryan Crane w/ @Stephens_Inc. pic.twitter.com/9SxlWGTEtq",1068286397554065409,2018-11-29,23:31:39,repfrenchhill,3,0,5,2018-11-29 23:31:39
"Good to see my old friend of three decades, former Senator Phil Gramm, as we honored retiring @FinancialCmte Chairman, @RepHensarling. pic.twitter.com/WwkMXFMJ11",1067831704897888256,2018-11-28,17:24:52,repfrenchhill,2,1,8,2018-11-28 17:24:52
Always pleased to celebrate Diwali on Capitol Hill. It was a great turnout of members and our visitors celebrating the victory of good over evil in the Hindu faith. pic.twitter.com/5NwYaBQfEk,1067476891160973312,2018-11-27,17:54:58,repfrenchhill,3,0,5,2018-11-27 17:54:58
"In the last year, 8,400 jobs have been created in Arkansas and unemployment is down by 3.5% in our state. Arkansans are #BetterOffNow since #taxreform, and I will continue to support policies that help Arkansans thrive. #AR02",1067461096594903040,2018-11-27,16:52:12,repfrenchhill,8,4,20,2018-11-27 16:52:12
"It was a joy to spend time with VP Steve Presley and his leadership team at @VircoInc in Conway. In classrooms across Arkansas and America, you’ll find their 100% American made products ranging from chairs, tables, and desks. Thank you for having me out today. pic.twitter.com/xGcG38BvVm",1067193718359433216,2018-11-26,23:09:44,repfrenchhill,2,0,16,2018-11-26 23:09:44
"This week I visited the Helton's farm which produces sustainable meat. Jana and Damon Helton have worked hard to establish this and their Olde Crows General Store, which sells local products. Shopping local supports hardworking Arkansans like the Helton’s. #SmallBusinessSaturday pic.twitter.com/sbzdspMtaB",1066408301955567616,2018-11-24,19:08:46,repfrenchhill,3,2,8,2018-11-24 19:08:46
Ready for  next #Hog 🏈 season.  #TigervsPhil to 22 holes!  Phil wins The Match in the dark!  What a round.,1066133776214966272,2018-11-24,00:57:54,repfrenchhill,2,1,6,2018-11-24 00:57:54
"This week I got to have a great talk with Melissa Francis on FOX Business. We spoke about the Financial Services Committee, on which I serve as the Majority Whip, and the upcoming Congressional session. If you didn't the chance to watch, take a look here. https://bit.ly/2FESpoI ",1066126489035378689,2018-11-24,00:28:57,repfrenchhill,6,0,10,2018-11-24 00:28:57
"After all that 🦃 and 🥧, hit the river trail for some bike time before 🐗#WPS #Hogs 🏈 and #Tiger vs. #Phil and more 🦃 pic.twitter.com/MnlUFlO01y",1066060814531084288,2018-11-23,20:07:59,repfrenchhill,3,0,14,2018-11-23 20:07:59
"From my family to yours, Martha, Liza, Payne and I wish you a very Happy Thanksgiving. #AR02 #Thanksgiving pic.twitter.com/IKs0Du4fkt",1065605823680761856,2018-11-22,14:00:01,repfrenchhill,2,1,26,2018-11-22 14:00:01
Tune in to @FoxBusiness right now as I talk with @MelissaAFrancis about the @FinancialCmte and the economy.,1064627185812676608,2018-11-19,21:11:15,repfrenchhill,3,2,4,2018-11-19 21:11:15
"This week was a productive one representing you. I continued to be a leader on trade issues, met with Arkansas families who visited our nation's capital, and my bill to preserve Arkansas’s Flatside Wilderness passed the House. Here are the highlights.  https://bit.ly/2zgPvRk ",1064590806391099392,2018-11-19,18:46:42,repfrenchhill,3,0,3,2018-11-19 18:46:42
Thank you @USDA @SecretarySonny for meeting with the AR delegation to discuss how we can work together to help our Arkansas farm families prosper. Agriculture is the largest industry in our state and an integral part of Arkansas's economy and heritage. #AR02 pic.twitter.com/0JClOhEisg,1063542718406844416,2018-11-16,21:21:58,repfrenchhill,7,1,11,2018-11-16 21:21:58
"Always good to see my friend, @LibnOfCongress, Dr. Carla Hayden. Great visit about plans for the Jefferson Building, future exhibits at the @librarycongress, and involvement of Arkansas librarians. In June, Dr. Hayden spoke to AR librarians when she came Little Rock. #AR02 pic.twitter.com/MqzXrk42EA",1063183985638100994,2018-11-15,21:36:29,repfrenchhill,3,1,12,2018-11-15 21:36:29
Thank you @jas_wdc for a great discussion about U.S.-Japan relations and trade last night. I enjoyed getting to speak alongside @JoaquinCastrotx and Abigail Friedman. pic.twitter.com/cyGCLf6vmu,1062758325572526081,2018-11-14,17:25:04,repfrenchhill,2,2,7,2018-11-14 17:25:04
My bill to enhance and preserve AR Flatside Wilderness for future generations passed the House unanimously today. Thank you @RepRobBishop & @RepWesterman for your help advancing my legislation in @NatResources. #AR02 http://bit.ly/2z7g0bI ,1062471861299232768,2018-11-13,22:26:46,repfrenchhill,3,2,16,2018-11-13 22:26:46
"This Veterans Day weekend, we honored and thanked all the brave men and woman who have served our country here at home and abroad. I'm grateful for their service. Here are the highlights.  http://bit.ly/2PmC8Jo ",1062365348522061824,2018-11-13,15:23:31,repfrenchhill,9,0,6,2018-11-13 15:23:31
"Thank you, @KARK4News, for holding a telethon today to raise money for the Gold Star Families Memorial Monument in honor of Arkansas families of the fallen. This is an important way to pay our respects to those who have paid the ultimate sacrifice. #AR02 pic.twitter.com/WuuRcANFef",1062077288551010304,2018-11-12,20:18:52,repfrenchhill,3,5,25,2018-11-12 20:18:52
"For #VeteransDay each year, @juliessweetshop opens its doors to our heroes across AR. This is my third year attending, and today like every year, I‘m pleased to see our community come together to show our appreciation for our veterans’ dedication and sacrifice to our country. pic.twitter.com/XW1TPDvzRB",1061740375935725569,2018-11-11,22:00:06,repfrenchhill,2,2,15,2018-11-11 22:00:06
"We honor our brave veterans for their courageous service and selfless sacrifice and we say 'thank you'. As we celebrate #VeteransDay, we remember the anniversary of #armisticeday, the centennial of the end of WWI, and that freedom is never free. pic.twitter.com/Acuhq2U82t",1061621379638935552,2018-11-11,14:07:15,repfrenchhill,3,6,24,2018-11-11 14:07:15
"Happy 243rd birthday, @USMC. Thank you to all the brave men and women who put their lives on the line to defend our freedoms. Semper fi! #MarineCorpsBirthday pic.twitter.com/ntKIOaIokq",1061253262760914944,2018-11-10,13:44:29,repfrenchhill,4,5,14,2018-11-10 13:44:29
"Congratulations to David Saavedra from Clinton High School for winning this year's #CongressionalAppChallenge for #AR02. Grateful to see talented Arkansas students pour their time, effort, and energy into creating their apps. #STEM http://bit.ly/2SUJaTQ ",1060939186474307584,2018-11-09,16:56:28,repfrenchhill,1,2,6,2018-11-09 16:56:28
"Whether it's strengthening our military, growing a healthy U.S. economy, or keeping our communities safe, we've delivered on our promises to Arkansans and Americans. Here are the numbers that show it → pic.twitter.com/rLdqDczbYs",1059883191740366850,2018-11-06,19:00:19,repfrenchhill,41,30,81,2018-11-06 19:00:19
"Iran is run by a rogue regime that poses a serious threat to our nation and our allies, and I strongly support the president reimposing sanctions that were lifted under the #Iran nuclear deal. http://bit.ly/2JFn3wB ",1059498012764966917,2018-11-05,17:29:45,repfrenchhill,8,7,13,2018-11-05 17:29:45
"In #AR02 this week, I enjoyed visiting with our Air Force families at the first air show since 2012, joining our Jewish community in prayer and in service for restoration, healing, and unity, and more. Here are some of the highlights.
 http://bit.ly/2PFqZTh ",1059465026476695553,2018-11-05,15:18:40,repfrenchhill,1,2,6,2018-11-05 15:18:40
My statement on the cowardly attacks on Egypt’s Coptic Christians by Islamic  militants ➡️ pic.twitter.com/D7mttzhBpI,1058826887315759104,2018-11-03,21:02:56,repfrenchhill,3,7,16,2018-11-03 21:02:56
"Outstanding #jobsreport news that exceeded expectations. #BetterOffNow
✅250,000 jobs added in October 
✅156,562,000 people employed 
✅Hourly earnings up 3.1% 
✅Unemployment rate at 3.7%
✅Over 2,100,000 million jobs created since #taxreform
 http://on.mktw.net/2zlZy74 ",1058349529626537984,2018-11-02,13:26:05,repfrenchhill,17,17,35,2018-11-02 13:26:05
I named the DoD's Defense Logistics Agency (DLA) as the latest winner of the Golden Fleece award for failing to complete a congressionally mandated audit for the second year in a row. http://bit.ly/2ETMUlH ,1058017700348391425,2018-11-01,15:27:31,repfrenchhill,11,4,8,2018-11-01 15:27:31
Love the pride and passion from @BryantSchools Hornets as they take the field for the 45th #SaltBowl #SaltyTradition pic.twitter.com/wGyx6EqNmi – at War Memorial Stadium / AT&T Field,1167813245614403584,2019-08-31,14:55:49,repfrenchhill,2,1,6,2019-08-31 14:55:49
Thrilled to watch the @bentonschools Panthers take the field last night at the 45th #SaltBowl #SaltyTradition pic.twitter.com/thEH2VtNxD,1167812621908754432,2019-08-31,14:53:20,repfrenchhill,1,1,8,2019-08-31 14:53:20
"Had a blast at the 45th annual Salt Bowl showdown between @bryanthshornetsAR and @bentonhighschoolAR. Special thank you to the @BentonPoliceAR and the @BryantPolice who worked hard to ensure that this was a fun, safe event for everyone. #SaltyTradition pic.twitter.com/MOzO4hpi09",1167643809041276929,2019-08-31,03:42:32,repfrenchhill,4,3,17,2019-08-31 03:42:32
Enjoying some great #SaltBowl tailgating tonight at @WMStadium. Can’t wait to watch @bentonschools & @BryantSchools kickoff the high school football season! #SaltyTradition pic.twitter.com/WShYE01O4G,1167580809752121344,2019-08-30,23:32:12,repfrenchhill,1,2,10,2019-08-30 23:32:12
The @Arkansas4H Citizenship Washington Focus delegation is ready for football season. Let's go Razorbacks! #WooPigSooie 🍀🐗 #OneHogCall @ArkRazorbacks pic.twitter.com/Ipe7U8qCDf,1167554280120901632,2019-08-30,21:46:47,repfrenchhill,2,0,14,2019-08-30 21:46:47
"I'm taking #ONEHogCall international. Proud to exchange some @ArkRazorbacks culture with my friend, U.K. Member of Parliament @Rehman_Chishti to celebrate the kick-off of the college football season. Let's go Razorbacks! #WPS #ONERazorback pic.twitter.com/4YlUJ4jrD2",1167511272189046784,2019-08-30,18:55:53,repfrenchhill,10,22,166,2019-08-30 18:55:53
"Tonight starting at 6PM, Arkansans will come together on the steps of the Arkansas State Capitol to remember the lives lost to the drug and opioid crisis, and to support those actively battling the disease. More info:  https://bit.ly/2L935g6 
#InternationalOverdoseAwarenessDay",1167479134676824064,2019-08-30,16:48:11,repfrenchhill,2,3,12,2019-08-30 16:48:11
"Thank you to Ambassador @fawaz_alkhalifa for meeting with @Rehman_Chishti and me to discuss Bahrain's views on maritime security in the Persian Gulf, sanctions enforcement, and building a culture of religious tolerance in the region. pic.twitter.com/OakZDHnSxd",1167171732546969602,2019-08-29,20:26:40,repfrenchhill,5,4,13,2019-08-29 20:26:40
"Recently, the @CityofConway Department of Sanitation was named the 2019 Recycling Education Program of the Year by the Arkansas Recycling Coalition. Congratulations to the entire city of Conway for its commitment to protecting our environment and natural resources! pic.twitter.com/eav0FSZ6Op",1167168746701672448,2019-08-29,20:14:48,repfrenchhill,2,5,11,2019-08-29 20:14:48
"Thank you to my good friend @Rehman_Chishti for introducing me to former UK Ambassador to the @UN and National Security Advisor Sir @LyallGrant. Had a great discussion about the importance of NATO, the Atlantic Alliance, and the ongoing conflict in Hong Kong. pic.twitter.com/lCWflraPpI",1167109236951855109,2019-08-29,16:18:20,repfrenchhill,4,1,9,2019-08-29 16:18:20
We have a great opportunity to strengthen our longstanding partnership with Britain by creating new trade deals that open markets for agriculture and financial services between our two nations. Check out my conversation on US-UK trade with @adamboultonSKY on @SkyNews. pic.twitter.com/qXRHPkZKX4,1166810291147091974,2019-08-28,20:30:26,repfrenchhill,4,0,12,2019-08-28 20:30:26
"My UK Parliamentary counterpart @Rehman_Chishti and I met with Manuel Lobo Antunes, Ambassador from Portugal to the UK. We had a candid and helpful discussion about Brexit prospects and key issues from the EU’s point of view. pic.twitter.com/tf9LDBbybA",1166776804566286339,2019-08-28,18:17:22,repfrenchhill,1,1,5,2019-08-28 18:17:22
"I have been on the road, traveling around central Arkansas and meeting with veterans, farmers, business owners, teachers, and students. Check out some of my favorite pictures from the road here:  http://bit.ly/30FeDwJ 
#AR02 pic.twitter.com/VQnG4wJPyX",1166733816473559050,2019-08-28,15:26:33,repfrenchhill,2,3,8,2019-08-28 15:26:33
"This month's recipient of my #GoldenFleece Award: @FEMA for poor management of hurricane recovery funds. 

Read more here:  https://bit.ly/328l77G  pic.twitter.com/b84E1BsB4r",1166452056607121408,2019-08-27,20:46:56,repfrenchhill,6,2,4,2019-08-27 20:46:56
"Congratulations to veteran Arkansas journalists Larry Miller, Frank Fellone, and David Bailey for being honored as champions of the first amendment by @ARPressAssoc this year. 
@ArkansasOnline pic.twitter.com/fM6aMH4NHD",1166424352797204485,2019-08-27,18:56:51,repfrenchhill,2,1,8,2019-08-27 18:56:51
"(2/2) Martha and I wish Sean and @RCamposDuffy only the very best health and well-being for their beautiful, growing family.",1166043852991619073,2019-08-26,17:44:53,repfrenchhill,0,0,3,2019-08-26 17:44:53
"(1/2) @RepSeanDuffy is a good friend, a remarkable father, and a great husband. I will miss his energy and passion for crafting policies that help make our country stronger, as well as his avid defense of a smaller, more accountable federal government.",1166043852270198785,2019-08-26,17:44:53,repfrenchhill,2,2,12,2019-08-26 17:44:53
