tweet,id,date,time,username,replies_count,retweets_count,likes_count
Small businesses help keep our local and our state economies running. I encourage everyone to take part in today’s #SmallBusinessSaturday and invest in our own communities across Nebraska.  #ShopSmall pic.twitter.com/VxOvGxijmP,1200784045287698433,2019-11-30,14:30:00,senatorfischer,11,7,33
"Thank you @realdonaldtrump for signing legislation supporting those fighting for democracy in Hong Kong. SE neighborhoods in DC
are diverse communities — this is America. We are all Americans and we are free. #FreeHongKong https://twitter.com/zlj517/status/1200077829456769024 …",1200446880716673025,2019-11-29,16:10:14,senatorfischer,20,12,44
"This year, I cannot express enough how thankful I am for the people of Nebraska. Through crises and challenging times, Nebraskans always help one another persevere and overcome.
 
#HappyThanksgiving pic.twitter.com/U4CiLg7sff",1200055493743374336,2019-11-28,14:15:00,senatorfischer,13,4,51
"As we approach Thanksgiving Day, I want to express my gratitude for the people of Nebraska. This year, our state has faced many significant challenges, but adversity doesn’t break us. Instead, it reveals our character, grit, and determination. #LoveNE pic.twitter.com/3a9N4038dP",1199515686785171456,2019-11-27,02:30:00,senatorfischer,23,10,89
"With this year’s busiest shopping season upon us, Nebraskans must be on guard for identity theft. Read this week’s column on legislation I am working on that will bring justice to credit card scammers and correct consumers’ credit histories.
More:  https://www.fischer.senate.gov/public/index.cfm/weekly-column?ID=1AE8A787-F40C-4176-A33D-64089B9FF1D0 …",1199027186474377216,2019-11-25,18:08:52,senatorfischer,5,2,11
"I’ve been working with Sharon Shore of Omaha, who brought this to my attention after her parents lost their lives to CO poisoning. Now that keyless ignition is standard in many cars sold today, this bipartisan bill will help prevent further deaths. ⬇️  https://www.fischer.senate.gov/public/index.cfm/news?ID=6438B37A-1DBC-4F91-8C6F-14A417C67D11 …",1197617378366042113,2019-11-21,20:46:48,senatorfischer,13,1,8
"Today, I joined @SenBlumenthal & @SenMarkey to introduce the #SCOPEAct. This bill would require cars with keyless ignitions to automatically shut off after a certain amount of time in order to prevent deaths from carbon monoxide (CO) poisoning. pic.twitter.com/Jl1P5RF1Vd",1197617375778086913,2019-11-21,20:46:47,senatorfischer,22,17,59
"Ainsworth Regional Airport in Brown County received a $6.5 million @USDOT grant for runway and taxiway rehabilitation. Investments in our state such as this one will help keep #NE families and businesses connected.

More from @NorfolkNews ⬇️ https://norfolkdailynews.com/news/briefs/ainsworth-airport-to-receive-million/article_e12ef3e8-0bee-11ea-83a9-6720e687b82e.html …",1197520972477353990,2019-11-21,14:23:43,senatorfischer,4,3,10
So great to meet with #Husker fans and representatives of @TheHomeAgency who are in D.C. getting ready for the game against Maryland this weekend. We discussed the importance of crop insurance and passing USMCA. Thank you all for stopping by. #GBR pic.twitter.com/sIsSDEdXjO,1197222088068812803,2019-11-20,18:36:03,senatorfischer,13,3,15
"As an #NE state senator, I spearheaded successes on infrastructure and found innovative ways to fund road maintenance and highway construction.
 
Now, I’m taking these wins to the U.S. Senate w/ my Build USA Act Infrastructure Act. Read my @WashTimes oped: https://www.washingtontimes.com/news/2019/nov/19/lessons-in-success-nebraska-sets-examples-for-infr/ …",1197157435468845057,2019-11-20,14:19:09,senatorfischer,10,4,13
Today I led 17 senators from ag states in a bipartisan letter to @EPAAWheeler calling for clarity on the regulatory treatment of biogenic carbon emissions produced from feedstocks. This clarity will remove a major obstacle to investment in rural America.  https://www.fischer.senate.gov/public/index.cfm/news?ID=639D065A-25C4-4B17-8AB3-A9F671E7B0B6 … pic.twitter.com/BiJkVFvoQN,1196835974761926656,2019-11-19,17:01:47,senatorfischer,4,6,15
Full statement here:  https://www.fischer.senate.gov/public/index.cfm/news?ID=30CFAD7B-A7F2-4D8A-AA05-CC79D4F55B84 …,1196474793714946049,2019-11-18,17:06:34,senatorfischer,2,1,1
"Congratulations to @US_Stratcom on the official opening of their new HQ and change of command. General Hyten, thank you for your steadfast leadership as commander. Admiral Richard, I’m pleased to welcome you to #NE, and look forward to working with you to keep our nation secure. https://twitter.com/DeptofDefense/status/1196458899659878401 …",1196474650848563202,2019-11-18,17:06:00,senatorfischer,5,5,20
It was an honor to attend Judge Brian Buescher's investiture ceremony as the next U.S. District Court Judge for the District of Nebraska today. I am proud to have recommended him for this judgeship. I know he will honor our state with his service. pic.twitter.com/EulB14YCXJ,1195470272150822912,2019-11-15,22:34:58,senatorfischer,25,3,29
It was very moving to meet the Bush family from Lincoln yesterday and present them with @CCAInstitute’s Angels in Adoption award for raising and adopting brothers Sterling and Payton. I am so glad they can now stay together in a forever loving home. #AdoptionAngels pic.twitter.com/9r3cRriwSR,1195393674227654662,2019-11-15,17:30:35,senatorfischer,7,4,15
"During a time when threats around the world are rising, it's essential we do right by our service members and provide them with the resources they need.
 
Congress must do our part and pass the NDAA. pic.twitter.com/Oe9b6FJPDI",1194747850707615745,2019-11-13,22:44:19,senatorfischer,29,7,30
"For the past 58 years, Congress has found a way to put politics aside, unite behind our service members, and pass the NDAA.
 
I'll be joining my Senate colleagues to stress the importance of continuing this tradition and securing an agreement on NDAA.
 https://www.senate.gov/legislative/floor_activity_pail.htm … pic.twitter.com/A5UTkMpH0H",1194714340898877442,2019-11-13,20:31:10,senatorfischer,2,7,17
"At a time when threats are re-emerging, we cannot afford to let political grandstanding get in the way of funding our military. Read this week's column on why we need to pass the defense appropriations bill and deliver our troops the resources they need:  https://www.fischer.senate.gov/public/index.cfm/weekly-column?ID=65C07B82-2634-4A8D-A256-DBF7613BCA8A …",1194380698444021765,2019-11-12,22:25:23,senatorfischer,29,8,24
"Happy to be working with you, @RepAdrianSmith, to help those living in western Nebraska receive access to local television programming! https://twitter.com/RepAdrianSmith/status/1194316957027311623 …",1194323710133637121,2019-11-12,18:38:56,senatorfischer,10,2,8
"Today on #VeteransDay, we pay tribute to all those who have served. 
 
Veterans represent the very best this nation has to offer, and I hope every Nebraskan takes a moment to thank a veteran today, and every day, for his or her service. pic.twitter.com/AUQZgUN0Xx",1193894899881566209,2019-11-11,14:15:00,senatorfischer,23,9,39
I want to wish a happy birthday to the brave service members of the @USMC. Thank you for keeping us safe for 244 years! pic.twitter.com/tpz8oN5hgM,1193521188095397888,2019-11-10,13:30:00,senatorfischer,33,25,139
"As we approach Veterans Day weekend, I want to sincerely thank the men and women from Nebraska and across the country who have served in our armed forces. We are a free nation because of their courage and patriotism. pic.twitter.com/JXraZgfGSt",1192977605818900480,2019-11-09,01:30:00,senatorfischer,23,14,57
"Nebraskans deserve access to Nebraska television content.
 
That’s why @RepAdrianSmith and I introduced the bicameral WEST Access Act today to ensure that satellite subscribers in 16 western #NE counties have access to in-state TV content. 
 
Learn more:  https://www.fischer.senate.gov/public/index.cfm/news?ID=413E3927-48DD-4665-B228-5E63B0FC0AA5 … pic.twitter.com/gWMfChBTpi",1192907867164233732,2019-11-08,20:52:53,senatorfischer,14,7,22
I want to thank @LVCommFound for inviting me to speak at their Salute to Veterans event last night. It’s always an honor to visit with our state’s veterans. We are all indebted to these Nebraska heroes for their courage and patriotism as they defended our freedom. #LoveNE pic.twitter.com/VCrAITCdkz,1192847395240992769,2019-11-08,16:52:35,senatorfischer,6,5,16
"📻 Yesterday, I called in to @RuralRadioNet to discuss my concerns with the @EPA’s supplemental rule on ethanol, Senate Democrats letting politics get in the way of funding our military, and the need to pass #USMCA. 
 
Listen to my Senate update here: ⬇️ https://twitter.com/RuralRadioNet/status/1192811181435691008 …",1192825123503558659,2019-11-08,15:24:05,senatorfischer,14,3,13
"As of today, 1/4 of our country’s circuit court judges are @realDonaldTrump-nominated judges confirmed by the Senate. This administration has put forth highly qualified nominees that will protect our constitutional rights & safeguard the values we Nebraskans hold so dear. pic.twitter.com/c7TgHbSgua",1192551507750793225,2019-11-07,21:16:50,senatorfischer,105,50,221
Find all our letters here:  https://www.fischer.senate.gov/public/index.cfm/news?ID=D0A08F23-FF99-4CAF-8FDA-D4B1AD9E0D50 …,1192493901749391361,2019-11-07,17:27:56,senatorfischer,1,3,6
"That’s why I joined @ChuckGrassley, @SenJoniErnst, @SenJohnThune, @SenatorRounds, @RoyBlunt & @SenatorBraun to submit comments on this Supplemental Rule on the RFS deal calling on @EPAAWheeler to fulfill @realDonaldTrump’s commitment and provide certainty for rural America. pic.twitter.com/vHdzSvcbCD",1192493898821750785,2019-11-07,17:27:55,senatorfischer,7,9,16
Yet the @EPA’s plan to calculate the reallocation of biofuel gallons fails to ensure that 15 billion gallons of conventional ethanol will actually be blended into our nation’s fuel supply. This is not in-line with my previous understanding of this agreement.,1192493888042352640,2019-11-07,17:27:53,senatorfischer,1,5,1
"Just this week, the CEO of a major oil refinery bragged that small refinery exemptions are “a real cash flow that [they] get every year.” 
 
These exemptions come at the expense of farmers and biofuel producers.",1192493886578610177,2019-11-07,17:27:52,senatorfischer,8,16,37
"I am proud to announce @USDOT is awarding a $16.9 million grant to widen 120th Street in Omaha.
 
Omaha will see a big benefit from this grant, which is why @RepDonBacon and I sent letters expressing our support for the project. 
 
More here:  https://www.fischer.senate.gov/public/index.cfm/news?ID=898AE079-D475-49C4-9F90-2EEDCE80C080 …",1192258190030848002,2019-11-07,01:51:18,senatorfischer,20,7,54
Speaking now! https://twitter.com/SenatorFischer/status/1192200517193289731 …,1192206490481909760,2019-11-06,22:25:52,senatorfischer,8,2,14
"I’m on my way to speak on the Senate floor to honor our veterans from Nebraska and across the country who have answered the call to serve and defended our freedom. 🇺🇸 
 
Watch live here:  https://www.senate.gov/legislative/floor_activity_pail.htm …",1192200517193289731,2019-11-06,22:02:07,senatorfischer,13,2,24
#VeteransDay is a deeply meaningful day for our nation where we come together to renew our appreciation for our nation’s heroes. Read this week’s column on how Nebraska community members & business leaders are working to honor our vets for their service.🇺🇸  https://www.fischer.senate.gov/public/index.cfm/weekly-column?ID=9DC99EFA-8B99-44BD-8892-7F24914F59DA …,1191854261640056832,2019-11-05,23:06:14,senatorfischer,7,4,12
"I’m proud to see that @LendingTree ranked Nebraska as the #1 safest state for young families! From low crime to high graduation rates, the Good Life is alive and well for Nebraska families. https://www.lendingtree.com/home/the-safest-states-for-young-families/ …",1191397601385623553,2019-11-04,16:51:37,senatorfischer,9,4,20
"I want to commend the Gering firefighters who are working 16-hour days to put out the wildfires in California. Thank you for your dedication to helping others and for showing the world what it means to be a Nebraskan. #LoveNE 

More via @NBCScottsbluff: https://www.ksnblocal4.com/scottsbluff/content/news/Gering-firefighters-continue-to-see-great-progress-with-California-fire-564345901.html …",1191391352833159168,2019-11-04,16:26:48,senatorfischer,2,5,35
"It was a pleasure visiting Saddlebrook Elementary in Omaha today. I heard from the dedicated teachers and read a story to a wonderful group of kindergarteners. These children represent our state’s future, and it's important we provide them with the knowledge to succeed. pic.twitter.com/v44SOoaXsB",1190378301979844608,2019-11-01,21:21:18,senatorfischer,19,4,16
"Anti-meat activists use faulty logic and cherry-picked statistics to villainize our beef producers, but the facts say otherwise. 
 
Read my @FoxNews op-ed on what trendy food fads fail to realize: feeding the world is more than a job. It’s a way of life. https://www.foxnews.com/opinion/americas-beef-producers-anti-meat-advocates-sen-deb-fisher …",1190290630666260485,2019-11-01,15:32:55,senatorfischer,34,42,96
