tweet,id,date,time,username,replies_count,retweets_count,likes_count
Come grab a cup of coffee and talk with me about what issues are important to you on February 20th at Ray’s Cafe. As your elected official I want to hear from you! pic.twitter.com/dgbhzIVooy,1091082691477417984,2019-01-31,21:15:59,repkendrahorn,8,26,132
I strongly support the Paycheck Fairness Act so hardworking women are fairly compensated for their work #116thCongress pic.twitter.com/lECXcjY2kt,1091056584342556672,2019-01-31,19:32:15,repkendrahorn,4,18,119
"Very excited about the opportunity to serve as chair of the Subcommittee on Space and Aeronautics for the Science, Space, and Technology Committee! pic.twitter.com/A1ei2HTHGe",1090765626468155392,2019-01-31,00:16:05,repkendrahorn,14,36,310
"Thanks to everyone who showed up this past Saturday for our Community Conversation event. As your Congresswoman, it is extremely important that I know what issues are important to you so I…  https://www.instagram.com/p/BtReTRGnvuz/?utm_source=ig_twitter_share&igshid=ht6nlq4ri884 …",1090716516738228230,2019-01-30,21:00:56,repkendrahorn,4,3,42
I am proud to have announced yesterday the Shutdown To End All Shutdowns Act. The suffering from government shutdowns shouldn’t be felt by those who didn’t cause them. #SEASACT pic.twitter.com/las4kT0vHF,1090640357862326272,2019-01-30,15:58:19,repkendrahorn,20,76,373
Here is my statement on joining the Blue Dog Coalition. I am very excited to be a part of this group! pic.twitter.com/RUKJ6btGA0,1090324493610991616,2019-01-29,19:03:11,repkendrahorn,18,17,147
Here are my thoughts on the re-opening of the federal government after this difficult government shutdown pic.twitter.com/byDjL95dZF,1088929856585388032,2019-01-25,22:41:23,repkendrahorn,11,15,91
"I had the pleasure of hosting my dear friends, @davidfholt and @gtbynum, along with their beautiful families on the Speakers Balcony yesterday. Please come back and visit me again soon! pic.twitter.com/zqxOEL6cFJ",1088495601405308930,2019-01-24,17:55:49,repkendrahorn,2,12,219
Come join me at the Cole Community Center in OKC on Saturday from 10am to noon for a community conversation. As your elected official I want to hear from you! pic.twitter.com/l4bBtzFip8,1088459163867459584,2019-01-24,15:31:01,repkendrahorn,10,15,63
Checkout my interview today with Fox 25 where I discuss the impact this government shutdown is having on the people of the 5th district and my efforts to get the government back up and running. https://okcfox.com/news/local/rep-kendra-horn-aims-for-government-to-re-open-before-moving-on-border-security …,1088233144724189185,2019-01-24,00:32:54,repkendrahorn,34,21,104
I am honored to be a part of the bipartisan Congressional Caucus for Women’s Issues and to have attended the Passing of the Gavel Reception last week to welcome new Members into the…  https://www.instagram.com/p/Bs_NvhKHsFv/?utm_source=ig_twitter_share&igshid=1fvnkxkeqov3b …,1088146874996088833,2019-01-23,18:50:06,repkendrahorn,5,1,58
For today’s Connecting With Kendra I recap my participation yesterday at several OKC events honoring Dr. King and my continued work to open the government. #TuneIn pic.twitter.com/b046hNznxb,1087868337714069504,2019-01-23,00:23:17,repkendrahorn,8,4,60
Thankful to be a part of the celebration honoring Dr. Martin Luther King Jr. yesterday in OKC. Being around the energy and community spirit of the people of the 5th district never fails to…  https://www.instagram.com/p/Bs9GFTWnTzP/?utm_source=ig_twitter_share&igshid=c8jv461pqzox …,1087848505396289536,2019-01-22,23:04:29,repkendrahorn,0,5,38
"I met with federal workers over the weekend to learn how the government shutdown has affected them. I have been working, and will continue to work to get the government back up and running https://www.koco.com/article/rep-kendra-horn-meets-with-federal-employees-affected-by-shutdown/25970384 …",1087792808612765698,2019-01-22,19:23:10,repkendrahorn,18,24,122
"This week I signed a letter to Secretary of Education Betsy DeVos to support student loan borrowers who are affected by the partial government shutdown. More than 800,000 federal employees missed a paycheck last week because of the partial government shutdown. pic.twitter.com/oXApb3YOMT",1086398350818271232,2019-01-18,23:02:05,repkendrahorn,20,11,82
Check out the @nytimes article from earlier this week highlighting the women of the 116 Congress. I am so humbled and honored to represent Oklahoma along with this amazing group of incredibly talented women. https://www.nytimes.com/interactive/2019/01/14/us/politics/women-of-the-116th-congress.html …,1086381605680226311,2019-01-18,21:55:33,repkendrahorn,9,10,58
"Hi y’all, tune into my latest Connecting With Kendra! Learn more about my recently announced committee assignment on the House Armed Services Committee. I am very excited to get to serve Oklahomans in this new capacity! pic.twitter.com/I7dS7o5CI5",1086027873285218310,2019-01-17,22:29:57,repkendrahorn,7,11,70
"As promised, here’s my first Connecting With Kendra video where I update you on what I’ve been doing in Congress to represent OK-5. Today, I am connecting with you from the statue of iconic Oklahoman, Will Rogers, in the U.S. Capitol Building! pic.twitter.com/CHyHnE6WzU",1085366524599250949,2019-01-16,02:41:59,repkendrahorn,18,19,159
"Today, in my inaugural speech on the House floor I discussed the national security and economic impacts of the closure of Oklahoma City’s FAA Mike Moroney Aeronautical Center. The Aeronautical center is one of the ten largest employers in Oklahoma. 
 https://media.c-spanvideo.org/trimmed/clip/475/4754278/clip.4754278.MP4-D20.mp4?Policy=eyJTdGF0ZW1lbnQiOlt7IlJlc291cmNlIjoiaHR0cHM6Ly9tZWRpYS5jLXNwYW52aWRlby5vcmcvdHJpbW1lZC9jbGlwLzQ3NS80NzU0Mjc4L2NsaXAuNDc1NDI3OC5NUDQtRDIwLm1wNCIsIkNvbmRpdGlvbiI6eyJEYXRlTGVzc1RoYW4iOnsiQVdTOkVwb2NoVGltZSI6MTU0ODM2MzkxMX0sIklQQWRkcmVzcyI6eyJBV1M6U291cmNlSXAiOiIxNDMuMjMxLjI0OS4xMzYifX19XX0_&Signature=BrvbicDW8HBcF~Ln81bT3RFMWsjbAk6KI5ZOc3aimSPS7vQhqddVBho1TU6esK48oDOEzkCiGrWN8dtm2mIj0JvKEK31vu9FZWm8NsZia7XSBP9lDmOFKEsVFqmRSWhU3niBlquMWhaRrNDxqKHi88s1X3qBSO6Ob6-hj0rqBpE_&Key-Pair-Id=APKAIHKVWBEAXX562G7Q …",1083508898596900864,2019-01-10,23:40:26,repkendrahorn,25,30,215
Hello Twitter! I am excited to be representing the people of the 5th District of Oklahoma! #MyFirstTweet,1083042276790669315,2019-01-09,16:46:15,repkendrahorn,69,86,826
