tweet,id,date,time,username,replies_count,retweets_count,likes_count
"This week I stood with community leaders to recognize #HungerActionMonth and denounce the President's heartless proposal to deny Americans access to food.

Submit your comments below on how harmful this will be to our most vulnerable citizens. 👇👇👇 https://www.regulations.gov/comment?D=FNS-2018-0037-0001&fbclid=IwAR3QFcDi4KS-1jciAZL3MwFWfScsTRy6L9CRa08zlsnlieR6Z8kiPqrlGz0 … pic.twitter.com/yuvzYFeeaH",1169989287804317699,2019-09-06,15:02:38,repjoemorelle,3,0,1
"On the heels of #LaborDay, I was grateful to sit down with labor leaders in our community to learn about their priorities and discuss the work I’m doing in Congress with my @EdLaborCmte colleagues to support working families here in #NY25 and across America. pic.twitter.com/Pl9hdFAxui",1169712795518156801,2019-09-05,20:43:57,repjoemorelle,1,0,5
"Donald Trump’s own agencies have confirmed what we already know: separating families causes irreparable trauma for children and their parents. It is a cruel and shameful policy that contradicts everything America stands for.

#KeepFamiliesTogether https://www.axios.com/family-separation-migrant-kids-mental-health-trauma-5fa95c59-476b-422a-8463-ef9004ff320a.html …",1169655944139149315,2019-09-05,16:58:02,repjoemorelle,3,5,15
"Proud to join @ClerkBello and Mayor Warren for the grand opening of our new Downtown #Roc DMV! 

Today, we make good on a decades-old promise, restore equal access to services for city residents, and begin a new, vibrant chapter in the city of Rochester’s history. pic.twitter.com/oDvUgxPsQt",1169631699581448195,2019-09-05,15:21:42,repjoemorelle,0,5,12
"There are 19 days left to tell Donald Trump to rescind his unconscionable proposal to cut SNAP benefits and deny access to food for 3.1M Americans.

Our families deserve better.

Make your voice heard this Hunger Action Month by submitting comment here.👇👇 https://www.regulations.gov/comment?D=FNS-2018-0037-0001&fbclid=IwAR3QFcDi4KS-1jciAZL3MwFWfScsTRy6L9CRa08zlsnlieR6Z8kiPqrlGz0 …",1169397860275752960,2019-09-04,23:52:30,repjoemorelle,3,15,22
"Thank you to @LenelS2 for the opportunity to visit, meet with employees, and to learn about what more we can do to strengthen and invest in cybersecurity. pic.twitter.com/4gvg4szEve",1169352211639492608,2019-09-04,20:51:07,repjoemorelle,0,1,8
"The country deserves to know what projects are being looted for Donald Trump's political vanity wall.

Diverting these taxpayer dollars is detrimental to our national defense, our servicemen and women, and ultimately the American people. https://www.npr.org/2019/09/03/757262799/trump-administration-diverts-3-6-billion-from-military-projects-to-border-wall …",1169277863956291584,2019-09-04,15:55:41,repjoemorelle,2,2,9
So proud of my granddaughter Arabella as she heads off to her first day of first grade! Wishing the best of luck to all students as they begin the new school year. pic.twitter.com/98D1HkWvve,1169235549833629696,2019-09-04,13:07:33,repjoemorelle,0,4,98
Children’s Institute is doing incredible work supporting children’s social and emotional development and I am excited they have been recognized with this award. I look forward to continuing our partnership to support children and help our families thrive. https://bit.ly/2MRYm4s ,1169016975131103237,2019-09-03,22:39:00,repjoemorelle,1,0,4
"Thank you to @mitchgruber, @ABCCAA, @childrensagenda and so many others for your tireless efforts on the front lines of this fight to protect our most vulnerable citizens.",1168956441165742080,2019-09-03,18:38:28,repjoemorelle,1,1,8
"September is #HungerActionMonth — but instead of fighting the hunger crisis, Donald Trump is cutting SNAP benefits and taking food out of the mouths of 3M Americans.
 
Today I stood with @FoodlinkNY and community partners to express our opposition to this unconscionable proposal. pic.twitter.com/yTn7gn00Nb",1168956437642522626,2019-09-03,18:38:27,repjoemorelle,1,9,30
"My Bill, the Reach Every Veteran in Crisis Act, would ensure we are doing everything we can to prevent veteran suicide and let our servicemen and women know that their lives matter. https://morelle.house.gov/media/press-releases/congressman-joe-morelle-introduces-legislation-strengthen-resources-veterans …",1168900466316664834,2019-09-03,14:56:02,repjoemorelle,0,2,3
"Canandaigua's VA facility receives 1,700 calls every day from Veterans in crisis – over 620,000 calls each year. 

This #SuicidePreventionMonth, let's commit to protecting the brave individuals who so courageously committed to protecting America. https://www.cbsnews.com/news/veteran-suicide-prevention-inside-suicide-prevention-call-center-for-veterans-responding-to-1700-calls-each-day/ …",1168900465305821190,2019-09-03,14:56:02,repjoemorelle,2,3,4
"This #LaborDay, we remember the men and women whose hard work and sacrifice built our country and our economy. 

Today and everyday, I am proud to stand as an ally to my brothers and sisters in labor — and I will always fight alongside them to uplift working families everywhere. pic.twitter.com/pdxDYim48W",1168530318485348352,2019-09-02,14:25:12,repjoemorelle,2,1,27
"A record 10 years have passed since we raised the federal minimum wage.
 
This is long overdue, would help boost our economy, and most importantly: it would help Americans provide for their families.
 
What are we waiting for? It's time to #RaiseTheWage. https://qz.com/work/1696971/why-we-can-raise-the-us-minimum-wage-without-destroying-jobs/ …",1168217429622870019,2019-09-01,17:41:54,repjoemorelle,0,2,12
"My heart is with Texas and the families who have suffered unimaginable loss tonight. 

How many more communities must endure this? #EnoughIsEnough https://twitter.com/cnnbrk/status/1167939403039178753 …",1167964341041127425,2019-09-01,00:56:13,repjoemorelle,4,5,22
