tweet,id,date,time,username,replies_count,retweets_count,likes_count,tdatetime
#PFAS is a clear threat to human health and our environment. Establishing one national protective standard for all PFAS chemicals in water is urgently needed.,1090294681408278528,2019-01-29,17:04:43,repdebdingell,1,3,12,2019-01-29 17:04:43
"If the administration refuses to act, Congress will. https://www.politico.com/story/2019/01/28/epa-toxic-chemicals-drinking-water-1124797 …",1090294680644931584,2019-01-29,17:04:43,repdebdingell,1,10,30,2019-01-29 17:04:43
Privacy is a public good. Joined @Symantec for #PrivacyCon2019 to preview what’s coming in the next year. pic.twitter.com/qlH2JQHtZw,1090278861852606470,2019-01-29,16:01:51,repdebdingell,3,2,9,2019-01-29 16:01:51
"If we can keep guns out of one person’s hands who shouldn’t have them, we should be doing that. Making every person who buys a gun going through a violent history check is a good place to start. https://twitter.com/detroitnews/status/1089848058916016129 …",1089936685817843715,2019-01-28,17:22:10,repdebdingell,11,17,73,2019-01-28 17:22:10
This is about the heart and soul of who we are in America not dividing this country with fear and hatred.,1089554084179398658,2019-01-27,16:01:51,repdebdingell,5,16,66,2019-01-27 16:01:51
"Freedom of religion is a fundamental pillar of the US Constitution.  From the steps of the Supreme Court to the floor of Congress - I’ll never stop fighting for freedom of religion, speech, and the press. pic.twitter.com/8KbJ95RUA5",1089554079314006017,2019-01-27,16:01:50,repdebdingell,7,20,88,2019-01-27 16:01:50
"Two years ago, the Trump Administration attacked it with the proposed Muslim Ban.",1089554069075779586,2019-01-27,16:01:47,repdebdingell,6,13,45,2019-01-27 16:01:47
"Happy Birthday Michigan! Our state has so much to celebrate, but it’s the hard-working men and women who make Michigan a great place to live, work, and play. pic.twitter.com/32L3kNhnLZ",1089152916802420736,2019-01-26,13:27:45,repdebdingell,5,17,99,2019-01-26 13:27:45
All of Congress cares about keeping our nation secure. We have a lot of work to do to regain American’s trust in their government.,1088893516053446656,2019-01-25,20:16:59,repdebdingell,17,5,27,2019-01-25 20:16:59
"People were scared to death of how to pay their bills and worried that hits to their credit scores would affect background checks, security clearances, and future employment.",1088893515483021312,2019-01-25,20:16:59,repdebdingell,10,4,22,2019-01-25 20:16:59
"It should have never come to this. Federal workers were held hostage for more than a month, many told to come to work while not being paid.",1088893514887385088,2019-01-25,20:16:59,repdebdingell,3,2,12,2019-01-25 20:16:59
As this shutdown goes into the history books we cannot for one second let the human face of this shutdown get lost.,1088893514295971843,2019-01-25,20:16:59,repdebdingell,5,7,38,2019-01-25 20:16:59
Perhaps disrupting air traffic out LaGuardia and other airports might help the White House better understand the human toll of this shutdown.,1088843120291262464,2019-01-25,16:56:44,repdebdingell,10,7,67,2019-01-25 16:56:44
"Going forward, I will continue to work with the EPA, the State of Michigan, and the City of Trenton to make sure our communities remain safe as this project  continues. Ensuring Downriver residents are safe will always be our number one priority.",1088528259099308039,2019-01-24,20:05:35,repdebdingell,1,2,18,2019-01-24 20:05:35
"As soon as asbestos was found, immediate steps were taken to correct the problem and a violation notice was  issued. I spoke to Governor Whitmer to ensure delays do not happen and that this is remedied as soon as possible.",1088528258424025089,2019-01-24,20:05:35,repdebdingell,1,1,14,2019-01-24 20:05:35
"Although reports of increased asbestos levels at the former McLouth Steel site are deeply disturbing, the system worked – #MDEQ was on site even though the @EPA is shutdown.",1088528257849397248,2019-01-24,20:05:35,repdebdingell,1,1,16,2019-01-24 20:05:35
Every day I hear from people caught up in the shutdown. Ann Arbor EPA workers tell me vital work is not being done while the shutdown continues. It is critical that we learn the damage this shutdown is causing federal agencies and Americans. https://twitter.com/EnergyCommerce/status/1088470690452389890 …,1088503328038940672,2019-01-24,18:26:31,repdebdingell,10,16,50,2019-01-24 18:26:31
The pain of abuse never stops - we must support each other. I am with @SenJoniErnst always to stick up for assault survivors. pic.twitter.com/japZFXDg8M,1088494763110789120,2019-01-24,17:52:29,repdebdingell,16,13,92,2019-01-24 17:52:29
Because federal workers aren’t getting paid. https://twitter.com/nielslesniewski/status/1088432465478369282 …,1088459669427900416,2019-01-24,15:33:02,repdebdingell,30,26,173,2019-01-24 15:33:02
"Extending unemployment benefits to hard-working men and women is the right thing to do. 

MORE here: https://debbiedingell.house.gov/media-center/press-releases/dingell-upton-lead-effort-provide-relief-unpaid-federal-workers-make …",1088179756808445952,2019-01-23,21:00:46,repdebdingell,2,6,13,2019-01-23 21:00:46
A missed mortgage payment affects their credit score and could impact future background checks and security clearance. They don’t know how they’ll afford gas to go to work to a job they aren’t getting paid for. #ShutdownStories,1088179756011610119,2019-01-23,21:00:45,repdebdingell,7,9,16,2019-01-23 21:00:45
"Public servants aren’t Democrats or Republicans, they are people working to keep us safe.",1088179755306926081,2019-01-23,21:00:45,repdebdingell,3,2,14,2019-01-23 21:00:45
The bipartisan #PayFederalWorkers Act makes unpaid federal workers eligible for unemployment benefits.,1088179754585546759,2019-01-23,21:00:45,repdebdingell,5,17,47,2019-01-23 21:00:45
"Air pollution can impact anyone, but children, seniors, people with lung or heart disease, and low-income communities are at greater risk. Protecting the air we breathe is critical for the health of future generations.  #HealthyAirForAll http://www.lung.org/healthyairforall …",1088150875833393152,2019-01-23,19:06:00,repdebdingell,8,20,52,2019-01-23 19:06:00
Transgender Americans – like any other eligible person – should have the same opportunities to serve our country and remain in our military ranks. This discriminatory ban must be reversed. https://twitter.com/nytimes/status/1087724887937085440 …,1087849787179839489,2019-01-22,23:09:35,repdebdingell,7,25,131,2019-01-22 23:09:35
"John and I are deeply saddened by his passing, and our thoughts and  prayers are with his family during this difficult time. Today and  every day, we are grateful for his selfless  leadership and courage of  our country’s servicemembers.",1087768796612448256,2019-01-22,17:47:45,repdebdingell,3,2,4,2019-01-22 17:47:45
"Kettles was a pillar of our community and  served as a trusted mentor to veterans after returning home from  Vietnam. His true calling was serving others, and we are all better for knowing him and learning from him.",1087768795589079040,2019-01-22,17:47:45,repdebdingell,1,1,4,2019-01-22 17:47:45
"LTC Charles Kettles exemplified the best of American values—courage, dedication, and selflessness. He went above and beyond the call of duty to save the lives of his fellow soldiers, and it was a true honor to ensure he was properly honored as one of our nation’s bravest heroes. https://twitter.com/wjrradio/status/1087760656403697666 …",1087768794741780482,2019-01-22,17:47:45,repdebdingell,1,3,9,2019-01-22 17:47:45
"On this #MLKDay we must remember that, never be afraid to stand up for what’s right and that we have a moral responsibility to speak out and fight against hate.",1087397985481195524,2019-01-21,17:14:17,repdebdingell,4,4,29,2019-01-21 17:14:17
"Dr. King taught that we are intertwined into an “inescapable web of mutuality.” He knew that in our country, it is love and cooperation with our neighbor that makes our democracy possible, gives it vibrancy and opens it up to those left out.",1087397983975550977,2019-01-21,17:14:16,repdebdingell,1,1,27,2019-01-21 17:14:16
"As a young teenager, the nuns took me to see Dr. Martin Luther King just three short weeks before his life on this earth would end. He was in Michigan to talk about open housing. It was a community divided; I remember the emotion of that event to this day. pic.twitter.com/piyYoDWe55",1087397980892733441,2019-01-21,17:14:16,repdebdingell,2,6,66,2019-01-21 17:14:16
COMING UP: I’m joining @AlexWitt on @MSNBC at 12:10 E. Tune in!,1087017835090591751,2019-01-20,16:03:42,repdebdingell,52,3,13,2019-01-20 16:03:42
"America is better than this. United we stand, divided we fall. I am deeply, deeply saddened by what happened.",1086989260539023361,2019-01-20,14:10:09,repdebdingell,106,8,53,2019-01-20 14:10:09
I was educated by Catholic nuns and they taught me the value of respecting every individual and recognizing all they have to give and the need to protect that as a basic human value. The fact that these were students at a Catholic High School only makes this worse for me.,1086989259049971712,2019-01-20,14:10:09,repdebdingell,53,4,52,2019-01-20 14:10:09
This blatant act of ugliness is yet another example of how this country is being divided by fear and hatred and is simply unacceptable.,1086989257707831296,2019-01-20,14:10:08,repdebdingell,27,2,20,2019-01-20 14:10:08
"I represent him and know him. He is from Ypsilanti, and a decent and caring human being in our community.",1086989256424345601,2019-01-20,14:10:08,repdebdingell,9,2,23,2019-01-20 14:10:08
"Nathan Philips, a veteran soldier,  was in DC to participate in the Indigenous People’s March. He defended this country, he formerly headed the Native Youth Alliance, is “the keeper of the sacred pipes” and leads an annual Ceremony at Arlington National Cemetery.",1086989254834733056,2019-01-20,14:10:08,repdebdingell,18,4,16,2019-01-20 14:10:08
"On MLK weekend and the Women’s March one would hope respect, inclusion, unity, equality might be the messages of the weekend. https://twitter.com/nytimes/status/1086982942965067776 …",1086989252854976514,2019-01-20,14:10:07,repdebdingell,19,6,62,2019-01-20 14:10:07
I’ll keep working in a bipartisan fashion to make them permanent and to fix our broken long-term care system.,1086352297762930689,2019-01-18,19:59:05,repdebdingell,5,1,16,2019-01-18 19:59:05
People should receive long-term care in the setting they prefer. I’m pleased the House and Senate passed short extensions of the Money Follows the Person program and Spousal Impoverishment protections. https://debbiedingell.house.gov/media-center/press-releases/house-passes-health-bills-supported-dingell …,1086352297083527168,2019-01-18,19:59:05,repdebdingell,3,3,16,2019-01-18 19:59:05
"My thoughts are with the families of the four fallen Americans. This tragedy underscores the ongoing instability in Syria as well as the danger ISIS still poses, and we must continue to examine the best way forward to protect Americans both at home and abroad. https://twitter.com/NBCNews/status/1085708281107103744 …",1085990919248273409,2019-01-17,20:03:06,repdebdingell,7,7,19,2019-01-17 20:03:06
Learning from the best! https://twitter.com/tedlieu/status/1085901851927687168 …,1085903653544837121,2019-01-17,14:16:20,repdebdingell,33,26,306,2019-01-17 14:16:20
Religious discrimination has no place in our country or our immigration system. Proud to cosponsor @RepBeyer’s bill. 👇🏻 https://twitter.com/RepDonBeyer/status/1085657372889034753 …,1085686770379968518,2019-01-16,23:54:31,repdebdingell,9,11,53,2019-01-16 23:54:31
Met with @MADDOnline President Helen Witty today to discuss my drunk driving bill. Grateful for the organization's work to turn grief into action and save lives. pic.twitter.com/lYTVmpkktD,1085659088481005568,2019-01-16,22:04:31,repdebdingell,0,5,26,2019-01-16 22:04:31
Students at @michiganstateu need to feel safe and heard. They need a President who is non-political and will listen to the survivors and the  MSU family. Today is another step in that direction. https://twitter.com/APCentralRegion/status/1085600901639872512 …,1085652319713189888,2019-01-16,21:37:38,repdebdingell,6,7,58,2019-01-16 21:37:38
"The #RaiseTheWage Act would gradually increase the minimum wage to $15 by 2024. By putting money in the pockets of hardworking Americans, this bill is good for workers, good for businesses, and good for the economy. pic.twitter.com/qSPcj7JxPl",1085603952434036738,2019-01-16,18:25:26,repdebdingell,10,26,66,2019-01-16 18:25:26
"Ensuring every American has access to affordable, quality healthcare has been something I have fought for all my life.

Getting a seat on the Health Subcommittee on @EnergyCommerce really matters. https://debbiedingell.house.gov/media-center/press-releases/dingell-appointed-health-subcommittee-energy-commerce-committee …",1085318404209295360,2019-01-15,23:30:46,repdebdingell,10,17,58,2019-01-15 23:30:46
"Nicola is an Air Traffic Controller. She has 4 sons, 3 of whom suffer complex medical issues that depend on her income. Despite receiving a paycheck that read $0.00 on Friday, she continues to report to work to keep the skies safe. #ShutdownStories",1085275614607798272,2019-01-15,20:40:44,repdebdingell,11,10,27,2019-01-15 20:40:44
Sarah from Belleville is a single mom now facing a daycare bill she cannot afford. She has started working the midnight shift at Denny’s to pay for gas that takes her to a job she won’t receive a paycheck for. #ShutdownStories,1085272026003189760,2019-01-15,20:26:29,repdebdingell,751,695,1407,2019-01-15 20:26:29
"Domestic violence shelters that depend on federal reimbursements are counting down the days until they will have to shut down operations. This shut down is a life or death situation for men, women, and children around the country. https://www.glamour.com/story/government-shutdown-domestic-violence-shelters …",1085269065478926339,2019-01-15,20:14:43,repdebdingell,5,18,22,2019-01-15 20:14:43
"Every bill that goes unpaid is a hit to federal workers’ credit scores & could adversely affect their security clearance, background checks, and future employment. Workers are scared to death what this shutdown means for them today and in the future. #ShutdownStories",1085268659109576704,2019-01-15,20:13:06,repdebdingell,3,3,10,2019-01-15 20:13:06
FBI agents can’t conduct investigations or do their jobs. A shutdown puts their personal finances and our national security at risk. #ShutdownStories,1085267536168538113,2019-01-15,20:08:38,repdebdingell,5,3,13,2019-01-15 20:08:38
Secret Service agents will take a bullet for their protectees. They have worked tirelessly without pay for the past 25 days and now are worried about how to pay their bills or if their credit rating will be hurt and impact their employment . #ShutdownStories,1085266794317860877,2019-01-15,20:05:41,repdebdingell,3,4,16,2019-01-15 20:05:41
Constituents are crying as they look at days ahead. They're caught in a catch-22 as they work without a paycheck but must make money to buy gas or eat and need approval to work a second job. They shouldn’t need a second job. We must stop holding them hostage. #ShutdownStories,1085265493265694720,2019-01-15,20:00:31,repdebdingell,10,21,65,2019-01-15 20:00:31
"Joining @C4AHC to discuss #PriceOfGoodHealth and #MedicareforAll. 

Every American has a right to quality, affordable healthcare. Period.",1085181664987353088,2019-01-15,14:27:25,repdebdingell,5,5,16,2019-01-15 14:27:25
"Introduced legislation with @RepFredUpton & @RepDanKildee to declare PFAS chemicals as hazardous substances & allow @EPA to clean up contaminated sites. Michigan has been hit hard by PFAS, and states must have the tools they need to protect drinking water. https://debbiedingell.house.gov/media-center/press-releases/dingell-upton-kildee-introduce-legislation-declare-pfas-hazardous-clean …",1084952090647105538,2019-01-14,23:15:10,repdebdingell,3,40,105,2019-01-14 23:15:10
"Excited for the first day of @NAIASDetroit? 

Tune into my Instagram stories as I tour the floor and see the latest product.",1084778227946713090,2019-01-14,11:44:18,repdebdingell,2,7,43,2019-01-14 11:44:18
"Joining @chucktodd #MTPDaily on @MSNBC at 5:15 to talk #Shutdown. 

Tune in!",1083842050934616071,2019-01-11,21:44:16,repdebdingell,7,5,19,2019-01-11 21:44:16
"Proud to introduce the Abbas Stop Drunk Driving Act.

I'm dedicated to their memory and preventing another life from being senselessly lost to drunk driving. pic.twitter.com/NMMCdpSqEO",1083793583818371072,2019-01-11,18:31:40,repdebdingell,12,12,45,2019-01-11 18:31:40
"We should all be the as eyes and ears, especially on Michigan’s highways or at airports. If something looks off, say something. You might keep a child from being abused.",1083738369019052034,2019-01-11,14:52:16,repdebdingell,2,11,27,2019-01-11 14:52:16
"Today is #NationalHumanTraffickingAwarenessDay. The US has a far higher problem than many realize and Michigan has an alarmingly high incident rate. Our children are especially at risk, a staggering number of human trafficking cases involve the sexual exploitation of a child.",1083738368389853184,2019-01-11,14:52:16,repdebdingell,8,26,60,2019-01-11 14:52:16
"Dave, a biologist at a research lab in Ann Arbor shared his #ShutdownStory: Weather forecasts aren't being formulated. The supercomputer watching Enbridge Line 5's safety is offline. 
 
But most importantly, the shutdown is affecting his personal finances and career.",1083511868130512896,2019-01-10,23:52:14,repdebdingell,10,26,56,2019-01-10 23:52:14
Free and fair elections are a pillar of our country’s democracy. Americans deserve assurance that their vote is secure from outside interference. https://debbiedingell.house.gov/media-center/press-releases/dingell-renews-legislation-safeguard-us-election-infrastructure …,1083434847023042560,2019-01-10,18:46:11,repdebdingell,2,2,18,2019-01-10 18:46:11
"Day 20

@USDA & @SBAgov stopped processing new loans.

Shipments of military products are stalled.

Mortgages applications are delayed.

The negative and lasting effects grow each day. #EndTheShutdown. https://www.washingtonpost.com/business/economy/this-is-ridiculous-small-business-owners-cant-get-loans-as-shutdown-enters-day-20/2019/01/09/c2de50fa-1379-11e9-b6ad-9cfd62dbb0a8_story.html?utm_term=.19dd427b18e6 …",1083424935425515520,2019-01-10,18:06:48,repdebdingell,4,6,20,2019-01-10 18:06:48
"Nothing will bring back the Abbas family. Our community will deeply miss them but we need to make sure that their death is not in vain, we are dedicate to their memories and others we know to try to prevent another life being lost this way senselessly.",1083396082179158017,2019-01-10,16:12:09,repdebdingell,5,7,28,2019-01-10 16:12:09
This will stop intoxicated drivers from ever starting a vehicle. If we can keep one person from dying on the roads and make people think twice before getting behind the wheel when they shouldn’t – even when they are buzzed and think they’ll be ok – then we will be successful.,1083396081499758592,2019-01-10,16:12:09,repdebdingell,14,11,42,2019-01-10 16:12:09
"This week, I’m introducing legislation in memory of the Abbas family that would mandate all new vehicles be equipped with interlock breathalyzer devices. pic.twitter.com/u6JTIPESh8",1083395767153377287,2019-01-10,16:10:54,repdebdingell,73,45,183,2019-01-10 16:10:54
Honoring the memory of the Abbas family on the House floor shortly. Watch here:  https://www.c-span.org/networks/?channel=c-span …,1083378733204033538,2019-01-10,15:03:12,repdebdingell,4,5,28,2019-01-10 15:03:12
This House member agrees too. https://twitter.com/JRosenworcel/status/1083116819597221889 …,1083117609866936320,2019-01-09,21:45:36,repdebdingell,2,8,59,2019-01-09 21:45:36
Read more on the #ButchLewis Act here: https://debbiedingell.house.gov/media-center/press-releases/dingell-introduces-legislation-protect-pensions-michigan-workers-have-0 …,1083081614844940288,2019-01-09,19:22:34,repdebdingell,0,2,7,2019-01-09 19:22:34
"American workers have done their part, now it’s time for Congress to do ours.",1083081614090010626,2019-01-09,19:22:34,repdebdingell,2,1,9,2019-01-09 19:22:34
"While it’s disappointing that the Pension Select Committee could not reach an agreement last year, our commitment to protecting pensions will not waver.",1083081613288923136,2019-01-09,19:22:33,repdebdingell,1,1,5,2019-01-09 19:22:33
Hard-working men and women have worked a lifetime thinking the pension  they paid into would be there for them in retirement. This is the money they counted on to retire with dignity and security and we must do everything we can to ensure they have the benefits they have earned. pic.twitter.com/oIwZ2Rl2KZ,1083081606754172930,2019-01-09,19:22:32,repdebdingell,2,7,11,2019-01-09 19:22:32
The bipartisan #ButchLewis Act will bring relief to the tens of thousands of workers and retirees whose lives have been turned upside down by proposed cuts to their pensions.,1083081606099861506,2019-01-09,19:22:32,repdebdingell,3,4,12,2019-01-09 19:22:32
No part of this shutdown makes Americans more safe. https://twitter.com/JoelAchenbach/status/1083050761490219009 …,1083064227491991553,2019-01-09,18:13:28,repdebdingell,15,46,251,2019-01-09 18:13:28
"Seven years ago I thought I'd never see my friend again. I love Gabby, her husband Mark, and their endless work to end gun violence. We must take action to save lives. pic.twitter.com/VstwD3Kab4",1083033697383784452,2019-01-09,16:12:09,repdebdingell,5,13,136,2019-01-09 16:12:09
"""She's trying to decide what she cannot live without. “I want to keep my health insurance,” said Kelly, who has high blood pressure. “I have to be able to pay for my medication. Hypertension's nothing to play with. This is a life&death situation for me.”"" https://www.washingtonpost.com/local/the-government-shutdowns-fear-factor-if-i-dont-work-my-bills-dont-get-paid/2019/01/08/1b86b30c-12ba-11e9-b6ad-9cfd62dbb0a8_story.html?utm_term=.76a4efc3ae99 …",1082755928036909058,2019-01-08,21:48:24,repdebdingell,4,9,23,2019-01-08 21:48:24
"Every day @realDonaldTrump keeps the government closed, small businesses pay the price. Due to the shutdown, the Small Business Administration has had to forgo millions of dollars in loans & contracting opportunities. It’s time for President Trump and the GOP to #EndTheShutdown.",1082718346477531137,2019-01-08,19:19:04,repdebdingell,10,23,90,2019-01-08 19:19:04
Devastated by the tragic loss of the Abbas family. My thoughts and prayers are with their family and our community as we mourn.  They gave so much to our community and were good friends of John and I.,1082367467626868736,2019-01-07,20:04:48,repdebdingell,3,2,47,2019-01-07 20:04:48
"Starting off the New Year, new Congress, and new state legislature by getting lunch with my colleagues who are representing the 12th district in Lansing. Look forward to continue standing up for the hard-working men and women of Southeast Michigan. pic.twitter.com/MypEao6sCF",1082358249561776128,2019-01-07,19:28:10,repdebdingell,1,4,21,2019-01-07 19:28:10
"Trump Administration officials should not be getting raises while 800,000 public servants are asked to work without pay. Unconscionable. https://www.washingtonpost.com/business/2019/01/04/while-federal-workers-go-without-pay-senior-trump-administration-officials-are-poised-get-raises/?utm_term=.2cb9e4fe337c …",1081263184454008834,2019-01-04,18:56:46,repdebdingell,37,27,71,2019-01-04 18:56:46
"The government should work #ForThePeople. #HR1 will reduce the role of big money in politics and make it easier to vote. Everyone deserves to have their voice heard in our democracy, and I’m proud to help lead this bill.",1081240797461258246,2019-01-04,17:27:49,repdebdingell,67,62,312,2019-01-04 17:27:49
Taking my first turn as Speaker Pro Tempore this morning. In the majority we all take turns managing debate on the House Floor. pic.twitter.com/RapQFgdVYu,1081201205932687360,2019-01-04,14:50:29,repdebdingell,20,30,287,2019-01-04 14:50:29
#SwearingIn Day with @SpeakerPelosi pic.twitter.com/25WSnDRPWo,1080957642925920256,2019-01-03,22:42:39,repdebdingell,12,6,58,2019-01-03 22:42:39
#swearinginday continues... pic.twitter.com/jLlJh8bPQS,1080957637414526976,2019-01-03,22:42:38,repdebdingell,1,0,26,2019-01-03 22:42:38
Scenes from #SwearingIn Day... pic.twitter.com/UM6yc8o3Pk,1080933841232191489,2019-01-03,21:08:05,repdebdingell,3,0,26,2019-01-03 21:08:05
Scenes from #SwearingIn Day... pic.twitter.com/kFvTwsGoJE,1080933835485954054,2019-01-03,21:08:03,repdebdingell,1,0,26,2019-01-03 21:08:03
Scenes from #SwearingIn Day... pic.twitter.com/mdP4fH5oAg,1080933829303508992,2019-01-03,21:08:02,repdebdingell,1,1,15,2019-01-03 21:08:02
Scenes from #SwearingIn Day... pic.twitter.com/52fpOXSTDJ,1080933823272157184,2019-01-03,21:08:00,repdebdingell,1,1,38,2019-01-03 21:08:00
"There’s a lot of work to do, but climate change, pre-existing conditions, and broken immigration policies deserve immediate attention from @EnergyCommerce. 

Ready to get to work with Chairman @FrankPallone! https://twitter.com/FrankPallone/status/1080924147797102592 …",1080932327205859338,2019-01-03,21:02:04,repdebdingell,8,6,48,2019-01-03 21:02:04
The rules of the 116th Congress will restore the legislative process in the People’s House. This is what it looks like when we have a Congress that works #ForThePeople!,1080878886978764800,2019-01-03,17:29:43,repdebdingell,5,9,81,2019-01-03 17:29:43
We have a lot to do. I am rolling up my sleeves.,1080860317926739968,2019-01-03,16:15:55,repdebdingell,3,4,16,2019-01-03 16:15:55
