tweet,id,date,time,username,replies_count,retweets_count,likes_count,tdatetime
"The President threatens to veto a bill because it would address PFAS contamination? Perhaps he should have to bathe, drink or swim in some of the water our communities do.",1148988507098144768,2019-07-10,16:13:01,repdebdingell,7,42,117,2019-07-10 16:13:01
"Each day we hear more horror stories from the border and how children and babies are being treated. We cannot let our hearts harden....every child has the right to be treated with humanity, comfort, and one would wish love. https://twitter.com/NBCNews/status/1148937225796804613 …",1148975106246553600,2019-07-10,15:19:46,repdebdingell,14,14,69,2019-07-10 15:19:46
"We should also chant “equal pay, equal pay.” https://twitter.com/AP/status/1148950141107417089 …",1148969140587311105,2019-07-10,14:56:04,repdebdingell,2,4,45,2019-07-10 14:56:04
"You show up✅

You work hard✅

You pay into your pension✅

But through no fault of their own, too many are at risk of losing the pensions they worked so hard to earn. By advancing the #ButchLewisAct, we will ensure all retirees are guaranteed the full benefits they've earned.",1148953467580485633,2019-07-10,13:53:47,repdebdingell,2,28,75,2019-07-10 13:53:47
"This is what happens when prescription drugs are treated as a commodity.
 
With #MedicareForAll hardworking men and women will receive the medication they need, when they need it. No more trips to Canada, no more tough decisions. pic.twitter.com/fmEVOz3Q5g",1148939148637671425,2019-07-10,12:56:53,repdebdingell,9,44,91,2019-07-10 12:56:53
"4,110,300 people in Michigan have a pre-existing condition. 

If the Trump Admin is successful in repealing the ACA, they all are at risk of losing coverage. 

To make matters worse, the Admin has no plan in place should millions lose coverage. 

Let that sink in. #ProtectOurCare",1148671473390968832,2019-07-09,19:13:15,repdebdingell,8,30,73,2019-07-09 19:13:15
"This is Carly. She is from Michigan and has Type 1 Diabetes – which is a pre-existing condition. 

If the Trump Admin is successful today in their lawsuit to overturn the ACA, millions just like Carly will be hurt. 

Today I am standing up for Carly to #ProtectOurCare pic.twitter.com/89OtiwO2pt",1148653641940787200,2019-07-09,18:02:23,repdebdingell,4,31,105,2019-07-09 18:02:23
"Tune in as both House and Senate Democrats join in opposition to the Trump Administration’s efforts to repeal the ACA in court. Today, I’m standing up for Carly from Michigan and the millions like her who would be impacted if the ACA is overturned. https://www.pscp.tv/w/b_S7ZjFkclFlR21EcGFqYkd8MU93eFdra0RZa2p4UezyV8Y4hAccf7lxiiWlvdNqyqrGl7eEzzowpH_0P_fs …",1148633600251826176,2019-07-09,16:42:45,repdebdingell,4,13,66,2019-07-09 16:42:45
"We have a moral responsibility to address the cost of healthcare in our country. 

It was a pleasure to join @Altarum to discuss why we need to bring together diverse and varied stakeholders to solve the crisis of healthcare costs. Only by working together can we get it done. pic.twitter.com/y8LdozmXDG",1148609776189870080,2019-07-09,15:08:05,repdebdingell,2,7,32,2019-07-09 15:08:05
"If the DOJ is successful in their lawsuit against the ACA, millions will lose coverage for pre-existing conditions. It would be a catastrophe and would send our healthcare system into chaos. 

The stakes for this hearing are too high and all of us must pay attention.",1148591324486127616,2019-07-09,13:54:46,repdebdingell,10,40,94,2019-07-09 13:54:46
Happy Birthday John! pic.twitter.com/DPX4neAEyu,1148375527725707264,2019-07-08,23:37:16,repdebdingell,78,179,3399,2019-07-08 23:37:16
"Congratulations to the @USWNT and we look forward to welcoming you to the Capitol! 

Thank you for inspiring millions of girls across the world! We should all be proud to play like a girl. 🇺🇸⚽️ https://twitter.com/USWNT/status/1147911775708467201 …",1147969966035148801,2019-07-07,20:45:42,repdebdingell,4,23,192,2019-07-07 20:45:42
"Making it to the World Cup final - it’s what the @USWNT does. 

Good luck today ladies! You’ve made us all so proud.",1147869815924776960,2019-07-07,14:07:45,repdebdingell,3,3,53,2019-07-07 14:07:45
"Today we all will enjoy fireworks, eat burgers, and relax. But let’s never forget why we celebrate the 4th. Generations ago the promise of our country was created – that every person has the right to freedom and the pursuit of happiness. This is a promise we can never forget. pic.twitter.com/GiSAwP1yag",1146779669435473921,2019-07-04,13:55:53,repdebdingell,10,14,73,2019-07-04 13:55:53
We are taking a poll on the favorite way to spend your 4th of July. I personally love a parade! I always begin my 4th of July marching in a parade (and yes in 👠). Share your favorite stories. Urge your friends to like my page and VOTE!,1146477288755798016,2019-07-03,17:54:20,repdebdingell,2,1,7,2019-07-03 17:54:20
"Congrats again to the @USWNT on a great win yesterday! They are performing on the field, drawing massive TV viewership, and breaking records in jerseys sold. 

But for some reason, they’re still paid less than the men?

Same work. Same pay. It’s that simple.",1146457743567589376,2019-07-03,16:36:40,repdebdingell,1,6,66,2019-07-03 16:36:40
"Share this post, tell your friends to like my page to participate, and send some photos in!

To submit a photo, email DingellPhotoCompetition@Gmail.com.",1146434933596065792,2019-07-03,15:06:02,repdebdingell,0,1,7,2019-07-03 15:06:02
"Do you have a picture of your favorite place in Southeast Michigan? Whether it’s a farmers market, the Great Lakes, or 4th of July fireworks, we want a photo from you! 

Starting today through July 22, my office is hosting a photo competition for the month of July. pic.twitter.com/48ljE2nsDt",1146434932052561920,2019-07-03,15:06:02,repdebdingell,1,5,16,2019-07-03 15:06:02
I guess Kim Jong-Un gave President Trump some ideas during their meeting. https://twitter.com/brianklaas/status/1146007985686274048 …,1146404678449684480,2019-07-03,13:05:49,repdebdingell,15,18,92,2019-07-03 13:05:49
This has been a difficult year as we say goodbye to so many giants of a different generation. Lee Iacocca was a unique force. My heart goes out to his family. Many of us are sadder as we say God speed to a towering figure in the history of the motor vehicle industry. https://twitter.com/freep/status/1146245973892636676 …,1146385206271774720,2019-07-03,11:48:26,repdebdingell,0,4,52,2019-07-03 11:48:26
"Yay for the women! Teamwork showed today. 

GO USA!!!!!! https://twitter.com/USWNT/status/1146159958934937601 …",1146185113417465857,2019-07-02,22:33:20,repdebdingell,1,4,53,2019-07-02 22:33:20
"Efforts to add a citizenship question were misguided, untested, and would seriously threaten participation and skew the results of the #Census. We must always stand in the face of efforts to undermine our democracy.",1146177945087688706,2019-07-02,22:04:51,repdebdingell,16,2,32,2019-07-02 22:04:51
"The Trump Administrations efforts to include a citizenship question in the Census was wrong from the beginning. 

To protect the pillars of our democracy, we must ensure all communities are accurately counted in the 2020 Census. https://twitter.com/nytimes/status/1146162641007710210 …",1146177812145086467,2019-07-02,22:04:20,repdebdingell,30,6,40,2019-07-02 22:04:20
"And that’s a wrap! Thanks for tuning in everyone! Should you have any more questions, you can always reach me below: #AskDebbieDingell https://debbiedingell.house.gov/contact/ ",1146177261730705408,2019-07-02,22:02:08,repdebdingell,3,0,5,2019-07-02 22:02:08
"Answer: The House just passed the SAFE Act – a bill to help strengthen the security & integrity of US elections. Democrat or Republican, our democracy depends on voters knowing their votes will count. #AskDebbieDingell https://debbiedingell.house.gov/news/documentsingle.aspx?DocumentID=1786 …",1146176161875210243,2019-07-02,21:57:46,repdebdingell,3,4,13,2019-07-02 21:57:46
Question from Instagram: Is there a real bipartisan commitment to election security or is it only an issue with Democrats? pic.twitter.com/dM9v2oep9f,1146176160595939331,2019-07-02,21:57:46,repdebdingell,2,2,7,2019-07-02 21:57:46
"Answer: House-passed HR 1, the For the People Act, requires Election Day be treated as a federal holiday. It is critical that we work to reduce barriers to voting. #AskDebbieDingell pic.twitter.com/TcZxqHDRAb",1146174295330217984,2019-07-02,21:50:21,repdebdingell,5,5,26,2019-07-02 21:50:21
Question from Instagram: Will you fight to make election day a federal holiday? #AskDebbieDingell pic.twitter.com/tUXVDZsZiu,1146174294013239304,2019-07-02,21:50:21,repdebdingell,1,2,19,2019-07-02 21:50:21
Securing our elections should be a bipartisan issue. The Mueller report made it clear – Russia interfered during the 2016 elections. It's time McConnell held a vote to protect a fundamental pillar of our democracy. #AskDebbieDingell pic.twitter.com/GNnGzny0cj,1146171420432568320,2019-07-02,21:38:56,repdebdingell,3,1,17,2019-07-02 21:38:56
"Question from Facebook: If McConnell continues to block any action on this, what can be done to insure that there is no external (foreign) interference in our elections?... #AskDebbieDingell pic.twitter.com/iVVMD7wctF",1146171419031756800,2019-07-02,21:38:55,repdebdingell,6,1,11,2019-07-02 21:38:55
H.R. 1 would do just that. In Congress I also introduced a bill that requires every vote produces a paper receipt.  #AskDebbieDingell https://twitter.com/mnykaza/status/1146147965842657281 …,1146169076710084609,2019-07-02,21:29:37,repdebdingell,2,1,13,2019-07-02 21:29:37
"Answer: It’s the responsibility of each state to maintain voter registration. Congress & the Fed gov't are responsible for ensuring states maintain reasonable standards, & protect voters from discriminatory practices. We must keep making progress to that goal. #AskDebbieDingell pic.twitter.com/S8CYXUazOu",1146166773256990720,2019-07-02,21:20:28,repdebdingell,0,1,7,2019-07-02 21:20:28
Question from Facebook: What steps is Congress taking to clean voting registrations of the deceased and non-citizens? #AskDebbieDingell pic.twitter.com/GXmkeMxnGN,1146166771558301696,2019-07-02,21:20:27,repdebdingell,1,0,7,2019-07-02 21:20:27
"Currently, some voting machines are like a black box – votes go in and the machine spits out a tally making audits difficult. In Congress I introduced a bill that requires every vote produces a paper receipt.  #AskDebbieDingell https://twitter.com/LauraHennesse11/status/1144706071560372225 …",1146164694559969281,2019-07-02,21:12:12,repdebdingell,0,10,23,2019-07-02 21:12:12
"*FLASHBACK* Sept. 5, 2018: I ask @Twitter CEO @Jack about machine learning and AI. 
 https://youtu.be/Cp6oYSrU94w?t=9780 …
#AskDebbieDingell https://twitter.com/drmanejwala/status/1145463444486971392 …",1146162739519414272,2019-07-02,21:04:26,repdebdingell,0,1,7,2019-07-02 21:04:26
Now to your questions. Because a fundamental part of democracy is transparent conversations with your elected leaders. Let's get to some questions on securing our elections. #AskDebbieDingell,1146161753778270208,2019-07-02,21:00:31,repdebdingell,1,2,7,2019-07-02 21:00:31
"This week, the week we celebrate our independence, we have to commit to protecting the freedoms we all hold so dear.",1146161752993914889,2019-07-02,21:00:31,repdebdingell,1,0,7,2019-07-02 21:00:31
"Voting is a fundamental pillar of democracy. The fight to remove barriers to the ballot-box has been long, but every step has brought us towards a more equal democracy.",1146161752192749571,2019-07-02,21:00:31,repdebdingell,1,0,4,2019-07-02 21:00:31
"The #ForthePeople Act (passed by the House in March) takes great steps to return the power of government to the people. HR 1 secures elections, reduces the influence of big money in politics, and strengthens government ethics laws. https://debbiedingell.house.gov/news/documentsingle.aspx?DocumentID=1694 …",1146161750812831744,2019-07-02,21:00:30,repdebdingell,1,2,3,2019-07-02 21:00:30
"Further, I have strong legislation (Safeguarding Election Infrastructure Act) which ensures states have the resources and intelligence necessary to protect voting equipment and safeguard our elections from outside interference. https://debbiedingell.house.gov/news/documentsingle.aspx?DocumentID=1024 …",1146161749671972866,2019-07-02,21:00:30,repdebdingell,1,0,4,2019-07-02 21:00:30
"Recently, the House passed strong legislation to strengthen the security & integrity of US elections. The SAFE Act provides funding to protect election infrastructure, requires paper ballots, and defends against foreign interference in domestic elections. https://debbiedingell.house.gov/news/documentsingle.aspx?DocumentID=1786 …",1146161748828987392,2019-07-02,21:00:30,repdebdingell,1,0,3,2019-07-02 21:00:30
"When I was sworn into Congress, I took an oath to defend our country from threats foreign and domestic. This is the time for everyone - Democrat and Republican to step up and protect the ballot-box.",1146161748011094023,2019-07-02,21:00:30,repdebdingell,1,0,3,2019-07-02 21:00:30
"The Mueller Report made it clear - Russia interfered in the 2016 elections, and still foreign actors are attempting to divide us and threaten voting. We can't ignore the evidence and must ensure this fundamental pillar of our democracy is sacred.",1146161747084152838,2019-07-02,21:00:29,repdebdingell,1,0,6,2019-07-02 21:00:29
"Welcome everyone to a conversation on election security! By signing the Declaration of Independence, our Founders asserted self-government free from foreign influence and interference. 243 years later - it's on us to deliver that promise. #AskDebbieDingell pic.twitter.com/qX0fcDAlna",1146161745377075200,2019-07-02,21:00:29,repdebdingell,2,1,11,2019-07-02 21:00:29
HAPPENING SOON: I will be hosting a Twitter townhall on election security at 5:00PM ET. Follow along to hear about work in Congress to keep the ballot box safe! #AskDebbieDingell. pic.twitter.com/lRWjmXPZtm,1146144186053398530,2019-07-02,19:50:42,repdebdingell,0,2,7,2019-07-02 19:50:42
"Game on for the women! Go @USWNT!

We are all cheering for you! https://twitter.com/USWNT/status/1145904931431301120 …",1146127436406579205,2019-07-02,18:44:09,repdebdingell,1,4,27,2019-07-02 18:44:09
"John Dingell said the single most important vote he took was for the 1964 Civil Rights Act. Fifty-five years later we still have work to do towards ensuring every American is free from discrimination. As we approach John’s birthday next week, memories like this are tough. pic.twitter.com/VjD1CcwSb9",1146074836877357056,2019-07-02,15:15:08,repdebdingell,10,36,182,2019-07-02 15:15:08
"One of the best parts about this job is all the fun, young people I get to meet! It was so much fun attending Dearborn’s annual Teddy Bear Picnic. pic.twitter.com/pesOBo18HE",1146060309238407169,2019-07-02,14:17:25,repdebdingell,2,3,42,2019-07-02 14:17:25
"On July 1, 1966, Medicare began. John Dingell Sr introduced the first version of Medicare in 1943. John Dingell Jr stood with LBJ and never gave up the promise that every American deserves quality, affordable healthcare. I think of him a lot as we continue that fight today. pic.twitter.com/jPkdNGYddc",1145879306515746816,2019-07-02,02:18:10,repdebdingell,11,40,188,2019-07-02 02:18:10
"Curious about legislation Congress has passed to make our voting systems safer? Reply with your questions or tweet them using #AskDebbieDingell.

Can’t wait to answer your questions tomorrow! pic.twitter.com/VBeG83S3Cb",1145780522758619137,2019-07-01,19:45:38,repdebdingell,3,3,11,2019-07-01 19:45:38
Asian Carp have the potential to devastate the waters we all love and depend on. Members of the Great Lakes States are united—we cannot let a single carp enter the Great Lakes. pic.twitter.com/ZieRrzqrD9,1145751668711141378,2019-07-01,17:50:59,repdebdingell,1,8,38,2019-07-01 17:50:59
Preventing Asian Carp from entering the Great Lakes is one of our top priorities. That’s why our delegation visited the Brandon Road Lock and Dam—a chokepoint for stopping this invasive species that we all worked hard to ensure has proper funding. pic.twitter.com/gkhECrC3ja,1145751666534375427,2019-07-01,17:50:58,repdebdingell,1,13,58,2019-07-01 17:50:58
"Normalizing relations with a dictator and negotiating with a dictator are two very different things. We should never get in the way of peace, but  Kim Jong-Un is a tyrant – that is something we can’t forget.

American actions cannot legitimize North Korea as a nuclear state.",1145723769706754048,2019-07-01,16:00:07,repdebdingell,11,17,77,2019-07-01 16:00:07
2018 was a memorable year. Representing Southeast Michigan in Congress and being a part of our community was my greatest honor. Here’s to more and better in 2019! pic.twitter.com/WHzckHfXO0,1079830990456086528,2018-12-31,20:05:45,repdebdingell,9,8,44,2018-12-31 20:05:45
Tune into @CNNSotu Sunday 12/30 at 9 am E. pic.twitter.com/I7bxIbYYbC,1079059950624751618,2018-12-29,17:01:54,repdebdingell,3,4,10,2018-12-29 17:01:54
"We need bold, new ideas to create a pathway to a clean energy future and create new, good-paying jobs at the same time. #ActOnClimate",1078702405741625346,2018-12-28,17:21:09,repdebdingell,5,2,16,2018-12-28 17:21:09
Action on climate change will be a top priority for the House in 2019. My friend and colleague @USRepKCastor is the strong leader we need to chair the Select Committee on the Climate Crisis. https://twitter.com/USRepKCastor/status/1078690800266104832 …,1078702404844077056,2018-12-28,17:21:09,repdebdingell,3,4,47,2018-12-28 17:21:09
"If you are in need of assistance please:
-call my Dearborn Office at 313-278-2936
-call my Ypsilanti Office at 734-481-1100
-or visit http://DebbieDingell.House.gov ",1078377614010650631,2018-12-27,19:50:33,repdebdingell,10,7,17,2018-12-27 19:50:33
"My office remains open for residents of the Twelfth Congressional District who need assistance with federal agencies, including Social Security, Medicare, veterans’ benefits, and others. pic.twitter.com/0COwRl0ftu",1078377612630810625,2018-12-27,19:50:32,repdebdingell,144,47,120,2018-12-27 19:50:32
It’s disrespectful to the service and time federal employees devote to our country. Time has come for us reopen the government and leave debate  for border security to regular order.,1078377142411505665,2018-12-27,19:48:40,repdebdingell,8,6,30,2018-12-27 19:48:40
"Using hundreds of thousands of federal workers – including members of the @USCG working on the Great Lakes, and @TSA  & @CBP agents keeping  airports, borders safe – as pawns is no way to run the government.",1078377141346189314,2018-12-27,19:48:40,repdebdingell,2,4,26,2018-12-27 19:48:40
"Every single Democrat agrees keeping our nation secure is our number one  priority. Let’s debate in Congress, on the floor and in committee, the best ways to keep our borders secure.",1078377140679266309,2018-12-27,19:48:40,repdebdingell,3,3,13,2018-12-27 19:48:40
"As this unnecessary shutdown continues, the President needs to show leadership by reopening the government.",1078377140175933440,2018-12-27,19:48:40,repdebdingell,9,13,75,2018-12-27 19:48:40
Merry Christmas and happy holidays to everyone celebrating! John and I send best wishes for a joyful day spent with loved ones.,1077353730817744897,2018-12-25,00:02:00,repdebdingell,14,5,137,2018-12-25 00:02:00
"The American people expect their government to work for them and listen.  It’s the holiday season, we should be showing America our better selves not driving the nation into a pointless shutdown.",1076297189025026048,2018-12-22,02:03:41,repdebdingell,61,1,48,2018-12-22 02:03:41
A government shutdown is unacceptable. It’s a lack of leadership from President Trump and Republican Congressional Leaders.,1076297188337217536,2018-12-22,02:03:40,repdebdingell,53,18,136,2018-12-22 02:03:40
"A wall is a symbol of division and hatred. We can all agree we need to keep our nation secure, but we must look at innovative technologies and border security — not a wall.",1075918225496555520,2018-12-21,00:57:49,repdebdingell,84,13,144,2018-12-21 00:57:49
"It’s the most wonderful time of the year
There is more that unites us
Than which divides us
When we hold others dear
It’s the most blunderful time
Yes, the most maddening time
But the most wonderful time
Of the year",1075792738480807937,2018-12-20,16:39:10,repdebdingell,10,0,15,2018-12-20 16:39:10
"There’s a new Speaker hosting
The Blue Wave is growing
And some decency back in DC
There’ll be compromise needed
And working together
To get the bipartisanship of long, long agooooo",1075792737771888641,2018-12-20,16:39:10,repdebdingell,4,1,14,2018-12-20 16:39:10
"It’s the most ridiculous time, of the year
There’ll be many late-night meetings 
And covfefe flowing
When Individual 1’s shutdown draws near
It’s the most ridiculous time of the year",1075792737021108226,2018-12-20,16:39:10,repdebdingell,3,1,7,2018-12-20 16:39:10
"There’ll be tax cuts not working
Healthcare for fixing
And potholes still covered in snow
There’ll be scary false stories
And tales of the glories of
Infrastructure bills of long, long ago",1075792736220012550,2018-12-20,16:39:10,repdebdingell,6,0,6,2018-12-20 16:39:10
"It’s the mad-maddest season of all
With 4am tweeting and oval office meetings
And not getting his wallll
It’s the mad-maddest season of all pic.twitter.com/5QXqNqOoRE",1075792734642954240,2018-12-20,16:39:09,repdebdingell,4,0,6,2018-12-20 16:39:09
"It’s the most blunderful time of year
With the President yelling 
And surrogates saying… 
it’s fine do not fear
it will be different next yearrrr
there’s nothing to fearrrr
It’s the most blunderful time of the year pic.twitter.com/KPrfe0ShDa",1075792733355290629,2018-12-20,16:39:09,repdebdingell,6,0,10,2018-12-20 16:39:09
"Upholding @JohnDingell and my favorite holiday tradition, here is the 2018 #DingellJingle set to the tune of ""It's the Most Wonderful Time of the Year.""",1075792732642250752,2018-12-20,16:39:09,repdebdingell,4,7,47,2018-12-20 16:39:09
We cannot grow numb to Facebook’s continued violations of user’s privacy. This @NYTimes report is another signal that Congress must enact legislation to protect Americans’ sensitive information. https://twitter.com/nytimes/status/1075211218137296896 …,1075490918327816192,2018-12-19,20:39:51,repdebdingell,1,10,39,2018-12-19 20:39:51
Banning bump stocks is a meaningful first step to keeping our communities safe. Let’s continue working together to pass commonsense gun safety laws and save lives.,1075439891394256896,2018-12-19,17:17:05,repdebdingell,10,13,140,2018-12-19 17:17:05
Grateful to @HRWC for bringing us together & to all the officials that answered questions & shared updates on PFAS with community members. This is the first of many public conversations & when Congress returns in January I’ll introduce new legislation to address the PFAS crisis. pic.twitter.com/I5w78T6qhD,1075232759835213825,2018-12-19,03:34:01,repdebdingell,1,6,17,2018-12-19 03:34:01
Today’s MDEQ report highlights the need for EPA to set one national protective standard for the entire class of PFAS chemicals.,1075232031301341185,2018-12-19,03:31:07,repdebdingell,1,2,14,2018-12-19 03:31:07
"Many in our community have questions about PFAS and its presence in our waters. Michigan has been hit hard, and this chemical is a threat to human health and our environment wherever it is found, whether in drinking water, air, food, or consumer products.",1075231829458911232,2018-12-19,03:30:19,repdebdingell,3,13,19,2018-12-19 03:30:19
Action on #climatechange can't wait and the Trump Administration has set us back decades. We need bold ideas. Excited to discuss a Green New Deal and looking forward to working on @EnergyCommerce to pass meaningful climate legislation.,1075071829302304768,2018-12-18,16:54:32,repdebdingell,50,8,42,2018-12-18 16:54:32
TONIGHT: Join local officials to discuss the health of the Huron River and the effects of #PFAS. Details below. pic.twitter.com/shtZmzOZIv,1075069669495721991,2018-12-18,16:45:57,repdebdingell,0,8,7,2018-12-18 16:45:57
"Congress has a duty to serve our nation's veterans as well as they've served us. The House passed a bill to assist Vietnam veterans exposed to Agent Orange unanimously in June, and it's time for our colleagues in the Senate to do the same. https://www.rollcall.com/news/politics/budget-scuffle-stalls-blue-water-benefits-for-vietnam-vets …",1074730217028108289,2018-12-17,18:17:05,repdebdingell,1,9,16,2018-12-17 18:17:05
Consumers should have peace of mind that the products they use are safe. That's why I wrote legislation to do just that. These reports are concerning and deserve answers. https://twitter.com/Reuters/status/1073641269036019712 …,1073687167287902208,2018-12-14,21:12:23,repdebdingell,2,8,11,2018-12-14 21:12:23
We cannot let the lives of very real people – innocent children – get lost in immigration debates. The death of a 7 year old girl in the custody of US Customs and Border Patrol is a tragedy. Anything less than compassion and dignity for those seeking a better life is un-American. https://twitter.com/NBCNews/status/1073529546182406144 …,1073680124036435968,2018-12-14,20:44:24,repdebdingell,15,10,45,2018-12-14 20:44:24
"6 years ago, 20 first-graders and 6 school staffers were senselessly killed at #SandyHook. 
 
Congress must act to prevent gun violence and fight to ensure that parents no longer fear that their child won’t come home from school. It's past time to act and save lives.",1073658133220900864,2018-12-14,19:17:01,repdebdingell,2,20,53,2018-12-14 19:17:01
