tweet,id,date,time,username,replies_count,retweets_count,likes_count,tdatetime
John Conyers spent his life championing those causes. The fights John Conyers fought will be remembered for generations. I am deeply saddened by his passing. May God bring his family comfort during this difficult time.,1188557433804906497,2019-10-27,20:45:49,repdebdingell,9,24,100,2019-10-27 20:45:49
"John Conyers was a civil rights champion who served Michigan and the people of Detroit for decades. He began his career working for John Dingell, before running for Congress himself and they both believed in justice and equality for all.",1188557430768181248,2019-10-27,20:45:48,repdebdingell,14,58,207,2019-10-27 20:45:48
Happy #Diwali to all those who celebrate! May we always bring light wherever we go. pic.twitter.com/GpBdIoIoJp,1188450860252176384,2019-10-27,13:42:20,repdebdingell,9,10,56,2019-10-27 13:42:20
Relieved to hear that the strike is ending and I respect the UAW’s decision to ratify this new contract with GM. Now the best workers in the world will soon be back on the job. America succeeds when our workers succeed.,1187864654325932032,2019-10-25,22:52:57,repdebdingell,5,7,76,2019-10-25 22:52:57
"Tomorrow is Drug Take Back Day!

Do you have unused or expired medications at home? Help fight the opioid epidemic by properly disposing of prescription drugs that are no longer needed or expired.

Follow the link to find a location near you:  https://bit.ly/2phBjWz  pic.twitter.com/lzPG6CSVAy",1187779439997997057,2019-10-25,17:14:21,repdebdingell,2,1,9,2019-10-25 17:14:21
"Fighting to lower the cost of prescription drugs.

Defending our national security and democracy.

Working to reduce carbon emissions.

The Democrats are hard at work #ForThePeople.",1187746192517718019,2019-10-25,15:02:14,repdebdingell,4,10,31,2019-10-25 15:02:14
A cut to food assistance programs threatens the health and security of Michiganders and millions of Americans. https://www.mlive.com/news/ann-arbor/2019/10/rep-dingell-cites-washtenaw-county-in-rebuke-of-plan-to-slash-to-federal-food-aid.html …,1187733970961752067,2019-10-25,14:13:40,repdebdingell,2,2,17,2019-10-25 14:13:40
"As a businessman, Roger helped save Detroit during the recession. As an entrepreneur, he built one of the most successful racing teams and businesses. And as an American, he embodies greatness.

I’m proud to call Roger a friend. John would be proud to see him receive this honor. https://twitter.com/freep/status/1187497769621229569 …",1187515124464136197,2019-10-24,23:44:03,repdebdingell,5,6,29,2019-10-24 23:44:03
"I will always work on privacy protection issues. Too many apps have endless access to our personal data.

How are Google and Amazon preventing apps like these from obtaining our personal info?

Are others using similar applications?

We need the answers. https://debbiedingell.house.gov/news/documentsingle.aspx?DocumentID=1966 …",1187453590874574849,2019-10-24,19:39:32,repdebdingell,3,5,23,2019-10-24 19:39:32
"These stories are concerning. So concerning, I sent a letter to Amazon and Google demanding answers. 

These applications were created for research purposes only, but how do we ensure there isn’t a path for malicious actors to follow suit. https://arstechnica.com/information-technology/2019/10/alexa-and-google-home-abused-to-eavesdrop-and-phish-passwords/ …",1187453589876289537,2019-10-24,19:39:32,repdebdingell,1,5,17,2019-10-24 19:39:32
"The Trump Administration’s proposed cuts to SNAP add to the hunger and fear.

This is where the rubber hits the road. https://www.mlive.com/news/ann-arbor/2019/10/42-of-washtenaw-countys-hungry-didnt-qualify-for-federal-help.html …",1187373241607868417,2019-10-24,14:20:15,repdebdingell,4,11,31,2019-10-24 14:20:15
This type of reporting is exactly why the House just passed the #SHIELDAct. We must always do all we can to protect our elections from foreign threats. https://www.washingtonpost.com/national-security/trump-told-russian-officials-in-2017-he-wasnt-concerned-about-moscows-interference-in-us-election/2019/09/27/b20a8bc8-e159-11e9-b199-f638bf2c340f_story.html …,1187135151412789248,2019-10-23,22:34:10,repdebdingell,3,14,40,2019-10-23 22:34:10
"Bipartisanship is real. Alongside @RepDonYoung, we just introduced a bill that will fund the National Fish and Wildlife Foundation through 2024. This will help ensure Michigan’s and the nation’s iconic species and environment are protected well into the future.",1187039731223334913,2019-10-23,16:15:00,repdebdingell,1,4,18,2019-10-23 16:15:00
There goes President Trump’s rooting out corruption argument. https://twitter.com/damianpaletta/status/1187004420283871232 …,1187017443471966213,2019-10-23,14:46:26,repdebdingell,0,8,45,2019-10-23 14:46:26
Our job as elected officials is to protect the Constitution and our democracy. Democrat and Republican alike. pic.twitter.com/Smn2eCsNQr,1186994705613152257,2019-10-23,13:16:05,repdebdingell,8,15,72,2019-10-23 13:16:05
"I remember how all Republicans were against the impeachment of Nixon until the facts became such that the duty was country first. As Members of Congress we are always Americans first with the responsibility to protect our Constitution, our democracy and national security. pic.twitter.com/3w6Fd73L2O",1186748510798004226,2019-10-22,20:57:48,repdebdingell,12,24,111,2019-10-22 20:57:48
"Meaningful PFAS provisions were adopted in both the House and Senate NDAA bills. But we can’t, however, in good conscience support a defense authorization that fails to significantly address cleanup at ongoing and legacy PFAS contamination sites. https://debbiedingell.house.gov/news/documentsingle.aspx?DocumentID=1957 …",1186707046453989376,2019-10-22,18:13:02,repdebdingell,4,5,19,2019-10-22 18:13:02
"The phrase “school lunch debt” should not be a thing. This man’s kindness is incredible to see, but it shouldn’t take a good Samaritan to help these children in need. https://www.cnn.com/2019/10/14/us/man-pays-off-school-debt-trnd/index.html …",1186683883192016896,2019-10-22,16:40:59,repdebdingell,2,5,64,2019-10-22 16:40:59
The question is simple. Is it acceptable for a president to pressure a foreign government to undermine our elections for his political gain?,1186644258314506240,2019-10-22,14:03:32,repdebdingell,36,33,148,2019-10-22 14:03:32
Does anyone have a copy of the Constitution for him? https://twitter.com/kylegriffin1/status/1186340167193366529 …,1186370331344281600,2019-10-21,19:55:03,repdebdingell,68,94,431,2019-10-21 19:55:03
"Nearly 4.5 million women have reported being threatened with a gun.

If it wasn’t clear before, it must be now. The Senate must reauthorize the Violence Against Women Act. The connection between gun violence and domestic violence is too strong for anything less. https://twitter.com/Everytown/status/1184841693499199488 …",1186292251883950080,2019-10-21,14:44:47,repdebdingell,33,264,752,2019-10-21 14:44:47
90 years ago Greenfield Village had a day like no other and opened The Henry Ford. Since that day Greenfield Village has shined bright and served as a living reminder that anything is possible. http://www.pressandguide.com/news/greenfield-village-to-mark-th-anniversary-oct/article_feb67826-f0f2-11e9-9344-a3a82528d0fc.html …,1186286918029455360,2019-10-21,14:23:36,repdebdingell,3,3,30,2019-10-21 14:23:36
"Just like 2018, Pennsylvania will be going blue this weekend #GoBlue #BeatPennState https://twitter.com/UMichFootball/status/1185529780227194880 …",1185583721409368065,2019-10-19,15:49:20,repdebdingell,0,1,35,2019-10-19 15:49:20
"The House has passed bills that will lower the cost of prescription drugs and raise wages #ForThePeople.

It’s time for Senate obstruction to end. pic.twitter.com/Xwv2CLqDra",1185256483455459329,2019-10-18,18:09:01,repdebdingell,14,14,46,2019-10-18 18:09:01
$345 billion. That money could help start a business or build a home. It means seniors don’t need to cut pills in half to eat. https://www.cnbc.com/2019/10/14/nancy-pelosis-drug-pricing-plan-would-save-medicare-345-billion-cbo.html …,1185232510483075072,2019-10-18,16:33:45,repdebdingell,2,26,62,2019-10-18 16:33:45
"For many women, access to early tests and screenings can mean life and death. For #NationalMammographyDay we must commit to spreading the word that early detection is the best defense against breast cancer. Schedule your annual mammogram today.",1185225263891832833,2019-10-18,16:04:57,repdebdingell,1,8,28,2019-10-18 16:04:57
"The facts are stunning. We pay 3 to 4 times the average amount of other industrialized countries for prescription drugs. 

The reason for this is simple. Other countries negotiate drug prices. We don’t.",1184982422988845057,2019-10-18,00:00:00,repdebdingell,4,12,81,2019-10-18 00:00:00
"There’s 3 billion fewer birds than there were 50 years ago. 

The monarch butterfly population is declining.

The Trump Administration is rolling back the Endangered Species Act.

These reasons alone are why we need the Recovering America’s Wildlife Act.",1184920304012988417,2019-10-17,19:53:09,repdebdingell,5,43,114,2019-10-17 19:53:09
This is what happens when you tell lie after lie. The truth will eventually be exposed. https://twitter.com/washingtonpost/status/1184893783827275778 …,1184900440565190662,2019-10-17,18:34:14,repdebdingell,1,9,37,2019-10-17 18:34:14
"Today is the 47th anniversary of the Clean Water Act, a bill John introduced and got passed after the Rouge River fire. I’m fighting hard to protect it from dangerous roll backs, but we all need to do our part to keep our water clean & update water infrastructure in our country. pic.twitter.com/BfOtNYPiSh",1184895791174946818,2019-10-17,18:15:45,repdebdingell,2,9,33,2019-10-17 18:15:45
Today’s the day! The Recovering America’s Wildlife Act will have it’s first hearing of this Congress. This bipartisan legislation will help protect the wildlife that is dying and becoming extinct. #RecoverWildlife pic.twitter.com/DzUsglT3sn,1184885101596938240,2019-10-17,17:33:16,repdebdingell,0,20,45,2019-10-17 17:33:16
I’ve sat in pharmacies and I’ve sat in hospitals. I’ve heard story after story. Drug prices are too high. pic.twitter.com/mBOBdcmdi5,1184861952977309697,2019-10-17,16:01:17,repdebdingell,9,23,82,2019-10-17 16:01:17
"When drug prices are negotiated, the costs will drop for hardworking men and women. Every other industrialized nation in the world does this. It’s time for us to put hardworking men and women first and do what’s best for them. #lowerDrugCosts",1184842630674505729,2019-10-17,14:44:31,repdebdingell,7,9,40,2019-10-17 14:44:31
"The Federal Government has no power to negotiate the costs of prescription drugs. Too many people cannot afford their insulin, high blood pressure medication, and inhaler. That must change.",1184822258516279301,2019-10-17,13:23:34,repdebdingell,4,1,37,2019-10-17 13:23:34
"Deeply saddened to learn another great has passed. Elijah Cummings & John were great friends & colleagues who never stopped fighting for the American people, truth & honesty, & what is right. Our country is better because of Cummings work, & it’s up to us all to take up the work.",1184812427902439424,2019-10-17,12:44:30,repdebdingell,1,23,220,2019-10-17 12:44:30
"#MadamSpeaker is not afraid to stand up for what’s right. 

We stand with @SpeakerPelosi. pic.twitter.com/gDnu2klUDW",1184621030414962688,2019-10-17,00:03:57,repdebdingell,30,126,919,2019-10-17 00:03:57
"At the funeral for the Abbas family, the children’s classmates asked me why someone hadn’t done something to prevent their deaths. The technology exists to prevent drunk driving. The time is now. We must act to prevent more innocent deaths on the roads because of drunk driving. pic.twitter.com/rAsrilIoOL",1184605959898972160,2019-10-16,23:04:04,repdebdingell,1,3,22,2019-10-16 23:04:04
"Today was more tears. My friends, the Abbas family from Michigan, joined Senators Udall and Scott as they introduced drunk driving legislation in the Senate. Our work must be bicameral and bipartisan. pic.twitter.com/Oto8BUrvfI",1184605950793138182,2019-10-16,23:04:02,repdebdingell,4,4,34,2019-10-16 23:04:02
"U.S. troops and the Kurds stood together in the fight to defeat ISIS. The Administration’s decision to pull select U.S. forces out of Syria is betrayal of our allies and undermines American legitimacy in the region. We need real strategy, not half-baked measures. https://twitter.com/NBCNews/status/1184549431569461248 …",1184584646891376641,2019-10-16,21:39:22,repdebdingell,5,15,66,2019-10-16 21:39:22
This is why we need the Recovering America’s Wildlife Act. 3 billion fewer birds than there were 50 years ago is terrifying. https://www.nytimes.com/2019/09/19/science/bird-populations-america-canada.html …,1184559876896415744,2019-10-16,20:00:57,repdebdingell,7,37,97,2019-10-16 20:00:57
"The fires in Lebanon have caused irreparable damage to Lebanon’s nature as well as its residents, including American citizens who reside in Lebanon. When your friend’s house is on fire you do all you can to help. That is the current situation we’re facing. https://debbiedingell.house.gov/news/documentsingle.aspx?DocumentID=1950 …",1184532546513784834,2019-10-16,18:12:21,repdebdingell,3,6,11,2019-10-16 18:12:21
"From vapes to cigarettes and cigars, all tobacco products must be treated the same. A whole new generation is getting hooked on tobacco because e-cigarettes come in flavors like mint and mango. We must address this before it’s too late.",1184525961687195649,2019-10-16,17:46:11,repdebdingell,6,2,26,2019-10-16 17:46:11
When did the Department of Defense first know about PFAS contamination and for how long? These are the questions that must be answered. https://www.washingtonpost.com/news/powerpost/paloma/the-energy-202/2019/10/15/the-energy-202-pentagon-watchdog-agency-to-examine-military-s-use-of-toxic-forever-chemicals/5da4b68d88e0fa3155a710de/ …,1184475455199555593,2019-10-16,14:25:29,repdebdingell,2,4,15,2019-10-16 14:25:29
No longer can hardworking men and women choose between taking their prescriptions or buying groceries. We need action now.,1184249139648962560,2019-10-15,23:26:11,repdebdingell,4,9,96,2019-10-15 23:26:11
No one is above the rule of law. https://abcnews.go.com/Politics/giukiani-comply-congressional-subpoena/story?id=66293635 …,1184217462587482112,2019-10-15,21:20:19,repdebdingell,10,8,72,2019-10-15 21:20:19
"Two years ago #MeToo changed us. It's become part of our national consciousness, demanding better for survivors and future generations. We can't let the words ring hollow. We must press forward for lasting change - a culture that believes and respects survivors.",1184215077953691648,2019-10-15,21:10:50,repdebdingell,4,5,33,2019-10-15 21:10:50
"Why can the military negotiate the cost of arms sales, but Medicare can’t negotiate the cost of prescription drugs?

We must change that so we can lower costs for hardworking men and women.",1184200881748762624,2019-10-15,20:14:26,repdebdingell,6,10,153,2019-10-15 20:14:26
Our higher education system is broken. National student debt has reached over $1.5 trillion and continues to rise. We need real change that supports students and student loan borrowers repaying their loans. https://www.washingtonpost.com/local/education/house-democrats-unveil-higher-education-plan-to-lower-college-costs/2019/10/14/9c8aedb6-eed2-11e9-89eb-ec56cd414732_story.html …,1184105392088977408,2019-10-15,13:54:59,repdebdingell,9,6,23,2019-10-15 13:54:59
It’s game day! Best of luck to @CoachJim4UM and our boys in blue as they take on Illinois today!  #GoBlue #GameDay,1183029801545850880,2019-10-12,14:40:58,repdebdingell,12,3,19,2019-10-12 14:40:58
On #NationalComingOutDay Day we celebrate the bravery of the LGBT community and renew our pledge to ensure everyone is free to be their authentic self and love who they love.,1182703529791819781,2019-10-11,17:04:29,repdebdingell,4,4,42,2019-10-11 17:04:29
"Thank you @NitaLowey for your service to US and being a mentor to all of us. Sad to miss seeing you in Congress, but grateful for lifetime of friendship.",1182345940960763904,2019-10-10,17:23:33,repdebdingell,3,3,17,2019-10-10 17:23:33
Being able to go on the Rouge River shows what happens when we are serious about cleaning up our water. We cannot go back to the days of rivers catching on fire. We must keep cleaning it up and protect our waters from new environmental hazards. pic.twitter.com/rqHY2Wev9c,1181673588765708288,2019-10-08,20:51:52,repdebdingell,27,61,391,2019-10-08 20:51:52
The Rouge River fire was a turning point in our nation. Our leaders rolled up their sleeves and worked hard to pass legislation to reverse decades of contamination. The Trump Admin must stop undermining the decades of progress. https://www.freep.com/story/news/local/michigan/2019/10/07/rouge-river-pollution-fire-zug-island-donald-trump/2347260001/ …,1181656524931907586,2019-10-08,19:44:04,repdebdingell,3,13,34,2019-10-08 19:44:04
THIS is why the Senate MUST reauthorize the Violence Against Women Act. https://www.huffpost.com/entry/domestic-violence-murders-rising_n_5cae0d92e4b03ab9f24f2e6d …,1181598948634644481,2019-10-08,15:55:17,repdebdingell,9,25,67,2019-10-08 15:55:17
"I miss John, he never stopped fighting for this. With this refuge, future generations will learn the importance of the outdoors and preserving our natural resources.",1181290742091845633,2019-10-07,19:30:34,repdebdingell,6,1,46,2019-10-07 19:30:34
"I am pleased to confirm that Secretary of Interior will join me Saturday, May 9th 2020 for a ribbon cutting to formally open the Detroit Wildlife Refuge. Thank you to every single person who had made this a reality. https://debbiedingell.house.gov/news/documentsingle.aspx?DocumentID=1934 …",1181290741236154368,2019-10-07,19:30:34,repdebdingell,8,9,57,2019-10-07 19:30:34
"These are the facts:

-Every new year becomes “the hottest year on record”

-800 million people are vulnerable to climate change

-Ice in the arctic is near an all-time low

We need absolute urgency to address this crisis.",1181271343167365121,2019-10-07,18:13:29,repdebdingell,45,48,263,2019-10-07 18:13:29
Status of House passed legislation. Isn’t it time for Senate action? pic.twitter.com/dl43ezrtuM,1181182865394032640,2019-10-07,12:21:55,repdebdingell,56,41,116,2019-10-07 12:21:55
"Michigan’s manufacturing story is about innovation - whether it's building cars or developing next-generation technology. As we celebrate National Manufacturing Day, we cannot forget the hardworking men and women of Michigan who’ve helped build this country from the bottom up. pic.twitter.com/Sp6T0rRNTR",1180150663789125633,2019-10-04,16:00:19,repdebdingell,16,3,14,2019-10-04 16:00:19
"Pushing seniors to Medicare Advantage plans will put profit before care. If Trump's serious about healthcare, he must work with us to strengthen the current system. But him touting falsehoods about Democrats' efforts to provide quality, affordable healthcare will do nothing.",1179872446104637441,2019-10-03,21:34:46,repdebdingell,23,16,78,2019-10-03 21:34:46
Does he still not get it? https://twitter.com/ryanstruyk/status/1179775190827503617 …,1179800313831858183,2019-10-03,16:48:09,repdebdingell,31,12,91,2019-10-03 16:48:09
Reading to young people about the Monarch Butterfly 🦋. No better way to chase the blues away on a rainy morning. The kids know a lot about protecting nature. pic.twitter.com/9eu7PSv1cF,1179777525410619394,2019-10-03,15:17:35,repdebdingell,9,3,65,2019-10-03 15:17:35
"A year ago today, Jamal Khashoggi entered the Saudi consulate and was never seen again. The Admin's failure to hold Saudi Arabia accountable is a failure of their moral compass. Human rights and freedom of expression must always be a priority for the United States of America.",1179497508038414336,2019-10-02,20:44:54,repdebdingell,11,35,119,2019-10-02 20:44:54
"All the UAW workers want is a fair shake and a level playing field. They’re hardworking men and women who’ve earned the right to fair wages, healthcare, and decent benefits. pic.twitter.com/BdTbU9GWXR",1179483016181231619,2019-10-02,19:47:19,repdebdingell,33,22,100,2019-10-02 19:47:19
Where is the humanity? These are humans fleeing the most dangerous and unimaginable living conditions. https://www.nytimes.com/2019/10/01/us/politics/trump-border-wars.html …,1179412782900551680,2019-10-02,15:08:14,repdebdingell,16,16,57,2019-10-02 15:08:14
When women succeed our country succeeds! https://www.detroitnews.com/story/business/2019/09/25/michigan-and-detroit-tops-growth-women-owned-business/2439842001/ …,1179405426045181955,2019-10-02,14:39:00,repdebdingell,11,11,55,2019-10-02 14:39:00
"Two years ago we witnessed the deadliest mass shooting in American history. 58 lives were taken in ten minutes.

Since then the House has passed gun reform that’s waiting in the Senate. We need real reform. When will enough be enough?",1179090415917654016,2019-10-01,17:47:16,repdebdingell,8,22,90,2019-10-01 17:47:16
"People are asking questions. They’re concerned when they hear our national security is in danger. 

We must proceed with the seriousness that this moment in history demands. The rule of law cannot be brushed aside. Not even for the President. pic.twitter.com/rliFhK1yrp",1179073603423391745,2019-10-01,16:40:27,repdebdingell,46,19,147,2019-10-01 16:40:27
"I’ve seen all sides of the opioid crisis. The desperation for help and the stigma of mental health. This isn’t easy for any of us to talk about, but it’s something we must discuss so we can stop the opioid crisis and help those who are suffering. pic.twitter.com/3TpSfQ0sEn",1179051727552733186,2019-10-01,15:13:32,repdebdingell,7,3,21,2019-10-01 15:13:32
The rule of law would say otherwise. https://twitter.com/mkraju/status/1178741187995488265 …,1178851276861431810,2019-10-01,01:57:01,repdebdingell,10,17,124,2019-10-01 01:57:01
We can build EVs here in the United States and we must.  Manufacturing is the backbone of our economy. Thank you @BGAlliance for bringing us together for a discussion on keeping the future of electric vehicles right here in the USA. pic.twitter.com/qdS6uRXDhZ,1100822822195216385,2019-02-27,18:19:47,repdebdingell,17,21,65,2019-02-27 18:19:47
"#MedicareforAll is the beginning of a national conversation about how to improve healthcare in the United States. 

Tune in to watch the introduction:  https://www.facebook.com/639796166125261/posts/1894845887286943?sfns=mo …",1100792625974730752,2019-02-27,16:19:48,repdebdingell,39,6,40,2019-02-27 16:19:48
"We can’t wait to #ActonClimate. We need bold ideas. We need to think outside the box. Our economy, our environment, and our future are at stake.",1100496595211173889,2019-02-26,20:43:29,repdebdingell,28,12,115,2019-02-26 20:43:29
"Joined @CNN's @KateBolduan today to speak about the importance of protecting our Constitution, our democracy and its system of checks and balances. Also had real conversation about easing into my “new normal."" pic.twitter.com/DQSUlMbibK",1100469072200904705,2019-02-26,18:54:07,repdebdingell,37,32,201,2019-02-26 18:54:07
Thank you @jfederations for having me. Your advocacy is vital to helping us make sure people are able to receive and afford care in the setting that is best for them. #JDAD2019 pic.twitter.com/rcsogzX99E,1100462429371289600,2019-02-26,18:27:43,repdebdingell,3,5,27,2019-02-26 18:27:43
Our workers do make the best product in the world and I thank @FiatChrysler_NA for their confidence in them.,1100445952282894336,2019-02-26,17:22:14,repdebdingell,0,5,28,2019-02-26 17:22:14
Hard-working men and women in Michigan are ready to fill these jobs and keep America as a leader in this extremely competitive global marketplace. We can’t get ahead by building in another country and importing back.,1100445950466772993,2019-02-26,17:22:14,repdebdingell,5,3,23,2019-02-26 17:22:14
Great news for Michigan from @FiatChrysler_NA today. I want to thank them to their commitment to production in the US. Their investment decisions are an important part of keeping this country at the forefront of innovation and technology in transportation and mobility. https://twitter.com/FiatChrysler_NA/status/1100433699877933062 …,1100445947316842496,2019-02-26,17:22:13,repdebdingell,6,14,56,2019-02-26 17:22:13
The Trump Administration owes Congress answers -- we need to know how many families were separated and their plan to reunify every child with their loved ones. #EndFamilySeparation https://www.cnn.com/2019/02/25/politics/family-separation-preview/index.html …,1100435912536801281,2019-02-26,16:42:21,repdebdingell,19,6,48,2019-02-26 16:42:21
Our forefathers wrote a strong system of checks and balances between branches of government to protect our democracy.,1100163900304228354,2019-02-25,22:41:28,repdebdingell,13,15,87,2019-02-25 22:41:28
I joined my colleague @JoaquinCastrotx in introducing a bill to terminate this action which violates the Congress’ exclusive power of the purse. I will vote to support the bill and against this overreach.,1100163899712827393,2019-02-25,22:41:28,repdebdingell,5,8,84,2019-02-25 22:41:28
Back at work and we will have a critical vote in the House. The President is challenging our Constitution and his authority with this national emergency declaration. https://twitter.com/SpeakerPelosi/status/1100154639318695936 …,1100163898601283584,2019-02-25,22:41:28,repdebdingell,14,26,155,2019-02-25 22:41:28
Ps. He will be cheering #GOBLUE this afternoon.....sure hope we win. He loved our team.,1099670326999478272,2019-02-24,14:00:11,repdebdingell,6,16,228,2019-02-24 14:00:11
