tweet,id,date,time,username,replies_count,retweets_count,likes_count,tdatetime
Wishing good luck to our boys in blue as they take on the Buckeyes today! Always one of the best days of the year.  We’re all rooting for a win today! #TheGame #GoBlue,1200816470864941056,2019-11-30,16:38:51,repdebdingell,3,2,24,2019-11-30 16:38:51
Small businesses are woven into the fabric Southeast Michigan. Hard-working men and women put love and heart into making their dreams come true while supporting our local economy. #ShopSmall,1200785302429863937,2019-11-30,14:35:00,repdebdingell,13,3,40,2019-11-30 14:35:00
Take a deep breath and hold on to all we treasure and value. Grateful for so many and so much. Happy Thanksgiving to all! pic.twitter.com/7csZpL2Upi,1200075877754654721,2019-11-28,15:36:00,repdebdingell,8,19,55,2019-11-28 15:36:00
My office will be meeting with @GovWhitmer's office and @MichiganEGLE to learn more about this specific incident. It is our collective duty to ensure the McLouth project is being carried out appropriately and protects public health and the surrounding environment at all time.,1199347480699252736,2019-11-26,15:21:36,repdebdingell,5,5,13,2019-11-26 15:21:36
Protecting air quality for communities is a top priority. This is now the second asbestos violation related to the demolition and abatement operations at the former McLouth Steel site. pic.twitter.com/AJvzTyYlpm,1199347477662449671,2019-11-26,15:21:36,repdebdingell,29,15,29,2019-11-26 15:21:36
Today’s International Day to Eliminate Violence Against Women. It’s a sad reminder that 1 in 3 women and girls experience physical or sexual violence in their lifetime. We must commit to end this epidemic. This issue impacts too many of us for there to be inaction. pic.twitter.com/79GvcqeA9u,1199013874697146369,2019-11-25,17:15:58,repdebdingell,4,23,48,2019-11-25 17:15:58
Our challenge is tough. Addressing it will require everyone at the table and working in the same direction. But it’s one we can meet with American might and ingenuity. https://www.freep.com/story/opinion/2019/11/24/zero-emissions-economy-2050-bill-can-take-us-closer/4264303002/ …,1198745899222126592,2019-11-24,23:31:08,repdebdingell,7,14,38,2019-11-24 23:31:08
"The U.N was clear. We must rapidly transition to a clean, net- zero emissions economy. That’s why today I introduced a bill that‘d ensure the United States meets that goal by 2050. With American ingenuity and might we can and we must make this happen. Our future depends on it. pic.twitter.com/1qDKdiKwKW",1197616600633036807,2019-11-21,20:43:42,repdebdingell,65,15,83,2019-11-21 20:43:42
"Dr. Hill is right. When our national security is questioned, our nation is further divided. 
 
Who benefits from this Scheme? Putin. pic.twitter.com/6KtDMLHPY1",1197552513588891648,2019-11-21,16:29:03,repdebdingell,34,41,172,2019-11-21 16:29:03
"Dr. Hill on Rudy Giuliani: ""He was clearly pushing forward issues and ideas that would come back to haunt us, and I believe that's where we are today."" #DefendOurDemocracy pic.twitter.com/YZcCj97px5",1197550454290419712,2019-11-21,16:20:52,repdebdingell,6,16,47,2019-11-21 16:20:52
"David Holmes: ""Senior officials were using the levers of our diplomatic power to induce the new Ukrainian President to announce the opening of a criminal investigation against President Trump’s political opponent."" 

#DefendOurDemocracy",1197542022938320898,2019-11-21,15:47:22,repdebdingell,13,26,81,2019-11-21 15:47:22
SAY IT LOUD FOR ALL TO HEAR. https://twitter.com/NatashaBertrand/status/1197519797170397185 …,1197530417529839619,2019-11-21,15:01:15,repdebdingell,4,41,157,2019-11-21 15:01:15
The American people have gotten to hear directly from the people closest to Trump’s pressure campaign and abuse of power. #DefendOurDemocracy https://twitter.com/washingtonpost/status/1197489669270843392 …,1197529441586561029,2019-11-21,14:57:22,repdebdingell,4,3,22,2019-11-21 14:57:22
It also included the work of many of my colleagues who share these concerns. The bill now advances to the House floor. And we are still working on more potential actions. We need to stop this contamination once and for all. These chemicals are too hazardous for inaction.,1197297384902025216,2019-11-20,23:35:15,repdebdingell,1,1,25,2019-11-20 23:35:15
"I made a promise to my constituents I would keep fighting for PFAS legislation that actually addresses cleaning up “the forever chemical” and calling it what it is -- a toxic chemical.

The Energy and Commerce Committee just passed the Dingell bill which addresses PFAS chemicals. pic.twitter.com/cl6omQm4vE",1197297162520088576,2019-11-20,23:34:22,repdebdingell,11,17,123,2019-11-20 23:34:22
"The idea of storing nuclear waste near the Great Lakes is plain wrong. Water and nuclear waste should never mix.

I will always work to keep our Great Lakes clean and stand up to anyone who gets in the way -- Whether it’s Canada or whoever. pic.twitter.com/UR3zsGHAsV",1197280943133929473,2019-11-20,22:29:55,repdebdingell,22,80,320,2019-11-20 22:29:55
"Deeply concerned @FCC backtracking on safety. Over 30,000 people die on our roads each year and this decision sets us back. https://twitter.com/detroitnews/status/1197221066730401792 …",1197264087983575045,2019-11-20,21:22:57,repdebdingell,1,10,9,2019-11-20 21:22:57
"Another a beautiful day with my @USProgressives colleagues! As Vice-Chair of this strong group, we are fighting for quality, affordable healthcare, strengthening education that is accessible and affordable, and strong trade deals that help hardworking men and women. pic.twitter.com/8nME74PNaq",1197250407711596544,2019-11-20,20:28:35,repdebdingell,4,4,21,2019-11-20 20:28:35
"A physically abusive boyfriend is the same as a physically abusive husband. Neither should be able to buy a firearm. 

Stay strong @SenSchumer. This is a fight worth fighting. https://www.politico.com/news/2019/11/19/joni-ernst-chuck-schumer-vawa-election-071565 …",1197203999834988546,2019-11-20,17:24:11,repdebdingell,4,16,82,2019-11-20 17:24:11
Is that called bribery? https://twitter.com/washingtonpost/status/1197173124774735873 …,1197184448250421250,2019-11-20,16:06:29,repdebdingell,10,8,76,2019-11-20 16:06:29
Gordon Sondland: “We worked with Mr. Giuliani because the President directed us to do so.” pic.twitter.com/B56RPap7pM,1197175674970218498,2019-11-20,15:31:38,repdebdingell,4,13,60,2019-11-20 15:31:38
"The Trump Admin said they’d get serious about the vaping epidemic. But news over the last couple days proved that untrue. The Admin isn’t serious about this crisis, so Congress is stepping up and advancing measures to help end the youth tobacco epidemic once and for all. pic.twitter.com/iXIgWqaqM8",1197169397426741248,2019-11-20,15:06:41,repdebdingell,7,6,24,2019-11-20 15:06:41
"LEAST PRODUCTIVE?!?!?!

@SpeakerPelosi and House Democrats are delivering #ForThePeople. 

Lower prescription drug prices, stronger domestic violence programs, common-sense gun violence prevention, and almost 400 House-passed bills are awaiting action from @SenateMajLdr. https://twitter.com/realDonaldTrump/status/1197144925034418176 …",1197162698007629824,2019-11-20,14:40:04,repdebdingell,7,18,66,2019-11-20 14:40:04
To think this is who the Republicans wanted to testify. https://twitter.com/ABCPolitics/status/1196904162681864192 …,1196934434689302534,2019-11-19,23:33:01,repdebdingell,7,12,74,2019-11-19 23:33:01
Pretty damning considering Kurt Volker is the star witness Republicans wanted to testify. https://twitter.com/ABCPolitics/status/1196904162681864192 …,1196929448253284354,2019-11-19,23:13:12,repdebdingell,2,16,82,2019-11-19 23:13:12
An American hero committed to the rule of law. pic.twitter.com/BCemovGUl0,1196889106502078465,2019-11-19,20:32:54,repdebdingell,8,12,92,2019-11-19 20:32:54
"BREAKING NEWS: The House passed funding to keep the government open. It will secure a pay raise for our men and women in uniform, extend funding for health initiatives, and ensure we have a fair and accurate census. This is a win for hardworking men and women across the country.",1196886747247976449,2019-11-19,20:23:32,repdebdingell,10,29,143,2019-11-19 20:23:32
Vindman is a decorated war hero. He heard President Trump say “do us a favor” during the July 25 call. He obeyed his sense of duty and raised concern over what was said. #DefendOurDemocracy. https://twitter.com/HouseIntel/status/1196804209993297922 …,1196818329765322757,2019-11-19,15:51:40,repdebdingell,12,71,303,2019-11-19 15:51:40
"""Dad, my sitting here today, in the US Capitol talking to our elected officials is proof you made the right decision 40 years ago to leave the Soviet Union and come here to America in search of a better life for our family.""
- Lt Col Vindman

These are the values we are defending",1196806244545310726,2019-11-19,15:03:38,repdebdingell,4,15,119,2019-11-19 15:03:38
"Lt. Colonel Alexander Vindman: ""What I heard was inappropriate...it's improper for a U.S. President to demand that a foreign country investigate a U.S. citizen and political opponent.""

Vindman reported what he heard out of a sense of duty. #DefendOurDemocracy",1196805029191147521,2019-11-19,14:58:49,repdebdingell,18,17,95,2019-11-19 14:58:49
"Lt. Col. Alexander Vindman was on the July 25 call between President Trump & President Zelinsky. Following the call he immediately raised concern over what was said.

As an American hero & Purple Heart recipient, we must listen to his testimony with the seriousness it deserves.",1196792571059724288,2019-11-19,14:09:18,repdebdingell,5,12,72,2019-11-19 14:09:18
"Like the rest of the country, I will be following today’s public hearings closely. We must know if our Democracy and rule of law was put at risk.",1196775770271694849,2019-11-19,13:02:33,repdebdingell,16,11,97,2019-11-19 13:02:33
"Deeply concerned the Trump Administration is moving to legitimize settlement activity, which overturns decades of precedent and will serve as an obstacle toward peace in the region. https://apnews.com/3da4fb3671004679a91a7d4ae9ab4e57 …",1196559700277518336,2019-11-18,22:43:58,repdebdingell,6,8,20,2019-11-18 22:43:58
"No one should be forced to choose between prescription drugs or putting dinner on the table. Period. 

It was great to join @AARPMichigan to rally behind H.R. 3. This legislation will lower the cost of prescription drugs and help hardworking men and women. pic.twitter.com/keDaBk7xQX",1196531323218931712,2019-11-18,20:51:12,repdebdingell,3,12,46,2019-11-18 20:51:12
"In the course of a few days, our country witnessed two more mass shootings. The Senate must schedule a vote on the Bipartisan Background Checks Act. It’s been over 260 days since it passed the House. When will enough be enough?

#EndGunViolence",1196512521559191552,2019-11-18,19:36:29,repdebdingell,1,11,50,2019-11-18 19:36:29
"Open enrollment is here! Make sure to #GetCovered and choose a plan that fits your needs.
 
Visit ➡️  http://healthcare.gov  to covered. pic.twitter.com/1IaZ4uu2I7",1196502289911078919,2019-11-18,18:55:50,repdebdingell,2,10,10,2019-11-18 18:55:50
"Climate change has many terrible effects, but one of harshest realities is what it’s doing to children’s health. We need bold action. Too much is at risk for anything less. https://www.nytimes.com/2019/11/13/climate/climate-change-child-health.html?fbclid=IwAR0U-3T4Iz66CzrkCS8IEqfboR73lOZ6XAASRPbk03m1VN9VkeDq9NlOM6U …",1196455075352371200,2019-11-18,15:48:13,repdebdingell,6,16,38,2019-11-18 15:48:13
"This week we heard very important facts during the public hearings of the impeachment inquiry. I paid close attention.

While they did their work, I had a busy week working on lowering Rx drug prices, investigating vaping illnesses, & building coalitions to act on climate change.",1196067692991696896,2019-11-17,14:08:54,repdebdingell,18,24,122,2019-11-17 14:08:54
"|￣￣￣￣￣￣￣￣￣￣|

        #BEATSTATE  

|＿＿＿＿＿＿＿＿____|              

               \  (• •) /

                  {    }                     

                   ---

                   |   | https://twitter.com/UMichFootball/status/1195703315910127616 …",1195736792756113409,2019-11-16,16:14:01,repdebdingell,3,3,47,2019-11-16 16:14:01
Fred! Couldn’t agree more! And to think people say bipartisanship isn’t alive. #GoBlue https://twitter.com/RepFredUpton/status/1195388940364189696 …,1195723299201921025,2019-11-16,15:20:24,repdebdingell,4,5,46,2019-11-16 15:20:24
"The American auto industry needs certainty, not court cases that will drag on for years. We need one national fuel economy program. One set of standards that go well into the future and increase year over year. That’s how we deliver certainty and reduce greenhouse gas emissions. https://twitter.com/washingtonpost/status/1195426069274353664 …",1195458310142644224,2019-11-15,21:47:26,repdebdingell,4,8,22,2019-11-15 21:47:26
Marie Yovanovitch has been appointed Ambassador three times – twice under a Republican president and once under a Democratic president. It is deeply concerning that while a witness is testifying to have the President tweet and intimidate her testimony. https://twitter.com/RepAdamSchiff/status/1195382103745150990 …,1195445350624104450,2019-11-15,20:55:56,repdebdingell,19,24,108,2019-11-15 20:55:56
Whistleblower protection laws are meant to protect whistleblowers. Period. https://twitter.com/HouseIntel/status/1195424856256499714 …,1195430683067453440,2019-11-15,19:57:39,repdebdingell,13,25,128,2019-11-15 19:57:39
"From lowering the cost of prescription drugs to working on a trade deal that puts hardworking men and women first, House Democrats have been working #ForThePeople.",1195423288505380864,2019-11-15,19:28:16,repdebdingell,5,9,20,2019-11-15 19:28:16
Building roads that can strengthen electric vehicle infrastructure is the type of innovation we need in the United States. It’s the future and it addresses climate change. pic.twitter.com/cL4lkIwegl,1195379884736090112,2019-11-15,16:35:48,repdebdingell,3,9,22,2019-11-15 16:35:48
"""Ukrainians who preferred to play by the old, corrupt rules sought to remove me. What continues to amaze me is that they found Americans willing to partner with them and...they apparently succeeded in orchestrating the removal of a U.S. Ambassador."" pic.twitter.com/h72JbiFgbx",1195373869747572736,2019-11-15,16:11:54,repdebdingell,25,31,97,2019-11-15 16:11:54
"""I do not understand Mr. Giuliani's motives for attacking me...I still find it difficult to comprehend that foreign and private interests were able to undermine U.S. interests in this way."" - Ambassador Marie Yovanovitch 

#DefendOurDemocracy",1195369010424090625,2019-11-15,15:52:35,repdebdingell,9,22,99,2019-11-15 15:52:35
"Ambassador Marie Yovanovitch has committed her career to the rule of law and anti-corruption. 

Her words today must be taken with the utmost seriousness. 

#DefendOurDemocracy",1195366553006551040,2019-11-15,15:42:49,repdebdingell,14,45,221,2019-11-15 15:42:49
"Quick sound bites don't always accurately capture in-depth perspectives. 

Thanks @SkullduggeryPod for sitting down for our discussion. https://twitter.com/SkullduggeryPod/status/1195138371078819841 …",1195348898149281794,2019-11-15,14:32:40,repdebdingell,4,3,7,2019-11-15 14:32:40
"We must build a world that puts public health, environmental protection, and the futures of all generations at the forefront of all we do on climate change.",1195084821745348617,2019-11-14,21:03:19,repdebdingell,3,0,10,2019-11-14 21:03:19
Now’s the time for the U.S. to lead the world in the face of this mass existential threat we all must confront. It’s up to all of us to meet this consequential moment together.,1195084820822528001,2019-11-14,21:03:19,repdebdingell,3,0,7,2019-11-14 21:03:19
"The United Nations was clear. The world must rapidly transition to a clean, net-zero emissions economy by 2050. From hurricanes, wildfires, droughts, and rising sea levels to mass displacement and global health crises, climate change has already changed the world around us.",1195084820063371266,2019-11-14,21:03:19,repdebdingell,3,3,15,2019-11-14 21:03:19
"#WorldDiabetesDay means different things in different countries. For the United States, it’s a reminder that the cost of insulin can be over 10 times more expensive than in Canada.

Insulin is lifesaving medicine. No one should be forced to ration it because of cost.",1195060117185662978,2019-11-14,19:25:09,repdebdingell,5,7,21,2019-11-14 19:25:09
"No one should go to school and fear for their lives. Sadly that was a reality for students again this morning.

When will enough be enough? https://twitter.com/Reuters/status/1195031842493218817 …",1195046837931167747,2019-11-14,18:32:23,repdebdingell,2,7,40,2019-11-14 18:32:23
Join us as we discuss the need to rapidly transition to a #100by50 clean economy. It is up to all of us to meet this consequential moment together and build a world that puts the futures of all generations at the forefront of all we do on climate change. https://www.americanprogress.org/events/2019/11/04/476822/build-100-clean-future-3/ …,1195032986435100672,2019-11-14,17:37:21,repdebdingell,2,6,14,2019-11-14 17:37:21
I have many questions. https://www.wired.com/story/google-is-slurping-up-health-dataand-it-looks-totally-legal/ …,1194969868782768138,2019-11-14,13:26:32,repdebdingell,1,5,37,2019-11-14 13:26:32
"Like the rest of the country, I am not a member of the House Intel Committee. I am an American citizen who values our democracy and rule of law. 

What I saw today was more evidence that President Trump took actions that threatened our national security. We must follow the facts.",1194789502046408704,2019-11-14,01:29:50,repdebdingell,11,37,271,2019-11-14 01:29:50
"Great news! The House passed the Rosie the Riveter Congressional Gold Medal Act! Like the men during World War II, women across the country also answered the call to serve. Their work should be celebrated.",1194749405422854156,2019-11-13,22:50:30,repdebdingell,2,11,106,2019-11-13 22:50:30
"For World Kindness Day, can’t help but think of these words from Mister Rogers. 

""There are three ways to ultimate success: The first way is to be kind. The second way is to be kind. The third way is to be kind."" https://www.usatoday.com/story/news/humankind/2019/11/13/world-kindness-day-2019-five-best-acts-kindness-year/2565525001/ …",1194731741413556229,2019-11-13,21:40:18,repdebdingell,0,3,19,2019-11-13 21:40:18
We all know the statistics. Those with a history of stalking and domestic violence shouldn't have a gun. The House knew this when it reauthorized the Violence Against Women Act. Now the senate must do the same.,1194699060541870080,2019-11-13,19:30:27,repdebdingell,6,15,52,2019-11-13 19:30:27
Today @HouseJudiciary advanced legislation to help ratify the Equal Rights Amendment! Michigan passed it in 1972 under a Republican Governor. Haven’t we waited long enough for equal protection under the law for all women?,1194679669901209601,2019-11-13,18:13:24,repdebdingell,8,41,241,2019-11-13 18:13:24
A 17-year-old boy from Michigan had to undergo a double lung transplant. The damage in his lungs was a result of vaping. Doctors said the damage to the boy’s lungs was unlike anything they’ve ever seen. Action is required now. This is a public health crisis. pic.twitter.com/IoYVNiqWQ1,1194663535273529345,2019-11-13,17:09:17,repdebdingell,5,12,24,2019-11-13 17:09:17
To not use science when creating clean air and clean water policy is irresponsible. No other way to put it. Science is the best tool we have when it comes to sound policy making. https://www.nytimes.com/2019/11/11/climate/epa-science-trump.html?fbclid=IwAR1coD5lPtl8earFc5o2fcIJdVLQG8dV0v8RxsgDqiwGmAGDuvpABnQIkz0 …,1194626968240693249,2019-11-13,14:43:58,repdebdingell,4,4,12,2019-11-13 14:43:58
Today is the first public hearings of the impeachment inquiry. As elected officials we take an oath of office to protect the Constitution. These hearings are about following the facts to do that.,1194602915958345729,2019-11-13,13:08:24,repdebdingell,12,21,151,2019-11-13 13:08:24
It's irresponsible for the continued asking of the whistleblower’s name to be made public. The Inspector General from the DNI's Office found the whistleblower complaint to be credible. The focus must be the rule of law. Not the name of the whistleblower. pic.twitter.com/RQxqWZZxg4,1194385557880811520,2019-11-12,22:44:42,repdebdingell,9,25,122,2019-11-12 22:44:42
Nearly 58 million people in America have been unable to pay for a prescription medicine at least once in the last 12 months. The Congress must #LowerDrugCosts by passing H.R. 3 into law!,1194329497077780480,2019-11-12,19:01:56,repdebdingell,3,9,34,2019-11-12 19:01:56
"The 700,000 DACA recipients across the country are just like us. They show up, work hard, and contribute to the American Dream. We as a country must stand with Dreamers today and every day.",1194278272990883841,2019-11-12,15:38:23,repdebdingell,11,12,92,2019-11-12 15:38:23
"This article made me cry today. John had many titles, but the one he was proudest of was veteran. https://urldefense.proofpoint.com/v2/url?u= https-3A__www.michiganadvance.com_2019_11_11_ken-2Dcoleman-2Dremembering-2Ddingell-2Dkeith-2Dand-2Dconyers-2Dproud-2Dveterans-2Dwho-2Dfought-2Dfor-2Djustice_&d=DwMGaQ&c=L93KkjKsAC98uTvC4KvQDdTDRzAeWDDRmG6S3YXllH0&r=ZkbRM0kqjFmgx9ZRFRuV56VcIVFaHg_nIIGVXIxyRWQ&m=xvX1hSjxSxQb80zM_8AyZjyXmNgRZ3sJDEd_rbQ94vU&s=6ckyNG4h1dP_OuIL0pULI3SRCMdqmZbU5gIx6RyKcrQ&e= …",1193945177959944195,2019-11-11,17:34:47,repdebdingell,5,15,92,2019-11-11 17:34:47
"Veterans Day is a time for us to pause and salute the men and women who served our country and defended the ideals that make this nation great. To every veteran, a grateful nation thanks you for your service.",1193896921812877312,2019-11-11,14:23:02,repdebdingell,4,12,65,2019-11-11 14:23:02
Stepped behind the bar at @Starbucks to work side-by-side with our local baristas. Starbucks is a great member of our community and shares our community’s commitment to hire veterans and military spouses. The new cups are filled with holiday cheer! pic.twitter.com/iAuJjJ4kWY,1193237687655960582,2019-11-09,18:43:28,repdebdingell,3,9,64,2019-11-09 18:43:28
Recent reports of violence against protestors in Iraq are deeply disturbing and must stop. We must support their right to equality.,1192897510668460038,2019-11-08,20:11:44,repdebdingell,0,1,21,2019-11-08 20:11:44
"People in Iraq deserve the right to peacefully protest against their government.  Thousands of Iraqi civilians have taken to the streets over the past month to protest corruption and inequality, and they have the right to be heard by their government. 1/",1192897509930283008,2019-11-08,20:11:43,repdebdingell,1,6,27,2019-11-08 20:11:43
Rituals and traditions gather generations together as community and we will all create new memories (and remember the past) as we gather once again for this year’s America Thanksgiving Day parade. Today was a great way to start the season.,1192890059139289088,2019-11-08,19:42:07,repdebdingell,0,1,23,2019-11-08 19:42:07
I wasn’t great at flipping  pancakes today; blaming it on the griddle. Thanks @GovWhitmer for doing a much better job than me. pic.twitter.com/G743DrPwG4,1192890058254278658,2019-11-08,19:42:07,repdebdingell,22,12,173,2019-11-08 19:42:07
"Stalking is stalking. Whether it is a felony or misdemeanor, the fact is stalking is often the first sign of future acts of violence. If we can keep guns out of the hands of domestic abusers, we will save lives. To me, even one life is worth saving. https://twitter.com/rollcall/status/1192592695937642501 …",1192633288218861570,2019-11-08,02:41:48,repdebdingell,5,35,131,2019-11-08 02:41:48
"Thank you to art students at Gabriel Richard High School in Riverview for making beautiful cards for ""Smiles for Vets."" They will bring heartfelt love and respect to the veterans who have served our country! pic.twitter.com/DouwLJL6q7",1192507653806788608,2019-11-07,18:22:35,repdebdingell,0,3,16,2019-11-07 18:22:35
"Over 200 days. That’s how long survivors of domestic violence have gone without support of #VAWA.

For each day the Senate fails to act, more lives are at risk. 

Millions of Americans and groups like @YWCAUSA are hard at work to ensure the Senate reauthorizes #VAWA.

#VAWA4ALL.",1192457608424251393,2019-11-07,15:03:43,repdebdingell,6,33,78,2019-11-07 15:03:43
Independent journalism is a pillar of our democracy. Proud to stand with @gmgunion and their reporters giving attention to the important stories of our time.,1192120944464220160,2019-11-06,16:45:56,repdebdingell,6,13,57,2019-11-06 16:45:56
"The Trump Admin is undermining global efforts to confront climate change. House Democrats stand with the rest of the world for the good of all future generations. What we need now is bold actions and defined goals. We must set course to achieving a 100% clean, net-zero economy.",1192097669046554625,2019-11-06,15:13:27,repdebdingell,15,18,91,2019-11-06 15:13:27
"If we want to talk about showing up, how about you schedule a vote on one of the 200+ bills we’ve sent you this year. https://twitter.com/senatemajldr/status/1191767229022560262 …",1191823322515955717,2019-11-05,21:03:17,repdebdingell,30,279,863,2019-11-05 21:03:17
"House Democrats have been busy at work with:

-A fair and balanced impeachment inquiry.

-Legislation to lower the cost of prescription drugs.

-Making sure a trade deal is passed that helps hardworking men and women. pic.twitter.com/hbpGvhAMb6",1191804310197284864,2019-11-05,19:47:44,repdebdingell,13,13,54,2019-11-05 19:47:44
Open Enrollment for the Health Insurance Marketplace has begun. Make sure you #GetCovered on  http://HealthCare.gov  for 2020.,1191791672566407168,2019-11-05,18:57:31,repdebdingell,0,4,9,2019-11-05 18:57:31
