tweet,id,date,time,username,replies_count,retweets_count,likes_count
"I am so excited for the Detroit Youth Choir!  Amazing talent!

Detroit Youth Choir goes to 'America's Got Talent' semifinals  https://www.clickondetroit.com/entertainment/detroit-youth-choir-awaits-fate-on-agt-results-show-tonight?__vfz=medium%3Dsharebar … via @local4news",1166873457772154882,2019-08-29,00:41:26,senstabenow,7,35,154
"This is the reason no other President has been allowed to run his business while being President! Yet another glaring example of the President promoting his business interests, personally profiting from foreign money, and violating the Constitution. https://news.yahoo.com/trump-floats-idea-hosting-2020-124819341.html?soc_src=newsroom&soc_trk=com.apple.UIKit.activity.Mail&.tsrc=newsroom …",1166039087494651905,2019-08-26,17:25:57,senstabenow,189,446,1048
ICYMI: This week I kicked off a statewide tour on Belle Isle to announce my bipartisan bill to keep the Great Lakes Restoration Initiative funded for the next five years. This funding has been a major success in restoring our waterways all across Michigan! pic.twitter.com/SOnVsbSCgN,1165642267702571009,2019-08-25,15:09:07,senstabenow,20,49,212
What a gorgeous Friday morning at the Shiawassee National Wildlife Refuge! Great Lakes funding keeps wetlands like Shiawassee healthy and thriving. Proud to lead the fight to ensure places like these critical ecosystems are funded for years to come! pic.twitter.com/rUHKo7BQYE,1165342525462327297,2019-08-24,19:18:03,senstabenow,7,24,111
"Lauren, you and all of the awesome advocates and caregivers are the real rockstars! https://twitter.com/LaurenKovach/status/1165073788314275846 …",1165254261678190593,2019-08-24,13:27:20,senstabenow,3,12,64
"Basic concept - Michigan workers want to export our products, not our JOBS!",1165030114972839936,2019-08-23,22:36:39,senstabenow,12,20,152
Many Jeep Grand Cherokees assembled in Detroit are sold in China. We want to build them HERE. We don’t want any plant moved to China to avoid tariffs.,1165030020877824000,2019-08-23,22:36:16,senstabenow,9,21,129
"Just for the record, President Trump, when China raises the cost of cars WE build and sell to THEM, that is BAD for American jobs.",1165029818540449792,2019-08-23,22:35:28,senstabenow,44,102,387
Beautiful morning at the Shiawassee National Wildlife Refuge! Watch and hear why the Great Lakes Restoration Initiative is so important here and across  Michigan. pic.twitter.com/mIFBgbyvm2,1164920224145190912,2019-08-23,15:19:59,senstabenow,7,24,133
"Happy 95th anniversary to the @JudsonCenter! Since my days in the state legislature, I’ve been proud to be your partner.  Thanks for always being there for Michigan kids and families. pic.twitter.com/O09FFz0sJB",1164904921944117249,2019-08-23,14:19:10,senstabenow,4,4,26
"Today, Senator Peters and I announced our bipartisan bill to extend and increase funding for the Great Lakes Restoration Initiative for the next 5 years! Success stories like Belle Isle and the Rouge River, Detroit River, and Clinton River watersheds make this bill a no-brainer. pic.twitter.com/WiOaROeKGR",1164718867463254016,2019-08-23,01:59:52,senstabenow,10,41,268
"For the record Mr. President, I’m proud of the over 712,000 hard-working Michiganders whose jobs are supported by the auto industry. They make the best products in the world - and they’re smart and tough! https://twitter.com/realDonaldTrump/status/1164311594081247233 …",1164603678524940289,2019-08-22,18:22:08,senstabenow,29,77,414
Team Stabenow having another great lunch at @eatdimestore. Detroit continues to rock! pic.twitter.com/MvGZkQEHwD,1164578691386662917,2019-08-22,16:42:51,senstabenow,1,4,44
I encourage you to get involved. This is so important! https://twitter.com/MichSoS/status/1163481658370252800 …,1163976437122109442,2019-08-21,00:49:42,senstabenow,4,37,98
"Keep up the great work, Dana! This is a very important issue! https://twitter.com/dananessel/status/1163762304426659840 …",1163953014740271110,2019-08-20,23:16:38,senstabenow,2,12,99
"While Michigan agriculture is struggling with poor weather and trade disruptions, the Trump administration continues to side with Big Oil instead of our farmers. Unacceptable! https://www.reuters.com/article/us-usa-biofuels-trump/trump-intervention-triggered-epas-surprise-biofuel-waiver-decision-sources-idUSKCN1V610F …",1163525925788631047,2019-08-19,18:59:32,senstabenow,12,32,68
This is exactly the opposite of what should be happening if our countries are striving for peace and understanding. https://www.nytimes.com/2019/08/15/world/middleeast/trump-israel-omar-tlaib.html …,1162348982577840128,2019-08-16,13:02:47,senstabenow,46,25,161
Happy birthday to my friend @RepKildee! Thank you for all you do for Michigan. pic.twitter.com/FFURVRpT7g,1160576888013766657,2019-08-11,15:41:07,senstabenow,14,8,66
Sending wishes for a very special birthday to @RepAndyLevin! So proud to be your partner! 🎂 pic.twitter.com/OokNdI9dXt,1160235052783079426,2019-08-10,17:02:47,senstabenow,7,6,39
What would summer at the lake be without our beautiful Michigan lighthouses! Happy #NationalLighthouseDay! pic.twitter.com/7exMXV1LeV,1159113163670994944,2019-08-07,14:44:48,senstabenow,5,16,94
Today is the 54th anniversary of the #VotingRightsAct - a reminder that Congress should act now to restore voter protections that #ShelbyvHolder gutted from the VRA over six years ago. Leader McConnell should let the Senate vote on the House-passed For the People Act! pic.twitter.com/IoBxEyAKWV,1158848269352615937,2019-08-06,21:12:12,senstabenow,5,27,74
"Farmers markets bring fresh Michigan-grown food to your community, while helping farmers sell their goods directly to you and your neighbors. This National #FarmersMarketWeek, get out and enjoy what your local market has to offer! pic.twitter.com/R17boZBcf4",1158521808439717888,2019-08-05,23:34:58,senstabenow,5,10,87
Enough is enough! Leader McConnell must make the Bipartisan Background Checks Act a top priority. This bill passed the House over 158 days ago. It is past time for the U.S. Senate to act!,1158201039155339264,2019-08-05,02:20:20,senstabenow,119,719,2625
This is exactly what we don’t want in our Great Lakes! https://twitter.com/ABC/status/1157295522195152897 …,1157324301978263552,2019-08-02,16:16:30,senstabenow,23,61,239
Thanks to my two Midwestern friends @SenatorBaldwin and @SenTinaSmith for the great work they’re doing on climate + Great Lakes! https://twitter.com/SenTinaSmith/status/1156972962924380160 …,1156997895855509505,2019-08-01,18:39:29,senstabenow,2,10,75
