tweet,id,date,time,username,replies_count,retweets_count,likes_count
Congratulations to this year's Nevada winners of the Letters about Literature Competition. All of these students make #NevadaProud!  http://nevadahumanities.org/programs/letters-about-literature …,1127000365822562305,2019-05-11,00:00:00,senjackyrosen,0,1,7
"Protecting and supporting our seniors is a key priority for me, and as part of @SenateAging Committee, I will continue to push for greater safeguards and increased funding for critical programs to ensure our seniors can age with dignity.",1126985265225064449,2019-05-10,23:00:00,senjackyrosen,2,6,20
May is #OlderAmericansMonth – a time to celebrate the wisdom of our seniors and ensure they have the connections and resources they need. pic.twitter.com/WiaM268jn3,1126970165982388225,2019-05-10,22:00:00,senjackyrosen,1,3,5
Highlighting female role-models can help combat negative stereotypes that hold women back from pursuing careers in STEM. Learn more about my #NevadaWomenInSTEM award by visiting  http://rosen.senate.gov  and nominate a STEM champion today! pic.twitter.com/UZbXyw35q4,1126945493689487360,2019-05-10,20:21:57,senjackyrosen,1,6,8
"Last year, @RepCarbajal & I toured the Tornillo Unaccompanied Minor Facility and the Paso del Norte Processing Center. DHS & HHS told us they were able to reunite separated families. It's become clear that DHS & HHS officials were deliberately misleading. http://ow.ly/6jhK30oHpSr ",1126916171197026310,2019-05-10,18:25:26,senjackyrosen,4,14,20
"Last year, travel and tourism brought in over $40 billion dollars to Nevada, which supported more than 400,000 jobs. Just one example of how #TravelMatters. #nttw19 pic.twitter.com/NxL6FC9n0u",1126890192038764545,2019-05-10,16:42:13,senjackyrosen,3,9,30
Good luck to all of the Howard R. Hughes College of Engineering students competing in today’s Spring 2019 UNLV Fred and Harriet Cox Senior Design Competition! #STEMrocks https://www.unlv.edu/news/release/unlv-engineering-students-present-high-tech-prototypes-fred-and-harriet-cox-senior …,1126660626980450304,2019-05-10,01:30:00,senjackyrosen,1,4,6
"Congratulations to the amazing Gold Award Girl Scouts from @GirlScoutsSN! This is a tremendous accomplishment, and I can’t wait to see what these inspiring young leaders continue to do in their lives and in our community. #GirlScouts #GirlLead pic.twitter.com/CbPjmwRfgD",1126653076478267394,2019-05-10,01:00:00,senjackyrosen,0,6,27
My Reno team had a great time at the Nevada Legislature ‘AAPI Celebration Day’ - a wonderful new tradition by the Asian Pacific American Islander Caucus to celebrate all AAPI cultures. #APAHM #AAPIHM pic.twitter.com/TfzUcVMxe7,1126637976652472320,2019-05-10,00:00:00,senjackyrosen,2,4,14
"Let me be clear: Nevadans wholeheartedly oppose becoming the nation’s nuclear dumping ground, and I’m working each day alongside my colleagues in Nevada’s delegation to stop efforts to revive Yucca Mountain. https://lasvegassun.com/news/2019/may/09/i-refuse-to-allow-republican-party-leaders-to-revi/ …",1126622877829271552,2019-05-09,23:00:00,senjackyrosen,8,15,55
"❌ The Violence Against Women Act
❌ Voting and Democracy Reform
❌ Net Neutrality
❌ Background Checks
❌ Paycheck Fairness
 
All under attack under this Administration.
 
That. Is. Not. Acceptable.",1126607779450384384,2019-05-09,22:00:00,senjackyrosen,11,15,57
"All children deserve a safe and caring home. May is #NationalFosterCareMonth -  a time to bring awareness to the more than 100,000 foster youth eligible for adoption right now and waiting to find their forever family. Visit  http://www.adoptuskids.org  to learn more.",1126592681142919171,2019-05-09,21:00:00,senjackyrosen,1,4,6
"Happy Independence Day to Israel, one of our closest allies, and the only liberal democracy in the Middle East. I’ll continue to fight for international recognition of Israel's right to exist and support its right to defend itself from terrorism and other existential threats. pic.twitter.com/99ISTeAvQW",1126571201059598337,2019-05-09,19:34:39,senjackyrosen,14,45,197
"During my first speech on the Senate floor today, I asked Senate leadership to pass my resolution with @Sen_JoeManchin to defend access to quality, affordable health care by unanimous consent. We must act to protect millions who risk losing coverage. https://www.youtube.com/watch?v=KUFApF1Ll1A&feature=youtu.be …",1126533700454371330,2019-05-09,17:05:38,senjackyrosen,5,9,30
"As my first action while holding the floor of the United States Senate, I’m asking Senate leaders to take up my resolution with @Sen_JoeMachin to defend the constitutionality of the ACA. Nevadans sent me here to protect their health care. That’s what I’ll continue to do.",1126503634491940867,2019-05-09,15:06:10,senjackyrosen,12,28,131
"There are plenty of ways that we can work to improve the Affordable Care Act, but destroying the law and leaving Americans at risk is simply unacceptable.",1126502902984396802,2019-05-09,15:03:16,senjackyrosen,19,71,238
"If the Administration has its way with invalidating our health care law, it would spell disaster for millions who rely on access to quality, affordable care. Over 1.2 million Nevadans live with a pre-existing condition. We all know what’s at stake.",1126502830687367168,2019-05-09,15:02:58,senjackyrosen,1,4,17
"But there’s no issue that matters more to Nevada’s hardworking families than health care. From Las Vegas to Elko, I’ve met with countless Nevadans who tell me what it means to not have to fear being denied coverage based on a pre-existing condition.",1126502444685512704,2019-05-09,15:01:26,senjackyrosen,1,5,18
"✅Protecting our environment and public lands
✅Embracing clean energy
✅Honoring our heroes and their families
✅Supporting economic growth
✅Investing in our children’s education 
These are just some of the issues we can work on together – across the aisle – and improve lives.",1126501835051798528,2019-05-09,14:59:01,senjackyrosen,16,30,75
"If there’s any issue that threatens Nevada’s beautiful landscapes and the people who call our state home, it’s Yucca Mountain. 
   
Mark my words, Nevadans’ voices matter. We do NOT consent to this ill-conceived project.

Not now. Not ever.",1126500234425708544,2019-05-09,14:52:39,senjackyrosen,1,11,29
"In Nevada, we come together from every background and walk of life to make cities that shine from out of the desert. Our diversity truly captures who we are. We must honor our immigrant story by passing bipartisan immigration reform that protects our Dreamers and TPS recipients.",1126499120791863297,2019-05-09,14:48:14,senjackyrosen,4,9,18
Nevadans sent me here to protect their health care. I’m about to speak on the Senate floor and demand immediate action to defend our health care system. WATCH LIVE >>> https://twitter.com/i/broadcasts/1kvKpOBwnqZxE …,1126498591231623168,2019-05-09,14:46:08,senjackyrosen,44,89,354
"Today, I’m heading to the Senate floor to address my colleagues about my top priorities in Congress, including a critical issue that affects all Americans – our health care. I hope you will join me by tuning in to watch. pic.twitter.com/knjGKAiEeS",1126491495933054978,2019-05-09,14:17:56,senjackyrosen,2,7,24
Had a productive meeting with @ACDCNV and #AAPI Nevada leaders today to discuss advocacy efforts on the issues that matter the most to Nevada’s AAPI community. pic.twitter.com/24T22V1Q2Y,1126283138525683715,2019-05-09,00:30:00,senjackyrosen,1,7,29
"Everyone should have the right to affordable, reproductive health care. I’ll keep fighting in the Senate to protect women’s rights to make their own choices about their bodies and ensure access to quality, comprehensive care. #PutPatientsFirst pic.twitter.com/oLfAIctpcg",1126268039308115975,2019-05-08,23:30:00,senjackyrosen,7,5,19
I led a letter today to @DeptVetAffairs' @SecWilkie regarding recent allegations of inadequate patient care and misconduct that reportedly occurred @VALasVegas and requesting an investigation into the charges of reported alleged mismanagement. Read my full statement >>> pic.twitter.com/xTosFkZBtI,1126254966493073408,2019-05-08,22:38:03,senjackyrosen,1,11,19
"Tomorrow morning, I’ll be delivering my first speech on the Senate floor to lay out my priorities for my first term and to discuss what I was sent here to do: defend our health care. pic.twitter.com/JVBafapMAg",1126213239749193730,2019-05-08,19:52:15,senjackyrosen,5,14,37
.@SenCortezMasto and I had a great morning spending time with Nevadans visiting Washington D.C. at our weekly #BattleBornBreakfast! pic.twitter.com/z6ylg4HHx2,1126179654539390976,2019-05-08,17:38:47,senjackyrosen,2,5,37
"Happy National #SmallBusinessWeek to the 270,000 small businesses that are the backbone of Nevada’s economy. Show your support for Nevada’s entrepreneurs this week by shopping at your local small business. pic.twitter.com/izpBp2YWID",1126139694427672576,2019-05-08,15:00:00,senjackyrosen,6,10,21
Honored to speak at today’s @WomensHighTech ‘Building STEM Pathways for Girls’ event to discuss my bipartisan #BuildingBlocksofSTEM Act and my work in Congress to introduce our young girls to #STEMeducation. pic.twitter.com/SRgo8ONvX3,1125935850838093824,2019-05-08,01:30:00,senjackyrosen,3,9,21
".@RepMarkTakano is right, we need to do more to help our veterans and to end this public health crisis. I’ll continue working to ensure that no veteran is left behind. https://thehill.com/blogs/congress-blog/lawmaker-news/441085-the-nation-needs-to-do-more-to-reduce-veteran-suicide?platform=hootsuite …",1125913204104757250,2019-05-08,00:00:00,senjackyrosen,5,7,16
The @DAVHQ plays such an important role in supporting our American heroes. My Las Vegas team was honored to participate in the Disabled American Veterans’ statewide convention this weekend. pic.twitter.com/v16UtjlzEn,1125898103188525056,2019-05-07,23:00:00,senjackyrosen,3,3,13
"Health IT and electronic medical records have great potential but need to work better for all Americans. That’s why I’m working with my colleagues to improve interoperability and security of health IT, records, and medical devices. pic.twitter.com/wSJvNMZAHS",1125883148674453506,2019-05-07,22:00:35,senjackyrosen,1,3,9
This @UN report is absolutely devastating and it should sound the alarm for all of us. We only have one planet – and we need action now if we hope to reverse course. https://www.npr.org/2019/05/06/720654249/1-million-animal-and-plant-species-face-extinction-risk-u-n-report-says …,1125845254240817152,2019-05-07,19:30:00,senjackyrosen,9,20,32
Teachers have the power to inspire and shape young minds into our nation’s future leaders. I'm proud to support @SenSherrodBrown and @SenatorCollins Teacher Appreciation Resolution this #TeacherAppreciationWeek to recognize the incredible contributions teachers make everywhere. pic.twitter.com/pUw639UQ8G,1125837706464882689,2019-05-07,19:00:00,senjackyrosen,0,3,8
"Our children are the future. I joined my colleagues in introducing a resolution celebrating El Dia de los Niños to highlight the importance of all children across our United States, and I am proud to report it passed the Senate last week. pic.twitter.com/hjvfS2RBpv",1125822605653684224,2019-05-07,18:00:00,senjackyrosen,0,6,9
"As we get closer to Mother’s Day, let’s not forget that just over one year ago this Administration began their despicable policy of family separation, tearing children from their mothers’ arms. We must demand complete reunification and accountability. pic.twitter.com/nw1go5syWB",1125792406790557701,2019-05-07,16:00:00,senjackyrosen,12,20,27
"On this day in 1843, the very first Japanese immigrants arrived in the United States. Since that time, Japanese Americans have made countless contributions to American history, society, and culture. We are strong because of our diversity. #APAHM",1125777087401472002,2019-05-07,14:59:08,senjackyrosen,1,5,21
Welcome Home! Team Rosen was excited to be part of the crowd welcoming back Honor Flight participants from southern Nevada on their return from Washington D.C. this weekend. We’re proud to honor these Nevada Veterans who gave so much to defend our country. pic.twitter.com/fh7irV2qoS,1125573462624391168,2019-05-07,01:30:00,senjackyrosen,0,7,32
Glad to see @RepSusieLee introduce the House companion of my bipartisan #HireStudentVeteransAct last week. We’ll continue working together on commonsense solutions to help our student veterans find gainful employment. https://twitter.com/RepSusieLee/status/1124008971801640961 …,1125557994085933056,2019-05-07,00:28:32,senjackyrosen,0,10,12
"The House is taking much-needed action to address climate change. 

It’s time for the Senate to do the same. https://www.washingtonpost.com/climate-environment/2019/05/02/house-passes-bill-force-us-stay-paris-climate-agreement/?utm_term=.4fe66bc3125b …",1125543263442591744,2019-05-06,23:30:00,senjackyrosen,12,9,31
#TravelMatters in Nevada where tourism is the backbone of our economy and is at the heart of thousands of jobs and millions in annual tax revenues. #nttw19 pic.twitter.com/HZdO9PJK8Y,1125528166192353280,2019-05-06,22:30:00,senjackyrosen,1,7,25
Proud to see my House colleagues fighting against this Administration's repeated attempts to undermine access to health care. I’ll continue doing my part in the Senate to defend women’s reproductive rights. https://www.washingtonpost.com/powerpost/house-democrats-move-to-block-trump-administrations-abortion-gag-rule/2019/04/29/d00e3c1e-6ac6-11e9-be3a-33217240a539_story.html?utm_term=.703311fbe92c …,1125513065519206400,2019-05-06,21:30:00,senjackyrosen,5,14,37
"Family separation should never have happened in the first place. Now, the lack of oversight or any plan by the Trump Administration to reunite these families is outrageous. This recklessness demands answers. https://www.nbcnews.com/politics/immigration/emails-show-trump-admin-had-no-way-link-separated-migrant-n1000746?platform=hootsuite …",1125499517728690177,2019-05-06,20:36:10,senjackyrosen,9,18,48
Denial of climate change is dangerous. This Administration’s attempt to cover up the seriousness of this very real issue is unconscionable. https://twitter.com/washingtonpost/status/1123972456698589184 …,1125423641427050497,2019-05-06,15:34:40,senjackyrosen,23,39,119
"Targeting innocent civilians with rockets is completely unacceptable. Congress must pass security assistance for our ally Israel, whose people have faced a barrage of rocket fire from Gaza over the course of 36 hours.",1125184084257460224,2019-05-05,23:42:45,senjackyrosen,33,34,151
Are you a small business? Need help with drafting a business plan? Be sure to visit the @SBAgov’s website for assistance with your small business needs! https://www.sba.gov/local-assistance?utm_medium=email&utm_source=govdelivery …,1125158226155016193,2019-05-05,22:00:00,senjackyrosen,0,2,6
"Vaccines are an important and safe way to prevent the spread of disease, including measles. For information on where to go for immunizations in Nevada, visit: https://immunizenevada.org/community/where-go …",1125128030442147840,2019-05-05,20:00:00,senjackyrosen,5,10,23
So proud of the students at @RanchoRamsLV for placing second internationally in the Real World Design Challenge! #STEMChampions #NevadaProud pic.twitter.com/jBDH0matri,1125118604456931329,2019-05-05,19:22:33,senjackyrosen,2,6,20
Wishing a meaningful Ramadan full of peace and togetherness to those in Nevada who celebrate.,1125067769974804482,2019-05-05,16:00:33,senjackyrosen,12,20,107
Our men and women in law enforcement exemplify courage and commitment to public service. My team attended the James D. Hoff Peace Officer Memorial to pay our respect to those killed in the line of duty. pic.twitter.com/NIEDWUbPfY,1124765703930830854,2019-05-04,20:00:15,senjackyrosen,3,9,25
Nevada’s public lands aren’t only a source of wonder and beauty - they create thousands of jobs and diversify our economy. I will continue to fearlessly defend our public lands for generations to come. https://www.nevadaappeal.com/news/opinion/national-parks-week/# …,1124750542603816960,2019-05-04,19:00:00,senjackyrosen,0,7,24
"My military legislative assistant observed operations aboard @TheRealCVN71. Fun fact, #TOPGUN2 was filmed aboard this aircraft carrier and at Nevada’s own @fallon_nas, home to TOPGUN and the premiere facility to prepare carrier air wings for deployment! pic.twitter.com/N1VCFlzrJH",1124735442027458562,2019-05-04,18:00:00,senjackyrosen,1,2,9
"Saddened to hear of the unexpected passing of NV Assemblyman Tyrone Thompson. He was a devoted public servant who was admired by his colleagues in the legislature and our entire community. His presence in Nevada will truly be missed, but his legacy will always live on.",1124726860271763456,2019-05-04,17:25:54,senjackyrosen,0,21,101
TPS has helped thousands of immigrants who have sought refuge from violent regimes and persecution rebuild their lives. I will continue fighting to protect Nevada’s TPS holders by advocating for comprehensive immigration reform and a pathway to permanent residency. #SaveTPS https://twitter.com/wfucoalition/status/1123595267910062080 …,1124457237286723584,2019-05-03,23:34:31,senjackyrosen,1,21,25
This Administration’s newest attempt to rob people of coverage protections for pre-existing conditions is despicable. I will continue to fight against the President’s assault on our health care. http://ow.ly/6Jcs30oCcKz ,1124441000212983808,2019-05-03,22:30:00,senjackyrosen,6,13,29
"All Members of Congress must be able to read and review the full report. For the integrity of our democracy, Attorney General Barr must release the complete and unredacted report. https://www.politico.com/story/2019/04/30/mueller-report-redacted-1295105 …",1124425902106955776,2019-05-03,21:30:00,senjackyrosen,25,18,63
"Members of our nation’s military exemplify courage, bravery, and sacrifice. During #MilitaryAppreciationMonth let's show our support and admiration for the men and women who risk their lives to protect our nation. pic.twitter.com/aCH1w6nmiG",1124403037727014914,2019-05-03,19:59:09,senjackyrosen,0,6,13
".@emily_jr_carter is a @UNLV Honors college and pre-medical biology student who advocates for more women in #STEM careers and for increased access to career and technical education in Nevada. Emily is a role model, an aspiring physician, and this month’s #WomenInSTEM! pic.twitter.com/Og7CSmUwbN",1124357081786662912,2019-05-03,16:56:32,senjackyrosen,0,7,9
"As a woman who started her career in computer programming, I know we need to do more to close the gender gap in STEM. That’s why each month, I’m highlighting women in NV who are doing amazing things in STEM. Click on this link to nominate a #WomanInSTEM >>  http://ow.ly/KnOV30nVRG6  pic.twitter.com/vOugobou25",1124342857769160704,2019-05-03,16:00:01,senjackyrosen,1,4,19
Our nation’s AAPI community is part of what makes our country so rich and diverse. During #APAHM we pay tribute to the Nevada AAPI community’s many contributions to our state and our economy by celebrating and honoring them. pic.twitter.com/0jya3pW0CN,1124325408181235712,2019-05-03,14:50:40,senjackyrosen,0,4,8
I joined @SenTedCruz and @timkaine in introducing a bipartisan resolution condemning anti-Semitism and commiting the U.S. Senate to take action to combat it. I will continue to do my part to work across the aisle to fight hate in all its forms. pic.twitter.com/1ZDr27DqTv,1124116258918666242,2019-05-03,00:59:35,senjackyrosen,6,16,62
Climate change is real and the time to act is now. http://ow.ly/UiXj30oC93y ,1124108811718078468,2019-05-03,00:30:00,senjackyrosen,7,11,30
Far too many in Nevada are being exposed to dangerous air quality. Climate change is the root cause of this problem – and we can no longer ignore it. We must take this issue seriously and find solutions to ensure the health and safety of our nation. https://lasvegassun.com/news/2018/apr/19/report-air-quality-in-las-vegas-ranks-as-one-of-na/ …,1124093713406484482,2019-05-02,23:30:00,senjackyrosen,6,5,18
"Teachers can have such a positive impact on their students’ lives. That’s why it’s so important for us to recognize their amazing work. I met with and presented a certificate to Mr. Knoeppel, Nevada’s Teacher of the Year! pic.twitter.com/tZcCb9onRq",1124067474373259265,2019-05-02,21:45:44,senjackyrosen,2,7,44
"As anti-Semitism rears its ugly head today, we have an obligation to educate current and future generations to fight against hatred and intolerance.",1124059091792539651,2019-05-02,21:12:26,senjackyrosen,0,9,26
Today my Las Vegas team was honored to participate in Nellis Air Force Base’s #HolocaustRemembranceCeremony. We must never forget the millions of Jews and others who lost their lives in one of the darkest chapters in history. pic.twitter.com/VbSYIqD13X,1124059089305317389,2019-05-02,21:12:25,senjackyrosen,2,5,24
"Reviving Yucca Mountain would mean transporting 110,000 metric tons of radioactive waste to Nevada. Let me be clear: Nevadans wholeheartedly oppose becoming the nation’s nuclear dumping ground. I'll continue working to stop these new efforts. http://ow.ly/Ddry30oC8Yx ",1124040866744520704,2019-05-02,20:00:00,senjackyrosen,6,9,20
I agree with @SenMarkey: Yucca Mountain is not a viable solution. https://twitter.com/JackieTothDC/status/1123608596883955713 …,1124036983817494529,2019-05-02,19:44:35,senjackyrosen,2,6,15
Happy Children’s Book Week! Let’s celebrate the joys of reading and work to instill a love for books in our children from an early age.  #ReadNowReadForever pic.twitter.com/V1oUU3H2ZX,1123988834113466368,2019-05-02,16:33:15,senjackyrosen,0,6,13
"During this time when anti-Semitism and bigotry is on the rise, it is vitally important that we lift up members of the Jewish American community, honor their achievements, and celebrate their immeasurable contributions to our great nation #JewishAmericanHeritageMonth. pic.twitter.com/qHBfshSes9",1123961548681220097,2019-05-02,14:44:50,senjackyrosen,5,16,37
"I met with @ClarkCountySch’s National Summit on Education Equity Rising Star Award Winner, Snehal Bhakta, who is working each day to level the playing field for our students. Nevada is so lucky to have you, Snehal. Congratulations! pic.twitter.com/mwne1unkVl",1123746424863186944,2019-05-02,00:30:00,senjackyrosen,4,18,56
"As part of the @SenateCommerce committee, I’m working to ensure consumer data is protected because Nevadans want to know that their personal information is not being used without their consent. pic.twitter.com/3oWafxwt8n",1123731325016350720,2019-05-01,23:30:00,senjackyrosen,2,6,20
I’m proud to represent such incredible constituents. Thank you for your hard work to educate and improve our children’s lives. Your service to our community makes Nevada a better place! https://twitter.com/MFreemanvegas/status/1122024793379704832 …,1123709647930691584,2019-05-01,22:03:52,senjackyrosen,0,4,16
"2019 has been an extraordinary year for women. Today, I spoke to a group of trailblazing businesswomen at the @committeeof200. When we bring more women to the decision-making table, we can make more progress on issues that affect working women and families. pic.twitter.com/mn9CclJzcR",1123687645652111360,2019-05-01,20:36:26,senjackyrosen,1,6,12
Storing nuclear waste at Yucca Mountain would threaten the health and safety of Nevadans. I addressed the Senate EPW Committee today and made clear that Nevadans wholeheartedly oppose becoming the nation’s dumping ground for nuclear waste. pic.twitter.com/UcuYfhntSZ,1123654839425224704,2019-05-01,18:26:04,senjackyrosen,6,6,25
"Don’t forget to stop by Mobile Office Hours TODAY if you’re having issues dealing with a federal agency, need assistance applying for a grant, and more!
 
⌚From 10am -12pm PT
📌At Desert Vista Community Center; 10360 Sun City Blvd, Las Vegas, NV 89134 pic.twitter.com/0FHH7bbtEp",1123620358576320513,2019-05-01,16:09:03,senjackyrosen,0,4,3
Another great #BattleBornBreakfast in the books! Great to meet with Nevadans visiting our nation’s capital alongside @SenCortezMasto. pic.twitter.com/cY8TzdoqcM,1123607717413883904,2019-05-01,15:18:50,senjackyrosen,0,5,13
"Yucca Mountain is a dangerous and costly project that is wrong for Nevada. I will continue to use every tool at my disposal to prevent this wasteful, ill-conceived project from moving forward.",1123594824593158150,2019-05-01,14:27:36,senjackyrosen,3,6,21
The majority of Nevadans oppose turning Yucca Mountain into a nuclear waste repository. This site is unfit and it poses a threat to the health and safety of Nevadans and millions of visitors who visit our state each year.,1123593583892881414,2019-05-01,14:22:40,senjackyrosen,5,8,41
I’m testifying now in opposition to dangerous plans by Republican leaders to turn Nevada into the nation’s nuclear waste dump. https://twitter.com/i/broadcasts/1DXxyNzZWdZKM …,1123589144838574080,2019-05-01,14:05:02,senjackyrosen,0,12,35
I’m about to testify against efforts by Republican leaders in Congress to revive Yucca Mountain. This project is wrong on so many levels. I stand with Nevadans who agree that this plan is dangerous. I’m not backing down. pic.twitter.com/fgY7iSi9Nd,1123582539413774343,2019-05-01,13:38:47,senjackyrosen,4,6,16
