tweet,id,date,time,username,replies_count,retweets_count,likes_count
"#TeamRosen tabled at the Reno Community Health Alliance’s Health Fair yesterday. If you missed my team but have questions dealing with a federal agency or need assistance with accessing low-cost services, please reach out to my office by visiting  http://www.rosen.senate.gov . pic.twitter.com/R4McIN7Gm2",1130963981881843713,2019-05-21,22:30:00,senjackyrosen,1,4,8
"Efforts to fund Yucca Mountain are dangerous. This project has no business being revived. I'm happy to see my colleagues in the House agree with our delegation by voting down funding for Yucca. 
 
I'll keep fighting to protect Nevada from this Administration's reckless plans.",1130960057791913984,2019-05-21,22:14:24,senjackyrosen,8,14,59
Countless Vietnam-era veterans who served in Thailand were exposed to Agent Orange and have been denied the service-connected VA benefits they deserve. I’m supporting legislation to give these military heroes the long overdue benefits they have earned. pic.twitter.com/r24bJPHZn9,1130947716153061377,2019-05-21,21:25:22,senjackyrosen,2,9,18
Breast cancer is still one of the most commonly diagnosed cancers affecting women. I’m co-sponsoring legislation to ensure the Breast Cancer Research Stamp remains available at the Post Office to help raise funds for research. pic.twitter.com/GoDGAtaWyp,1130933771799281666,2019-05-21,20:29:57,senjackyrosen,3,4,7
The majority of Americans support access to reproductive care. We cannot allow a systematic campaign of misinformation to turn back the clock on women’s reproductive rights. https://www.washingtonpost.com/opinions/trump-owns-this-attack-on-american-women/2019/05/20/7c139a5c-7b2c-11e9-8ede-f4abf521ef17_story.html?utm_term=.d6331387749b …,1130918738834989056,2019-05-21,19:30:13,senjackyrosen,27,31,91
"Having issues dealing with a federal agency? Need assistance applying for a grant? Want to learn more about military academy nominations? Stop by today’s Mobile Office hours! 

⌚️ From 9am -11am PT 
📌 At Heritage Park Senior Facility; 300 S Racetrack Rd, Henderson, NV 89015 pic.twitter.com/CUqQBNwWps",1130852713883787264,2019-05-21,15:07:51,senjackyrosen,3,6,11
"100 years ago, the 19th amendment passed and gave women a powerful tool in our fight for equality: the right to vote.

I co-sponsored a resolution with all the women in the Senate to celebrate women’s suffrage to recognize our historic gains while we look towards the future. pic.twitter.com/3SYiS1yWCg",1130843807266869249,2019-05-21,14:32:28,senjackyrosen,7,18,54
"Having issues dealing with a federal agency? Need assistance applying for a grant? Want to learn more about military academy nominations? Stop by tomorrow’s Mobile Office hours!

⌚️ From 9am -11am PT

📌 At Heritage Park Senior Facility; 300 S Racetrack Rd, Henderson, NV 89015",1130649279683604482,2019-05-21,01:39:29,senjackyrosen,2,7,16
"The Colorado River Drought Contingency plan, which was signed into law today is much-needed legislation that will help western states maintain access to water for future generations. I was proud to help introduce this bipartisan bill. I’m confident it will help Nevada.",1130631555607605248,2019-05-21,00:29:03,senjackyrosen,1,5,12
"We cannot allow this campaign of deliberate misinformation to enable politicians to repeal #RoeVWade. I will continue to stand up for women’s health, and women’s reproductive rights. https://www.cnn.com/2019/05/18/health/abortion-myths-and-facts/index.html …",1130616702629060609,2019-05-20,23:30:02,senjackyrosen,9,35,78
"Many Medicaid managed care plans provide quality coverage, but I am concerned about reports that this isn’t always the case. I joined my @SenateAging colleagues in a letter to @SecAzar asking for answers and appropriate oversight. pic.twitter.com/LZbqjR7FFZ",1130601595580772352,2019-05-20,22:30:00,senjackyrosen,3,7,13
I joined @SenCortezMasto in demanding answers from @HHSGov on how this Administration’s move to restrict Title X will impact access to care for Nevada women. pic.twitter.com/CBpemVy8uM,1130573631237578752,2019-05-20,20:38:53,senjackyrosen,4,8,27
"In 2019, insurers will return $1.4 billion in rebates thanks to the ACA. Yet, families nationwide have to choose between putting food on the table or paying for medical care. We must work on making health care more accessible and affordable for everyone. http://bit.ly/2vLYiZk ",1130524197929795584,2019-05-20,17:22:27,senjackyrosen,6,6,16
73% of Americans do not want to see Roe overturned. These restrictive abortion laws are part of a deliberate effort to roll back women’s rights. We must stand up and continue to #ProtectWomensReproductiveRights. https://www.bostonglobe.com/opinion/2019/05/17/opinion-michelle-williams-anti-abortion-laws-have-dire-public-health-consequences/O3fLh6tQSeSofoQNC1qAhL/story.html?event=event12 …,1130276956123979777,2019-05-20,01:00:00,senjackyrosen,19,26,79
"Following the grand opening, I held a roundtable with members of Nevada’s #AAPI community to discuss my legislative efforts in Washington and the issues that matter most to our Asian American community. pic.twitter.com/YQzgmY9Iqq",1130249830448685058,2019-05-19,23:12:13,senjackyrosen,2,2,20
"Thrilled to stand alongside @ACDCNV for the grand opening of their new office today! This community center will offer valuable resources like Nevada Health Link enrollment assistance, civic engagement opportunities, and immigration services. pic.twitter.com/QkQGFOW1I5",1130249498591203328,2019-05-19,23:10:54,senjackyrosen,3,7,35
"To say that these new abortion laws are extreme is an understatement. The rights of women to decide, with their doctor, what medical choice is best for them cannot be allowed to be stripped away by politicians. #ProtectWomensReproductiveRights https://www.washingtonpost.com/national/health-science/as-states-pass-restrictive-abortion-laws-questions-surface/2019/05/19/6962a96e-7a34-11e9-b1f3-b233fe5811ef_story.html?utm_term=.af3a9f0d0489 …",1130216556946788353,2019-05-19,21:00:00,senjackyrosen,8,22,66
"Congratulations to T.J. and Carolyn Sue Matthews, and Meadows Bank for being awarded this year’s @CathCharitiesLV’s Heart of Hope Award. Thank you for your service to our southern Nevada community. pic.twitter.com/Ox8MRsnMTN",1130201460019539973,2019-05-19,20:00:00,senjackyrosen,1,2,8
My bipartisan #CyberReadyWorkforceAct addresses a growing problem in our workforce by helping train personnel to fill available #cybersecurity jobs. pic.twitter.com/hjxr5N70Ku,1130186327452995585,2019-05-19,18:59:52,senjackyrosen,0,3,11
"This week, #TeamRosen attended a presentation of a fully furnished home to a deserving Las Vegas veteran in need. Thank you, VAREP for your kindness to our heroes and for exemplifying the community spirit that makes Nevada great. pic.twitter.com/gHIs2PIeNM",1130171263605989376,2019-05-19,18:00:01,senjackyrosen,1,10,29
"My admiration goes to the veterans who embarked on @RebelVETS and @tmccnevada Veterans Club's #OperationBattleBorn #RucktoRemember. These vets will make a 400-mile journey from Carson City to Boulder City carrying 6,950 dog tags to honor all the fallen service members since 9/11. pic.twitter.com/gqq8yMbtnO",1130160057277132801,2019-05-19,17:15:29,senjackyrosen,2,7,20
"We need bold 🌎 #ClimateAction now if we want:
🌳 Trees
🐞 Insects
🦊 Wildlife
🚗 Clean air
🍏 Orchards
🌊 Clean water
🌻 Wildflowers
🥕 Healthy vegetables
🐬 Clean, plastic-free oceans
🚄 Sustainable public transport
♻️ Waste reduction and recycling",1130140812950609921,2019-05-19,15:59:01,senjackyrosen,12,43,143
"#TeamRosen celebrated Older Americans Month by tabling at the Senior Safety Fair! Visit my website:  http://www.rosen.senate.gov  if you, or anyone you know, needs help dealing with a federal agency. pic.twitter.com/IZXbvzAuVZ",1129914569277812736,2019-05-19,01:00:00,senjackyrosen,2,4,16
So many in Nevada and across our country suffer from Alzheimer's. In Congress we can do more to improve care. That’s why I’m co-sponsoring the Improving HOPE for Alzheimer’s Act to assist providers and increase patients’ ability to utilize treatment through Medicare.,1129899468352921600,2019-05-19,00:00:00,senjackyrosen,4,7,28
Congratulations @unevadareno graduates on your well-deserved success. #TeamRosen was happy to share in the excitement of your graduation ceremonies this week and we’re very proud of you! #PackPride pic.twitter.com/TKsfESg3Up,1129884368363806720,2019-05-18,23:00:00,senjackyrosen,0,3,18
#TeamRosen was honored to be a part of the @UNLV @RebelVETS graduation celebration this week. These student veterans are making the successful transition to civilian life through education. I’ll continue to support our vets through legislation like my #HireStudentVeteransAct. pic.twitter.com/lJISTtwKXU,1129869269095739392,2019-05-18,22:00:00,senjackyrosen,0,4,18
"This week, my northern Nevada team attended ‘May Science be With You’ to celebrate @DRIScience’s 60 incredible years elevating the State of Nevada as a science and technology powerhouse! #DiscoverDRI pic.twitter.com/d3xWZ6BTwD",1129854169764884480,2019-05-18,21:00:00,senjackyrosen,0,5,17
"ICYMI: My bipartisan, bicameral #BuildingBlocksofSTEM Act passed the @SenateCommerce Committee this week! This bill would expand #STEMeducation for young children, and increase participation of girls in computer science. https://www.reviewjournal.com/news/politics-and-government/jacky-rosens-stem-bill-heads-to-senate-floor-1664093/ …",1129823970071416832,2019-05-18,19:00:00,senjackyrosen,1,8,21
The House has passed the #EqualityAct! Now it’s time for the Senate to vote to end the legal loopholes that allow for discrimination against LGBTQ individuals. #PassTheEqualityAct pic.twitter.com/AiPt3Moek3,1129809282789183490,2019-05-18,18:01:38,senjackyrosen,6,5,19
"No one, especially children, should ever be made to feel unsafe, threatened, or intimidated by anti-Semitic or white supremacist bigotry. That's why I'm supporting bipartisan legislation to address anti-Semitism in our schools. https://www.reviewjournal.com/news/education/anti-semitic-notes-found-at-northwest-las-vegas-middle-school-1664346/ …",1129778823627780096,2019-05-18,16:00:36,senjackyrosen,2,9,33
"These statewide abortion bans are a cruel act against women and our health care rights. Personal medical decisions should be decided by patients and doctors, not politicians. https://twitter.com/nytimes/status/1129457828249444352 …",1129764334471659523,2019-05-18,15:03:02,senjackyrosen,19,24,104
"This is the type of action we need federally to protect people against surprise medical bills and ensure coverage for those with pre-existing conditions. Nevada is one step ahead, and I’ll keep using my voice in the Senate to keep up the fight. https://www.rgj.com/story/news/2019/05/15/sisolak-approves-protections-pre-existing-conditions-nevada/3687010002/ …",1129749070623444996,2019-05-18,14:02:22,senjackyrosen,2,7,37
"We need to reform our broken immigration system by prioritizing legislation that focuses on keeping families together, protecting #Dreamers, and providing a clear path to citizenship. The President’s misguided immigration proposal would accomplish none of this. https://twitter.com/washingtonpost/status/1129154824707203073 …",1129562958428876800,2019-05-18,01:42:50,senjackyrosen,23,13,41
💪 https://twitter.com/washingtonpost/status/1129412485478604800 …,1129553090791858183,2019-05-18,01:03:37,senjackyrosen,3,20,107
We only have one planet. We must take a stand in fearlessly defending our environment for generations to come. #EndangeredSpeciesDay http://www.endangered.org/campaigns/endangered-species-day/ …,1129537082571993088,2019-05-18,00:00:00,senjackyrosen,1,11,27
"Our nation is facing a climate emergency. We MUST make #ClimateAction a priority. Our businesses, cities, economy, environment, wildlife, food supply and livelihood depend on it. https://money.cnn.com/2018/08/17/news/economy/climate-change-economic-forecasts/index.html …",1129521981106208770,2019-05-17,23:00:00,senjackyrosen,1,11,21
"Hot off the press! 📰 Nevada has been ranked as the 6th best state to do business in! I’ll continue to support common sense, forward-thinking policies that enable businesses to develop, grow, and thrive in the Silver State. https://www.nnbusinessview.com/news/nevada-ranked-as-a-top-10-best-state-for-business/ …",1129506882672943104,2019-05-17,22:00:00,senjackyrosen,6,6,18
"We can grow Nevada’s economy when we embrace pro-growth policies. Today, I spoke with Nevada’s Latino small business community at @lvlcc’s luncheon hosted by @RTCSNV about legislation I’m championing in Congress that will help invest in our economy at home. pic.twitter.com/1PgNAGSNOl",1129492178860990465,2019-05-17,21:01:35,senjackyrosen,1,4,8
Hate has no place in our country. I stand together with LGBTQ Americans everywhere. That’s why I’m co-sponsoring legislation to call on the @StateDept to defend the rights of LGBTQ people worldwide. pic.twitter.com/JdItKx4ODX,1129482552316715009,2019-05-17,20:23:19,senjackyrosen,13,30,99
I was honored to speak at today’s @UNLVLaw’s commencement. Congratulations to the class of 2019! I know you'll continue to make #NevadaProud for many years to come! pic.twitter.com/HxHnp0Oiu0,1129464356637483008,2019-05-17,19:11:01,senjackyrosen,1,9,62
HAPPENING NOW: I’m delivering @UNLVLaw’s Commencement speech. Tune in here: https://www.youtube.com/watch?v=IGq9QGmcVd8 …,1129444834304040960,2019-05-17,17:53:27,senjackyrosen,1,5,27
Honored to speak at today’s @HCC_Nevada Pancakes and Politics event on a range of issues that impact southern Nevada’s businesses. I will continue to pursue forward-thinking legislation to diversify our economy and better the lives of Nevadans. pic.twitter.com/srdwjLCr2p,1129421672883396608,2019-05-17,16:21:25,senjackyrosen,0,4,7
"65 years ago today in Brown v. Board of Ed, SCOTUS ruled that segregation in our schools is unconstitutional. Though we’ve come a long way since then, we must continue fighting for justice and equality in all aspects of American life, including education. https://www.vox.com/identities/2019/5/10/18566052/school-segregation-brown-board-education-report …",1129396075725557761,2019-05-17,14:39:42,senjackyrosen,5,5,29
"25 years ago, Congress founded the Asian Pacific American Caucus to give our nation’s #AAPI communities a louder voice in our government on the issues that matter most to them. Happy 25th anniversary CAPAC! 🎈 #CAPAC25YEARS https://twitter.com/CAPAC/status/1128428106837053441 …",1129196158478372871,2019-05-17,01:25:18,senjackyrosen,1,4,10
Cyber attacks are a real threat to our national security and our economy. I’m working to ensure our nation is cyber ready. https://www.politico.com/newsletters/morning-cybersecurity/2019/05/15/cyber-apprenticeship-election-security-bills-debut-621452 …,1129159594096451585,2019-05-16,23:00:00,senjackyrosen,1,5,11
"The lack of access to affordable housing is an issue that continues to affect far too many Nevadans. I spoke to @nardotrealtor today on how I’ve made it a priority to further policies in Congress that promote fair, affordable, sustainable homeownership. pic.twitter.com/dKhyvGeZzw",1129144495361208320,2019-05-16,22:00:00,senjackyrosen,3,8,16
I attended the Asian Pacific American Institute for Congressional Studies 25th Anniversary Awards Gala this week to recognize Karen Korematsu and the Honorable Ruby Moy for their dedication to our AAPI community’s civil rights. pic.twitter.com/jgCEd85LvG,1129131016583569409,2019-05-16,21:06:27,senjackyrosen,0,6,13
We can do better for our most vulnerable children. I’m proud to join the Congressional Coalition on Adoption to work toward ensuring all children find their forever family.,1129123400373407755,2019-05-16,20:36:11,senjackyrosen,4,11,43
"I will continue to fight to ensure that the air we breathe is free from harmful pollution. That means continuing to support legislation like the Clean Air Act, along with other policies that help Nevada move towards a clean energy economy. #NationalCleanAirMonth pic.twitter.com/Q0OKtiG9SU",1129043499167494145,2019-05-16,15:18:41,senjackyrosen,3,7,11
The demand for talent in cybersecurity is sky-high and we’re putting ourselves at risk if we don’t address the current shortage in our workforce. That’s why I’m introducing the #CyberReadyWorkforceAct. https://thehill.com/policy/cybersecurity/443711-lawmakers-introduce-legislation-to-improve-cyber-workforce-funding …,1128842974975148032,2019-05-16,02:01:52,senjackyrosen,1,10,21
I helped introduce the Central America Reform and Enforcement Act to provide a coordinated response to effectively tackle the root causes forcing families to flee the Northern Triangle countries. https://twitter.com/washingtonpost/status/1128312674150907904 …,1128827772904923136,2019-05-16,01:01:28,senjackyrosen,4,6,15
"The actions of the Alabama Senate, and other state governments, to strip away reproductive rights from women is wrong, plain and simple. Choices about women’s health are between them and their doctor—not politicians. https://twitter.com/nytimes/status/1128479306567573506 …",1128809879865577473,2019-05-15,23:50:22,senjackyrosen,19,35,114
"During National Police Week, I commend our nation’s law enforcement officers for their dedication to public service and honor those who made the ultimate sacrifice in the line of duty. pic.twitter.com/dDnh9g8yrf",1128788139143761921,2019-05-15,22:23:58,senjackyrosen,2,3,5
"This week marks #NationalTransportationWeek. Nevada’s transportation infrastructure is a key component of our state’s commerce. We must strengthen and improve our roads, highways, and airports to support our state’s economy.",1128737464389128193,2019-05-15,19:02:37,senjackyrosen,0,3,13
I’m also thrilled to co-sponsor the 21st Century STEM for Girls and Underrepresented Minorities Act to ensure students in Nevada and across our country are prepared for careers in the 21st century. Read more here 👇  https://www.rosen.senate.gov/node/269 ,1128712769291870208,2019-05-15,17:24:29,senjackyrosen,0,6,10
"My #BuildingBlocksofSTEM Act has passed the @SenateCommerce Committee. This bipartisan bill would expand #STEMeducation for young children, and increase the participation of girls in computer science. pic.twitter.com/EysEIclJ6x",1128712060173455360,2019-05-15,17:21:40,senjackyrosen,2,16,26
Wrapped up another successful #BattleBornBreakfast with @SenCortezMasto. Great to meet with so many Nevadans and give an update on what my team and I are working on in Congress. pic.twitter.com/A8vaBug1b5,1128687625760591872,2019-05-15,15:44:34,senjackyrosen,4,3,23
"We put our nation at risk when we neglect our cybersecurity. That’s why I’m proud to introduce my bipartisan #CyberReadyWorkforceAct to support the creation, implementation, and expansion of apprenticeship programs in cybersecurity. pic.twitter.com/7IXpo6lRAi",1128668061286924289,2019-05-15,14:26:50,senjackyrosen,2,11,20
Had a wonderful meeting with @WashoeSheriff’s office today to discuss how to best support their law enforcement efforts. Thank you for all that you do to protect and serve our communities! pic.twitter.com/AjHwt6fV2q,1128449917007978498,2019-05-15,00:00:00,senjackyrosen,0,7,18
"Countless women in Nevada and across our country lack access to the quality, affordable health care they need. During #NationalWomensHealthWeek I pledge to keep fighting so that all women have access to the care they deserve. pic.twitter.com/Zn5zsjeUsv",1128434816800542722,2019-05-14,23:00:00,senjackyrosen,13,18,65
"Robert, a psychologist from Minden, NV sent a letter to my office recently describing the devastation he is seeing on our community.

We must take immediate action and save lives. pic.twitter.com/XyIeJisjaI",1128420422104563714,2019-05-14,22:02:48,senjackyrosen,6,10,31
"Too many in our communities are suffering as a result of our country’s gun violence epidemic. Just last week, we witnessed yet another school shooting that will forever change the lives of the students, teachers, and parents of the STEM School in Highlands Ranch, CO.",1128420421127364609,2019-05-14,22:02:48,senjackyrosen,9,12,37
"Education inequality, homelessness, lack of basic health coverage - all of these hardships affect our nation's children. I’m proud to be recognized as a @Campaign4Kids champion. I’ll continue to promote policies that defend and support our children. #Champions4Children pic.twitter.com/HElTdAlasD",1128395844351418368,2019-05-14,20:25:08,senjackyrosen,4,7,12
We must do all we can to prevent and treat child abuse. That’s why I’m co-sponsoring @ewarren’s bill that would provide greater resources to tribal communities across the country in an effort to better address this threat. pic.twitter.com/mA18yAUgEJ,1128349733368598528,2019-05-14,17:21:54,senjackyrosen,1,10,33
"Nevada's diversity is a testament to true representation. Through initiatives like @GovSisolak’s Office for New Americans, Nevada will continue to embrace our diversity and our immigrant story and reflect the changing face of our nation.",1128312677632225280,2019-05-14,14:54:40,senjackyrosen,6,12,53
"1 in 5 adults in the United States experiences a mental health condition in a given year. It is important to learn, see, and show you care during #MentalHealthMonth and year-round.  https://www.nami.org/ ",1128056962468458496,2019-05-13,21:58:32,senjackyrosen,4,17,37
No one should be denied a home because of who that person loves or how that person self-identifies. I’m co-sponsoring the Fair Housing and Equity Act to ensure that all people have equal access to housing. pic.twitter.com/HLwqn6x5vl,1128016342811070471,2019-05-13,19:17:08,senjackyrosen,7,9,21
Congratulations to yesterday’s IBEW local union 357 graduates and Class of 2019! pic.twitter.com/hUMyCk6hAO,1127732690223075329,2019-05-13,00:30:00,senjackyrosen,3,4,26
"Are you a small business owner? Do you need assistance understanding your tax obligations? Are you interested in learning about tax benefits that may be available to you?

Visit  http://www.irs.gov/newsroom/irs-tax-tips … for resources to help grow your small business! pic.twitter.com/X5I1atVGdE",1127703749907111936,2019-05-12,22:35:00,senjackyrosen,1,2,8
Our nation’s law enforcement sacrifices so much to protect our communities and keep us safe. That’s why I was proud to join a bill directing @USTreasury to mint a coin commemorating the opening of the National Law Enforcement Museum. pic.twitter.com/O8k8zRNrvb,1127675316934254593,2019-05-12,20:42:01,senjackyrosen,7,3,7
"Congratulations to the winners of this year’s @LasVegasACC Annual Asian Chamber Scholarship! These outstanding students were selected by a @ClarkCountySch committee for their commitment to community service, leadership, and education. pic.twitter.com/0xBMrQb45H",1127643022152351745,2019-05-12,18:33:41,senjackyrosen,1,4,13
"Happy Mother’s day, Nevada! pic.twitter.com/iy4qajOMQg",1127610543223836672,2019-05-12,16:24:38,senjackyrosen,0,5,21
My Las Vegas team had a wonderful time at this week’s US-China Asian Cultural Tourism Festival! pic.twitter.com/bguc48CRDm,1127370302474866688,2019-05-12,00:30:00,senjackyrosen,0,3,14
Team Rosen was thrilled to attend @CPLCdotORG’s 3rd Annual Esperanza Awards to recognize the immeasurable impact that Latino teachers have on the lives of our Nevada students. These incredible teachers are the hope for future generations. ¡Felicidades! pic.twitter.com/SbwCNPff5w,1127355202762199040,2019-05-11,23:30:00,senjackyrosen,1,3,12
We must ensure that student vets have every opportunity to achieve a higher education. My bipartisan #HireStudentVeterans bill will open opportunities for those transitioning back to civilian life.,1127338447419707392,2019-05-11,22:23:25,senjackyrosen,0,5,25
"Congratulations to this year’s @CSNCoyote graduates, including our student veterans who have served our nation proudly! pic.twitter.com/O4fV4u5mnm",1127338445045731328,2019-05-11,22:23:24,senjackyrosen,1,4,27
".@NAWBOSNV empowers women in Nevada, and nationwide, to reach their highest potential. Congratulations to the incredible women recognized at this year’s Women of Distinction Awards Luncheon! pic.twitter.com/mbU2fmRaGF",1127326614818316288,2019-05-11,21:36:24,senjackyrosen,1,6,14
"Congratulations to Arthur Acuna of @BishopGormanHS, Ananya Sahiba Dewan of @NwctaHawks, and Cristal Giselle Vargas of @CarsonSenators for being nominated as this year’s Presidential Scholars! You all make us #NevadaProud! https://www.reviewjournal.com/news/education/3-nevada-students-named-2019-u-s-presidential-scholars-1658077/ …",1127279706116476929,2019-05-11,18:30:00,senjackyrosen,0,8,18
"There is no issue more important than keeping Nevadans healthy. That means fighting to ensure that the air we breathe is free from harmful pollution. During #CleanAirMonth, let’s commit to keeping our environment clean.",1127250384706244608,2019-05-11,16:33:29,senjackyrosen,3,5,34
"Today, @SenCortezMasto and I joined @ENERGY Secretary Rick Perry and @NNSANevada Administrator Lisa Gordon-Hagerty to tour the Nevada National Security Site. pic.twitter.com/buCmyOt3cl",1127058571919855616,2019-05-11,03:51:17,senjackyrosen,1,5,17
"My Las Vegas team attended a town hall with the Southern Nevada VA to learn new ways to address issues affecting our veteran community. If you or anyone you know is having issues with the VA, please reach out to my office by visiting  http://rosen.senate.gov . pic.twitter.com/Zt7Ly2aXOH",1127015466336178177,2019-05-11,01:00:00,senjackyrosen,0,2,11
