tweet,id,date,time,username,replies_count,retweets_count,likes_count
"We’re spreading the word that our constituent services team is ready to help with any federal issues like Medicare, Social Security, and VA benefits. Our door is always open! (2/2)",1207072771899101185,2019-12-17,22:59:09,repjoshg,12,0,5
"#TeamGottheimer took part in the Oradell Senior Holiday Dinner, with the Oradell Council, Police Chief Wicker, and the Oradell Girl Scouts. (1/2) pic.twitter.com/D2btPIJmoS",1207072766886842374,2019-12-17,22:59:08,repjoshg,4,1,7
I will not stop fighting until we've fully repealed this tax hike on North Jersey. (2/2),1207046398849536001,2019-12-17,21:14:21,repjoshg,18,4,15
"We need a solution to the SALT cap that’s whacking us with thousands in new taxes. North Jersey is facing decreasing home values, increased outmigration to other states, and a higher cost of living. (1/2)",1207046398023262210,2019-12-17,21:14:21,repjoshg,21,3,29
"To our Hometown Heroes, thank you for everything you do to make North Jersey a better place! (2/2)",1207013208399241221,2019-12-17,19:02:28,repjoshg,0,1,4
"This week, I honored dozens of residents at my Fifth District Hometown Heroes Awards. So many in our communities volunteer, mentor our children, protect us, and help the less fortunate — and they don’t get the recognition they deserve. (1/2) https://wrnjradio.com/gottheimer-honors-hometown-heroes-in-warren-and-sussex-counties-2/ …",1207013207400955905,2019-12-17,19:02:28,repjoshg,3,2,7
Last week's deadly attacks were despicable acts and they have no place in New Jersey or in our country. (2/2) pic.twitter.com/ZbHOF5d3iI,1206967852944805890,2019-12-17,16:02:15,repjoshg,3,1,12
"Yesterday, I joined federal, state, local, and religious leaders in Jersey City at JC Kosher Deli, to pay our respects and to stand in solidarity against anti-Semitism and hate, and at the wake for Det. Joseph Seals, where thousands gathered to honor his life.  (1/2) pic.twitter.com/lKjgEEibp6",1206967843042078720,2019-12-17,16:02:12,repjoshg,7,5,32
"I honored local first responders, veterans, students, search and rescuers, life-saving bystanders, volunteers, teachers, community leaders, and residents who have made outstanding contributions to the North Jersey community. #NJ5

(2/2) pic.twitter.com/IwIwq9d3QH",1206755026464575490,2019-12-17,01:56:33,repjoshg,9,1,16
"We are lucky to have so many unsung heroes in our communities, whose quiet power of service goes on every day without the recognition they truly deserve.

Today, at our Fifth District Hometown Heroes awards ceremony, was their day.

(1/2) pic.twitter.com/3LnbQlIH8Z",1206755016608010240,2019-12-17,01:56:31,repjoshg,12,3,19
Gottheimer Statement on Articles of Impeachment pic.twitter.com/zFNPH4XRpA,1206741893666758657,2019-12-17,01:04:22,repjoshg,579,363,1941
"...preserve the lower carpool tolls, keep congestion down, and reduce emissions. (2/2)",1206675303214567425,2019-12-16,20:39:45,repjoshg,12,0,2
"I am proud that the Port Authority reversed its decision on removing the carpool discount, as I called for along with @BillPascrell. I appreciate the Port Authority’s willingness to work together with me to find solutions to... (1/2) pic.twitter.com/mCnSlUWWFG",1206675243512799232,2019-12-16,20:39:31,repjoshg,9,2,12
"We must reinstate the SALT deduction to put a stop to home values dropping, residents leaving our state in droves, and our residents getting whacked with thousands in additional taxes.

(2/2)",1206362881169788928,2019-12-15,23:58:18,repjoshg,33,4,11
"The SALT deduction cap has property values plummeting in each county in #NJ5:
⛔️ Bergen: down 9.9%
⛔️ Warren: down 7.1%
⛔️ Sussex: down 8.2%
⛔️ Passaic: down 9.8%

(1/2)",1206362878531579906,2019-12-15,23:58:18,repjoshg,32,6,14
"Since 2005, they have given more than 200,000 trees to troops and military families. I want to thank the Cerbo's team for having me and for making the holidays brighter for our brave military. Happy holidays! (2/2) pic.twitter.com/eVsObpjoqX",1206249797193281536,2019-12-15,16:28:57,repjoshg,8,1,6
"This weekend, I visited Cerbo's Tree Farm in Branchville to see everything they do for the community during the holiday season. Cerbo’s provided 300 Christmas Trees for military families through Trees For Troops. (1/2) pic.twitter.com/s8nkvPMakD",1206249781405896706,2019-12-15,16:28:53,repjoshg,14,3,11
This deal will be an incredible boost for jobs across the United States and will bring our trade relationships with Mexico and Canada into the modern era. (3/3),1206227096986640386,2019-12-15,14:58:45,repjoshg,8,0,3
"I commend everyone involved in reaching this bipartisan deal, including my colleagues in Congress, the White House, the U.S. Trade Representative, labor groups, American workers, farmers, and businesses. (2/3)",1206227095791316993,2019-12-15,14:58:44,repjoshg,4,0,0
"To finally get the bipartisan deal on USMCA across the finish line, I am urging congressional leadership swiftly bring the deal to the floor for a vote this month. (1/3) https://www.tapinto.net/towns/newton/articles/gottheimer-calls-for-house-passage-of-bipartisan-usmca …",1206227094788878336,2019-12-15,14:58:44,repjoshg,13,4,6
"I joined the Sussex County community today to take part in Wreaths Across America at the Old Newton Burial Ground, which dates back to the Revolution. Those buried here gave their lives for the very freedoms we hold today. We must always get the backs of those who have had ours. pic.twitter.com/cia1S8OgAM",1205972815792525313,2019-12-14,22:08:19,repjoshg,50,5,23
"Twenty-six families torn apart, all due to inexplicable gun violence. Today, and every day, we honor their memories and continue to mourn with their loved ones. 

(2/2)",1205928178814005249,2019-12-14,19:10:57,repjoshg,6,2,5
"Seven years ago today, twenty-six lives were tragically taken at Sandy Hook Elementary — six- and seven-year-old children, never allowed the opportunity to grow up, and brave faculty who lost their lives protecting the children they taught each day. 

(1/2)",1205928177807364096,2019-12-14,19:10:57,repjoshg,7,3,9
"Without the work of our brave law enforcement officers, the tragedy of these violent anti-Semitic attacks may have been much worse. 

(2/2)",1205602253874311172,2019-12-13,21:35:50,repjoshg,104,12,56
"It appears that given the stockpile of weapons and explosive devices that the Jersey City attackers possessed, authorities now believe the attackers may have been targeting a nearby yeshiva and the 50 children inside. 

(1/2)",1205602253102632961,2019-12-13,21:35:50,repjoshg,49,58,91
"I applaud the House for coming together in a bipartisan manner on the USMCA bill. 

This bill is a win-win because it will help protect American jobs, boost our economy, and help family farms. 

I’m looking forward to the House passing USMCA this month.",1205583432379752448,2019-12-13,20:21:03,repjoshg,84,4,22
The Moocher states are continuing to make off like bandits with our tax dollars. I'm sick and tired of this and I know hardworking North Jersey families are too. (3/3),1205527702100488192,2019-12-13,16:39:36,repjoshg,24,2,12
"The Garden State has filed an appeal against the absurd federal ruling that's continuing to allow the SALT cap to raise our taxes, lower our home values, and drive our residents out time and again. (2/3)",1205527701349707777,2019-12-13,16:39:36,repjoshg,12,4,10
New Jersey is continuing to fight the cap on the State and Local Tax deduction — and actually cut taxes for us. (1/3) pic.twitter.com/UwP7blGhqT,1205527627588608002,2019-12-13,16:39:18,repjoshg,14,3,16
I will continue to work with faith leaders and local community members during this heart-breaking time. There is no place for acts of hate like this in North Jersey or our country. (2/2),1205273731624554497,2019-12-12,23:50:25,repjoshg,17,1,10
"Yesterday, the Church of the Most Blessed Sacrament in Franklin Lakes was set ablaze and destroyed by an arsonist who, thankfully, is now in custody. I want to thank the brave firefighters and first responders who dealt with the incident so quickly. (1/2) pic.twitter.com/KDuDGc7bcN",1205273728264941568,2019-12-12,23:50:24,repjoshg,16,5,17
"In the greatest country in the world, where we innovate like no one else, it's critical we never give up hope that the next cure is within reach. My amendment today will help us reach that goal of curing our most life-threatening diseases. (3/3)",1205268888163946496,2019-12-12,23:31:10,repjoshg,8,0,3
"These are areas where the science is the most difficult, but also the most important. Cures for these conditions could always be just around the corner, but not if we are forced to abandon what might be the next cure. (2/3)",1205268887333457920,2019-12-12,23:31:10,repjoshg,3,0,3
"Today, my amendment to H.R. 3 passed the House, to ensure continued innovation and research to further the development of life-saving medicines including cancers, Alzheimer's, ALS, and rare diseases. (1/3) pic.twitter.com/cu7451eP3z",1205268784942067712,2019-12-12,23:30:45,repjoshg,24,2,23
"This week, my bipartisan Protecting Your Credit Score Act of 2019 was passed out of the Financial Services Committee -- a huge win for North Jersey families and all American consumers who want help tracking their credit and protecting it from hackers. pic.twitter.com/ksabvc5fEN",1205237266597195788,2019-12-12,21:25:31,repjoshg,19,3,13
"Great to spend time at the Village during the Ridgewood annual Tree Lighting with the Mayor, Deputy Mayor, Council, Chamber of Commerce, and sponsors.  Thank you to all who joined us for the holiday festivities! (2/2)",1205178880656625665,2019-12-12,17:33:30,repjoshg,6,1,4
I want to congratulate the Ridgewood Maroons football team on an incredible season and for winning the State Championship! (1/2) pic.twitter.com/kU1utOgULu,1205178879083720705,2019-12-12,17:33:30,repjoshg,6,0,10
"...including especially Detective Joseph Seals, a father of five and a 15-year police veteran, who gave his own life to save others and to protect the community. (3/3)",1205151908731801600,2019-12-12,15:46:20,repjoshg,3,0,9
We must stand together to denounce this hate and to do everything possible to prevent more violence. We also stand together to honor the law enforcement officers harmed in the attack... (2/3),1205151907670573056,2019-12-12,15:46:20,repjoshg,10,0,11
I just spoke on the House floor to remember the lives lost this week in Jersey City. I am devastated to learn that the victims of that shooting may have been targeted because they were Jews. (1/3) pic.twitter.com/YQM0YsxWUr,1205151771947126785,2019-12-12,15:45:47,repjoshg,22,7,43
"We’re here to listen & can assist with VA benefits, Social Security, Medicare, & much more. 

(2/2)",1205129748755701760,2019-12-12,14:18:16,repjoshg,4,0,2
"If you’re experiencing an issue with a federal agency, please join my #NJ5 constituent services team for our mobile office hours today at Oradell Borough Hall at 355 Kinderkamack Road, Oradell, NJ 07649 from 5-6 PM. 

(1/2)",1205129747942006785,2019-12-12,14:18:16,repjoshg,13,1,3
Gottheimer Statement on Tragic Attacks in Jersey City: pic.twitter.com/9GafpK0KGQ,1204898821324582913,2019-12-11,23:00:39,repjoshg,6,4,21
"We all mourn with the family and loved ones of fallen officer Joseph Seals, and our prayers are with the officers and civilians who are still recovering.

(2/2)",1204813846323564544,2019-12-11,17:22:59,repjoshg,3,1,12
"I am devastated to learn that the victims of yesterday's shooting were believed to have been targeted because they were Jews. 

Hate has no place here in New Jersey, and hate has no place in this great country. 

(1/2)",1204813845698678785,2019-12-11,17:22:59,repjoshg,8,7,34
"Several deaths are currently being reported, including a police officer. 

This is tragic news and we mourn with their families and loved ones. https://twitter.com/NJSPBA/status/1204485910076821505 …",1204509294143705089,2019-12-10,21:12:49,repjoshg,15,4,7
"Praying for these officers, their families, all those who are being impacted by this situation. Reports say all Jersey City public schools are locked down and that @NJOHSP is aware of the ongoing incident. https://www.northjersey.com/story/news/hudson/2019/12/10/police-responding-active-shooter-jersey-city/4386033002/?utm_source=northjersey-News%20Alert&utm_medium=email&utm_campaign=news_alerts&utm_term=news_alert …",1204490114132525056,2019-12-10,19:56:36,repjoshg,9,1,4
"I’m calling on Democrats and Republicans in Congress to repeal this tax that’s hurting our families, our patients, NJ jobs, and raising health care costs across the board. (2/2)",1204481518548275201,2019-12-10,19:22:26,repjoshg,34,2,11
"The Medical Device Tax suspension expires on the last day of the year, which will send health care costs up. I've been fighting to stop this tax, save consumers money, support NJ's life sciences jobs (65,000+ jobs), increase innovation, & continue to grow our local economy. (1/2) pic.twitter.com/a6GkoRIAor",1204481516128133120,2019-12-10,19:22:26,repjoshg,10,6,12
"NJ has been disproportionately impacted by the SALT cap & we are facing decreasing home values, increased outmigration, & a higher cost of living. 

NJ residents deserve an actual tax cut. 

I will not stop working until we've fully repealed this tax hike on North Jersey.

(2/2)",1204464506887450625,2019-12-10,18:14:50,repjoshg,7,2,11
"Today, the House Ways & Means Committee introduced a plan to repeal the State and Local Tax (SALT) deduction cap. 

We need a solution for SALT and we need it now. 

(1/2)",1204464505914306560,2019-12-10,18:14:50,repjoshg,6,5,12
"Great visiting with everyone at my 45th ""Cup of Joe with Josh"" Town Hall in Northvale this weekend, where constituents asked me about congestion pricing, reinstating SALT, casework concerns, and drug pricing, among other items. (1/2) pic.twitter.com/aH57SeVVaV",1204181486506782720,2019-12-09,23:30:13,repjoshg,28,1,8
"These events are open to everyone including the media, and anyone can ask me a question on any issue. (2/2)",1204181483621093376,2019-12-09,23:30:12,repjoshg,11,0,4
"Because of the State and Local Tax deduction cap, New Jersey is the #1 State for out-migration and has lower home values. When there was no cap: 
-Bergen County claimed $24,783.
-Sussex County  claimed $14,267
-Warren County claimed $12,588
-Passaic County claimed $14,714 
(1/2)",1204113572474884096,2019-12-09,19:00:21,repjoshg,70,1,10
"We need to keep fighting to re-instate SALT, maintain New Jersey's property values, keep people in the State and have other states pay their fair share. Enough is enough. (2/2)",1204113571975770112,2019-12-09,19:00:21,repjoshg,3,2,6
"Standing with The Brady Campaign, @MomsDemand, Students Demand Action, and our local leaders, we all called for action to protect students in North Jersey and across our nation from gun violence. (2/2)",1204077983058796545,2019-12-09,16:38:56,repjoshg,1,3,7
"Last night, I had the honor of taking part in a vigil to remember the twenty-six victims of the Sandy Hook Elementary School shooting, which took place seven years ago this week, claiming the lives of six and seven year olds and educators, well before their time. (1/2) pic.twitter.com/e1LHMvwfDc",1204077981116829696,2019-12-09,16:38:56,repjoshg,2,3,11
Happy to join Mayor Ramon Hache and the Ridgewood Chamber of Commerce in Ridgewood on Friday night for the Ridgewood Tree Lighting. It’s a wonderful Ridgewood tradition and one of my favorite ways to kick off the holiday season. pic.twitter.com/RH6r4xJxGt,1203846207363268609,2019-12-09,01:17:56,repjoshg,4,3,9
New Jersey is the #1 state for outmigration. We need to reinstate the SALT deduction and give a real tax cut to NJ. (2/2),1203749948077965312,2019-12-08,18:55:26,repjoshg,6,0,7
"We must keep sounding the alarm on the State and Local Tax Deduction cap — and push to reinstate it and cut taxes.  The SALT cap has been hurting families, small businesses, and continues to reduce investment in our local services including first responders. (1/2)",1203749877458575361,2019-12-08,18:55:10,repjoshg,7,2,9
Thank you to everyone for coming out and getting into the holiday spirirt! (2/2),1203694612768075776,2019-12-08,15:15:33,repjoshg,12,0,1
#TeamGottheimer attended the Franklin Lakes Annual Christmas Tree lighting at Borough Hall hosted by Mayor Bivona and the council members. The ceremony was sponsored by the Franklin Lakes Public Library and the Borough of Franklin Lakes. (1/2) pic.twitter.com/qklzxCjzsL,1203694606325563392,2019-12-08,15:15:32,repjoshg,2,2,4
We know that this will help save countless lives and fight terror in the region.  Our relationship with Israel should never be quid-pro-quo. (2/2),1203460204035289089,2019-12-07,23:44:06,repjoshg,18,1,3
This vote officially put to rest the splinter view of adding new conditions on defense aid to Israel and reinforces our historic commitment to preserving a two-state solution. (1/2) https://www.al-monitor.com/pulse/originals/2019/12/democratic-lawmakers-2020-rhetoric-israel-aid.html …,1203460141712117761,2019-12-07,23:43:51,repjoshg,5,4,5
"That’s why I’m proud to have voted this week to pass H.R. 4, to take vital steps to address voter suppression. It’s now time for the Senate to act.",1203430553342615558,2019-12-07,21:46:17,repjoshg,4,6,16
"The Voting Rights Act of 1965 made it possible for millions of people to gain access to the ballot box, who for too long had been left out. Voting is the bedrock of our democracy. We should take whatever steps possible to increase, not eliminate, access to the ballot. pic.twitter.com/hYKGR8OMqo",1203430551761432578,2019-12-07,21:46:16,repjoshg,10,11,33
"Today marks 78 yrs since the attack on Pearl Harbor, a day “which will live in infamy,” where the US lost thousands of brave servicewomen & men. We also remember those lost this week in the tragic attack in Pearl Harbor & we mourn with their families. #PearlHarborRemembranceDay",1203381723754569728,2019-12-07,18:32:15,repjoshg,1,1,11
"Finally, I voted to pass the bipartisan House two-state solution and to commit to continue protecting our key ally Israel — without any new conditions on aid. This weekend, I'll be back in North Jersey for a “Cup of Joe with Josh” Town Hall. Hope to see you soon! (4/4)",1203351826826964992,2019-12-07,16:33:27,repjoshg,5,0,6
"I helped pass bipartisan legislation to stop predatory robocalls, which now heads to the President's desk to be signed into law. (3/4)",1203351825816178694,2019-12-07,16:33:27,repjoshg,2,0,8
"In DC, I helped announce the Advancing Support for Working Families Act to give families the option to advance $5,000 of their Child Tax Credit for the first year of a child’s life or following adoption. (2/4)",1203351824679473152,2019-12-07,16:33:26,repjoshg,1,0,2
"Watch my weekly update here!

I started my week at the George Washington Bridge to urge the Port Authority to reverse course and keep the carpool discount on the GWB, to help ease congestion, lower emissions, and keep tolls down. (1/4) pic.twitter.com/Cf5tIKWHXx",1203351665866366977,2019-12-07,16:32:48,repjoshg,9,5,19
".@SenatorMenendez and I are deeply concerned about the re-arrest, harassment and ongoing detention in Nigeria of Omoyele Sowore from Haworth, NJ. 

We will continue working to ensure he is not deprived of his rights and will be able to return to his family safely. pic.twitter.com/3mp0zPrCd8",1203129946761244673,2019-12-07,01:51:47,repjoshg,17,38,55
"AND:

✅Protecting us all from foreign terrorist organizations, including Hamas and Hezbollah.
✅Prioritizing a two-state solution, while ensuring the U.S.-Israel relationship remains bipartisan.

We need lasting peace, @IlhanMN.

(2/2)",1203086234291228672,2019-12-06,22:58:05,repjoshg,15,9,31
"THREAD:

A bipartisan group of 36 members committed us to:

✅Pres. Obama’s agreement to support our ally, the only democracy in the region.
✅Aiding Israel in our fight against terror, where last month 450 rockets from Palestinian Islamic Jihad targeted innocent lives. 

(1/2) https://twitter.com/IlhanMN/status/1203003145212829696 …",1203086233213247488,2019-12-06,22:58:04,repjoshg,26,14,45
"Join me this Sunday for another ""Cup of Joe with Josh"" Town Hall at the Northvale Classic Diner in Northvale! Looking forward to discussing how I can fight for you in DC. pic.twitter.com/O5tbkfiQZd",1203051560533725185,2019-12-06,20:40:18,repjoshg,8,2,2
"Read about my work on suspending terrorist content on Twitter, developing technology to counter killer drones, and supporting Israel in its fight against terror above. (2/2)",1203006829439176712,2019-12-06,17:42:33,repjoshg,3,1,6
"Great to sit down with @themishpacha to talk about supporting our key ally and democratic state in the region, Israel. (1/2) https://mishpacha.com/a-few-minutes-with-rep-josh-gottheimer/ …",1203006828533231616,2019-12-06,17:42:33,repjoshg,3,4,11
We need to reinstate the SALT deduction and give a real tax cut to NJ. No more hand outs to the Moocher States! (2/2),1202977406073671681,2019-12-06,15:45:38,repjoshg,8,1,9
"I just left the House floor where I’m sounding the alarm on how the SALT cap is hurting families, small businesses, and first responders in NJ-5. Because residents now owe thousands more in taxes, twice as many people moved out of NJ last year than moved in. (1/2) pic.twitter.com/RVcGPQGikO",1202977360146051072,2019-12-06,15:45:27,repjoshg,7,5,18
"1.4 billion robocalls have been placed to the Garden State so far this year. 

That’s why I cosponsored and voted to pass the bipartisan TRACED Act, to attack the issue from every angle and finally put a stop to predatory robocalls nationwide.",1202754617286770690,2019-12-06,01:00:21,repjoshg,17,5,44
"With my amendment, we commit ourselves to strengthening the U.S.-Israel relationship, which is key to America’s national security. (4/4)",1202746969074085889,2019-12-06,00:29:58,repjoshg,11,3,22
"...with new conditions until Israel makes concessions according to their beliefs — including how Israel treats Gaza, which is controlled by the foreign terrorist organization, Hamas. (3/4)",1202746968327544833,2019-12-06,00:29:57,repjoshg,5,2,19
"This amendment is absolutely necessary because of the extreme, and misguided views of some, especially several currently running for our nation’s highest office, who seemingly believe that assistance to Israel should be held hostage... (2/4)",1202746967639638016,2019-12-06,00:29:57,repjoshg,8,4,21
"I just spoke on the House floor in support of my bipartisan amendment to be included in the two-state solution resolution, cosponsored by a bipartisan group of 36 members, to ensure no new conditions on U.S. aid to Israel. (1/4) pic.twitter.com/5OoUQFirLf",1202746727947747328,2019-12-06,00:29:00,repjoshg,23,16,55
"I will keep on this and make sure we have resources for the clean-up. Please let me know if we can do anything. (3/3) 

Find a recent list of warming, food, and shelter centers here: https://www.njherald.com/news/20191205/town-by-town-recovery-updates …",1202615787879620614,2019-12-05,15:48:42,repjoshg,2,0,0
"It has taken way too long for too many of our friends and neighbors, especially for the elderly, but I appreciate the regular communication from power companies.

Thousands have regained power and utility companies have assured us that crews are working around the clock. (2/3)",1202615786927509504,2019-12-05,15:48:41,repjoshg,2,0,0
"I have been in close contact with Sussex & Warren County mayors, local and state leaders, and utility companies to ensure all is being done to completely restore power soon. (1/3)",1202615785610522624,2019-12-05,15:48:41,repjoshg,1,2,1
"We’re here to listen & can assist with VA benefits, Social Security, Medicare, & much more.",1202578269926805504,2019-12-05,13:19:37,repjoshg,4,0,1
"If you’re experiencing an issue with a federal agency, please join my #NJ5 constituent services team for our mobile office hours today 12/5 at the Green Township Municipal Bldg. at 150 Kennedy Rd, Andover, NJ 07821 from 6:00-7:00 pm.",1202578268777525251,2019-12-05,13:19:36,repjoshg,1,3,3
"Thanks to the owners of The Curious Reader, The Creative den, Little Joe and John's Barber Shop, Carrick Mor, The Stephen Azzarone All State Insurance Agency, Bagel Gourmet, and John's Boy Pizzeria for welcoming me and providing so much to North Jersey. (2/2)",1202361717986078722,2019-12-04,22:59:07,repjoshg,0,0,0
"Glen Rock, thanks for having me for #SmallBusinessSaturday! Small businesses are the bedrock of our North Jersey community and we must do everything we can to cut red tape and lower taxes for everyone. (1/2) https://www.tapinto.net/towns/fair-lawn-slash-glen-rock/sections/business-and-finance/articles/glen-rock-celebrates-shop-small-saturday-with-congressman …",1202361715649847296,2019-12-04,22:59:06,repjoshg,2,0,4
"Utility companies do not accept payment by pre-paid card and do not demand immediate payment. Please never arrange payment or divulge account/personal information. If you are unsure, please call 1-877-434-4100 to check. (2/2)",1202329428644286464,2019-12-04,20:50:48,repjoshg,1,1,2
"As we work through the winter weather, I want to urge North Jersey residents to be wary of utility scams this holiday season. We’ve received reports of scammers contacting customers urging them to pay a delinquent bill through a pre-paid card. (1/2)",1202329427780263939,2019-12-04,20:50:48,repjoshg,3,2,4
Please remember to always stay clear of downed power lines. Stay safe and be a good neighbor by checking on those vulnerable to the cold. (3/3),1202263127540346881,2019-12-04,16:27:21,repjoshg,6,0,0
