tweet,id,date,time,username,replies_count,retweets_count,likes_count
"...designated as warming centers. Nearby, Sparta Township's police station and Ogdensburg's firehouse have also been opened as warming centers.

If you need assistance at any time, please call my Glen Rock office at 201-389-1100 or my Newton office at (973) 940-1117. (2/3)",1202263126751793153,2019-12-04,16:27:21,repjoshg,4,0,1
"As people continue to get power back, please continue to stay safe and warm.

In northwestern NJ, Vernon Township Senior Center, Green Township Fire Department, Wantage Town Hall, Franklin Borough Firehouse, and the Stillwater Municipal Building have been... (1/3)",1202263125996789760,2019-12-04,16:27:20,repjoshg,1,1,5
"...new tolls, add a ton of new cars onto the bridge, and create more air pollution. That’s a lose-lose-lose for absolutely everyone. It just doesn’t make any sense to me, and I hope Port Authority will reconsider their decision to impose a new carpool tax. (2/2)",1202228717965266944,2019-12-04,14:10:37,repjoshg,2,0,8
"With traffic nearly unbearable, we shouldn’t be undoing a policy that saves commuters money, encourages fewer cars on the roads – and helps our environment. Eliminating the carpool rate will cost New Jersey residents thousands of dollars a year in... (1/2) https://newyork.cbslocal.com/2019/12/02/george-washington-bridge-carpool-discount-port-authority-josh-gottheimer/ …",1202228717105405952,2019-12-04,14:10:37,repjoshg,7,8,19
"Thanks to all the drill teams, marching bands, and pageant winners for getting everyone into the holiday spirit! (2/2)",1202007521533288448,2019-12-03,23:31:40,repjoshg,1,0,0
"#TeamGottheimer took part in the Greater Newton Chamber of Commerce's Holiday Parade down Spring Street, alongside Town Crier William Joseph, Police Chief Michael Richards, parade announcer Michael Hantz, and, of course, Santa. (1/2) pic.twitter.com/RrNNf3Xw0u",1202007517410340866,2019-12-03,23:31:39,repjoshg,3,2,5
"As snow and ice continue impacting North Jersey, I want to thank all of our law enforcement officers for keeping people safe and all our utility workers for helping get power back up and running.",1201934509480071170,2019-12-03,18:41:32,repjoshg,0,1,5
"We’re here to listen & can assist with VA benefits, Social Security, Medicare, & much more.",1201899380581818369,2019-12-03,16:21:57,repjoshg,1,0,0
"If you’re experiencing an issue with a federal agency, please join my #NJ5 constituent services team for our mobile office hours today at River Edge Public Library at 685 Elm Ave, River Edge, NJ 07661 from 5-6 PM.",1201899379747151873,2019-12-03,16:21:56,repjoshg,1,1,0
"UPDATE: The Beemerville Fire Dept. in Wantage Township (227 County Road 519, Sussex, NJ 07461) has also been opened as a warming center.",1201897415856537600,2019-12-03,16:14:08,repjoshg,0,0,0
"If you need assistance at any time, please call my Glen Rock office at 201-389-1100 or my Newton office at (973) 940-1117. 

Please remember to always stay clear of downed power lines. Stay safe and be a good neighbor by checking on those vulnerable to the cold. (3/3)",1201887943373283328,2019-12-03,15:36:30,repjoshg,1,0,1
"...and the Stillwater Municipal Building have been designated as warming centers. 

Nearby, Sparta Township's police station and Ogdensburg's firehouse have also been opened as warming centers. (2/3)",1201887942177968135,2019-12-03,15:36:30,repjoshg,1,0,1
"Thousands throughout the Fifth District are currently without power due to snow and ice. In northwestern NJ, Vernon Township Senior Center, Green Township Fire Department, Franklin Borough Firehouse,... (1/3) https://www.njherald.com/news/20191203/storms-knocks-out-power-to-thousands …",1201887940714147840,2019-12-03,15:36:29,repjoshg,1,3,1
"If you need assistance at any time, please call my Glen Rock office at 201-389-1100 or my Newton office at (973) 940-1117",1201598311481987073,2019-12-02,20:25:36,repjoshg,17,0,2
"Due to winter weather impacting North Jersey, we are will be postponing our Green Township mobile office hours to a later date. 

Please stay safe and warm and visit  http://211nj.org  or call NJ 2-1-1 for assistance in finding a warming center near you. https://twitter.com/RepJoshG/status/1201200842826760200 …",1201598310055923713,2019-12-02,20:25:36,repjoshg,3,1,5
"Today, I announced plans with @BillPascrell to urge the Port Authority @PANYNJ to reverse course on its proposal to eliminate the carpool toll rate discount on GWB, so that we can keep traffic down, keep emissions down, and save Jersey drivers their hard-earned dollars. pic.twitter.com/3Hc9kUqXFk",1201585667953876992,2019-12-02,19:35:22,repjoshg,8,6,19
"Thank you to all the incredible volunteers, all the businesses who help support this cause, and to Director Julia Orlando for all the work she does for our North Jersey community every day. (2/2)",1201315884339470337,2019-12-02,01:43:20,repjoshg,87,0,2
"This season is a time to be thankful for all that we have and to find ways to give back to our community and help those who may not be as fortunate, and that's exactly what takes place at the Bergen County Housing, Health and Human Services Center. (1/2) https://patch.com/new-jersey/ridgewood/local-officials-help-serve-thanksgiving-dinner-bergen-shelter …",1201315883102146560,2019-12-02,01:43:20,repjoshg,4,1,5
"I don't think any of us can think of a better way to celebrate the Thanksgiving weekend, and something to give thanks for, than to have you home with your families. https://www.northjersey.com/story/news/local/2019/11/30/national-guard-troops-welcomed-home-teaneck-nj-thanksgiving-weekend/4333700002/?fbclid=IwAR2754m6TIXFgbln-zTrC-jb9iiRdn3JBW0PVxJR5FJT18cAwKtfdhgRMbU …",1201242518228221953,2019-12-01,20:51:49,repjoshg,1,2,4
"We’re here to listen & can assist with VA benefits, Social Security, Medicare, & much more.",1201200843858567169,2019-12-01,18:06:13,repjoshg,0,0,0
"If you’re experiencing an issue with a federal agency, please join my #NJ5 constituent services team for our mobile office hours tomorrow 12/2 at the Green Township Municipal Bldg. at 150 Kennedy Rd, Andover, NJ 07821 from 6:00-7:00 pm.",1201200842826760200,2019-12-01,18:06:12,repjoshg,5,2,3
Find HIV services and testing near you here:  https://locator.hiv.gov/ ,1201190215626477568,2019-12-01,17:23:59,repjoshg,1,3,2
"Today is #WorldAIDSDay, when we can reflect on the progress that's been made to make HIV/AIDS a manageable disease, support those living with HIV, remember those who have died, and continue work to #EndAIDS, fear, and stigma. pic.twitter.com/CAWp5KuWUc",1201190213713891335,2019-12-01,17:23:58,repjoshg,1,4,7
...to find NJ preparedness info @ReadyNJ. (2/2),1201166772159877120,2019-12-01,15:50:49,repjoshg,1,0,1
"Winter weather is heading towards North Jersey, so please stay warm & be a good neighbor by checking on those vulnerable to the cold. 

Visit  http://211nj.org  or call NJ 2-1-1 for assistance finding a warming center near you @NJ211, & visit  http://ready.nj.gov ... (1/2)",1201166770360528898,2019-12-01,15:50:49,repjoshg,1,1,4
